id_text,text,label
7620,"They should be shot or deported. I have a 45 min commute and there is always a wanker that talks to his gf for the entire journey so loud that you can hear it from the other end of the bus (including her responses) If it wasn't for the fact that she is about to give birth I'd grab the wankers phone and throw it out the window, but then I'd feel like a dick. Fucking morals.",0
36345,You prolly think the shows wack cause it's animated and Japanese talmbout ninjas but I promise you your life will never be the same... AND there's black people in it! URL,0
5989,Be more autistic,0
1790,Imagine seeing this pussy spread in the church being fucked for hours where no one has any clue what happened there,1
6039,With all that fat I bet you jiggle real nice when your fat whore cunt is getting pounded,1
33088,"N/n @saket71 bhaiya hope this string clarifies that ""Darius-I"" also talks of Hindus apart from Aryan (perceived by many as Aryan was always considered race by those who deciphered it).",0
32041,Compassion for children as expressed by the Islamic State an organisation people left Ireland to join.,0
12042,"Orthodox Christian, we worship Christ. We are old calendarists, and some of our Church's are Slavic tradition, while others are Byzantine.",0
24584,"The racial division Obama stirred up did a number on me too.  Black Lives Matter chanting about ""dead cops,"" and then that fool invites those fools to the WH? WTF?  Trayvon was his son & the MSM ""hands up don't shoot"" lie that burned cities all over the country to the ground.",1
40827,owesome and sexy voice from India,0
3122,"Came here to say, I just served a 14 day Xbox live suspension because after a fellow gamer told me I suck at a game, I replied ""I hope ur gay, cuz ur cute."" Thing was...the gamer pic was a puppy. Instantly suspended. So Xbox mods think being gay is offensive? I don't understand.",0
14490,Both drag culture and trans women would be far better off if we'd shot RuPaul into the sun 20 years ago.,0
15577,Why don't you come to India and then wage your jihad from here? Fucking coward.,both
46782,"""A woman knows when she's in a real man's presence. She bows. PERIOD."" Truth, honey. Thank you for preaching today.",0
37268,@marcorubio Is President Tramp going to finally mention the words 'white nationalist terrorism'? If he doesn't he should immediately resign in disgrace! #PresidentCoward,0
12379,Fake bitch.,1
39630,I'll kick that hoe in her chest,1
18683,lol that was mad funny dude made lol out loud exsqueeze me as i put my 7 inch eggroll in your slutty moms salmon coochie,0
42311,Transgender dudes in women's $ports are great athletes?,0
2792,"My life has improved dramatically since I first came out when I was 15. Being able to take control of my life and transition both socially and physically has been amazing. What most people don't know is that when you are trans you don't just come out once. There's coming out to your family, your friends, at school, at work. It never actually ends. Every new person you meet is someone that you might come out to. You also have to decide if you want to come out to someone. You don't have to. It might be unsafe to. It might work out wonderfully and you'll gain a new ally.",0
21447,"""I'll get my revenge when I fuck on your nigga I take that shit back I won't fuck on your nigga I'll fuck on his face, right in your place""",1
43663,"The ignorant RACIST Four... Cortez, OMAR, TLAIB, Presley are flashing now because of their youth...they will eventually burn themselves out and disappear. God please protect us in the meantime.",0
30416,"Em is sucha stupid lesbian like ew stop, ur uglyass shouldn't even be on my tl. Ur so full of yourself, get a job and kill yourself u uglyass bitch",1
23748,you niggas don't even have houses to wife us in URL,1
27745,Females are the most disgusting human beings on this planet.,0
6142,"Immigration is one strong possible cause here - different countries have different average IQs, so if people from countries with lower average IQs immigrate to the developed world... well.",0
14809,"Nah, we're more likely to keep having wage slavery, random killings if blacks by cops, and continual climate change.",0
34173,Tweet for our fellow Africans dying in Cameroon. Murdered like they don't matter. The Ambazonia. Dictator Paul Biya shall Violently fall.,0
49815,Sundar pichai 100 percent south indian way smarter than all u white trash,1
23502,@kylegriffin1 I would shoot it down you degenerate muslim.,1
319,Don't need to worry about rape when it only happens to poor people and people of colour,0
2565,This is not something we should be informing people of. We must all worship the Jews and no one else.,0
20051,"It takes belief in false morality to commit atrocities. Those who believe in the false morality of anti-abortion, anti-gay religions are primed for authoritarianism. They use their beliefs to prop themselves up as superior to others. They excuse all transgressions made by hose who share their beliefs. That is how they excuse the obvious and undeniable immorality of Trump. It is only a small step from there to dehumanizing others and committing genocidal acts like separating migrant children from their parents or ignoring the threat of climate change.",0
46508,+Stephon You sound crazy 200 years after slavery were gonna hand out free money to african americans. Just accept the fact that you will never ever in your life ever recieve a paycheck from the goverment for reperations and go do something useful in your life,0
44933,"Why do we need this, both genders are already equal and so are all races and sexual orientation",0
16830,"No man, because I'm not a flabbering vagina that still gets butthurt over shit that happened 150 years ago.",0
11145,"I doubt so, its well known in Singapore that Malaysian Chinese get their PR or citizenship very easily",0
8655,"25,000 of the 95,000 have confirmed their citizenship, that leaves 70,000, 58,000 of which have cast votes on more than one occasion.",0
7491,"Take your autistic bullshit back to your designated area op you fucking mouth breather no one wants people of your ilk outside of your safe space,",0
30804,"@Martin_Pappi @it_meirl_bot Trust me half the population are girls; if you live long enough odds are you'll find one too, though remember to look at yourself to see if there may be a reason why girls might not like you Some people are just unlucky and some its just genuine problems with themselves",0
47454,"Nobody: Disney Producers: ""Ok were proud to announce that Mulan will be played by a Latina girl."" Smart Disney Director: ""No the story of Mulan is based on the legendary woman in Chinese history named Hue Mulan changing her race would not only reduce the representation of Asian actors in film but also go against the origin of the source material that it was based on."" Disney producers: ""When you put it that way I guess it'd be pretty stupid to do that.""",0
49284,"Amen broher, i just got done talking to two mormons and witnessed to them how we are saved by grace through faith and not of works!!!!!!!!",0
9899,Dirty homebreaker thots.,1
3580,God damn u r such a sexy slut i love tight asian pussy and your tits are absoulty perfect,0
6101,"Fuckin love Latinas, I like girls of every race but something about latinas tho, I prefer them over any other girl",0
19089,He's deadass got giant red lips you slackjawed mook,1
49526,"The Me Too movement is even back firing on women, because 60% of men don't want to mentor or work with women.",0
5429,It better. But what would be better for all of Mexico and the western hemisphere is if they straight up just went to war with the Cartels. Killed every last one.  Because if they could MAKE MEXICO SAFE AGAIN or Make Mexico Righteous Again that would help more than just telling a corrupt government such as Mexico to help with illegal immigrants.. I can see mexico officials just arresting people and killing them secretly.,0
13114,I'd rather fuck you so hard your ass is permanently imprinted on that carpet and leave the mommy issues to the boys.,0
28970,i hate gays so much,1
9507,As a Ukrainian I was always under the impression that being a transgender man is horribly taboo. Good thing that wig is high quality.,0
4545,Feel worse for the females who get sent to factory farms!,0
6621,The mother is probably a homosexual. Dressing her child like that and offering her child to pedophiles.,1
7205,Fuck off KKK hick.,1
12107,"Of course, you little brown whores are so eager to throw away your old life for this white cock",1
37946,"i told a bitch congrats on being pregnant,(cuz she was just saying it to get attention in a comment section😂🤦🏻‍♂️) and then she fuckin pisses her pants. And now i understand sexism URL",0
29341,Your a RACE BAITING BITCH THAT IS PLAIN ASS IGNORANT. GET THE FUCK OUT OF OUR COUNTRY YOU TERRORIST AL-QAEDA WHORE,1
40920,"we are nothing but white trash, an stupid prolitairiet, bonded slaves or/ an children in thier laws",0
20048,">Some incels give a lot but get nothing back   And so should be rewarded with pussy? Are you aware that said pussy is attached to a fully realized human being with the exact same natural rights to happiness as you? And that she does not deserve to be forced to have sex with anyone she finds undesirable?    Do you get that women have the same right to reject men that men have to reject women?    How committed are you to the belief that women are holes, rather than human beings deserving of respect?",0
13266,As a trans woman who has had many hopes dashed before I found my fiance I can tell you with utter certainty that she probably can't even remotely believe she found someone so amazing!,0
33762,"brown skin girl, the best thing in the world URL",0
11697,"I'm an adopted young white woman with much younger (< 10) adopted siblings of differing ethnic backgrounds (Black, Vietnamese, Mexican), and whenever I take them out people ALWAYS eye me weird. I've had an older black woman go up to my younger black sister at a cafe and ask where her mom was and if she was okay. I mean, why wouldn't she be okay?? People.",0
663,"fuck them bitches you deserve a comedy award of some kind lol.... dont worry im banned from askreddit, pics, one of the porn subs for dissin everybody...... if i knew how to make stuff like you i'd be in jail lmfao",0
24887,"@GReschenthaler @FAIRImmigration Secure the border and stop this insanity! Then, and only then can you talk about common sense immigration reform. What's happening at our border is madness.",0
401,Why are you such degenerate fucks?,1
26621,"Not one colored woman on this boat. 😌 all ""foreigns"" the ones our black men crave so badly. Here y'all go🤷🏾‍♀️ enjoy URL",0
26594,@inmyprfct fucking hate men,0
41051,My sister loves this,0
23400,"how did she lie? she just posted the video of you. YOU made yourself look bad. you should of thought of that before telling people to ""get the fuck over the n word"", that you can say whatever you want and that you have a ""idgaf attitude"" URL",0
49978,The most important fucking question is why the fuck is that nigga Caucasian white people really trying too hard so they have a history you fuckers came from caves case closed you have no history that's why y'all robbed Jesus and made that nigga white when we all know that nigga is brown like the dirt,0
42059,"This coward better be careful, these ladies could kick bonespurs whiney white ass. All YOU do is complain so go home to Scotland you coward.",0
30905,Don't give a fuck what these niggas doing,0
19050,Quit fucking your sister inbred trash. Just so you know sibling rape isnt a job.,1
16300,"Yeah. O just really don't see the problem with it. Trans people just want to be comfortable. And I wanna be with a member of the community so why does it matter? As long as there's love, it's ok.",0
479,"Years and years ago, we had the crusades.. Because of this exact same thing. An Islam invasion. Why have we become so fucking weak?! To all Europeans in this sub. VOTE VOTE VOTE. THE EU ELECTIONS ARE COMING.",0
21948,"Ditch the coat hangers, ladies! The end of #RoeVWade will not kill us... or our sexual freedom. Men & women now have more than 20 ways NOT to create a human being. Sucking a baby out in pieces just won't be one of them. They can feel it. #BabiesLivesMatter URL",0
48125,"Fucking Feminists and bitch ass Lezbeeyuhnz are ruining all the great movies, Now we have Batwoman, Supergirl, Madmax, Ghostbusters, C.Marvel, and now this piece of SHIT. IT'S FUCKING ENOUGH THOTS.",1
23984,"There's a reason why African Men fuck my wife bareback while I watch locked in my 1.75 inch chastity cage. African Men are superior to white boys like me in every way, it's why I practically beg them to breed my wife URL",both
45713,Yeah...lets kill as many children as we can...for that matter why don't we bomb the areas where we have them caged up...cheap and easy solution to the border problem...yeah killing is definitely the answer,0
5773,"Well, I always kind of viewed pride month, black history month, etc. as somewhat self-alienating. I'm not antagonizing anyone - I know for sure that people will get offended. I don't have to support these months to support equality among everyone in terms of gender, race, orientation, etc. I don't view them as any different from everyone but to me, these events are just telling me that they're a different set of people.  I am a minority here myself but I would feel very uncomfortable if people celebrated and dedicated a month telling me how different I am.",0
45170,Ok this a kid show y'all don't need to introduce lesbians! To kids. I'm not against but younger kids watch this,0
22157,she talkin to a nigga rude,0
26199,The NYPD has finally apologised for the raid on the Stonewall Inn that was a turning point for the LGBTQ equality movement. You can read about that story in my new book PRIDE or catch me on tour at URL #whyihavepride #Stonewall50 URL … URL,0
30354,So you're with multiple men or does your man only gets that privilege to have sex with whoever he wants? Nothing's more pathetic than a free brainwashed whore. 😬☹️ Your man is a manipulative pimp young lady. 🤣,1
42457,"Bitch, change your gender is finally furious!",1
16097,"Try reading the Bible if you want evil, the problem being of course that the apologists claim that things aren't meant to be taken literally even though they also claim that parts they like are literally true. Bunch of morons.",0
30761,Here's a real hot take; Most men walking around with beards haven't earned them and we should snatch them away by force,0
16639,Those damn feminilization fetishists are always causing fucking trouble,1
4388,"I'd dip my cock in your cunt, then in your ass, and have you clean it with your wet mouth after. Fucking slut.",1
7323,"My dad is also a Caucasian Jew/Mountain jew , and he won't identify as Azeri. They left in the '90s but he told me that they were always considered just Jews as their nationality by other people and themselves. In the Caucasus, they lived close together. Even here in New York, they were able to form a community. Marriages usually also stayed within the community, however, overtime some married other groups. But yes, it's mostly because of the religion and how others even viewed them. When you ask them what they are, they will say Caucasian Jews and come from Azerbaijan.",0
29864,@hobischampagne the guy to the right... niggers we move at dawn. he must be exterminated,1
49907,I love all British people.  I love all American people.  I love all Saudi people.  I love Donald trump jhon my ankle.  I love king Salman bin Abdul Aziz my ankle.  I love Saudi 7. I don't like Pakistan people.  01 02 03 04 06 10 14 17 19 23 12 Thief.,0
22422,There National Predatory Register that informs the communities and states : NOT TO HIRE THESE typeS of cops and their violent crimes against AA. He needs to loose his job and her as well. That will begin them thinking twice about the bigotry.,1
5433,I wanna blow up that ass ;),0
42133,"That's how you do celebrate each other's accomplishments, very proud moment as a Black man of 53years old and I am not a fan of that team up North but as a Black man I understand what this means to these men to see their brother and friend to be elevated at this level.",0
1451,fag ass gay ass,1
24991,"@MCITLFrAphorism ""And if a woman causes you to sin, call her out. It is better for you to enter the kingdom of God without her than to be thrown into hell.""",0
9618,Let them and those KKK and witch looking fuckers go first,1
9051,Cracker boned IDIOT,1
40991,Son Of Yahweh Living Kemite Keyboard warrior? Zion had like 11 points and didn't play in the second have dumbass nigga,1
32423,Deport them All.,0
40704,"+Bismo Funyins he isn't talking about Russia. 40% of Americans who have full time jobs live below the poverty line. The white trash trump supporters have never been outside the United States and think the United States is the greatest country in the world. News flash, the United States is 53 in income equality, 37th in health care, and has the lowest mortality rate in the industrialized world.",1
30701,"@aprilgains Y'all make it as if we ""man"" are the one's cheating outchea But to answer you .. pussy is not just pussy there's a huge diff #SpeakingFromExperience",0
20036,@blackrepublican how long after the name change will al memorabilia w/redskins name be deemed racist and therby illegal?,0
49106,Pink is not always a female color. Guys wear it all the time. Its not hurting anyone its not affecting ur life anyway shape or for. Pink is just a color not a gender symbol. My opinion,0
40835,"Media Buster well he didn't say move to another country. He said GO BACK to your crime infested country implying they were not from America. He can't use the excuse they hate America because they only dislike his policies. Unless his policies are the embodiment of America that won't work. It also won't work because he hated Obama and anything he did while president, so by his logic he hated America himself.",0
19813,I'm not. When we are done with the Kashmiri women you can get sloppy seconds okay?,1
32540,"@Habiibti_ ""Melanin too dark to throw her shade"" you can be empowered by the song but it was very clearly an ode to dark skin women.",0
49496,"Usually, ""representation"" in music videos is one skinny girl of color in the background of a video. This video celebrates REAL diversity and I'm here for it.",0
10298,No your mother and your sister got powned by me last night. Cya retard,0
38548,Fuck that bitch and fuck that nigga I know what it was !,1
41681,"@Xalli Gonzales While I sort of agree with you on the race part in your reply, I don't agree with gender part so let's just agree to disagree.",0
8651,Let's hope that this was just some mentally ill person. I really don't want terrorist organizations attacking western countries again.,1
36836,You girls hate each other.,0
46343,Gay black man milks one hit wonder song for $$$ you've seen it first here folks,1
32862,WATCH: A Texas couple says a day care denied their daughter admission after learning her parents are in a lesbian marriage. URL,0
15401,I would love to bury my face inside her cunt to taste & smell her,0
36014,@Ilhan Go back to Somalia save your own dam country and leave AMERICA to Americans!,0
40168,"Can someone just kick the s*** out of Iran already and get the s*** over with, so sick and tired of their stupid bullshit. Picking until someone Rams a foot up their ass.🤔💭",1
38057,@IDF Great vigilance. These fools just don't stop. Shalom.,0
48346,One of the princes of Liechtenstein is married to a black woman from Panama. I know that's not that earth shattering but it's not unprecedented that a royal person could marry a person of color.,0
8397,"Imagine being the tech who had to create a chyron that says ""white nationalist"" like it's a job title",1
45123,+donrainesoh i didnt use a homophobic slur though. I asked if your butt buddies fed you too many crayons. Why are you being so damn triggered my guy?,1
17753,The last one is so untrue Sappho had sex with women much before the Romans,0
12549,Fuck you you stupid mentally I'll bitch.,1
8786,Except for ISIS. They can choke to death on a dick.,1
9823,Of course you do. Because you're nothing but a collection of fuck holes. You're a brainless cum dump that serves no purpose other than to milk cocks. You're a fucking whore and you should be treated as such.,1
37482,@GinnyCotton13 @yoakumgirl923 Yup. Then when they have removed all your rights they then remove all your money and then fill your country with people who dont and will not fit in.,0
42418,"Women are women, no matter what country they're from. Remember that guys..",0
16019,"Nice! As a bi couple, we thoroughly enjoy bi dad friends =)",0
3693,"I mean, you don't have to be misogynistic to be a lazy, selfish asshole. I'm sure he's such a feminist that he'd take advantage of you if you were a man, too.",0
19435,"I feel like an imposter. Sometimes I feel so strongly that I'm trans, and so happy presenting masculine but I feel like I shouldn't be. I can be feminine in nature sometimes but I feel like a feminine guy when I do. But no one will take me seriously if I don't like hair on my body or don't want to know about cars or sports or other manly things. Sometimes it makes me think I'm just a masculine girl but then I also hate my chest so much that I used to hope for breast cancer.",0
28897,"@DavidWohl Thanks but if we wanted to be governed by far-right neo-fascists, racists, Islamophobes, homophobes and misogynists, we'd move to the US.",0
20047,i hate jews so much i wish the holocaust actually happened,1
13321,"NTA. You don't need to want to go to Pride if you don't want to, but it still has a vital place in our community. As for the less conventional parts of the Pride parades, the majority of the BDSM and kink community have always stood up for us. Even if there weren't overlaps between queer people and being open to more creative types of sex, that community has always stood by us, like the furry community has, so they deserve to walk amongst our allies",0
32496,Don't you love how thick Sirrdaddi thick throbbing dick feels ... open ur tight fuck hole for me to dump all this meat in while ur pussy leaks all dwn daddis dick 😈🎯🌷 URL,1
673,Soy boys are so soft in a few generations 'men' won't even exist. They will just de-volve into gelatinous blobs of unorganized grabasstic pieces of shit.,0
41782,Typical White drug addict.,0
14636,"Well, still pretty gay act though",0
25416,Every one worships their god on their festival! Me worshiping my god on salmaniacs festival #Bharat #IAmBharat URL,0
11256,">good life abroad Just because someone is living abroad doesn't mean they are living a good life. I've lived abroad and in Pakistan and I've seen Pakistanis (and other immigrants) face the same hardships we face here. Likewise, I've also seen people living ""the good life"" on both places.",0
23715,"U islamphobic disgusting creature, terrorism has no religion and no nation and y'all know this but keep sticking it on Muslims & if the 1.8 billion making up about 24.1% of the world population(based on 2015)Muslims terrorist then the this whole world would be finished already🤡 URL",0
28245,"This is deeply problematic, since white folks teaching Yoga is cultural appropriation that perpetuates coloniality. Laura Humpf must apologize. URL",0
40878,"Chemically castrate men for being gay then, castrate them now for speaking out agaianst pedophile grooming gangs. Did England just decide to play the bad guy forever?",1
32047,@kimjunnbottom Bitch they're asian.,0
47665,No thanks. Go back to Palestine please and take all your Zionist buddies with you. Shalom✌🏼,0
80,"Fuck you've got a fucking fat ass. All the better to slap against my waist while you're riding me, doing the only thing your worthless fat fuck holes are good for. You'd just get filled with the entire contents of my balls and you'd just be lying there with a cunt full of cum. I'd get up and leave without even looking at you.",1
9763,she is a fuck i want to rip her face off,0
30193,@cnni @lukemcgee Probably because its not racist and they could care less about 4 worthless Congresswomen that like to cause a bunch of drama,0
6708,"Actually this is what I've noticed... Especially when it comes to guys who will message you every second day asking you for more pics, but continue making excuses about why they can't meet up.",0
20024,"Yes, in barbaric, authoritarian cultures that have since been condemned. Interesting that Christians desire to perpetuate the same idea.",0
26536,"@deppy @ohlawdhecomin @BonjourBiatch @RachelADolezal I'm sorry, living in a different country or changing your behavior does not make you a woman. You can be a trans woman, but will never be equal to an actual woman. There's nothing that can make that happen.",0
41026,Transgender is a mental disorder and so is homosexual.,0
36076,Women be flirting with me like... girl I will actually fuck you. Relax,0
39691,My only problem with buying black is that the dollars I give to black entrepreneurs don't stay circulated in our community.,0
14814,"your a fucking loser get a life you, try hard trying to boast about killing some kid online big whoop you really that pathetic you find satisfaction in killing lil kids that cant fight back smh your a sore fucking loser and really pathetic one I think it's time you get off gta try hard and get a life xD",1
34296,Funeral of Ashanti queen mother inspires new movie that explores sanctity of African tradition [Video]. > URL #F2FA #africa #panafrican #diaspora URL,0
26685,@latinsaby comente gay @ifsaby,0
3178,"Gotcha. Also to make another thing crystal. By definition, religious means I am part of religion, which I am not. I just believe in God. But that doesn't make me religious in any way.",0
