id_text,text,label
7314,I'm marrying a Venezuelan and theyre ecstatic :),0
42844,"Truth sometimes hurts,but that does not make what you were trying to say wrong or worth a conversation.caring for women's sport does not make you transphobic.if we lose the ability to have conversation we lose the ability to think.the problem I see here is the trans communities inability to have a intelligent conversation on the said arguement which I see as problem.it is especially confounding to me that the atheist community is not willing to have this conversation either which is a bit religious.keep up the good work steven.",0
38237,"@MikeHuckabeeNH We have thought and prayed after each and every mass shootings and God said to us, ban the assault weapons. The Congress kept ignoring what God said to do over and over and over and over. Now the fake pastor says only thoughts and prayers can stop mass shootings.",0
49449,"That neighborhood tho, clean as hell but yeah Im starting to think very much so, especially for a black man. In America I'm starting to think women are starting to just flat out hate men for no apparent reason. Yeah anywhere overseas is gold for an American man. Hell I dont even think you have to go as far as Asia. I think Europe alone will do the trick. As long as you leave America and cross that pond it starts there. I want to try the women in the UK/ London area and then go from there. I heard women out there in the UK crave American black men and American men in general.",0
21177,@DarrenBlowe @CumGiveDaddiSum You ain't shit 😂😂 but she has to be prepared for responses like that 😂😂,0
16931,"You look like you let random dudes from the bar aggressively fuck you, spit in your face and call you a whore. You let them fuck your pussy unprotected with razor bumps on it and then you suck their sweaty dicks and then go home and kiss your son.",0
27566,@raymysterio305 Should have stayed in Mexico and seen a doctor. Oh but then they would have to pay. Illegal aliens Illegal aliens. Sick and damn tired of going to the ER sick while staff struggles to understand the words coming out of their mouth. ERRRRRRRR,1
20055,There is plenty of evidence that women and non-white people are disadvantaged in almost every hiring process in the western world.,0
4640,Instead of husks try jews,1
11977,"Although it's primarily an American concept and ""white"" is an American cultural group, so really Europeans, even Swedes as Norwegians, are not white.",0
11659,I hope your canaries get sodomized by this fat Greek faggot,1
49237,How about we send white people back to the caves,0
48213,"Like Elizabeth Taylor in the role of Coleoptera, like Yule Brenna playing Chinese emperor, like Russel Crow being Egyptian king, when there's black, Chinese and anyone else but a white person in Hollywood that can fill that role. Whites have been telling other people's stories for years and the story of the people they are trying to tell ends up being embellished and is often WRONG and/or prejudice.",0
39705,This slut's getting fucked by 8 guys at the bathhouse. 😈 I'd love to eat his pussy after all the fuckers have deposited multiple loads in it! 💦💦💦💦😛💦💦💦💦 @Dev_Tylerxxx #gaysex #orgy #gaygroup #bareback #fucking URL,1
9393,"Seriously, what kind of faggot would preemptively exclude that sweet sweet bussy.",1
39106,It's almost funny how easily these fag sluts let me bang them raw. Of course I have rubbers of my own in case a sexy chick comes by. I just enjoy breeding the dumb cunts without the fear of knocking one up. They're all gagging for some straight cock and will do anything to get it URL,1
46579,The would to Africa I am black and proud,0
28758,bitches real life fall in love w a nigga who treats them like a human sock,1
43101,Give the jew some money and he will firget this. He s crying cuz he wants donations. Jew loves money 😂😂😂😂,0
40280,Yeah incels think every is.,0
13526,God I fucking hate whores,0
42741,You spit on the graves of those that died in actual concentration camps. Then again I'm guessing you are anti-Semitic.,0
34767,i bet this bitch in like 10th grade. i can FEEL it. stop playing with my moots like that before i really decide to do witchcraft and place a 1000 year curse on you and your entire family,1
40211,"+Nitish Thakur Open ur eyes people..... We Sikhs , Muslims , Christians and Dalits have no respect in India.....Wakeup Wakeup.....They do not care about u guys....They will keep persecuting you and your generations ahead....Wakeup and make your own country out of India or you guys will always be Second class in India.",0
43868,Smart men know you protect women.,0
43859,These was happens when devil worship happen .. god away.. cursing these state,0
33805,Every time you walk out the it's a lame nigga under your belt,0
13499,"The only thing Alinity has going for her as a human being is her sexuality, if she werent a moderately attractive Thot, she would be begging on the street for scraps like the rest of us. She is a human sex toilet, nothing more. If i had the chance i would split her crainium in a hundred pieces and drink her cursed blood from her skull.",1
13119,Are you on drugs? Trump could rape baby jesus in a church on live TV and every evangelican republican will say that the fucking jew deserved it.,1
4703,"I respect that is how you viewed it. I think the most surprising part to me is that I agree. I am very aware of inequality in the justice system towards blacks. And just like any inequality, I detest it. I was vocal about that. I made it a point to say it, repeatedly. But because I have my own voice in how I express that, I'm a piece of shit. We all got our opinions. And I don't care up or down what you think about me. I'm just surprised by it",0
26474,Ace/aro folks are Queer,0
10584,"I haven't been discriminated against because of the diagnosis, it just saved my life and made my existence easier when I got right meds and other care. It definitely exists and it's just a bit different from person to person just as most illnesses are. My physical wellbeing is looked after just as the mental is, I get regular check ups with comprehensive blood work done and all that.",0
8296,"Don't worry about it, kiddo, you'll soon learn to embrace the perspective that you have from both cultures. And you'll find people who understands your experiences.  As a slightly older gaysian, happy to chat about it with you.",0
41287,"If your shitty government tries anything we will bomb you, and the US will too. You belong to us.",1
10026,That's one expensive child. Child support should not be used to drain men of there resources.,0
5467,"As a 5'6 guy, I don't mind one bit, and kinda have thing for tall girls lol. I do wish I could I meet some of the women in this thread who have no problem with it apparently.",0
12748,At least he's not a homophobic asshole... Just a generic asshole,1
38386,id throw a bible at chenpa but she'd probably shove it up her ass,1
3993,"TAL -  81 words, about the struggle to get homosexuality removed from the American Psychiatric Association's list of mental disorders.  My Pen Pal, which features a fascinating story about a pre-teen American girl becoming pen pals and eventually 'friends' with Manuel Noriega.  Fiasco is great, too.",0
6865,"As Muslims, we gather five times a day in Masjid (Mosque) to pray ... also we have a weekly Event Salat Al djumuaa (friday prayer) were everyone must come to the mosque ... Everyone is your friend. Everyone is your brother",0
28838,"@realDonaldTrump @seanhannity Islamists are putting women into political spots in the West. These women are, young, pretty, and able to talk. Taqiya allows them to spout Leftist values they do not, of course, share, but to exploit useful idiots.  It is codenamed: The #LipstickJihad  URL",0
44905,All those old Jews and pensioners to Rob I feel sorry for the people of Florida,0
29570,"Niggas be like ""black lives matter"" then go spin the opps block and kill 4 innocent people. Eat a dick",1
29888,"at least a minyan's worth of Jews have been arrested today, and we are STILL blocking every entrance to ICE headquarters #NeverAgainIsNow #ShutDownICE ✊✊✊ URL",0
6490,I love when vaginas are exposed in ballbusting. It shows how superior women are that they dont have the same weakness as men,0
26273,@ChuckGrassley You put babies in concentration camps. You can fix it or shut the f*ck up.,0
37660,"' #ModiKillingKashmiris India being ruled by 5% minority Brahmin, who consider others inferior beings & thr crimes r unfathomable",0
6969,Looks like the slavs where up to no good again,0
3101,"Is it accurate or too simplistic to say that AA yay/nay is more like 50/50 among the demographic as a whole? Do Filipinos, Vietnamese, Koreans and Japanese support or oppose or is it neutral?  ​ Do you think Asian Americans would be open to Affirmative Action if it was more comprehensive (quotas in higher culture as well as media like TV and Film including the possibility of having more films like Black Panther for other ethnic groups)? Forgive me if that sounds rater politically correct?",0
34598,"If Muslims take over THIS country what are the Hollywood Hoes, who love globalism and these ""romantic"" religions, going to do? They'll be in jail minute one with their nudity and mouths !",1
47129,Anyone who is Transgender and facing depression should watch this and revaluate his/her life.,0
20058,"Why did I click on your profile? You gave no source anyway, you just are a hateful human being. Good grief. You have been given sources by others disproving your statements, but no you didn't, once you cited the hatesub GC, that is used only to missrepresent Transgender people and to deny their existence",0
49584,"Send all of these ""ladies"" back to mexico so they can fix that first.",0
38422,"Hey, Mexico! Until you get your narco gangs under control & your mass murders stopped, keep your f**king nose out of our country's business! You have a shithole country, we have a Constitution! We will control our guns as we see fit! #ShallNotBeInfringed URL",1
47084,Its jews again ! MF! May god take these creatures away from us,1
36107,If I had a son and he turned out straight I'm sneaking into his room at night and showing him what good dick feel like 💯,1
49312,Me beast should pretende to rob a bank. Because he is white,0
18872,"Oh man.... Female.... At another mans house? He was probably better looking than you, and had more money. She deserves better than you.",0
12647,"Haha they're just cranky incels that are upset that they can't get her.  And even if they don't, I see no need to be rude or condescending when talking about her, it just shows to prove how immature and pathetic they are, to the point that they take out their frustrations on others.  I really hate ppl like this.",0
23220,Gays and Bi are the worst type of people and pride month is the worst month! #PrideMonth #PrideMonth2019,0
34185,lame ass whore,0
45841,Mny of your subcribers are indians,0
43427,Say her name. The title should read: Presidential Candidate Kirsten Gillibrand gives powerful answer to 'so-called white privilege' question.,0
16871,she is fucking ugly,0
4041,"As a gay here, we love everyone at pride...except those who say we shouldn't have rights. We can't win this fight alone, we *need* (desperately) allies. There's power in numbers and more love to go around",0
47492,"Brown & Black people need to all unite against WHITES now!! They have always been the white devils enslaving, killing, raping, and stealing native lands!!! Kill all whites.",1
16337,"reason one as to why I'm afraid to tell my parents I'm bi. stay strong dude, us closeted fellas are rootin for ya.",0
6345,Go suck the lispy queer's dick,1
34242,@AdamSerwer @jonfavs The advancements achieved during the Civil Rights Era have been fought tooth-and-nail since then. Affirmative action has been chipped away because SCOTUS—mostly white people—claimed that it discriminated against white people.,0
30904,you whites have disappointed me for the last mothafuckin time!! trash ass dumb ass mfs. y'all think all Africans have the same accent?? cant take 2 seconds to learn about our country or culture before making a movie about us. did they even cast any Ethiopians? i wanna shoot y'all URL,1
48605,How can you see someone bettering the country through YouTube comments? You have a crystal ball? What a retarded comment. Hopefully someone shoots AOC then you'll know who they are 😭,1
443,I wouldove to cum in that right pussy of yours,0
42966,"Go back to Africa? Pot is calling kettle back the President's father is from Germany in Europe. Donald Trump whom the parents migrated from Germany after the second tribal wars which they called 2nd world wars came to America in search for better lives, peace n progress.Congress omor parents migrated from Somalia in Africa for safety because of the unrest their country for peace n transquilities, this is a nation of emigrants let support one another to maintain the unity of the nation Shalom.",0
30242,"i scrolled down your cc, answer now plz — I've date a Nigerian and half Nigerian and half Jamaican , the other were just talking stages URL",0
10771,"Holy shit. An actual Asian actor for an Asian role?  Hopefully he proves to be a huge step in solidifying normalcy of Asians in Hollywood, particularly males, who've struggled with representation for (honestly I believe) far longer than other groups have.",0
31488,PROPHET MUHAMMAD PBUH SAID.❣ The strongest bond of faith is loyalty for the sake of Allah and opposition for His sake.🌹,0
27666,@KingLeo25 We don't need all this nigger hate man. Come on lol why won't you let me and #6Braids be friends,1
42908,My crush loves me,0
47694,"Those 4 BITCH'S needs to be pulled out in the streets and horse whipped, they are lowlife UNAMERICAN trash.",1
33513,Bitch u was at my graduation and just starred at me u ugly fuck ur hella fuckin gay u faggot ass bitch go suck gang dick bitch before i gotta go nigga mode n slap u myself u dusty ass ashy ass bitch,1
15283,Fuck those bitches who don't want to worship Satan with you.,both
4864,This attitude is all to common in the black community. Hate doesn't beat hate.,0
27283,@pigmen_mc Hey nigger. Fuck herix clan they suck big dicks. Imma dislike bot all ur vids to fuckin 100k bitch ass fat ugly fuck suck ur mums tits u nigro,1
35449,"I'm confused ...How can dude tell if someone has good pussy?  From my understanding ""good pussy"" means y'all nut fast from a couple weak ass strokes URL",0
45924,White supremacy at it again another lynching of another black man ain't that a b**** this m*********** the other guy Epstein can walk in and out of jail for hours and do as he pleased to get just like Bill Cosby you want to go after this guy like a runaway slave white supremacy that's the f****** problem.,1
20063,"Lady in the back Blinks when ""her"" camera red light goes on. Part of the tranny SHOW. Before ya deny...see: Transvestigations on Yt. Trannies are PROUD to show How It's Done!👍",0
11920,Yes they are fag.,1
661,What answer. You say Quran and Hadith.  What verses in the Quran what is the reference? What Hadith what is the reference? You got nothing for me to go on From seriously.  Please explain how I am wrong or where I have been proven wrong....?,0
6529,"Transgender people* (know you have good intentions, just helping you fine tune them)",0
22548,"This is the ugly face of Islam. This is the story of every non-Muslim, from Jammu & Kashmir to Iraq and Syria. It's your 'peaceful' neighbour who rapes and kills you, the same neighbour who vouchsafes your safety and security. How can Muslims expect non-Muslims to trust them? URL",1
3396,"Any of your ""friends"" should be supportive. When I came out when I was 13, I found out very quickly who my real friends were. Any friends that don't respect your decision aren't your friends. Love to whatever you decide 💙💙",0
17506,What no? The lesbians are the best part! I don't remember any incest though... What are you talking about?,0
3502,"The problem is it's now become open and publicly accepted that feminism is not about equality at all. In their opinion, all men are part of the problem. So any wrong to any man is a equalizer to all women. It's very black and white, as all women are repressed and deserve constant retribution. This is the new equality.",0
40516,"Ghetto fukin retards talking about he wasn't a threat. Hope they get locked up, disgusting ignorant thugs",1
25269,"@MileyCyrus Oooo careful there! Such violence, lucky you escaped that dangerous aggression! Put that vile woman hating rapist behind bars!",1
28836,Me And My Baby Mother Can Be Mad Beefing Whatever I'm Still Not Fucking Wit None Of You Bitches 😂 Always Going Make Sure She Good Regardless 💯,0
20041,"I'm sure there were several others, but Islam is definitely the worst",0
30353,"@HomeRuleNow Shoot the *unts with hollow point bullets filled with pig fat, that'll ensure their eternal damnation, no virgins for them",1
49314,Transgender Michael Michelle Obama make some phone calls. Next thing the criminal is let go. Hmmmmmmm,1
8269,"Why pig men, this is sexist. /s",1
25457,if a lesbian can control herself in a room full of changing women a man can control himself around a woman wearing fucking clothes URL,0
39769,A MENTAL HEALTH DATABASE WHAT THE ACTUAL FUCK. URL,0
18989,Every single white country is getting swamped with 3rd world trash. Look around.,1
11139,"Atheism is over, it's all about Atheism+ now",0
9415,Look at all these kink shamers,0
18981,"Rather be an obese piece of shit than Sunni, inshalla",0
32730,@RampCapitalLLC And everyone is transgender and legally getting their balls waxed by a 13 year-old robot girl.,both
35088,Attn: World Hamas and Islamic Jihad  abuse the children of #Gaza indoctrinating them with hate  and weaponizing them  with grenades and firebombs.  This child abuse must end. URL,1
6457,"The twin of incels, but usually for people who were burned during a precious relationship (or think they were burned). They've decided women are to blame for all of men's troubles and if women would just shut up and get out of their way the world would be a utopia.",0
13742,"Ahh, congrats!! I'm so proud of you!! I sorta feel you on that! I'm still mostly closeted and for a long time felt bad about being bi. Then I found this group of precious souls (I love you all!!) and since them I've started living myself! This is probably one of the most supportive groups in this website. 💕💜💙",0
45977,+Raymundo11 shut the fuck up Europeans rob entire continets wholesale but want to talk about Africans lol return the entire continent of America and Australia you scumbags,1
28174,Calling all Black women writers aged 16-22: this is a brilliant opportunity. URL,0
39264,@iancarty123 @mazma4002 Hope his dick turns to a cancerous piece of shit,1
3405,I hate them all. All religion is a man made construct in a sad attempt at understanding life and asserting control over chaos.,0
20004,ayo i even kill handicapped and crippled bitches/look at my scalp real close and you'll see triple sixes,1
32555,Retweet this tweet if you want to pull a girls hair like this while you fuck her ass raw! #porn URL,1
40906,Fuck muslins and that aoc bitch.,1
44104,How is it a sin? If you are not a citizen you shouldn't count. It's simple.,1
17048,So another white boy went on a killing spree?,0
20018,"RT @JihadistJoe: We Muslims have no military honour whatsoever, we are sub human savages that slaughter unarmed men, women & children http:…",1
30407,Sorry you peasants aren't making these men eat your ass. These niggas abusing your vaginas and beat you for face lmaoooo that ok y'all do that while I push their face in my butt 🙂,0
22438,@charliekirk11 You know people who practice the religion of peace don't vaccinate,0
40544,"+Have you seen chef? jews are white people, idiot",0
46221,The title of this video says that the comments were racist so obviously they must be.🤷🏾‍♂️,0
20185,"Diop Reflects On Being 1st Black Woman Director In Competition At Cannes Film Fest: Mati Diop was initially disappointed when she, by reading a news article, discovered that she was the first black female filmmaker in the Cannes Film Festival's… URL URL",0
7856,Black People are not human. Remember we considered them 3/5th human. They have one of the lowest IQ's out of any race collectivity. They're disgusting physically and extremely violate.,1
530,"It's good to be comfortable in your own body! You're who you choose to be, and if you're trans that's cool and if you're cis that's cool too.",0
2571,She asked you to stop bothering her pussy. She's probably having her period right now. You know how girls get.,0
9300,"Funny thing was I did question it when I was in my early teens and though I might be Bi or Curious but I was most definitely into girls/women.  Turns out the world around me was just a lot more homophobic than I was and I thought that if you weren't *repulsed* by the idea of a naked man, then you might be gay(ish).  Took about a year (and no experiments thank god. That would have been a disater) to work out that I'm straight. So thankful that my parents gave me the support and freedom to work that out on my own.",0
47044,"Truth Teller You Never,Ever Give Radical Muslims a Path To A Nuclear Weapon!!! Odickama was a Traitor not just to America But To The Entire Free World!!! If you idiots think they won't use one as soon as they get it, just remember you are infidels yourselves!!! We need to turn the sand into Glass...ASAP!!",0
44017,+Female Russia DIRTY FILTHY DISEASE CARRYING MEXICANS,0
4865,>incelosphere Ahh. >self obsessed foid that thinks whoring in Europe for 2 months is totally just as fulfilling as rearing a child It makes so much sense. How mad are you that you're child free not by your own choice?,1
3556,Would you say this if his mother sacrificed a goat to appease a god? Why is it only disrespectful if you don't want to participate in Christian rituals?,0
6924,That they wipe their ass with water and hands in Burma,0
17226,Is that supposed to be closed off? She was just puking out of that spot on the overflow tank.,0
49065,No one cares jack your fucking gay,0
43647,Saudi Arabia is the source off all terrorist and is support by USA. When USA will stop playing world bully.,1
26314,Niggas really thought they was finna be on they hot boy shi w futures EP but all y'all got was broken promises n missing us females. LMFAOOOOO fuckin losers. URL,0
10595,I told him it was gay. He said im gay too  It tastes so fucking good.,0
40757,Come on man Mexico's the most corrupted country you guys took all the guns from your citizens so that your government in the cartels can do whatever the f*** you want and your people don't have a way to fight back the only thing they can do is move illegally at that two other people's countries because your country is such a f****** broken piece of s*** you should be ashamed of yourselves how many of your own people you guys have murdered and slaughtered f****** pathetic,1
25580,"@king_Bello7 @JohnHGraham6 @b77_sarah I think if it was any other culture the guy would be facing assault charges, of course it is islam.",0
10750,"""You ever heard of the Harlem Struggle, slut?"" She'd nod her head no. ""Well you're about to find out first-hand!"" I lie on my back and pull her face down , 69 style, onto my cock. I pull hard, smashing her nose against my balls. Then I throw my legs up behind her head to replace my hands. Figure whore leglock style. I'll bet that would surprise her!",1
18752,The Jews aren't behind everything. Don't be so /pol/ brained.,0
34481,Retweet if you want my perfect fat ass bouncing on your cock @KitteyKatey #horny #boobs #tits #pussy #porn #amateurporn #nsfw #cumslut #blowjob #sex #slut #ass #dick #cock #jailbait #bbc #gangbang #cuckold #fuck #fuckme #whore #cumtribute #nude #naked URL,0
45424,"Says the woman with her breasts hanging out. I know you're not a Christian, because Christian women do not dress like hoes.",0
7791,Fuck guys who spew shit at you and start sPeLlInG WORRDS ERATICally to drive home that they're totally having a breakdown and that's why they're being so mean and oh the worse I am to you the more you should feel bad for me because I'm so lonely why don't girls like me ))): slut,1
26320,"Hang out with queer, aries, at one table = Pecah pala ! URL",0
35069,"@marathiputra She's claims to be Christian (Baptist?) African-American and will continue to do so. Even though her father is a Jamaican immigrant, and she was raised by a divorced Tamil-Hindu mother.",0
33310,Nothin but bitches I be fuckin,1
43542,Drake a fag!! Who tf would get tats of nba players number?!! Fag nigga,0
23660,Fucked with all the wrong females my whole life,0
48684,"Men or women, England will never, ever win anything 😂",0
12294,"I see literally one tweet saying ""aren't there enough white characters"", and not a single other negative tweet",0
33571,#BlissfulSunday .....🙏🙏 @Gurmeetramrahim Singh Ji Insan 🙏🙏. Today a huge gathering of followers from various states reached at @derasachasauda to attend the pious Naamcharcha. It was a peaceful gathering in which the followers prayed and meditated together. URL,0
11462,"This is what happens when you have isolated yourself in a frenzy of populism from friends and allys and instead have to do the dirty work for an angry Orange toddler the other side of the Atlantic who is desperate for a distraction. Toddler Trump can't stand the deal with Iran because black man's name is on it, and now England is being humiliated by religious fanatics who until recently were minding their own business and persecuting women. We are reduced to this weakness because of 17.4 million idiots.",1
