id_text,text,label
3861,"it's because after the initial interest women realise you're full of shit The man doesn't match the impression they get.  For example if you act all idgaf and thug and all this shit, and then like a pushover once you get attention.. their hindbrain goes #ALERT ALERT LYING CUCK BETAMAX FAGGOT DETECTED",1
47565,Crazy women with very tiny little brains trying to destroy yet another western country!,0
16361,Hahaha fucking white people,0
48264,"They're always such victim's. This border things is such a fiasco! Told 8 mo., ago this was a crisis...oh no your making things up! Now they're crying and begging for illegals.",1
1172,"Roots? All of your family are stupid fat white redneck trash. You sweaty fat neckbearded virgin cunt. Hopefully your family die in an accident, not you, just your family. You fucking gimp lol",1
30336,Another 9/11 victim has been identified. Remember her instead of wetting yourselves over Omar.,0
3727,I would love to rape you and fill all of your holes with cum,0
29276,"Commemorating the 10 year anniversary of the ""Urumqi Massacre"" which took place on the 5th of July 2009, #Uyghurs all over the world took to the streets in protest of the #Chinese government's oppression against the #Uyghur #Muslims. 👇 URL URL",0
30651,Oh my pink triangle! The great Indian ppl have decided to fight #fascism with #homophobia.,0
45509,Too many homos in the bible belt,1
9054,Yeah we're all Nazis because you can't buttfuck and exchange needles without getting AIDS.,0
4251,"Good, fuck these low life people.",1
1291,You look like ISISs IT guy but got fired and now live in your moms basement.,0
19685,You're also a complete faggot for participating in the Chapo subreddit. You and your shitty political humor can get dunked on you fucking bozo,1
25663,You really a HOE ASS NIGGA if you come back and save these dudes @KDTrey5,1
29483,We will not break our tv sets We will not cry like mad. We will not abuse our players. We are Hindus and we are one of the respected countries in the world. We still love our team. Team india you are still our best👌 URL,0
38839,@oldmanebro Son wiggin Wayne killin mostly all them niggas above him URL,1
24788,Stop making these closeted boys your project. They are not going to come out for you 😒,1
5203,"This is why america is possibly the most retarded, dumbed down, fucking idiotic country in the world. If japan decided to get revenge for hiroshima and nuke america id be in *fits* of laughter.",1
3299,"Oh and the Christian ones. There's a big one in my town only a 1/4 mile away from the town sex shop that says like ""LUST WILL SEND YOU STRAIGHT TO HELL"" or something.",0
13803,There are pros and cons for merit based immigration.  Some of the visas to work here are merit based.,0
7189,The use of suggested profanity is not very Christian of you,0
36795,This is because the #ElPaso killer is white. Would Gov. Abbott have this reaction if the killer was Muslim? URL,0
19853,"""women shouldn't get mutilated"" ""women should be forced to go kill who their politician tells them to kill""",0
40507,Danile be trying to talk spanish but she dont even understand me as a Latina dont accept this who else this disrespectful,0
3538,"I care not you Nazi incel. I'm fixing to.the next dead radio subreddit super star until i eventually get doxxee and lose my friends, iob, and family. Suck my small irish cock faggot",1
7410,Same. There are some very fine Indian men out there.,0
41449,Lets piss off some idiot incels. Let's bring them down for good.,0
31247,"I'm sick and tired of just being ""just friends"" like open up ur fucking eyes and see the potential bitch",0
31569,Tears at funeral for 86 Muslim victims of one of the worst massacres of the Bosnian war URL,0
9256,"The way you were born isn't somthing to celebrate but the hardship you over came because of the way you were born is.  Im not proud I happend to be born trans, im proud of what I've gone through to be myself",0
43544,"you prove churches have all the nut cases Christians Muslims does not matter , YOU PROVE ALL THE PSYCHOPATH AND LIARS ARE AT POLICE STATIONS AND GOVERNMENT BUILDINGS",0
2996,Its the bleach blonde hair. Doesn't look very good. As well as the nice dress.,0
28577,"@BComeUsefulWord @awwadsalotaibi In your fucking country guys with swords would cut her head off. So fuck you, saudi arabian islamo fascist",1
40962,Just bus them back over the Border what is the big deal,0
5424,"Another fundie that refuses to do the job, so should lose it.",0
11054,Why the fuck can't I beat black children?! I can do that IRL right now! Fucking SJW cucks,1
40164,RACIST CUNT MARTIN LAURANCE WOW LOOK AT ALL THESE BLACK PEOPLE WTF ARE YOU DOING HERE OH IS THAT RUDE THEN WTF MAKES YOU THINK ITS NOT RUDE TO ALL RACES U FUNNY CUNTS EVERYONE IS GONNA BE KILLED BY NAZI SOCIAL ENGENEERING MULTICULT SATANIC CULT NWO SHIT FUCKIN RETARDS IM SICK OF IT JUST FUCK OFF LEAVE PEOPLE THE FUCK ALONE,1
32207,Look at this fucking pussy URL,0
12643,So my wife has two other dicks and the count goes up. Haha! Why don't y'all pay some of these bills for that free pussy.,0
1490,"I'm a 40-something married trans woman with kids who is 3+ years into transition, 2 years full-time. I'm happy to chat with you!",0
42475,What is wrong w being a immigrant?She is human not a alien and a citizen on the US. You could have been a immigrant. Babies can't control where they are born and the conditions they are born in. We are all human and want opportunity for a good life. You people are so ignorant and full of hate.,0
37211,@RepDebHaaland @RavMABAY @RepEscobar Radical change in American economy and Foreign Policy. Stop instigating ethnic conflicts worldwide that end up in wars where the USA sells weapons in order to steal natural resources to countries of extreme poverty. Produce potatoes instead of guns.Leave peaceful people in peace.,1
48296,Didn't they make the playoffs....since these 2 niggas started playing together?🤔🤡🤡 niggas shouldn't even be allowed to talk basketball now days. Trash reporters,1
35061,I'd be one clown ass bitch if I was out here worried about a nigga .,1
45423,When the atheist say that he kind of lose relation with Him when he's not find church to sing in choir. I know it's him,0
22925,"@Deannemh You are so right sister, a popular kids cartoon on PBS recently had a gay wedding. It's pure brainwashing. URL",0
4166,"Yep, Eastern Orthodox.",0
20790,Omg I'm finally going to be killed by an incel,0
10100,"evangelical christians call Trump ""one of their own"". That means they are pro child rapists, bigots, racists, xenophobic and rapists. Sure doesnt seem Christian to me.",0
16996,"As an openly gay black man back in the day, life must have had its challenges. His music is so soulful, and it hits me straight in the heart strings.",0
45598,"ANOTHER FEW TO LOOK AT IS AOC,OMAR AND TALIB? THEY HATE AMERICA,THEY HATE WHITEY/BLACK MEN ANYONE AMERICAN AND ITS A FACT THEY HAVE ACCESS TO WEAPONS,ARE RAGING EVERYDAY ,HATE OU R PRESIDENT AND HAVE SHOWN NO KNOWLEDGE OF OUR GOVT?MAYBE THEY THOUGHT THEY ATTACKED THE WHITE HOUSEAND GOT WHO THEY WANT TO GET?JUSSIE SMOLLETSEEKING REVENGE FOR HIS BEATING?MAYBE HE THOUGHT THERE WAS A MAGA MEETING THERE? WHY DO WE ASSUME ITS A STRANGER?",1
45568,She knows NOTHING about immigration laws or laws that are broken in America! So according to her testimony no one who breaks the laws needs be locked up. Not even American citizens or LEGAL immigrants. She needs to shut her uneducated ignorant mouth. She continually shows how ignorant she is!,1
7804,U.K. is full of cry baby virgins lmaooooo,0
18234,It's a shame such savages desecrate a beautiful language like Portuguese. They need to use their native monkey languages. Fucking niggers,0
29972,"""Send her back"" sentiments would have been standard fare at Know-Nothing rallies in the 1850s, or Klan rallies in the 1910s-20s.",0
36079,"If we're gonna do this, the narrative SHOULD be, ""if WW were as excited to vote 4 the first WW candidate as black voters were in 2008/12, 45 wouldn't have gotten elected"". If you want to do this, there is your damn story. But no, white voters can never be held accountable but...",0
39501,These lil niggas is ugly,1
31501,"Wake up America. The Muslims have their foot in the door. If we don't end our PC tolerance of this evil in our midst, America is doomed. Vote them out!!!",0
3454,white people: lol black people are all thieves  also white people: watch me embezzle all these FEMA funds!,1
38541,@_flora15_ @jainnaincy10 @sharmarashmi20 @RstfOfficial @ColorsTV @shantibhushan3 @mnysha @rajabetasharad Bcoz for them male have no dignity it's such a shame they re promoting male rape molestation illegal marrige males also have dignity rape is rape males also have dignity looser CVS,0
39283,"""Good whore, keep taking your Mommy's fat cock like a good bitch that you are! Oh and if you fucking love it~ Call your husband and tell him, that you won't be back home today~ Since you staying at your Mommy's place.. And I promise, I will fuck you for whole night!"" URL",0
45523,this bitch is disgusting wtf,0
46864,Goy's need to open the boyder or your literally a Nazi!!!!,1
32387,This actually happened to me smh hate niggas,1
23583,Eat that pussy till she cumm and make her cumm again .💯,1
5239,"If you savages could think beyond taste and 72 hoors, maybe half of you won't be trying to allahu snackbar themselves.",0
37019,I honestly think. Hear me out. We need a new revolution.We need to stand up for our own community. Im tired of seeing terrorists terrorising out country. We need to execute these fuckers. #walmartshooting #WhiteSupremacistTerrorism #massshooting #ElPasoTerroristAttack #Terrorism,1
21022,Jokes on them cos I hate them bitches anyway,1
4132,Fuck you mods I can't fucking post bunch of faggots,1
13471,"eh, i slightly feel bad for her. just because she lives in a world where getting one cut and a few marks on her face means ""disfigured"". she is probably screwed for life and never going to get a husband with only 98% flawless skin.  she might as well just give up on life... /s",0
44693,Unfortunately White people dont want their deity blemished. Everything about Trump is a destructive disaster .They would see this orange piece of shit destroy everything just to dismantle everything Obama. Free fall and splat.,0
43945,"Women are incapable of handling anything that doesn't involve creating public humiliation. The idea that she would tell people to unsub from James' channel is unthinkable. And, she even goes so far as to accuse him of flirting with straight men. Just exactly how is that any of her business? I am gay and have had countless women flirt with me, even hit on me but I haven't gotten hysterical about it. Westbrook is one sick bitch and it's unfortunate that PeopleTV is helping her spread her vitriol as if James has had enough. Thanks to Westbrook he is receiving death threats.",0
6447,How many autists does it take to call the bear jew on Jay Clayton?,0
28903,"@RealMAGASteve Ummmmm, pretty sure that chick has a dick.",1
2845,English people just be rascist.,0
7960,"You faggot, quit thinking you need replaced just because the morons on TV tell you so. If we had a functional government they would encourage birth rates among the native population by providing tax cuts and even doing what poland does, for every woman that has 4 children they give her a minor government pension.  This fucking lie that we need to replace our native populations with garbage floatasm from the third world is an absolute absurdity.  just because your cup is half empty, you don't piss in it to make it full again, you fill it back up with good water.",1
48088,God won't bless his son's murderer Israel.,1
14289,Ugly bitches roll together. I should know I only bang fatties and uggs.,1
22794,Niggas ain't really with me !,0
22127,"It's wild how scared white folks are of me, a short Asian lady with too many chin hairs and too little sense of fashion. Find a mightier enemy y'all. You're embarrassing yourselves.",0
3595,"""If you're black?"" Quit it with that bullshit. If he has a gun drawn on you, this is a good move for every race. GTFO",0
41132,This from a leader of a country that was responsible for 60 million deaths. Concentration camps. Nice try bitch you handle your problems. Stay the fuck out of ours.🇺🇸🇺🇸🇺🇸🇺🇸👍👍,1
31760,Yal niggas gone get pregnant from all that dick riding,1
10719,"Just nuke whatever country their in, coz y not",0
9201,We already segregate freshers in a lot of campus accom,0
48567,"+Vickie Geraghty I agree 100%!There's also poor help for the mentally ill, and a summervery toxic culture. All the more reason to actually find a solution. Not just pray to Someoneone who isn't their.",0
7017,"she calle them niggers, well hope that chink bitch dies in a fucking fire how bout that? black were here in usa before asian so tell that asian hoe to go home",1
1113,An atheist cuck claims to know all about the conditions in hell. Huh.,0
3076,"Except that time when God hardened pharaoh's heart against Moses just so he could kill a bunch of kids, in his divine mercy.",0
28435,"Democrats applauding the Rainbow flag outside our embassies while covering up a gay man Christopher Stevens death, blaming a YouTube video, when he was murdered and dragged through the streets, is the height of hypocrisy. #NeverForgetBenghazi",0
2060,"There is no form of birth control except abstinence that leaves you absolutely free of any chance of pregnancy. So yeah, you could have been wearing a condom, she could've been on the pill, you could be tracking her cycle and pulling out, and it still could have been yours. Nobody needs to be stealing your precious seed from discarded condoms or whatever other weird MRA talking points you have in your head. Also, you're an asshole. Accept your judgement.",0
10986,Piss off faggot,0
2150,i can attest to that. i host agloryhole myself and most the cock that message me are at least 7ins or bigger. I always ask why they wanna use the gloryhole and its the same mostly. they are married and liek the anons part to the whole thing,0
20038,"Aint nobody wearing those new Westbrook ""Jordan's"" but Mexicans & trailer park trash white girls.",1
36582,The #massshooting in El Paso Texas is a white supremacist terrorist attack.  Linguistic precision matters.  My soul cries out!,0
20365,It's interesting what so many of us view as masculine energy. URL,0
43709,"You guys are great, but you're not the only Christians who are teaching about the dangers of Zionism. There are several brave voices, among which are Chuck Baldwin (fantastic teaching btw), Owen Benjamin, Vox Day, Adam Green, Steve and Jana Ben-Nun and many others.",1
6480,"The worst is they sacrificed virgin girls. If they were to sacrifice someone, they should have chosen ugly old hags instead.",1
24778,"Bangladesh Awami League wishes everyone around the world a very happy, blessed and prosperous #EidulFitr #EidMubarak URL",0
49133,"AMERICA the land of many psychopaths yet the main one is given constant publicity-sorry to say this but some women out there need to keep their mouths constantly closed-Aoc,the Muslim terrorist Omar god 😄😄😄 (oh my god)😄😄😄,FEMINISTS,sjw's &antifa 🙊🙊",1
10792,"Christian fathers make their preteen daughters swear their virginity to them until they are married. Their preteen/teen sons, though, well... go out and get em, slugger! That's my boy!!",0
28006,PUSSY BITCH,0
26399,"Another twink, another fuck! We started safe, but after a minute he begged me to fuck him bare. Who am I to complain? 💦😈💦 #gay #fuck #bare #ass #dick #cock #amsterdam #dutch #twink #cum #porn URL",0
43069,Such a trashy country. They need immediate population control. A plague would also do them pretty good.,1
10550,Agreed (from the Middle East),0
26415,"@notcapnamerica Jesus would beat half his ass, then turn to the other cheek and beat that before ripping off his penis using it as a slingshot to launch the pervert's ass into the icy cold waters of the Atlantic. Then Jesus would walk across the Atlantic and kiss the perv on the forehead.",1
13326,Stop reposting faggot,1
43529,Put this cunt on the street there he'll see how black people get harrassed by police he reading from books typical mr know it all,0
41279,Ugh boy I feel your pain... it's so hard. It's really hard. But I am beyond happy the world slowly becomes a more and more better place for LGBTQ+ people.,0
17980,"You're right, I didn't think about that. And we should be raising our children to not discriminate regarding of race, wealth, social status, etc. just treat someone how you would like to be treated. I just don't feel right when you point out the race of children when trying to make the point of not treating people of a different financial standing. She's profiling the children at the same time as she's teaching a lesson of compassion.",0
45120,"NOT THE SQUAD! ISLAMIC FASCIST JIHADIS, U.S. ENEMY COMBATANTS. IMMORAL, BIGOTS, HATERS, ANTI AMERICAN, LINKED TO HAMAS, HEZBOLLAH, CAIR, MUSLIM BROTHERHOOD, ISIS, SYRIAN REBELS, ANTIFA, CAUSE OF HORRIFIC SUFFERING WORLDWIDE. WTF ARE THEY DOING ON U.S. SOIL IN OUR GOV'T? ASSASSINATE.",1
1634,"Actually, there were plenty of female rulers in the ancient world. Or what would usually happen is a strong woman would be the real power while her husband did as he was told.",0
7546,Stfu bitch ass.,1
25326,"It doesn't matter if you're: — Black — White — Rich — Poor — Tall — Short — Cis — Trans — Disabled — Able-bodied You are VALID, you are WORTH IT, and you are LOVED. Except if you think a ""straight pride"" parade is a good idea.",0
39093,"You didn't have to say you were black, you must already think that you are. Gon have the nerve to call a nonblack a ""nigga"". It must be engraved in your brain that you got some black skin cus baby you hangin onto that word for to dear life LMAO yall be killing me goin in so hard",1
25627,@playboicarlsin1 Stupid ass white boy go back to school and shoot something,0
2556,"Look, if you want to proudly proclaim that you have better twerking skills or look better in a wet t-shirt than women, then take your gross ass self somewhere else.",1
49991,Simple Dumacrat. If you hate the USA go back to your fine country of origin. I'm sure it's gang busters there.,0
41311,"In time your going to regret fuckinv over the American people because of ""morals"" I'm a fuckinv Mexican and I see what's going to happen... invite the third world, become the third world, simple as that... bunch of stupid ass wet backs getting their children raped and killed... but it's ok, let them all in and that would solve everything right... America hating clowns",1
33637,Honestly though some white people are really fucking idiots I swear,1
36356,"These reports make it clear that the Trump administration is determined to continue inflicting cruelty on immigrant families at the border. This isn't border security. It's human rights abuse, and we've had enough. Congress must immediately pass the Keep Families Together Act. URL",0
42544,Democrats are anti white male,0
927,Complaining about and insulting America and it's people and then bleaching your hair blond and shoving colored contacts into your eyes with the goal of to looking like California girl.,0
25650,"Trump's tariff threat appears to be working as heavily-armed Mexican police and Marines confront caravan of Central American migrants  Mexico dispatched a special unit of 200 agents to intercept 1,000 Aliens headed for the US. ⁦@TheLastRefuge2⁩ URL",0
21758,@StarDanielle @2020MNCongress Good news hopefully you send her packing back to Somalia with that hideous un American thing on her head !,1
27440,"Hazrat Mirza Masroor Ahmad ""Islam's true teachings are so complete and beautiful"" #StopWW3",0
19091,"Or just started harassing her online telling her she's a tease, slut and bitch.",1
25210,#عيد_مبارك   Eid Mubarak to all of u.. May ALLAH shower his countless blessings upon you and your family... ❤❤❤ #eidmubarak @TeamKHRoffice URL,0
39037,End of an Era The iron lady of India is no more Reasons behind women empowerment One of the best minster India had. #SushmaSwaraj #RIPSushmaJi URL,0
6842,Giant vaginas with feet. Y'all look like the three kids that your step dad hates to have to call his own. You three fuck faces remind me of sex with Ron Jeremy. Nothing to boast about other than getting railed with a ten inch dong.,0
40836,What is racist about asking what country ur family is originally from?,0
45413,"This is whats going to happen to America, if the US does not repent and turn back to God. Stop sinning and promoting abortion or the US is going to be the next Sodom and Gommorah. Jesus is The Only Way. REPENT.",1
38065,all of you nigga's are a waste of time honestly,1
821,Someone needs to break that cunt in. A hairy pussy like that should be left gapping and dripping cum.,1
37643,"@DeepInTheHills @KimDamore Racist, bigoted jerks mess with others and feel offended when others don't appreciate it. People will less likely attempt to do anything to them if they have an assault rifle in their immediate possession.",1
37193,Her insecure ass doesn't need to get married. This is sickening. URL,1
40383,"Yes, judge the president as a misogynist then marry into a monarchy.",0
18308,indian mods are cucks,1
48899,This is a little BOY anyway . A transgender . The real story here is Sodomy .,0
29530,Could never respect a nigga that fold on the mother of his kid,0
20046,"Men are still ten times more likely to die on the job. As we get more ""equality"", I don't see women taking dangerous jobs from men. Women are taking safe jobs from men so even more men will die on the job. If we were to have a another Vietnam (60,000 killed), 97% will be men. Men die earlier than women, but spending on woman's healthcare research (breast, ovarian cancer etc.) is four (4) times greater than the sending on mens healthcare research (prostate, testicular cancer etc.). The list goes on.",0
14155,Or if you do it in such a way that your criminal justice system punishes some races more often and more severely than other races.,0
28083,"Headline reads, ""First Generation Multicultural Woman in Tech"". I'm a first generation Caucasian male in Finance. Where's my accolades?!",0
11812,Then show us how much of a good slut you are and fuck yourself with something (fingers toys whatever you deem appropriate to stick in your cunt),1
24669,@MalaMujerFuerte @latimes Каrl Marx opened the gates oh hades. And Europe is sinking in this antiwhite racism ocean of colored muslim migrants,0
42031,they have a white dude just serenading them with a guitar. Feels nice to be black rich.,0
5607,Can't wait to see you stroke that big cock and see it cum :)),0
26235,"It's here already! Sharia, blasphemy laws used against conservatives! Someone better stand up and claim the law that supersedes that! The constitution! @TuckerCarlson @seanhannity @JudgeJeanine @AlanDersh URL",1
2157,Oh no I'm definitely trans. I'm much happier now than I was before I transitioned.,0
38088,@tampa1_ @RepAdamSchiff THEY ARE ALL WHITES. THEY ARE WHITE SUPREMACISTS.,1
37654,@btap2015 Shame on @ImranKhanPTI while India was banging kashmir this coward was planting the trees. Such a shameless and coward man history will never witness.....,0
23735,Latina Lesbians Giving a Good Lick  URL,0
43555,It's not about being racist it's about what comes out of the squad's mouth that's what it's all about doesn't matter what color their skin is that doesn't matter just put a dirty sock in their mouth,0
11901,A autist piece of shit,0
38263,@keriberry_420 My cock so hard for u r pussy,0
42759,Just vote off the people of color first nice,0
34681,🤐 shhhhh them yung buls always wanna give me that good boy pussy 😈 But don't ask for that thug Dick if you can't take it! 🍆🍑💦💦💦☄ URL,0
45674,The 2nd video the black american women.. She slay it,0
45472,"yep, now we will soon see iran go up in flames. I love it. kill them all and start with those ugly babies.",1
43340,This is white folks business. Black folks stay out of it.,0
9175,...I love you so much right now. This is pretty much a perfect summation of gender identity vs gender expression vs gender roles.,0
43369,Well the Philippines decided that the tsunami that hit Thailand was a message from god to institute sharia law. Maybe instead they should have voted for a government that would take climate change action?,0
8357,"No, you sense fuck, we dont want people stealing more of our tax dollars than already do. Irish criminal aliens? fuckin deppt those mics too. Fuck off and come back LEGALLY.",1
4956,She deserves to be sprayed down with cum,0
24942,Great Raya message from Tun M. Need transcript.. URL,0
47470,People are like why does a girl with epilepsy wants to be a runner   why the fuck not what does she got to lose I find it encouraging even with epilepsy she's doing something she loves to do and she isn't giving up half of us put on excuses on top of excuses to not do what we love or to stop trying new things instead of being assholes how about leave a nice encouraging comment or don't say nothing at all you load of negative useless manginas,0
40457,Beautiful girl but -for being American.,0
48156,that woman is mad and needs help she probably hasnt bathed since she was 10,0
13253,> or just a bar I don't know what the fuck y'all think Mexicans are up in our everyday lives to but now I get why you're making a big deal about that wall.,0
28026,Sonke Gender Justice joins 'Stop the Bantustan Bills' coalition in protest march - URL #GoogleAlerts,0
15034,"shut the fuck up you little sissy bitch boi, go suck a cum puddle up from a glory hole you little slut do it, its awesoome",1
