id_text,text,label
39637,"@indigosky42 @Itsafairday @realDonaldTrump @GOP   4 days after Mexican people were targeted shot & killed for being Mexican, you target them again & further traumatize these people So much for unity & love etc.... What is going to happen to these children? Do you know, do you care?  #ICE  #iceraid",0
23162,"So can Americans flood into Mexico and get signed up for welfare, food stamps, free housing and cableTV? We don't speak Spanish so you must have translators everywhere, and put English signs up everywhere. I would like a nice place along the Baja with a view OK? No work either URL",0
42179,"conservatives are gunna hate me for this but this is a terrorist attack. Done by a white male . Almost all of the mass shootings these 2 decades have been don't by white males and people have the audacity to call arabs terrorists.smh maybe if some of you guys would look farther than the brim of your mega hat you would be able to see that arabs , hispanics , and African American males aren't the biggest problems here",0
10742,"I'm 22. Since hormones are more effective at feminizing the younger you are, I wish I had been brave enough to transition years ago when I first accepted that I was trans. Oh well, better late than never!",0
48311,Just replace them white folk with illegals. Problem solved,0
4522,Fuck dude I love chubby white guys u guys have the perfect ass,0
3055,I clearly state that we aren't perfect. So what if I mess up? Yea I believe in God and certain hard practices but oh fucking well. I can't like a pussy here or there? I hope you liked what you saw because I know I did 🙄,0
20032,shut the fuck up you dumb black bitch,1
35853,Too swift on my toes to get caught up with these hoes !,1
36174,"Yes ọsụ caste system has been abolished but most people still practice and believe in it. I once asked my father his view on the issue of ọsụ, he said he would allow his child marry one but wuld nver allow his daughter marry into ọsụ family because of the social stigma",1
20010,"Hey ,muslim dickhead !!!!!!!! Why don;t you go and shove Allah or whatever the fuck you call the retard up your stupid backwards ass !!!!!!!!! You fucking muslims are a bunch of jealous west hating mongs, Islam is a peaceful religion, BULLSHIT !!!!!!! There are many times when it refers to violence. So go strap on your suicide bomb and blow yourself up. yey, one less feeble minded prick ion the world.",1
27114,You fags wish you can suck this cock🍆💦 sub to see more URL URL,1
43326,Being a zipper head and a faggot must be trying plus your sore ass hole and throat,1
32593,No exceptions. All trash even the one on that fat headed hoe,0
21190,you love watching me suck alllll that in 🤤 does that virgin pindick want some attention? then let me laugh at it while fucking your wallet.  make me wet & $end. because i fucking said so.  #findom #smokingfetish #cuck #asiangoddess URL,0
44081,"+Hotty Tasha don't fool yourself we gonna tie the series, win in 6, and send that tall lightskin lanky African back to greece",0
20017,"My God look at these BARBARIC PPL. And these pigs all watching. They r a very, very sick culture. And Omar and Rashid want this crap here. This is America not the Middle East. Round them up and send them home.",1
5644,I think for me it's one of of the best parts of being female! The friendships and community I have with other women.,0
4805,Canada's version of this treasonous twat is our somali immigration minister who still retains his somali passport.,1
9746,"Let's see...  Fake Christians, The Prideful, Hypocrites, Liars, Cowards, False Teachers, and Money Lovers.  Sounds like the guy with the sign is going, and isn't self-aware enough to figure it out.  Also, Catholics, Hindus, Muslims, Buddhists, (Satanists, Atheists, Jesus Mockers)... I guess by elimination and behavior he's one of the less polite flavors of Baptist?  And then there's ""Good People"" near the bottom of the left side. What?",0
22,The guys are one thing but then you have a woman there making one of the worst comments. I say rape them all with a cactus and say God willed it,1
17946,Fuck you jewish cunts and US lapdogs.,1
26958,"3. Perhaps India and Pakistan should think more about encouraging female labor force participation? Religion and culture, and views about women's role in society, are likely relevant? URL",0
34385,@antigravitylite Fast forward to the end of your miserable life.. Oh yeah Poor Defenseless Hater.. Fuck you God forsaken ass hole. Poor Bitch,1
20302,Brie Larson has single handily caused an untold number of gay girls to realize they're gay and an entire generation of girls will grow up and realize as grown ups that it was in fact Carol lesbian Danvers who was their first crush  URL,0
13045,"this ignores the fact the West keep fucking with and destabilising the middle east, causing it to slip further and further away from what we deem as 'civilised'",0
37363,Went to a car wash got on Twitter and we'll you know the rest 😂🤤💦🍆 #hung #latino #cock #precum #bi URL,0
18076,You need to be held down and raped by a dog like the bitch you are,1
17589,Go to hell you digital spic.,1
48078,Meanwhile White Billionaires are making a killing off student loan debt🤣🤣🤣No idea why white people are against free city colleges.. Kinda weird actually,0
20420,it was there for 2 years. 2 whole years. every day i hate men even more. fucking trash. im URL,1
1614,And go through the trouble of dealing with your disgusting fat dead ass? Nah bitch nobody would wanna touch that,0
25891,"@joshi_bp @t_d_h_nair No, the other way. Social scientists support intolerant Muslims and thwart liberal Muslims.",0
8446,"""Sorry bitch, I'll call you that now as it's just a name"" Oh, you dont like being called that? Too bad, it's just a name bitch. Hi bitch, how are my daughters?",1
24040,@ZionistGirl18 @SaraCarterDC @LoriLMarcus The one that will allow its residents to practice whichever religion they choose. So the Jews obviously.,both
11452,I will fuck her ass and pussy right in front of you,0
41690,Go back Omar you piece of garbage ... From Vietnamese proud American .,1
40260,"extreme Lube WHERE IS THE WAR ASSHOLE?  EVEN SO, ITS NOT YOUR LIBERAL MARXIST COMMIE PROPAGANDA EVIL ASS THAT WILL FIGHT AND PROTECT OUR GOD GIVEN FREEDOMS WHILE SCUM IRANIANS COVER THEIR WOMAN LIKE ITS THE YEAR 700AD! GO READ A HISTORY BOOK AND OUR CONSTITUTION BEFORE YOU COMMENT LIKE THE IDIOT MORON CLOWN YOU ARE!",1
34578,Who the hell on earth do you think you are to destroy Hindus or Catholics?? Shameless termites like you would perish to dust in even trying to touch the Humanity. Parasites like you should be thrown out of my land... URL,0
47685,"You'll earn equal pay when your level of play and contribution is the same as the men's. Sorry ladies, but most people don't watch women's soccer. Hell, most people don't want the men's US soccer team play. Unfortunately, soccer is dominated by the men in South America and Europe.",0
17028,"Great comment.  I love traditional Catholicism and traditional Catholic communities, but there's no denying that we have our own problems, pride being the biggest.",0
11769,"I'd stuff her head between those rails, rip her pants down and fuck her seven ways from Sunday until there is so much cum leaking from her pussy it pools around her knees",1
14199,"oh please. this Tunisian Love Rat *needs* to be exploited on liberated american trash tv as the first step towards breaking down the sexist, centuries-old mindset he's been conditioned to live by. i'm supposed to feel bad for him? he probably fucks like the amish.",0
7532,Americans could too if they were such giant pussies.,1
28157,Stfu and suck your own dick. #findom,0
37230,jojo's bizarre adventure isn't boring ur just homophobic,0
17246,"It's absolutely terrifying coming out to people that you're close too, but once you do it and they respond it's such a massive weight off your shoulders. If they're trans I guarantee they will have gone through the same nerves and terror when they came out, but I'm sure they're far happier now",0
43689,Look everyone a real Christian.,1
12962,"Boi, don u mess wit me, I ain playin round",0
28823,@Queerty No one cares. She's a professional athlete I'll never meet. She did a good thing as an American citizen. She happens to be beautiful. I don't care who she has relationships with.  Next crisis.,0
27588,Pakistan: Offended Muslims riot after Trump cut the $200 Million aid - Now they hate America for free URL,0
12386,Jizz down her throat then call ICE for deportation,1
43925,GOD destroyed Sodom and Gomorrah California?,0
35793,"LOL some guys can never get the hint when a babe wants them. Stupid idiots 😁 It's me, I am Some guys 🤧 URL",0
21329,"@AmbJohnBolton If you're not too busy, maybe you could swing by Saudi Arabia and watch them behead a few teenagers.",0
29533,"Post-relationship grief affects men, in the long term, more than women.",0
17303,"Disgusting turtle cock I knew it. You probably look like a gross Euro inbred with your receding hairline to top it off . I bet ""mommy"" has to pick out your nasty dick cheese too. You sound like such an entitled prick. If your parents and nation are rich and you still can't get it together you are truly a pussy boy.",1
13505,There's way too many soft ass bitches in the world that can't think clearly or just have no sense of skill evaluation and base everything off feelings and vibes. Y'all stupid for that.,1
49897,The gay neega has too many tats,1
37866,Incarnation Month #CelebrationsWithHumanWelfare By @derasachasauda Followers only because they following the teaching of their true spiritual master & that is none other than St. Dr. @Gurmeetramrahim Singh ji insan. URL,0
5029,The eunuch's screeches sound convincing to retards,0
6103,"Lets give some incel answers •A man with money that doesn't make me have sex with him. •A man with good dick game that gives good head, and lets me have a sugar daddy",0
41272,This is what happens when u give white people a lot of money,0
28308,"You're the bigot. Your ""religion"" throws gays off buildings. How about you go back to Somalia & take your anti-American values with you? URL",0
40620,Fuckin white supremacist another fuckin you tube algorithm smh,1
46847,"The 4 Congress women don't dislike American.. Like most Americans they dislike trump, and he's using his supporters to fight his battles like cowards do..",0
14917,I thought the retard was a girl,1
9090,Any girl that dresses like that is fake. Looks like a bitch,0
27669,@conprivx Connor you are literally gay you have raw anal every time you shag,0
44820,The us is a shit country ive lived there trash everywhere paroanoid people a shit hold,0
2768,I'm always smoking that reefer and jaywalking It sure is nice being white,1
20070,Who hurt you? Lol. It's comical how stupid and angry you people are.  MEH AMURICA. MY LAND. MINE. BANG BANG GUNS. NO BROWN PEOPLE. WAHH.,0
31971,burn bitch,1
8423,Kinda boring knowing we Singaporean won't dare to do anything. Meanwhile somewhere in murica you will have some crazies who might really do so,1
38605,"i'd hate to be white, you could be woke asf but get mean mugged because you're natural smell is pennies and dog food",1
26076,"@vicecanada Sexualizing young kids isn't pro-gay, it's the actions of psychotic pedophiles who non-stop hate on Trump to take attention away from the fact they sexually & mentally abuse very young children.",0
9922,I'm sure it does suck because you Suck on every level Incel republican bitch.,1
1903,"I was told there would be storm troops in the streets by now to get the gays, the minorities, and all other non-Republicans, the sky would be gray, the world would be nuked, the world would be conquered, we would be conquered, and that Bernie can still win. WTF HAPPENED",0
35475,"Please join the #IStandWithZakzaky twitter storm today by 4pm (Nigerian time). This is a trend against the recent ""proscription"" of the Islamic Movement in Nigeria. Share widely  Thank you @adeyanjudeji @Tutsy22 @KneWKeeD @AbdulMahmud01 @Austynzogs @segalink URL",1
19628,"It's not a bad thing at all; I know I'll always be a female and I'm fine with it. I've done a lot of research and have listened to FTMs about their experiences and I think I have a pretty good idea of what transitioning will, won't, and might do for me. But I definitely can say that I've made peace with being fundamentally female.",0
46560,lol thot acts all loving yet tries to go out with him once a day....,0
6609,And mass deportations are the way to solve America being overpopulated!,0
8538,Homosexual rate drops to 0% because of lung cancer.,0
4361,"As a lesbian, I have the lowest statistical rate of HIV. Those filthy straights though, they breed disease /s Two can play the cherry picked stats game shithead",0
7954,And they are meN little fuckers.,0
49195,"Americans are dumb as rocks, letting socialists take over! All young American women will mimic AOC, her BABY-TALKING STUPIDITY! AND MAKE BABIES? NO WAY AOC COULD NOT KEEP A BABY ALIVE, TOO DUMB, SO WOMEN WILL STOP HAVING BABIES! GOOD IDEA. Too many messed up kids already caused by moron parents and communists running the schools!",0
48549,"oh the Iranians better watch out, here comes my tough guy",0
43321,I hate the white guy with the beard,0
11841,"Well, that's fucking disgusting. Shame she turned out to be a criminal and a cunt.",1
26607,@TheGreenParty's deputy leader @Amelia_Womack reaffirming the commitment to women's equality in every aspect of public life. #gpconf URL,0
8692,It's eugenics. It's practically genocide,1
5972,"Fellow straight here. Sex is not a single, sex is not immoral. If your in a good relationship with someone you love who loves you back, then that's what matters. There isn't anything wrong with it. It doesnr matter if your relationship is homosexual or heterosexual or some other label, so long as it's consenting, loving, and between adults. Don't let some preacher with a bronze age mindset try to get in the way of that. Fuck his opinion.",0
39801,"May Allah bring destruction upon India, filthy country. URL",0
6384,"> getting raped by china well of anything, it's quebec getting raped by china. the chinese own everything here LOL",0
25290,Eid Mubarak to all my Muslim brothers,0
40295,"Lol stfu nick ""stupid white boy"" wright. Shaq and the orlando magic may have beat up jordan's bulls in the 95 playoffs but jordan went back and got his vengeance against them the next year. Stop discrediting one of the greatest legends you bron bron black cock suckin' piece of shit. Your father should have ejaculated you on the fucking toilet when you were a shit ass sperm. Fucking white trash bitch ass dweeb. Go suck your mother's hideous tits. ,.!..",0
41958,"@Keepadagroov typical of those who deny reality , hate white people and are the true racists.",1
29320,I don't go back and fourth on the internet🙄 Real bitches don't get into that 💆 #MiseryLovesCompany,0
6288,"No. That was a story.  But what Jesus actually taught was so outrageous to the populous of the day, they executed him.",0
1574,hate that liberal cunt. She needs to get raped on air.,1
34518,"@_SJPeace_ The world is infested with.white psychopaths that r real Alliens and I tell u now, We really have a problem in this world as long as the whites exist.. They r the worst cruel unreasonable twisted minded jealous assholes ever. Blacks r by nature good beings!",1
18295,"Well I think it sucks that we are still not having true equality, getting paid less, dealing with prejudices and so on. Apart from that menstruation is not so great. On the other hand I really like my boobs a lot. I'm not into girls but i like mine.  And it's nice to wear skirts and dresses. Especially on hot days I don't envy men who have to wear suit on formal occasions while I am allowed to wear a short dress.",0
32698,White people really be driving cars that niggas don't even think about 😂 I ain't never seen a nigga cop a Mazda or Subaru off the lot 😭😭😭,1
3268,"I like Anglican Catholic. I picked the Episcopal Church as an adult, but I considered RC. Besides loving the Anglican traditions and liturgy as well as Episcopalian positions on women and LGBT I would never join the RC church because I cannot imagine being out of communion with my loved ones.",0
29310,"Wait wait him being shot and killed while he was unarmed and on the ground face fucking down was justified? Bitch what, there's videos all over the internet of armed White people being arrested unharmed after assaulting officers and other people. Shut the fuck up",0
33717,"From the look on this #faggot's face, it knows that it has become the #Alpha's bitch and that it is nothing but a hole for the Alpha's dick! URL",1
20858,"Give women a choice, a voice and most importantly opportunities to do whatever they want to do in life. Eliminate patriarchy and educate everyone you know about equality and equal rights! URL",0
48402,just like your ancestors were on their way to India on a spaceship,0
10424,"Stop sending nudes to anyone with a penis, men ain't shit",1
5460,Fuck you smurf ass faggot. Go drink bleach.,1
12906,Grab'em by the pussy? I KNEW KiA was a sanctuary for T_D!,0
15580,I'd liked to fuck the gay out of her.,1
32208,You should've been born with a vagina fucking pussy,0
4559,"I'm a white boy but my husband is Puerto Rican. I embrace all kinds of culture and really appreciate what his family's culture is all about. I try to embrace it. I went to PR with his family this past spring and I'm left realizing that I really ought to better learn Spanish. The funny thing is, I often forget that dating ""outside your race"" is supposed to be ""taboo"", every so often I realize we hit with a ""double whammy"" of sorts of two stupid rules that are meant to be followed.",0
13697,This nigger counts.,1
13709,"The word is racist. And racist is racist. (If you mean the one with the ""a"" at the end, it's used in the black community as a non-pejorative, but that's something that's exclusive to them.)",0
25462,"These man are all cry babies what's wrong with them, give us some toxic masculinity man... #loveisland",0
40475,Oh so the other countries that starve and mass murder their own people are angels....,0
285,"I want to fuck you so bad that my cock is throbbing. I want to fuck your tits and with each stroke, you can catch the tip of my cock in your mouth.",0
26645,@jamila_jb @quickiemart @AOC Lol!! Yep!! This was Spanish territory long before it was Mexican and then American. Read massacre canyon. Where the Sioux massacred over 100 Pawnee women and children. Then the apache death cave where the apache kidnapped- raped and murdered Navajo girls,1
45006,He doesn't love him..! But you're gay ass does..! because you're nothing but a goddamn dick sucking butthole licking shit eating faggot queer,1
9520,Fuck israel,1
33556,"As if a bunch of racist ""old white men"" Law Society Benchers had the gall to raise an issue with ""squaws and niggers"". ????? Who does that but an ""old white man"" lawyer???",1
31121,@Jmruggiero84 @docrocktex26 @pricklyeater @pannlewis44 No that's not right either now you are marginalizing white people. There has to be coexistence And acceptance,0
19894,"So...guys like this Dayton shooter with an (alleged) history of rape threats, violence against partners and serious mental illness should be given girls in private rooms to do with as they wish?  I thought these people were against murderering hookers?",1
37025,Ugly lonely women always have the most to say about men...... Like how tf would you know? You don't got nobody.,0
45255,"Take the full force of the US military, federal police, and immigration services and send them street by street, town by town, and state by state with the mission of removing all illegal persons, dreamers, anchor babies, and any extended relatives to Mexico no matter nation of origin. Let Mexico figure it out. They have been sending them here for decades. If that doesn't stop the flow north. Revoke the citizenship of all prison inmates with a life term or longer and deport them to Mexico in mass. I'd bet Mexico would start building a wall tomorrow.",0
21473,"'Imposter syndrome' is deterring women from starting their own business, according to our latest research.  So we've launched #OwnYourImposter to support women and build their confidence to start or grow a business. Watch these inspirational women discuss their own experiences. URL",0
20003,#whitepower...I'll hang you nigger,1
11021,I'll just identify as a woman and problem solved.,0
8287,lol more like she got all the good dick she needed now she's bored with it and willing to settle,0
49529,Gotta blame it on the jews,1
43236,No one wants you Americans  Your there for a reason ?,0
29233,@BADxDC Hell nah and she's white but I think she use to be black in a past life or something,0
43496,Bye brown border barbarians!,1
39394,White supremacy someone will take that rifle and shove it up his ass URL,1
3670,I hope you die you fucking bitch,1
16003,I just looked and you were the first to use it in that way. I specifically said it wasn't a bad thing to say unless *you you you* used it racially which ya did. Sooooo.,0
14693,She's the epitome of dumb blonde cunt whore.,0
39436,what a dumb fucking cunt,0
47927,"Islamic terrorist regime of Mollas scare of their shadow,They attacked Mr Javanmardi program,With these kind of ISIS acts,This regime can not save its terrorist regime,It is the end for second ISIS Mollas in Middle East.",0
44423,It's always the jews.,both
37368,@rolandsmartin @SethAbramson When 19 al-qaeda guys attacked us we sent troops to war in Iraq & Afghanistan and stayed there for the next 18 years. And they weren't even from those countries it turns out. If a few mass shooters in a row were muslim that could be all the excuse Trump needs to invade Iran.,0
9616,Hey are you the daughter of the woman I just killed? Go fuck yourself. Idk y youre on this subz. But. I will fuck your eyehole,1
15961,"should HAVE you degenerate dumbfuck. in which lower class ghetto do you live that ""have"" sounds like ""of""? do you have 5 dicks at a time in your mouth while speaking?",1
29480,"@sadieannerue You guys know I of course I love and accept everyone in the lgbtq community! And also, I LOVE THE CRANES🙌🏼❤️ thanks",0
26073,@LindaFairstein you're a disgusting piece of shit i hope you have children that get wrongfully accuses of a rape so you can't watch them grow into adults you piece of walking garbage. Disgusting,0
34221,"it was a edgy Hanukkah, Charlie Brown",0
5044,As a black American man I can say it's a personal thing . I try to live my life to the best of my abilities and hating or disliking someone for something they had nothing to do with is not in my code. That said we as a people are so disconnected today. So it's hard for us to collectively agree on anything.,0
15924,Typical reddit faggot,1
20951,@Sethdiddy @Andrewpic947 white people scared of they kids lmfaoooooo,0
1049,"I don't think you can commit blasphemy if you're not Muslim if the first place😂 But on a serious note, this is absolutely ridiculous and disgusting. Things like this are what paint a bad image of Islam.",0
47716,USA got what they deserve for there actions around the world it's karma and it will be getting worst day by day...they shall all perish soon,0
36069,@_vmmvr2 @AshmeigOsman I hope they put you all in a misogynistic men holocaust,both
12196,"From a girl that just discovered she was a girl, I'll gladly take on the title of lesbian in your place c: Congrats dude! I'm proud of you 💜💜💜",0
16764,Thats the meme caricature of a manipulative Jew that subverts other nations with his tricks and deceptions.,0
6647,"I'm such a man whore, I will literally do anything a woman tells me to in bed.",1
10747,Not just thundercunts. Cock juggling thundercunts.,1
18312,Omg id bury my face in that beautiful round ass! Omg u made my big black 8 inch cock so hard,0
24956,"And while we're at it, stop insulting male politicians by drawing them sucking dick. Sucking dick and being gay are cool as fuck. I love doing both those things. Come up with something less homophobic.",0
7492,"Wait, you forgot to tell us that she was stunningly beautiful without trying but also not like other girls because she was strong but secretly wanted the man to take care of her!!",0
40393,"AmeriKKKa is a 4th world country. It's lawless pigs kill in the streets with impunity, judges are bought off & racist, while the AG breaks laws to protect a racist president who worked with Russia to get elected.",0
36661,"Maharaja Hari Singh trusted evil desert aliens & all native Kashmiris, Pandits, Hindus massacred, Prithviraj Chauhan showed mercy to evil aliens & millions of natives massacred , Gandhi trusted aliens & country divided, millions massacred. Never, ever trust evil desert aliens! URL",0
27509,"As this dirty rotten hypocritical bastard Franklin Graham is scraping out the last few dollars in the collection plate at his Church this morning, He is saying that flying the gay pride flag is offensive to Christians while he supports this dirty filthy sexual predator Trump. URL",both
15273,"This makes me feel so welcomed, as someone that is trying to learn more about who I am, but having never met a jewish person outside of my family",0
26421,"Happy #PRIDEMONTH⁠ ⁠⁠ ⁠!  No matter how you identify or who you happen to love, you are celebrated! Your feelings are real. Your identity is valid. YOU are loved and accepted just as you are. Be proud!! RT to show your support for the #LGBT+ community.  #FridayMotivation URL",0
