id_text,text,parent_text,label
1579135502594105345,"@rockstarsani @jdmulniwasi @RajniGa89602955 @SaumyaBaudh @TanyaRNC @Sanpriya1995285 @HINAGAUTAM4 @Bahujan_Sherni @Amita30103965 @PoonamS27299337 #मान्यवर_कांशीराम_साहेब 
#कांशीरामजी_को_भारतरत्न_मिलना_चाहिए 
#बहुजन_महानायक","@RameshR09138630 @jdmulniwasi @RajniGa89602955 @SaumyaBaudh @TanyaRNC @Sanpriya1995285 @HINAGAUTAM4 @Bahujan_Sherni @Amita30103965 @PoonamS27299337 #मान्यवर_कांशीराम_साहेब 
#बहुजन_महानायक",0
1538255178498990083,@DanDartsDawson Shocking tactics by them Dan,"Jose is genuinely the best counter in this team, and by quite a distance as well.",0
fj6nmk5,"I suppose joining the cult of disenfranchised white males could possibly make you friends, just not the sort of friends any normal human would want.","Lift weights, listen to Jordan Peterson.",1
1580327755895357440,@ShawnaRobbins_9 ?????,@calvin_knapp You’re following too closely. Back off. ?,0
fjabngb,U r too dangerous to be left free...,"I don't want to alarm anyone but the coronavirus will soon spread in an irreversible way. The first means of contamination are bank notes, don't touch them.
Wear gloves and place all notes in a sealed envelope and leave them by your front door, message your address.
Tomorrow morning I'll come by for collection and elimination, I'm doing this for the good of public health! Don't thank me...",0
1579517352441712644,"@ajay43 People those who feel bharat is broken, do #BharatJodoYatra ? . Isn't not Shame on #congressitoolkit and #RG . If it would have led by Proposed presidential candidate or current president makes sense. Let thim.first stick to one constituency for the betterment of locals.","The more you see it, the more you realise that the ordinary citizen thirsts for a more inclusive and humane India. This is why the #BharatJodoayatra is gaining more traction by the day",0
1580525701228564482,@EeeJaye9 Only counts if it’s recorded and posted??,Hey!! Guess what!?!? Today is my wedding anniversary. Maybe I should celebrate by burning my marriage license?!,1
1537914172360445952,@grainfole @ShaneSaint I hope to God Wexford show up tomorrow or it ll be like the Kerry game with Wexford playing the part of the Kingdom men.,@ShaneSaint Wexford had a tougher league campaign than Kilkenny etc. And we've beaten all the other 5 teams left in the championship this year,0
fjcsida,Wechat + 3x mark up?,"Like why? We get it, coronavirus is serious, but you don't need like 20 packets of toilet rolls??",1
1572492778537369601,@JohnSimpsonNews He’s playing to a Russian public and hawks first. But I agree. He’s upped the stakes. He had to. It strengthens his negotiating position if that is what it comes to. He knows he can’t win a conventional war.,"This is a very dangerous moment. Phoney referendums in Russian-controlled eastern Ukraine will mean Russia can claim that Donbas etc is actually part of Russia. If Ukraine continues to advance there, Putin will threaten to use nukes to defend Russian territory. WW3 would beckon.",0
fja1bhb,You realize that it didn't spread from 10 to 1700 in 10 days right? That's just how much testing they did in 10 days.,"If you think how Italy went from under 10 confirmed cases up to over 1700 confirmed cases in the space of 10 days its probably not ridiculous of anyone on this sub to atleast buy the essentials needed in a practical sense. Buying products that have no expiry date and can be used regardless of the eventualities of this virus.
My list
Gas for cooking. 
Cooking oil
Toilet roll. 
Bottled water or one of those purifier yokes to improve the tap water. 
Any medicine needed/ask doctor for a few scripts
Hand sanitiser
Any foodstuff you like to eat with a long expiry date, not fucking bread or milk",0
fjc6r5j,the best is when the sign says it'll be there in 2 minutes and then suddenly switches to 6,Buses simply not showing up. Happened to me probably 8 times in a year where I’m late for a lecture or just anything really because a fucking bus decided to disappear.... legit happened to me today so needless to say the wound is still fresh :(,0
1580525672232992768,@GriffinxBryant Both fair questions,@rguns51 Why is ozuna dh?,0
fj97ja5,Very accurate,"Anyone who knows his bloody past would know how much of a statesman he is. It is highly unlikely that the countries around the world, with all the intelligence capabilities they have, aren't aware of Modi's past. All of them just Ignore everything, because India is a big country that imports a lot and would buy stuff from them. They will continue to look the other way, till we continue to buy stuff from them. The day we stop paying them to buy stuff, we will see many of them suddenly become concerned about the situation in India and will talk about re-establishing democracy..",0
fj8jdn3,">If you do not accept an idea from an opposition party and at least consider it, then you are not running the country to benefit its citizens.
when has the lnp EVER benefited the citizens EVER","I couldn't believe it when I watched him say this in question time.  What an absolute numpty.
Not only what his stupid joke unfunny, he repeated it again the next day with a smug face, looking back at his colleagues as if he was a school yard bully.
What is wrong with measuring how happy a society is instead of just looking at monetary figures?
I think it's a great idea in this modern age.  We could use the results and data to focus funding on improving quality of life for people instead of just looking at the books.
It's a no brainer yet this clown and his party are taking the piss out of a great idea simply because it came from the ALP.
If you do not accept an idea from an opposition party and at least consider it, then you are not running the country to benefit its citizens.",1
fja3gcl,"Ohh that makes sense. I can definitely see this kind of thing working better for Sheffield than it would for Leeds.
That said, I'm sure the new Leeds Playhouse building looked really odd when it was first designed, but it didn't take me too long to start liking it.
(Leeds person having visited Sheffield many many times here.)","Not sure how Leeds will take it; the artist, Rob (low level claim to fame: he's a mate of mine) has a lot of really cool stuff all over Sheffield that is of a roughly similar style, especially 3D stuff like that. It's generally liked in Sheff, but whether Leeds folk will take to it the same way...well having lived in both places I'm not too sure. I mean they have Broadcasting Tower, which was built when I lived there and I was flabberghasted cos to me it's a fucking disgusting monstrosity. Yet it won awards apparently. 
Basically art is very subjective, and people can be real dicks about it. Including me, though I try not to be these days.",0
1538218602444337152,"@beerkarmanyc I may have missed this, are you very anti seltzers?","No promises, but I think I’m going to finally drink a hard seltzer today as one of my shifties.",1
fjaj0sc,It's just a shame imo. I would really like to be able to speak our language properly but I have an Irish oral for the LC soon and it is actually embarrassing that I'm still struggling to hold a general conversation after 13 years of learning it,"The way it's taught, you're not handed novels in French and just told, translate that and then explain the themes and nuanced readings in the language you're still not fluent in...
I still have better French than Irish after 21 years being out of school",both
1538242590738456576,"@Matt_Koury Wow - Well done South Africa for showing us some all attacking exciting rugby. Great game and well done the Stormers, had you wrote off at halftime?","Wow - Well done, Stormers! #URCFinal  ??",both
fj5bcpb,"Its not like money could be mismanaged, or that cancer is simply incurable and the money is put to treatment research.","With the amount of money that has been donated, it's impossible that a cure for cancer hasn't been found yet. Personally, I think the cure must be hidden somewhere and only the wealthiest people can access to it",1
fj9suc7,"Dalali karna band karo
band karo
band karo",Iaintwotuthink is a genius lady,0
fj54bb5,How often do you see any kind of baby bird?,pigeons are surveillance drone placed by the government. I’ve never seen a baby pigeon. They just spawn out of nowhere.,0
fj964ft,"I have a dunking problem. I've tried to quit many years ago but this is who I am and I've accepted that. The melted, gooey chocolate, the soggy base, a hint of coffee mixed into the dark chocolate. It's wrong, I know that but what can I do","Serves you right for being a degenerate.  Dunking any kind of biscuit is an abomination but chocolate ones are particularly objectionable, specially in these difficult times of coronavirus, Br*xit and Baby Boris when everyone's nerves are frayed.  Have you no consideration for other people?",0
1537733534256865280,@theflowershed4 @NetIrlKilkenny @LEOKilkenny @BITAIntl @WomensInspireIE @Tweetinggoddess Thank you flower shed,@biddysgoodluck @NetIrlKilkenny @LEOKilkenny @BITAIntl @WomensInspireIE @Tweetinggoddess Congrats and well done ?,0
fje1rba,"A lot of Blanchardstown is really nice. It's a very big area. ITB is closer to Mulhuddart than it is to Blanch village. Mulhuddart, Fortlawn and most of Corduff are shitholes afaik.","eh... have you been to blanch ? lol
I remember arriving at ITB each morning after a weekend there'd be a new burnt out car in the far side of the car park. ""natives getting restless"" - was the best phrase I ever heard.",0
fjccvim,"Look mate, who cares about people's health and well being when our institutions are going broke. /s","It was such a brilliant idea to have the students back. 14-day offshore quarantine works so well. Who thought this could be coming, right",1
fj87oge,"> .. but serious crimes (murder) would be an issue. 
Shur I'll throw in the application and see how it goes.","I understand only criminal charges show up, and hypothetically if it did mention anything they look at the nature of what occurred e.g. speeding fine NBD, but serious crimes (murder) would be an issue. An admission to a psychiatric unit might be viewed as beneficial to the school because you would have lived experience which is valuable.",both
fj9b27z,Because is true maybe?,Think I've seen this meme for every town in ireland over the past week.,1
fj9o343,Ben_dover_pliss is trying to live his college days by stalking college kids.,Iaintwotuthink is a genius lady,1
1572500478549979139,"And we know that if Putin were to try to out on a big ritual show it would manifest as vulgar, ugly and threatening. Not so, our British rituals, which convey a solemn looking to the eternal. Lived truth  will symbolically out: it manifests itself as beautiful.","Where we fail to see our earthly processes of rule as attempts to convey and symbolise eternal rule, they inevitably degenerate into the exercise of power and contested power. Of course such symbolisation can sanctify abuse, yet we now know that that is the lesser danger.",1
fj924zz,So a cost-benefit analysis actually favours something the liberals have done?,read the article!  This place smashed out 80000 cups a year. Expected to boost sales by 20000 cups. Will pay for itself within a year! This is a good investment.,1
fj5446b,this is the second comments about drinking human juices and i don’t know how to feel about that,gamepigeonaddicts don’t drink alcohol they drink pure human juices,0
1572499950386417668,@NanouuSymeon Only if it helps you to concentrate otherwise it's a distraction and will lead to unnecessary errors.,Code with music or without?,0
fj57o1f,"I have had people comment about the economy and i agree with you, while other parts dropped massively other parts rose, however i am interested to know now what your oppinion is on the actual virus and a possible mass outbreak?","I was scared initially because I wasn't sure how the stock market would react.  I lost money when the stock market dropped massively in the past few weeks.  Got out of those positions, switched mindsets, and now I'm back to making money.  In fact, coronavirus spreading has actually benefitted me.  Not saying that is a good thing, just trying to make the most of a bad situation.",0
fj6dtxs,"That's par for the course for races (does the air race run at the same time?)
I used to work in Chester and on the bus home on race day there was always a drunken crowd of strangers singing, and one guy at the front being the ""conductor"" who was usually the most pissed.",I went to Ascot once to watch the Red Bull Air Race. On the train back I was on a carriage with a bunch of drunken men singing sea shanties,1
1578450436448624641,"@rawrsa When I was a kid they were at least twice as long as this ?

They are still delicious though",@Ithika whaaaaa i want it!,0
fjcsw8b,No it's not.,"Once people think that everything is created by God, thinking stops.
Whatever happens, is the work of Gods",1
1572499591089758209,"@OurKantoLife @ExcelPope Sorry, did you just suggest trying to get someone fired?",@ExcelPope Carly may Kavanaugh again? Need to reach out to her employers. Ridiculous apology. She’s only sorry she’s been outed. Disgusting,0
1572383605598617601,@Logically_JC Cruelty is their policy. And hatred.,"It would be nice if Republicans could find just one candidate who isn’t a criminal.

Then we could focus on policy disagreements like adults, instead of their various crimes. 

It would also be nice if they had policies.",0
1578642434883727360,"@BeatTheCult Family, friends, football, travelling, my dogs.

You know, real tangible things.","Hey atheists, what gives your life meaning if you don’t believe in God?",1
fjaayki,All the electoral money at play!,No surprises. BJP wants power at any cost. They don't mind even if country get burned.,1
fj9mu2e,">No IT conference is complete without a heap of unrelated bullshit. 
Considering it costs you absolutely nothing to write down your (presumably cis, given your response) pronouns, what's your issue? Takes ten seconds and you can forget it's there. I don't see why you'd ever care.
Given the inherent networking nature of these events, you may we well stick down pronouns along with your name. Literally no reason not to, and to be annoyed by that is stupid.
Writing down pronouns may seem stupid to you (again, presuming you're cis) but it can make things so much easier for any trans members of the community in attendance. 
It's not for you.","""As an effort to further the inclusion, lanyards were given out to those who bought tickets, on which there was a special section for writing one’s pronouns. This was a remarkable touch that a lot of people very much appreciated.""
No IT conference is complete without a heap of unrelated bullshit.",both
fjdenhl,I've been listening to RTE Lyric and loving it,"I can't listen to newstalk/rte1/today FM anymore, it's wall to wall Corona virus shite repeating itself over and over. I started listening to LBC, it's pretty good.",0
1572349551247527938,@IanStratton Utter fantasy,"Wow! Maureen Lipman on lbc states “the Queen’s death has United the country including the Corbynistas and people live in the real world”
What a classless comment.",0
fj588bo,"I’m definitely a part of the younger metalhead community and I do have some shirt from my favorite bands but I really support them. I went to a Slipknot concert 3 days ago actually, but I do understand what you mean.",Kids that wear band shirts but don't actually support that band....I'm looking at you dumb emo kids in the Misfits shirts.,0
1580551468670910466,@CalltoActivism Me,"BREAKING: Officer Fanone demands that Donald Trump be “held accountable” for the actions that led up to January 6.

Who stands with Officer Fanone and agrees with him? ✋",both
1580526144017006593,"@yaitskayy If we talking OG starts, I got my squirtle squad!",fuck your zodiac sign what pokémon do you start with,both
1578404148663287810,@AnnaLZubarev @KnownOrigin_io Thank you Anna! ❤️‍?❤️‍?❤️‍?❤️‍?,@carmeljenkin @KnownOrigin_io Wow! She’s so beautiful!!!!???,0
fjb4bzh,"> But I've known quite a few still think it's just a flu.
Genuine question (not being sarcastic): the listed symptoms for COVID are exactly the same as the symptoms I get when I have the flu. So why is this so much worse?",I think it's a serious threat to our society. But I've known quite a few still think it's just a flu.,0
fjagl99,"This is, without a shadow of doubt, the best answer here.","Pass them a barm and ask them what it's called. If they don't fiercely defend their answer while decrying all others, they're a spy.",0
fjcrt1y,Same here. Literally visiting every corner of the country in the next 2 weeks and they will all be large gatherings.,"I make my living gigging around the country, a little fearful gigs will be cancelled now...",both
fjcgcga,There’s no point now. Cats out of the bag,"Can we perhaps upgrade the travel advice for all these countries please? 
A ban, sure but most of them are “returning” from holidays",0
fj67eqp,"It's just difference of opinion. 
Earlier, most India were poor and uneducated, they depend on others to make their living. We are agriculture based country while west are mostly industrial based country. 
These differences make our living conditions. If you can get any job and place to live in a country, but still choose to live in your parents basement, isn't it would be an insult.","I don’t get why the term living in your parent’s basement is an insult?
I thought Indians took great pride in living together.
Probably western culture focuses more on self dependence and living independently. That’s bizarre. Or marybe I’m an orthodox bigot",1
fja4f98,Seems legit. 10/10 would recommend.,"The only way this works is that you apply one kilo of dung, and one litre of urine, of cow, per person. Works better if the cow is red in colour. White cow is the weakest, black is a little better, red works best.
This has to be layered, so the first day, you apply. And wait for it to dry. The next day, DO NOT WASH OFF. Apply the new stuff over the old stuff as a layer.
You have to do this until the summer comes. ~~Or Shivraathri [Feb 20/21, 2020].~~ This process needs to be continued right through summer into the rainy season, and you have to wash it off in the first rain.
And you have to go about your business. Sitting at home aggravates the symptoms.",both
fj69g6o,"Naaah, its Nehru","Bitch please, everyone knows it's Bernie Sanders that is triggering riots",0
1538140637937147906,@SButlerHughes ?Sharon x,@NoeleenMcLaugh2 Sending love Noeleen ❤️,1
1580229398761832452,"@TruthMaccabee As an ordained priest, I took an oath to support the Holy Father and to teach what the Magisterium teaches us. Only that I reject sodomy, I reject all sins, not just one sin. God bless and best wishes to you.","@VudatNation No FATHER, NO! You can support the TRue Magisterium of the Church. That's all. This is not a cafeteria where we choose what we like. Do you or do you not condemn sodomy?",1
1578602162544082946,@davidhogg111 You need to put down the meth pipe you are Hallucinating. ????‍♂️,I am so fucking proud of my generation. We had the highest youth voter turnout in American history in 2020. We along with many other groups- played a critical role in helping elect Biden- the most accomplished American president in most of our lifetimes. When we vote we win.,1
fj5ds9g,"This guy ""yard poops"".","Watch where the dog usually poops and shit there, no one will suspect a thing.",0
1538089546339975168,@Killybegsgirl Very very worrying. Hard decisions coming soon. Very sad.,@mistereatgalway It’s very worrying.,0
1538755893692604417,@cZrotot999 @MufcWonItAll @bobskino @EK3N3 This is the reason why most of these guys don't give access to fans. Why record him?,@MufcWonItAll @bobskino @EK3N3,0
fjahqp2,People can come to Ireland whatever way they like. Once they’re here and they like it that’s the main thing,You applied for citizenship? WELCOME :) Ah lovely. We really appreciate you not skipping the line sneeking in the backdoor,0
1579725663254482944,@tanvishah140 Thaaanks :D,@adityaoberai1 Damn this photography skills?,0
1579170195825782784,@TechiHachi1 Not lies,@LiveLaughLof Virtue’s of lies,1
1578289055263252480,So sad to see it go!,"From next season, the next generation Chevrolet Camaro will replace the Holden Commodore, while the next generation Mustang will line up for Ford. Much of Australia’s recent history has been tied up in the ‘Ford Vs Holden’ rivalry, with households split evenly for a long time.",0
1572500973494439940,"@myeyemyview A lot of English people don’t understand or speak proper English, init!?","I got a letter from the NHS this morning,
It included instructions in 28 different languages, that's right 28.
Here's a way to save the NHS money, only treat people who speak the language of the country they live in,",1
fj5cqaf,"MOOD, being Gay or Bi would ultimately destroy the premise of this.","Have sex with all the girls, lesbians know their way around better anyway",1
fj8vp98,"There are many one in the ministry of minority affairs(Naqvi), another is national Spokesperson(Ansari), and there is another who was discriminated against at a rally in Delhi Rally on 22 December(Ilmi).",I'm always in surprised to find muslims in the BJP at the first place. Despite the kind of venom spread by the parties top leadership,0
1572500680820273158,"@murdo_fraser @ScotParl @theSNP @ScotTories @ScottishLabour @scotlibdems Who cares about that inept disrespectful tramp looking non entity offensive party’s supposed leader.

A total embarrassment to Scotland and the SNP just by association. He is playing the SNP for all it’s worth and making them look seriously bad",Some tremendous speeches and tributes to her late Majesty Queen Elizabeth @scotparl today from across the political spectrum - @theSNP @ScotTories @ScottishLabour @scotlibdems. A little disappointing that one Party is entirely absent.,0
fj7j6hy,Believe it or not. The great unwashed also enjoy rugby. It’s one of the few sports we are good at.,"Don't worry, rugby fans can easily afford Sky. One less ivory back-scratcher.",0
fjejvbm,RTE never moved on from the 80's.,Winning Streak never moved on from the 80s.,0
fj977yx,"You are right. But instead of asking them to go vegan, best to start with yourself :)","Everytime the typical vegetarian tries to guilt trip me about my food choices, I point out that the dairy industry is just as brutal and has a similar carbon footprint. I ask them to stop eating milk, dairy, ice cream and chocolates. That shuts them up.",0
fjc128p,"C31 often has up to 180,000 viewers. More than sky news does country wide.
They also livestream on line.","Sad to see.
I have to wonder how the likes of C31 would fare as Youtube or even Twitch streams these days.  Is there any estimate of audiences for the community stations?",0
fj7va1b,It will take Michael weeks of dole payments to replace the broken window on his 2004 Toyota.,Resulting riots in carlow have caused literally dozens of euros in damage,1
1580540763171336193,@IAmSteveHarvey Meeting a person ?,"If you could “Delete” anything from your past, what would it be?",0
fj9101n,"I know, this is totally unacceptable considering how hard Peter Dutton touts national security.",">the Commonwealth was trying to provide the manifest ""as urgently as they possibly can""
What the actual fuck?  Manifests are compiled and submitted by airlines by law.  The Commonwealth government is not able to get a copy of a few pages done quickly?  And the Commonwealth is only today thinking about a process to deal with this request?  God we're so stupid.",0
fj663p8,Period? This isn't American Problems friend,I’d fire him for going to Greggs period,1
fja9iiw,"shit off, ugly.",Fucking hell how can you be that degenerate? And how do you have the money for multiple deliveroos per day?,0
1572506565021929474,@claireroberts01 BIG happy birthday to yoooou ???,"Today is my birthday, I have balloons ???I want to thank my donor and family who 24 years ago decided that they wanted to donate their kidneys and I was one of the lucky recipients. #forevergrateful ❤️",0
fjav8b1,"Yeah, obviously you get the guns first, then you shoot the Bishops.",Pretty telling of the evil of the USSR...,both
1572307371472596992,@gettagrippe97 ?? cant stand u,My ex has the highest chance of dating me so caught feelings at your own risk,0
fj52ixs,You'd become their new lead singer,"Like me? Because I’d love to sing for Queen, but I’m not gay and don’t want to have AIDS. No judgement, I just need clarification.",0
fje48l5,Most Brits I know are fairly sound and if anything are more just uneducated about the not so nice parts of their history. Its them-uns up North that have a hard on for the Monarchy that I would be worried about.,Anybody want to check /r/unitedkingdom to see if they have a shit fit about this traitorous act,0
fjep5r4,Hey if it wasn't for old Wojtek that works at the sketchy car mechanics down the road you wouldn't have passed the NCT,Well as an Irish man to you: thank you for taking those shitty jobs none of us want??,1
1580554710364278784,@morethanmySLE ?,Who is ROOTING for Beto O'Rourke to be the NEXT Governor of Texas? ✋?,0
fj84fvk,Not in Melbourne,"The four seasons in Australia are Summer, Summer, Winter and Summer.",0
