id_text,text,parent_text,label
fjamxcs,"My brother recommended posting a note saying:
“I’ll park wherever I want you   _  _  _  _   _  _ _ “.","Fill in the blanks and give it back, I think that's the game",0
fj656z3,"But with more global warming we can have more freak storms.
Invest in coal. Invest in the future.","You are in the middle of storm Jorge!
Not taking away from the increased input of green energy into the grid, that's awesome, just pointing out that what you are seeing isn't the norm and we still have a ways to go until it is!",1
1578390625833058304,@londyloo Yes and very easy. I think I made my appointment for the next day.,"Have you gotten the Bivalent covid vaccine? 

If so, how easy was it for you to schedule and get to the vaccine appointment?",0
1579889021127258113,"@stufflistings Q9) A. 10MP ?

#GalaxyZFlip3 
#FlipAtFlipkart #GalaxyZFlip3 
#GalaxyZFlip3Giveaway 
#stufflistingsarmy 
@stufflistings","Q9. What is the resolution of the #GalaxyZFlip3 front camera?
A. 10MP
B. 5MP
C. 8MP
D. 12MP
#FlipAtFlipkart #GalaxyZFlip3 #GalaxyZFlip3Giveaway #stufflistingsarmy",0
1580520528187510785,@MotherCluckyou ?? Definitely hope it gets better from here MC!!,Yesterday I was greedy and inpatient and burned my top lip with my hot tea. This morning I tripped on a kitchen rug and busted the inside of my bottom lip when I slammed into the kitchen counter. I will be taking instant oatmeal to work for breakfast and lunch today ???‍♀️,0
1537903070541013006,@Neillmccay At least it’s free of charge,@akellyucc That's shocking,0
1579750734731804673,"REMEMBER THAT.
1)It was Mulayam Singh who made Nuclear Deal possible with US in 2008 when Leftists withdrew support from UPA to Stop Bharat's Develop.
2)It was Mulayam who diverted SP Votes to Modi Ji in 2019 elections

Mulayam definitely Wasn't AHMED PATEL to say Good Riddance!","SAD NEWS!

SP Founder Mulayam Singh Yadav (82) passes away,after being critically ill.

Wait! I know many will pounce on me for offering condolences to someone who got Karsevaks Fired at in Ayodhya in 1990,who was into Minorities Appeasement,was Corrupt etc!",0
1579762510252867584,@pushpathak ए हैं लोकेशन,"सुना है सबकुछ मिल जाता है गूगल पर
 वफादार दोस्त चाहिए लोकेशन भेजना मुझे",0
fjbe3na,"Blindboys hot take that Hitler copied the laundry company's logo would be hilarious if some people didn't take it seriously. 
We had numerous posts about it on /r/ireland after the podcast, as if it were established fact.","Adolfs brother worked in the shelbourne. Blindboy Podcast about it, fucking hilarious",0
1538218056840798209,@ArnoutPosthumus Thank you for recorrecting autocorrect,@tiffaquinn Veganizing haggis*,0
fj9o8n2,"Is it one of those roller lads or just, like, literally the kind of towel one would have at home?","In the gents toilet where I work, there's a hand towel that hasn't been washed in at least 6 months. It turns my stomach and I refuse to go near it.",0
fj7ptbm,"I remember watching an episode with the Slovene(?) aliens, around the time when people were absolutely raving about the brilliance and originality of the revival, and it was literally an entire 45 minutes of fart jokes.","I can say with hand on heart my opinion has nothing to do with gender, but for many, many years, I've found the writing, acting and effects in this show to be utterly cringeworthy.",both
1580561065988870144,@NickAdamsinUSA Yes they are,Weak men are the most dangerous humans in the world.,0
fjcmfmc,Go to lalalandahop.com.au I just looked at the bottom of the cup lol,"wwhat's the pattern called at Myer?
Edit: it's Wild Fur You Australiana version lol",0
fjcu4vq,The most disappointing trailer since... well... cant remember the last time I was so disappointed,What an absolute load of garbage. I read those books as a kid. They were great. Not even close,1
fj57mac,"Same, I played soccer in a team when I was younger but hated to watch people play it cause you dont do anything.","As a guy, I hate watching sports. I think its the most boring shit ever, its like watching paint dry. Id rather play than watch. I can't understand how you can watch like 2 hours of guys playing something and get excited over it. Yes you can hate on me all you want thats just my opinion.",both
1572500760684011522,@thomasforth @Mr_John_Oxley The Nimby paradox. Housing no. Energy no. Airports no. Anything no?,@Mr_John_Oxley I'm quite excited for that West Lancashire by-election if Truss really does go all in on fracking. We may see a negative score in an election for the first time ever.,1
fje6p2y,She should self-isolate for three weeks at least. Anything else is irresponsible. Show her this post!,"So my roommate just got back from a skiing trip in Andorra two days ago and now has a dry cough, fever and fatigue. 
She called out of work sick but won't call the GP till the morning. She saids she doesn't feel too bad since it's no worse than a cold. 
And she's not exactly being over the top with the whole hand washing thing. Oh, and she works in pharma . We're fucked lads!",0
fj7ufmo,Only in the bedroom.,Vegemite is the red line. You must like Vegemite.,1
fjbv84c,"Seriously.
Talk about a non-story.","That must have been the easiest job in the world, digging up dirt on Bronwyn and Ley. The dirt pretty much dug itself out of the ground for those two.",1
1580399979159769088,"@rocketcityhog Honestly, he seems to be doing well there, to her, and even my, perspective. He’s not dumb and decent in a crisis. But, it’s his views and lies that got her.",@Lcmwriter100 What is the sense of the job DeSantis is doing wrt hurricane recovery?  Does she have an opinion?,0
fj7p81j,What’s with all the students traveling to Italy during February. Was the school in Maynooth had a load of students over there as well.,"Coronavirus: Dublin school to close for two weeks as student has Covid-19
Closure ordered after student identified as first case in Republic
A scientist works at a laboratory in Israel trying  to produce a vaccine against  Covid-19. Photograph:  Jalaa Marey/AFP/Getty
Paul Cullen Health Editor
Updated: 2 minutes ago
A Dublin school with 400 pupils is to close for two weeks after one of its students was confirmed as having the coronavirus.
The teenager, who is the first person in the Republic to test positive for the virus, became ill in recent days after returning from Italy and is in isolation in Dublin hospital.
Public health officials have ordered the closure of the school in order to minimise the risk of person-to-person transmission of the disease.
The decision was announced by the National Public Health Emergency Team on Sunday evening.
The team announced the first confirmed case of the virus in the Republic of Ireland on Saturday night. Another case was confirmed in a patient in Northern Ireland earlier this week. That woman had also travelled from Italy and passed through Dublin airport. The Dublin-Belfast train was later sanitised as a precautionary measure as it was believed the woman travelled home on it.
Low risk
It is understood the risk to other pupils in the Dublin school is considered low but the closure has been ordered on a precautionary basis. Students are being told to self-isolate at home and to indicate if they start showing any symptoms.
Public health officials plan to maintain daily contact with the students by phone, and will ask them to indicate by text whether they are showing symptoms.
hospital as officials trace contacts
Parents were being informed of the closure on Sunday evening and a helpline for affected people is being set up.
There is no justification for any other schools closing due to concerns over Covit-19, public health officials have advised. No new cases have been confirmed in Ireland today.
The Department of Health released the following statement on Sunday evening:
“Contact Tracing of the confirmed Covid-19 case, in the East of Ireland, has identified and made contact with a secondary school. The principal, staff and parents of pupils of this school have been notified. Following risk assessment, all pupils and teachers are being treated as close contacts of the confirmed case.
The school will close for the duration of the incubation period, which is 14 days.
All pupils and teachers are being asked to restrict their movements until the end of the incubation period and will receive guidance on the meaning of ‘restricted movements’.
Public health doctors will actively follow-up with all students and teachers on a daily basis over the coming 14 days.
Dr Tony Holohan, Chief Medical Officer with the Department of Health, said: “Contact tracing has assessed that close contacts of this patient includes pupils and teachers of a secondary school. Public health doctors are in direct contact with pupils, their parents and the staff involved.
“Patient confidentiality in this case, and in all cases, should be respected. The Department of Health will provide updated information as necessary.”
The Department of Education said: “The Department of Education is available to assist the school in any way necessary. The Departments of Education and Health are in regular contact. The closing of this school was a decision made on public health grounds after risk assessment deemed it appropriate. All other schools will remain open. The Departments will continue to communicate with all schools on this issue.”
Covid-19 is spread through close contact with an infected person’s body fluids (e.g. droplets from coughing or sneezing), or by touching surfaces that an infected person has coughed or sneezed on.
The general public is advised to follow advice from the HSE and the Health Protection Surveillance Centre to protect their health.",0
1572560983926919168,"@POTUS Everything is up with the Biden administration: inflation 9.2,%, gas 39%, electricity 45%, crime over 100%,  Ilegal immigration over 100%.","Since I've taken office, companies at home and abroad have announced over $85 billion in new investments for electric vehicle, battery, and charging manufacturing all here in the U.S.

America is back leading the way.",0
1579752910954823682,@eminogluenes @MiracComran @tugvabilecik @tugvaTR Lovely ????,@MiracComran @tugvabilecik @tugvaTR Allah razı olsun kardeşim. Rabbim birliğimizi daim eylesin.,1
1572500721874145280,@IanStratton Why has a mediocre former actor been asked for a comment?,"Wow! Maureen Lipman on lbc states “the Queen’s death has United the country including the Corbynistas and people live in the real world”
What a classless comment.",0
1578316966426980352,"@rockstartheory @terrypunter5 @essendonfc Yes, a fit and confident HJ could be anything","@terrypunter5 @essendonfc All fairly untapped quantities. If anything I feel Duzza has the heart and effort instilled so just reckon he’s gonna come on nicely next year. HJ was glowing in 2021 but had injuries this year which clearly ruined his self confidence. He could be anything.
Cox I’m not sold",0
1579206705816416256,Still livid at the priest who said WW111 was imminent at a children's mass today. Not least for making me define imminent as 'a long way away' to Chung Flit. What an arse. No more mass,"I never go to mass but had to this past 2 weeks for family occasions. Notable at today's mass we got a lecture on the unborn,how to pray away imminent WW111 but no mention of the tragedy up the road in Cresslough ?",1
fj51mmt,Haha... stay the fuck away from me,Me ;),1
fj7gyro,WASHING MACHINES LIVE LONGER WITH CALGON!,">    classic tv jingles: Hastings Direct, Calgon
As a 50 year old Brit, I can tell you I have no idea what those sound like.
I could tell you what Shake’n’Vac does though.",0
1578565582580219905,@drbrby Legit downpour,@nevenaspirovska the umbrella! lmao,0
fj9t97l,"Who knew the brother of Ekta Kapoor, the sanghis favourite TV producer, was a RW zombie. 
Tusshar (why there are two s in his name is beyond me) is a Akshay Kumar clan fixture. This was expected.","another jobless bollywood sanghi found
https://twitter.com/TusshKapoor/status/1234327063860928512?s=19",0
fj7yw6m,"No it's not. 
You are keeping up with the flow of traffic in your lane. If some moron is hogging the second or 3rd lane and travelling slowly you cannot be expected to weave between lanes to get in front of them. They're the ones breaking the law. 
I wonder what would OP do if the lane hogger was in the rightmost lane?","Ok genuine question here: if your lane is empty and you just carry on  maintaining your speed and go past them, is that still classed as undertaking?",both
1578283653976961024,"@cruicerod @JonesHowdareyou @InsidersABC Haven't watched since just after Speers took over... Don't need his biased Murdoch ignorance in my life &amp; he does not even try to hide his, or the bias of 'our' @ABCTV..",Peter Dutton is on @InsidersABC again this Sunday This is his third appearance since the election,0
fj57p3i,That isn’t good,"Guy not only fractured his femur during baseball, but dislocated part of the bone. That's two years ago, and according to social media he is still rehabilitating.",0
1579904365397413889,"@stufflistings B. 54,999 till 12th October
#FlipAtFlipkart #GalaxyZFlip3 #GalaxyZFlip3Giveaway
#stufflistingsarmy","Q2. What is the sale price of the #GalaxyZFlip3?
A. INR 69,999 till 12th October
B. INR 54,999 till 12th October
C. INR 74,999 till 12th October
D. INR 84,999 till 12th October

#FlipAtFlipkart #GalaxyZFlip3 #GalaxyZFlip3Giveaway #stufflistingsarmy",0
fja30m3,I don't find him funny either. I watched a video of his to try and understand the appeal and I almost fell asleep,"They're like that Pewdiepie fella for me. Nothing against them, don't dislike them, but they're not at all funny and I cannot comprehend how they are popular as they are.",1
1578631205452664833,"@wendy_resists Correct, they shouldn’t be.",Trump Supporters believe that they are not treated with respect.,both
1578229749864075265,@TheVoodooQueen I know!! Lost 3 &amp; now gained 2 in one year???❤️???,@Sal_of_Lourdes Wow Sal.?????,1
fjd7bew,Applied Psychology and Social Studies,What course is this?,0
fj821d5,Thanks man I'd like to make a difference in people's lives.,"Good luck becoming a mental health nurse. 
I too was admitted to the psych unit. Still trying to make something of myself afterwards.",both
fj548os,Maybe you should give him more treats? :D,Dog barks at me every once in a while for no reason. New bad habit.,1
1537708662164271104,@barrymags2001 Morning Maggie,@ElaineARoche Morning Elaine ?,0
fj7wsng,lad me too,Town or county? because I live in Tullow,1
fj71hqi,so the tale of the stork bringing babies is based in truth after all...,"A mate of mine found a baby duck in his closed off yard once, he took it in and it grew into a fuck of great big white duck, he keeps ducks now.
He reckons a seagull nicked it from a farm and dropped it.",both
1580538535743918080,@MotherCluckyou Well at least both lips are even now so you don't have to worry about looking lopsided ??,Yesterday I was greedy and inpatient and burned my top lip with my hot tea. This morning I tripped on a kitchen rug and busted the inside of my bottom lip when I slammed into the kitchen counter. I will be taking instant oatmeal to work for breakfast and lunch today ???‍♀️,1
1572560228780216325,@streamside1070 @DigitalSciGuy we want to build it so more than 126 people are using it,"@DigitalSciGuy Per the 2018 commuter rail counts put out by the T, there were an average of 126 people using the three Weston stations in total per weekday.  You want to build this for 126 people?",1
fj6x0c1,"I'd imagine, like their old postfone thing they had its to fleece the grannies.",Why would anyone use this service given the drawbacks and huge charges?,1
1580025907385106433,@novusweirdo Thank you for your mutual understanding. God bless you! I appreciate your support! I don’t know why people take my tweet out of context and accused me of being harsh &amp; rigid? I pray for all who read my tweet today for mutual understanding.,"@VudatNation You're a good example, Father, but unfortunately people make things a lot more complicated than they need to around here.",0
fj9hynz,There's a ton of useful info in your post! Thank you so much!,"Tinder - People are mostly looking for casual relationships and are very out there about wanting to hookup. Because of how famous it is, it attracts all sorts of crowd. Personally I thought it had a creepy vibe.... more scope of getting pervy messages. I would be a little careful here.
Hinge - Hinge is the most favored one, the crowd is fairly decent. The platform itself encourages open discussions and keeps the conversation fun and engaging. Men on hinge are better at conversations and it has less creepy vibe. Though they are good I didn't find many guys who were looking for ""marriage"" they were open to dating, meeting and taking it from there. Hinge felt like a safe space to talk to cute guys and work on your dating skills, and you do end up meeting cool people.
Matrimony sites - Shaadi.com involves creating an extensive profile with lots of details. It allows you to restrict your search related to caste, religion, veg - non veg, smoking drinking etc. The agenda is very clear so everyone on that site knows they are looking for a life partner... conversations are more honest and open... Though there will be lots of people who will reach out to you , dont be surprised if some guy's mom or brother reach out. Have clear boundaries about how much you want to engage, and set the expectations from the get go. There are some good guys there, but you gotta keep looking!
Overall - Have an open attitude, meet people , talk to them and be safe!",0
1578268768593059840,This whole thing was tampering and reeked of salary cap shenanigans. At no point did the other clubs have the right to talk to a player under contract for another whole season. The system needs reform and strong penalties for these types of actions.,"Now that the dust is settling on Munster staying in Melbourne, can we revisit the fact that the Dolphins, Tigers or ANY other #NRL club were not supposed to be making any offers to Munster (or Anasta as his manager) until 1 November 2022.",0
1578396709951971329,@cleokali_x Challenge accepted,currently going through a bit of an aussie hip hop phase and I think this is the only genre I’ve ever really listened to that I just can not bring myself to play in session. there is simply no way to make it work. one can not do sadism to a soundtrack of our unadulterated accent.,1
fj5sf0v,"Weird how in yesterday's post on here the 2nd highest upvoted comment was how the government was racist for announcing the travel ban on Iran but now people are complaining it's too late?
https://www.reddit.com/r/australia/comments/fb8b5u/australia_announces_iran_travel_ban_amid/fj335sa/","Too slow to travel ban Iran, unfortunately. They should have done it as soon as it was clear that Iran couldn't deal with their outbreak. As a result of the delay, returnees from Iran have already led to 2 AU cases and 1 NZ case.",0
1538151928005271552,"@BrexitforUK @andrewdoyle_com Indeed,much histrionics and an extraordinary display of flouncing . I could never come close to emulate that level of exposition .(I was a disappointment to my parents )",@andrewdoyle_com You're correct but their way sounds much more dramatic..,1
1538187635281301507,@cheechray710 @MidnightPanthrs Thank you my guy ??,@DonMaguire_NFT @MidnightPanthrs ???,both
fj9zdo3,"I've done the same. Sure we will get through it anyway if there isn't a shortage. I've stocked up for similar reasons as you. My son is immunocomprised.
I don't wanna be going out if there does end up being lots of cases!","I've done an extra shop of long date item. Rice pasta flour tinned tomatoes. All things that are on my usual list.
My son is immunocompromised so we may choose to self isolate as a family before the government makes it mandatory. 
That and I dont want to fight hoards of people for the last bag of rice in a weeks time once the government admit we are fucked!",0
1538166424216252416,"@SoniaHarrisPR Fresh mint, proper peppers and melons, the list is long ?","@ProperFood_ie I would only add Buffalo Mozzarella and / or Burrata. (Who am I kidding, I mean both). Tomatoes… grilled peaches… the stuff of dreams.",0
1572499815728312320,@PianoAvengers @HaroldHss3 Beautiful voice ❤️❤️❤️,@BobbiBicker @HaroldHss3 He just makes me happy ?,0
1578477335044444160,@McFaul Are you a warmonger?,"These days, I have the privilege of interacting almost daily with Ukrainians — senior government officials,  journalists, diplomats, NGO leaders, soldiers, business leaders, academics, students. &amp; every time I do, my awe for their spirit, intelligence, bravery &amp; convictions grows",0
1579526427955056641,@Paytmcare Just getting replies only and not getting support for the same.,"@balapc05 Hi, we have replied to you via direct message. Please check for more details. Thank you.",0
1579723372359225344,@WinnersWLD Amen and Amen. I believe and receive I'm the Mighty Name of Lord Jesus Christ,"Let businessmen use their minds to paint pictures of success in their businesses, and it shall be so. Let the career person imagine himself at the top echelon of his career, and it will be impossible for him to remain at the bottom. 

That’s how to get God committed.",0
fj58vvx,"When we see emojis on Reddit, we wash em out","No tik tok, no emojis and is actually funny",both
fj5cixi,I think he killed himself. The conspiracy was that he was allowed to kill himself,"The theory that Epstein didn't kill himself. Memes aside, he could've probably exposed a lot more rich people for their sex crimes. They just bumped him off before he could do so.",0
fja447w,"We recently moved offices. Our old place had some lovely triple velvet but the new place has the cheapest, most flimsy paper I've ever used. Now I only ~~pinch~~ am given it in emergencies.",Free bog rolls.,0
fja7189,posting this again because r/india has taken down two posts under which I made this comment.,Modi is a megalomaniac and attention seeker. He can't keep himself off the mainstream media. This is not happening. Just another PR stunt.,1
fj58o1f,Is there anyway to run as a sport in college or beyond?,"They should get over it, since they’re not in highschool anymore, and can no longer compete in highschool track. They missed their chance and should move on.",both
1538617090319564802,@mattjwoodturner @Djmc76 Hahaha...nit fir himself though.?,@Djmc76 Prawn sandwiches,1
