id_text,text,parent_text,label
1572500521310883841,@tw1ttercr1tter1 How are you going to win without,@Tookey6859 What's the point in winning an election if you then have to appease the Tory voters you wooed?,0
1579860949665660930,@sihagmahi4321 Thank you ?,"@jaaniii_29 Hpy b,day ?",both
1578579616700465162,"@TheGamingNook1 Dishonored is pretty cool, great narrative and nice gameplay, enjoy!",@elisdee_one Enjoyed Deathloop a surprising amount so I’m doing my first ever playthrough of Dishonored now and really enjoying it so far,0
fjdgros,I'm not sure about that comment with the greens. The Nordic systems rely on exploitation of vast amounts of natural resources to fund a lot of what they do. If you copy pasted those systems into Ireland we'd have a massive shortfall in the budgets.,"If the Irish people actually wanted change to a more Nordic system as Bernie envisages, they'd have voted for the Greens or the Soc Dems.
A vote for SF is just a vote for 'let someone else pay for me'. Our selfishness is just based on monetary lines, not racial or ethnic lines.
Ireland is a very different country to America. Here we have the 2nd most progressive tax intake in the OECD with the top 10% contributing 60% of our taxes.
https://www.thejournal.ie/irish-tax-system-inequality-4975546-Jan2020/",0
1572561016072044550,@TallGoddessss Thanks love! ?,Happy Birthdaaaay @TheGreatKingSIR ??,0
1578285915159801856,@DrPieterPeach Cutting much shorter than it’s been so that’s the face!! Plus jet lag tiredness.,@inquisitiveGyn You look a little uncertain about it,0
fj9kp26,I'm sure your lungs are perky compared to my 45 years of abuse.,How buggered am i? 28 with heart failure.,0
1580229398761832452,"@TruthMaccabee As an ordained priest, I took an oath to support the Holy Father and to teach what the Magisterium teaches us. Only that I reject sodomy, I reject all sins, not just one sin. God bless and best wishes to you.","@VudatNation No FATHER, NO! You can support the TRue Magisterium of the Church. That's all. This is not a cafeteria where we choose what we like. Do you or do you not condemn sodomy?",0
1572135829543305218,2/ Daily Reading: Psalms 49-50; Acts 20:1-16.,"1/ Enjoy our Devotional entitled, ‘PRAY MORE’",1
fj9iuir,"‘As an American’....the preamble to absolute shite. Your ‘society’ is the youngest in the world and it is a mishmash of different countries’ cultures. Your military/government are the ultimate global terrorists, nobody wants to be like you. You’d get your molotov swiftly rammed up your arse if you start making those threats here. Shut up and keep your aggressive ideologies to yourself","As an American that's been here for awhile now, I do appreciate the idea of not spending the entire budget on tanks every year, but I'm also pretty sure I could take over the country with a good pistol, a few molotovs, and a half decent scarecrow.  A little more funding for the poor lads in the defense force might be appropriate
Edit: Apparently none of you can understand hyperbole and instantly equate more funding with a call for rampant militarism and imperialism. Calm down you knee-jerk slacktivist keyboard warriors.",both
1572501130260905986,"@RJPcoach @CoachingFamily @coachingbadges @TheS_Resource Started as a block of Duke of Edinburgh  stuff. Volunteering I think.

Now there's a whole range of reasons. I think most of all I find it intellectually stimulating and challenging, interspersed with some great moments, memories and bonds","Some questions for everyone?

Why did you start coaching?

Why do you coach now?

If the answers aren't the same what changed and why?

@CoachingFamily @coachingbadges @TheS_Resource",0
1578470336399519745,@BurnwoodAmelia Thank you so much ? ?,@James_Patrick88 I'm happy for you. Congratulations!!! I hope you will reach more people because you're awesome,0
1579196857263493120,"@magnumlady A  Creeslough lad in Australia started a gofundme for the people if the village with a target of 60k. As I write, it has raised 225k so I think that's probably the place to go.","Wouldn't it be a lovely gesture if the electricity bills for the businesses giving the emergency services, journalists, and volunteers, free refreshments in #Creeslough was paid for them.
Any idea how this could be organised so that people could donate some money?",0
fj94pls,"maybe he'll get that ""sathya"" Sai Baba's vibe and start performing miracles..","I request Yogiji to practice Yoga along with a room full of Corona virus infected ppl, so that the virus is cured for all these patients and Yogiji himself gains immunity from the illness..",1
fj5ahbn,Well considering his cell mate was Nicholas Tartaglione I’m pretty sure Epstein was murdered.,I like that people always are worried that Epstein was murdered instead of suicide. What if this was a ploy to cover up that he just escaped or paid his way out of prison?,0
1579886133617758209,@trafficchd @DgpChdPolice @Balramchd123 @Jitende09571247 @Balram39293137 @HinaRohtaki @nagarkoti @chandigarh_admn @aajtak Nothing happened and neither any PCR were came. What type of complaint you did?,"@VikasPandey_Chd @DgpChdPolice @Balramchd123 @Jitende09571247 @Balram39293137 @HinaRohtaki @nagarkoti @chandigarh_admn @aajtak @VikasPandey_Chd Sir, thanks for the information. We have informed PCR-112 for further action in this regard.",0
1580383671248654337,@ChuckCallesto @PatriotXV11 Prayers for the family ?❤️?  #RIP,"BREAKING REPORT: Marine Recruit, Private First Class Javier Pong – [18 YEARS-OLD] – Dies After Collapsing During a Training Exercise at Camp Pendleton...",0
1579052712502923265,@DeeHalnon Thank you Dee,"@mtully21 How right you are Maureen
Your flowers are just beautiful ?",0
1580441593529921537,@SarahGraff13 @PeteButtigieg Now that is really cool!!!  Thanks for sharing that,"Just ran in to @PeteButtigieg in the Charleston SC airport! Couldn’t help myself.. as he went by I yelled, “I love you Pete! You’re awesome dude!” And he turned around and smiled and waved. I’m a fan ?",0
fj747r8,That's grand since that's an adults choice. The parade is more for the young ones who are vulnerable to the disease and I could understand why some would rather it not go ahead since people like anti-vaxxers exist.,Sure everyone will be jammed into every pub in the country anyway.,0
1579060498787553280,@psneeze @colmtobin Mission: to mopily go where no man has moped before,@colmtobin He'll be boldly staying put from now on.,1
fja5rcy,Lol yeah. Coincidence and you got lucky xD,"Ek din mene JP ko fake birthday wish kiya tha. Sab karne lage. Phir pta chala ki sach me uska birthday hai. Oops! XD 
(Hope I’m right, jp?) O.o",0
1579904365397413889,"@stufflistings B. 54,999 till 12th October
#FlipAtFlipkart #GalaxyZFlip3 #GalaxyZFlip3Giveaway
#stufflistingsarmy","Q2. What is the sale price of the #GalaxyZFlip3?
A. INR 69,999 till 12th October
B. INR 54,999 till 12th October
C. INR 74,999 till 12th October
D. INR 84,999 till 12th October

#FlipAtFlipkart #GalaxyZFlip3 #GalaxyZFlip3Giveaway #stufflistingsarmy",0
1572169347224797184,"@JohnMcCullough6 May be a bit weird to us today, but symbolic breaking of things is a very old tradition!",@archae_delle Weird behaviour there.,0
1579683081665249281,@debabrata2008 Thank you sir,@lokipalauri Many congratulations,0
fjepd7j,"They have special maps of Ireland in Dublin. Everything beyond the M50 is just marked, ""Here Be Dragons.""","Find it awful grandiose that we've just renamed Dublin to East Ireland without consulting anyone, but fair enough.",1
1538126608774709249,@ConnemaraFarmer I'm not too worried about where it comes from as long as it keeps coming?,@1noeloconnor Looking at government money?,0
fj55et7,What's SMU and who's Craig James?,Craig James killed 5 hookers while he was at SMU.,1
fjbkv61,this is how this country is now... and it's fucking SAD,"It's not illegal in the end though is it? Lnp voters won't know or simply won't care. They only care about protecting their negative gearing. Every lnp voter i know tells me that's why they vote for them. 
Nothing, not even their children's future outside of this property bubble matter. Lnp could shoot poor ppl in televised safaris and i bet if the opposition promised a 50% cut in property they would stay with lnp.",0
fjd7bew,Applied Psychology and Social Studies,What course is this?,0
1572561635633692673,@bluertwo Tough one but I’ll go for Queen.,Queen or Prince?,0
1572346398967840768,"@King_Shark95 @buitengebieden Hi Fissyomi, this series is called The Mating Game, it explores the extraordinary range of courtship strategies animals use to win over a mate, from deserts to oceans &amp; jungles to freshwater habitats! You can watch it on BBC iPlayer, we'd love to hear what you think!?✌??","@buitengebieden @TaniaEsteban_ Name of this programme anyone??
Loved watching his docs growing up..",0
1580513923391844358,@JLaFrance3WV ??? now that’s funny,"@calvin_knapp ???????? bravo Calvin, you shook the bushes and some dumb asses fell out ?",0
1538231283243003909,"@L_I_Editor Got a quote for a paperback the other day that was more than the unit cost for same quantity, same book, same printer in hardback 6 months ago (which in turn was about a euro higher per unit than 3 months earlier).","Also this week: after chasing a reprint for weeks the printer tells me they never printed it because they couldn’t get the paper!

And I learned of a major printer that is only running machines every 2nd day due to energy costs.

Chaos behind the scenes of publishing these days…",0
fj5vjya,That's something even the girl I am currently with does. But instead of watching geopolitics she sleeps on my shoulder in which she murmurs god knows what,"Saturday night ka mera 'sneak in the garden and light up a joint' routine badiya baith gaya hai. Kal mast joint fooka gaane sunte sunte and moon ko dekha and uske baad some geopolitics ke videos. Man, I love saturday nights.",0
1580489644562874368,"@jamesdaldus Awesome.
I received my mail in ballot couple days ago.",@Forgetfulness19 Good morning Lee again...I voted early already...all blue since Nixon...everybody please plan your blue vote now..the GQP MagaQ crowd are already promising horrible things if they take power...,0
fj58o1f,Is there anyway to run as a sport in college or beyond?,"They should get over it, since they’re not in highschool anymore, and can no longer compete in highschool track. They missed their chance and should move on.",1
1579739548212670465,@SKPDI_4 @saif_khan124 You are right mam aapke pair Kahan hai mujhe,"जब देश की लंका लगेगी न तो उससे कोई अछूता नहीं रहेगा, 

वे अंधभक्त भी नहीं जो आज बिना अच्छा-बुरा सोचे आंख मूंदकर सरकार की जय जय कर रहे है!!",0
fjcrc8a,"See, I find sally and erica really awkward and forced. Maybe they will grow into it.","Ben and Liam always seemed awkward. I really like Sally and Erica, I think they’ll only keep getting better.",0
1579755680902578176,@kinnarmehta9 True,@RajendraWadher First check if how many subsidiary co they have. Most of MNC have cent percent subsidiary co and all new business goes there in many such cases,0
1572560792284975106,"@bswatridge @SimpsonsQOTD “Captain McAlister, is it true that you’re not a captain at all?”","@SimpsonsQOTD ‘Twas a moonless night, dark as pitch, when out the mist, came a beast more stomach than man.",1
fj5apz7,"It wouldn’t be difficult to program this into the program, so you’re likely correct. Google probably figures they don’t want to ask you right after they did a bad job","Google Maps only asks you for feedback on its navigation when it knows it did a good job.
I use navigation all the time, and I find that when it gets me to the destination on time or earlier than predicted, I get a notification asking to rate the trip. But if it gets me there after it originally estimated, I never get that notification.",0
fj7r22t,It's simple. There are no guys in South India and there are no gals in north India. I have no idea why it's so hard to figure out.,Can't get it without being anti-national.,1
1579752486394826754,@souryadash Now its gone!,@aratrika_g08 This looks like an approaching apocalypse !,0
1572520037973659652,"@MerielMyers My age, It won’t go backwards.",What are you starting to like less and less the older you get?,1
1572558691064508416,@ew55p Better wear some earplugs lol,@coreydeanstone lmao can you IMAGINE the backyard as your backyard ??,1
fjcmydr,"We are still neutral.
I'm not sure you fully understand what that means tbf.","Sure Ireland hasn't been neutral since ww never.
We claim to be neutral but we're very pro allied.",0
fj76fon,If your referring to the school in the east of ireland that the news is reporting on then it's Scoil Catriona on mobhi road in dublin,"Which town is it really, and school?",0
1579720277877223424,@ThePawanUpdates Congratulations ?,"जय श्री राम! हे तुमचंच सगळ्यांचं हँडल आहे. म्हणून, तुम्हाला प्रत्येकाला आज मी 25K वेळा मनापासून धन्यवाद देतो. नमन..?",0
1578522078231556096,@kelly_ques Purse way too many purses !!!!!!??❤️??????,"If you had to gift me the last thing you purchased, what would I be getting?",0
fjcnf31,"> Wake the fuck up Australia, ~~you're getting~~ you have been robbed.
FTFY.","Wake the fuck up Australia, you're getting robbed.",both
1579525516759306240,@SahabazAli4 Thank you Sahabaz,@lokipalauri Congratulations ?? sir,0
1572500941743755264,@ByrneBarry of course they did...,Schofield and Willoughby say they didn't jump queue when they did.,1
1572576635723083776,@RBReich Past due,The wealth of the top 1% increased by $6.5 trillion last year.  It's not radical to tax the rich. It's radical to let a small group of oligarchs hoard that much wealth.,1
fj9sc8o,A sensible bit of legislation would be to require all incoming calls and SMS messages to be blackholed if they contain a name of an Australian government agency or any Australian phone number unless the holder of that number or the relevant agency has approved the spoof.,"It isn’t the same contact per se, it’s just that the Govt agency responsible for myGov sends the messages from a name, and not a registered phone number. This makes impersonating them stupidly easy as you’ve seen.
Further, there’s no real global standards for verified SMS which increases the likelihood of people being phished. While Google has made some in-roads for their customers in select countries, it isn’t rolled out in Australia or other major nations. And Apple just keeps hoping more businesses will use their iMessage for business platform, but their rollout of it is as slow as a wet week.",0
1578337525584007168,@mugspunting @7horseracing Where is SS these days?,@7horseracing Ahh cmon fam why you gotta do us dirty like that ??,0
fj591zm,"On the assumption that everything is a chemical, can you elaborate?",It's a type of chemical to disinfect stuff. I don't know what exactly it's called. Not exactly healthy to breathe in though.,1
fjat3dn,You know what they are,Seriously what is a pasta tea bag?,0
1572500607126347777,"@hawrth That’s awful, so sorry to hear that. I hope you’re doing okay.","I was in A&amp;E yesterday. I cant go into details but I was treated inhumanely. They couldn't give me the care they should have but wouldn't admit that either. I also saw 4-6 elderly emergency patients on beds in the corridor, no lovely ones able to stand with them :(",0
fj5bcpb,"Its not like money could be mismanaged, or that cancer is simply incurable and the money is put to treatment research.","With the amount of money that has been donated, it's impossible that a cure for cancer hasn't been found yet. Personally, I think the cure must be hidden somewhere and only the wealthiest people can access to it",1
1579740144953085952,@SubbaRaoTN As lot of happening in India itself Sir ????,"Frankly speaking, I had totally forgotten about the RUSSIA-UKRAINE war .....

#NoToNukes",1
1578593464539033600,"@_AnthonyWA I concur, verbosity doesn’t equate with lucidity, it’s just insufferable pomposity and sententiousness.",I hate people who use big words just to make themselves look perspicacious.,0
fja0izn,"Wash hands 
-When you Wake up
-Every 2-3 hours with proper soap and hum along to a song, atleast till you reach 3/4ths of the song approx 5 mins 
-Before you go to bed",Can anyone redirect me to the right kind of n95 masks to be used as precaution? Would appreciate any links.,0
1578275426933538816,@itstilby I like pins ?,@CassieMcD_ good l o r d,0
fj9330z,"Have you thought about the cost of rich people who don't like paying their taxes LMFAO just get private health you pleb so you don't have to deal with the public. /S 
Probably because it's just a flu.","It’s a fucking disgrace that we can’t protect the doctors and health staff working in hospitals.
Why don’t they have all the protective equipment?
Edit: I know a doctor who works at Westmead hospital that has complained to management that they can’t get a hold of masks.",1
1538253676292210688,"@ScouseBirdBlogs Dignity is in tact until you give up closing it and just let it flap, imo xx",Is there a dignified way to fasten a bodysuit?,both
fjaxmrt,"The first study I found suggests otherwise, giving a figure of 0.73mm/year.",Yet strangely the seas are not rising in Sydney Harbour,1
1572500618081882113,"@cjcheesecake Same, I started drawing a ? when signing cards etc, who new so many things are made in the form of snails!!","All the Paddington Bear gifts and marmalade sandwiches the Queen received reminds me of the time I said that the snow baby ornaments where kind of cute to my mum, then she told everyone and for the next fuck ton of years every fecker bought me snow baby ornaments.",0
fjcffak,"wish bum guns were a thing in Australia, so much better than toilet paper","In unrelated news, bidet sales are through the roof.",1
fjcm1hn,Sounds too good to be true,"The world is ending 
Change my mind",1
1572383605598617601,@Logically_JC Cruelty is their policy. And hatred.,"It would be nice if Republicans could find just one candidate who isn’t a criminal.

Then we could focus on policy disagreements like adults, instead of their various crimes. 

It would also be nice if they had policies.",0
1542166847398739968,@duffycj @Finnoozy @dubhghaill2 Kip on all sides,@Finnoozy @dubhghaill2 Thought the exact same a few weeks ago arriving into it. Dublin Airport is a proper kip on the arrivals side,1
fj9n2u4,Exactly!,Who's Peter Andre?,1
fj51l79,"You beat me by 4 min, I like you dark friend.",All of them,1
1539031698108817408,@cjhenri 2 suns and 3 daughters… all great Christina!,@mtully21 You obviously have an amazing daughter⭐️,both
1572279538989801472,"@LuckyHeronSay Nah, it's very silly. Mixture of Disney and Eton",Is it because I'm not British (though I've lived in the UK since arriving from Ireland as a young child) that I can't relate to this mass 'grief' around the death of the Queen?,1
1575443543623098369,"@Onlineace @DailyStuffMag Naw,hillary,biden,obama and fauchi",@DailyStuffMag Trump should be in jail!,1
fj9v51t,He was right that would have been brilliant,"GF used to work there in marketing they get these requests daily.
A former director wanted to bring them back but marketed as Oliver Twists. He was advised this probably wasn't a good idea.",1
1580438283804610562,@ThatcheriteD MUCH MUCH worse. Very dangerous.,"Question for people older than me: Were the left always such unutterable pieces of garbage, or have they gotten a lot worse in recent years?",0
1572561265297620996,@RonnyJacksonTX Have another drink,"If Kamala thinks a bus full of migrants outside her home is a crisis, she needs to see what Texans are living with EVERY DAY. Sorry the immigration crisis finally makes you feel uncomfortable, Kamala. IMAGINE HOW WE FEEL IN TEXAS!!",1
fj51yx0,Well isn’t that a nice way to phrase it.,I don’t masturbate. My seed spills only into your mother.,1
fj51gtd,Actual 3%,"Coronavirus has spread to many countries in such a short amount of time that it’s a worldwide threat. Even though there is a <~10% chance of dying to the virus, it has a very high infectivity",both
1578312001209528320,@AnneErickson For what?,Heavy metal is the best medicine ?,1
fjdoskx,"A partner is far more likely to be infected - because of things like kissing. But siblings/parents etc are less because not kissing. But obviously they are definitely at risk because living in close quarters is known to spread things like this - look at norovirus. 
I would say the whole idea of not quarantining the families unless the exposed is showing symptoms is because if theyre not showing symptoms (coughing, sneezing etc) theyre probably not spreading it very far. You have to exchange bodily fluid to infect, so the idea is probably (hazarding a guess) that they aren't exchanging saliva etc. Will be interesting to see when an adult is diagnosed if they quarantine their partner.","If a family member becomes infected and self isolated, isn’t it too late for the rest of the family at that stage? Because they would’ve been in close contact before the symptoms showed up. 
Say you’d kissed your partner the night before and then next day they have symptoms. Won’t you be guaranteed to get it too?",0
1572502716597039110,@Joeytaylor123 Was about £1.61 all in the jokers,"@andy_cov93 Saves you what, £2,50??",1
fjcl727,Physical money is fully gross.,"Knew someone who worked in a bank, their hands would get black with dirt after handling money",0
1538173738596073474,"@FieldingPolly There are only ~30,000 Mincéirí in Ireland so every family is struggling with suicide. It’s a desperate situation &amp; we really need to have the British &amp; Irish governments address why kids are choosing not to live because of how settled people are treating Travellers.",@RobertBohan So terribly sad,0
1538455672291004417,@MUFC1908 100 per. Cent. He didn't have a good season but no one around him ran into good positions either. It's hard to pick people out when they're stationary,"I can understand the frustration towards Bruno Fernandes, but to HATE him and send him abuse is just WEIRD!
He’s an EXCEPTIONAL player, tries things others don’t and when the come off is beautiful to see.
Hence the Assists &amp; Goals.
Class Act. Love him me!
#MUFC #ManUtd",0
fj69w93,Theres slightly more than 7 million in the country mate.,"23 people infected. In country of seven million.
A few are on a cruise ship thousands of miles away, the rest are locked up in military airbase.",1
fj7aalg,Til they find out there's a set amount of school dates in the year and they're gonna lose two weeks of holidays somewhere else.,Imagine being a kid and this happens. You’re delighted tbh.,0
1534473362327863296,@garyvee @veefriends I don’t own any but definitely working on it ?,Would love to see your @veefriends pls share in the comments ???,0
fj98hoj,To be fair - we voted him I'm knowing how much he'd fuck us.  I feel he'd have a pretty good argument there was consent.,He's been the fucking the country for a while now and I certainly don't consider it consensual!,0
1572562857438642184,@StephenMoore Perhaps Trump made six times the number of questionable statements.,"PolitiFact ""fact-checked"" President Trump almost 6 times as often as they do Joe Biden.

Now you know why Americans don't trust fact-checkers.",0
fjcsy63,"I'm of two minds about this - on one hand, people are obligated to abide by their visa conditions no matter how long they've lived here - if you don't your visa will be revoked.
For most immigrants, the pathway to citizenship is fairlystraight forward, so if they choose not to become citizens,that's their own fault. 
The dame can't be said of our kiwi brethren for them it is difficult if neigh on impossible to gain citizenship.  That we allow them to come here and live indefinitely without giving them a chance to become citizens is morally wrong.","We shouldn't be deporting people to countries they've never lived in or only lived in briefly as a child and have no connection to.
Dutton is just another fool trying to be a hard man at the expense of basic empathy.",0
1579904821766672384,"@stufflistings A. Dynamic AMOLED 2X
#FlipAtFlipkart #GalaxyZFlip3 #GalaxyZFlip3Giveaway
#stufflistingsarmy","Q5. What is the display type of the #GalaxyZFlip3? 
A. Dynamic AMOLED 2X
B. Dynamic AMOLED 3X
C. Static AMOLED X
D. Dynamic IPS
#FlipAtFlipkart #GalaxyZFlip3 #GalaxyZFlip3Giveaway #stufflistingsarmy",0
fjcuo9i,"Its a good point. 
If we are going to arrest every man who raises a threat, there will be scores of people to arrest - starting from Anurag Thakur and Kapil Mishra to local goons. 
If cops were willing to arrest anyone who says anything provocative, no riot would have happened. 
But their balls have shrunken to atomic size.",Javed Akthar is asking why only Shahrukh was singled out and arrested!,0
fj5dn01,KFC Spork?,Spoon and Fork,0
1578372780747526144,"For those at the margins of society, cultivating hope can be done through pathways (e.g., religion, family) that sustain hope. They cannot speak up like the other group because they don’t have a voice. Even when they do it may not matter! 

(One more tweet) 3/4","For the privileged, acknowledging that things are hard and speaking up about it is easy. This can be an example of how they cultivate hope.

However, the same cannot be said of those at the margins of society who may simply pacify their adversity and oppression.

(read on) 2/4",0
