id_text,text,parent_text,label
fj9lkik,">  the quintessentially British van is the transit.
Would that be the Ford Transit, made by an American car company?","How embarrassing for him.
1) all that stuff attached to his van.
2) driving a Renault. Everyone knows the quintessentially British van is the transit.
Honestly, your downvotes are welcome, but if he pulled up in that van and I had hired him, I’d be questioning my decision.",0
1572501203753504768,"@VindyaPeiris2 sometimes, but i dont care, no one can judge others by tweets","Someone I don't know sent me a message saying I'm a very arrogant girl,Do you also think that I am such a person???",0
1572500003956076544,@emmagraeauthor We seem to  live by lists Emma lol? always more to add,I love to-do lists. I feel a little bit more accomplished every time I tick something off. I even added a friend’s errand so she would finally do it if I nudged her enough. ?,0
1579300909359980544,@REAL___HINDUTV श्री नितिन गडकरी जी,"मोदी जी के बाद प्रधानमन्त्री पद के लिए आपकी अगली पसंद क्या होगी बताएं 

1. योगी आदित्यनाथ       2.❓❓❓❓",both
1578405357915115520,@SaveAmerica206 Consider me gone…,Musk could own Twitter some time the next two weeks. Will u leave if he starts charging a fee to use it?,0
fj6b5ot,Lincoln's coat of arms (or at least the Uni's) features swans. Swans are a thing in Lincoln :),"I was going to tell you to watch out for the swans, only to realise it isn’t Glastonbury. 
Nice picture!
EDIT: Wells. Not Glastonbury.",1
1572500762391105536,"@EmmaPinky83 Have a great day.  I got up, bought vodka, came back, ordered MacDonald’s breakfast, poured vodka into coffee.

I may be under a level of stress and anxiety at the moment. I also bought a massive slab of clotted cream fudge designed to be chopped up that am just biting into.","Wank morning, (before any pervs think I meant that literally I didnt) thank fuck I've been called into work earlier I'm off to see if I can shake this shitty feeling ?",0
fj747r8,That's grand since that's an adults choice. The parade is more for the young ones who are vulnerable to the disease and I could understand why some would rather it not go ahead since people like anti-vaxxers exist.,Sure everyone will be jammed into every pub in the country anyway.,0
fjd1tvp,"Thanks, IF.","You will need ID and proof of address. If you already have an account, and you can prove that, you should be OK. They are issuing SSCN codes that you can use to identify yourself as an account holder.",0
1578229142784704512,@LemonFacexxx1 Beat it into submission…..,@meholt What do you do when your dick is angry?,1
fjbkv61,this is how this country is now... and it's fucking SAD,"It's not illegal in the end though is it? Lnp voters won't know or simply won't care. They only care about protecting their negative gearing. Every lnp voter i know tells me that's why they vote for them. 
Nothing, not even their children's future outside of this property bubble matter. Lnp could shoot poor ppl in televised safaris and i bet if the opposition promised a 50% cut in property they would stay with lnp.",0
1572501106613424128,@LetsTalk_FPL My old man’s a Leicester fan and can’t believe that iversen hasn’t been given a chance yet,"Fixtures matter of course, but Leicester's haven't been great either.

You could maybe say they've been a *little* unlucky.

You could also say that Iversen probably deserves a chance...",0
fj6r3d8,"It does state to ""Exercise High degree of Caution"" in India. However it doesn't tells explicitly the reasons that are there in the article","Check yourself if the above information is written on  Canadian official website 
https://travel.gc.ca/travelling/advisories
If you open the article title and body are contracting each other. 
Edit:.
u/futuoerecutus provided me the url  which has the stated information. 
https://travel.gc.ca/destinations/india
It appears to be genuine.",0
fj5df9v,Totally got sucked down the rabbit hole on this.,"That Diana Ross and Smokey Robinson are Michael Jackson's actual parents. That's why he was the talent in the Jackson family and why there were rumors that he was Evan Ross's father (they both look like Diana). Smokey would've been 18 and Diana 14 years old when Michael was born so Berry Gordy arranged to have the kid given to his old boxing buddy and fellow musician from Chicago, Joe Jackson, who he would fund leading to the formation of the Jackson 5. Joe had a big family where Michael would get everything he needs while training him to be an entertainer and Motown could protect their image by taking the child out of the picture.
It turns out the kid is a talent and as we all know the Jackson 5 make it to Motown, but even before that there were several documented instances of Diana Ross in Gary, Indiana such as at the school talent show where the Jackson 5 performed. She has said multiple times on live television that Michael is her baby/child, says she's doing it all for him, and joked about him playing her son in a future movie. She has also said publically she was in love with Smokey Robinson growing up, living on the same street as him in Detroit, which is odd because he had a girlfriend during that time who he later married. Diana also changed high schools around the time Michael was conceived (when she would have gotten pregnant). She was going to Cass-Tech to study home economics and Smokey also enrolled in an engineering college around this time, because they were soon to be parents and Motown hadn't broke big yet. A decade later the Jackson 5 auditioned for Motown in Detroit, then did a second performance at a Motown get-together at Berry's house, and Michael has stated that at that point Diana told them she wanted to take special interest in their career.
There's a movie called Double Platinum which stars Diana Ross and is about how she gave up her kid for her career and later reveals to the kid she's her mother when she sees that the kid has talent, then goes on to help her with her career which would parallel the real life story with Michael. Her daughter in the movie also wears a dress that has the same design as the shirt Michael wore for Billie Jean at Motown 25. It's written by Michael in his autobiography Moonwalk that he and the Jacksons lived with Diana Ross in Hollywood Hills when the Jackson 5 first signed to Motown and moved to LA, and her and Michael used to go out almost every day, just the two of them. This would have been when Diana Ross revealed to Michael she's his mom, he would've been about 10 years old and that's why he became quiet and shy from then on. (This wouldn't be her only time doing this, when she had a daughter with Berry Gordy she didn't tell her who her father was until she was 13.) Smokey Robinson also stated when he was leaving the Larry King interview shortly after Michael passed away that one of his fondest memories of Michael was when he used to go golfing at the age of 10 or 11 with him and Bobby Taylor, who is said to have discovered the Jackson 5 even though their first album at Motown was presented by Diana Ross. 
This was also what Michael meant in the song Billie Jean when ""this happened much too soon, she called me to her room"". Diana was the one who said ""I am the one, but the kid is not my son"". She meant I am your mother but you're not my son, you're a Jackson now. Diana Ross is Billie Jean (Diana plays a character called Billie Holiday in 'Lady Sings the Blues' which came out a few years before 'The Wiz' with MJ). This is also what the song Dirty Diana is about, it's about Diana Ross the groupie who seduces Smokey Robinson, who she grew up on the same street as, conceiving Michael. Then there's the song Who Is It which is about a mystery person who abandoned Michael, and in the music video he holds a card that says 'Diana'. The song Wanna Be Startin' Somethin' also talks about how ""if you can't feed your baby, then don't have a baby"" and again refers to the mystery Billie Jean character. He references Ain't No Mountain High Enough in the song Leave Me Alone and says ""Don't you come walkin' beggin' back, mama"". He also references Ain't No Mountain High Enough in the songs Baby Be Mine, Speechless, and Keep The Faith. This is all also why you see a weird sexual dynamic between Michael Jackson and Diana Ross but you will never actually see a picture or video of them making out.
Recently a video surfaced of Diana Ross singing You Are Not Alone to Katherine Jackson; just like how she probably used to sing Ain't No Mountain High Enough to Michael when he was living with her. This is seen in the aforementioned movie Double Platinum as well, Diana sings her lost daughter to sleep with a famous song. And in TMZ's video ""The Last Time We Saw Joe Jackson"" an old senile Joe says ""I raised Michael, he's my son and Quincy Jones knows better. I don't talk about it, no way."" He's defending the supposed fact that Michael is his son for a seemingly unknown reason, and even in past interviews he always emphasized ""he's a JACKSON"". After MJ's death, Joe when interviewed said he was doing great, meanwhile Smokey Robinson went on the Larry King show and praised MJ as an artist.
This theory explains why Michael not only looks like Diana Ross and has the same features and eyes as her, but also explains why his facial structure looks like Smokey's & their profiles and ears are completely identical, and why he was a musical prodigy who had the stage presence and songwriting abilities of his real parents (Diana, Smokey & Michael are the only three musicians besides the Beatles who have two stars each on the Hollywood Walk of Fame - one for being a member of their original groups and one to celebrate their success as a solo artist), as well as having a very soft voice which both Smokey and Diana (and Evan Ross!) have in common. Here you can see how much different his eyes looked from his brothers and how much they look like Ross eyes. Now you can see why his personality developed the way it did. It's why he acted like an orphan and called himself Peter Pan and built Neverland to help disadvantaged kids, why he isolated himself from his family and could never manage to have a normal relationship with women. It absolutely explains why he had such a severe identity crisis. And it explains why Diana Ross is second to Katherine Jackson in his will regarding who would take care of his children, and why Joe Jackson has been known to dislike Diana Ross. At Michael Jackson's public memorial the first person that comes out is Smokey Robinson reading a letter from Diana Ross, who writes that she's mourning so hard that she cannot attend the memorial and that Michael was ""part of the fabric of her life"". When Smokey speaks about MJ later he calls him his little brother, which would imply blood relative. In the movie Hitsville USA: The Making of Motown, Berry Gordy jokes with Smokey about how some of the babies that the groupies were having were his & that MJ reminded him of a little Smokey. Also, the movie An American Dream was about the Jackson 5 and would've been propaganda to reinforce the coverup story. 
So, it wasn't that Michael was ever trying to look like Diana Ross like people thought, he was actually displaying features and mannerisms that he INHERITED from her. In one of the clips below she says he has the same features, skin tone, and bone structure as her. Now you might say well Janet looks a lot like MJ, but growing up in his shadow she adopted many of his mannerisms and used makeup and plastic surgery to replicate his appearance (like Latoya did) but their vanity was merely deception. Joe and Berry branded and marketed the Jacksons a certain way to make Michael seem related, such as with the matching outfits and afros, but if you look at their features it's clear the only similarity to Michael is the way they smile (a learned trait). MJ has much more defined features and is rail thin like Diana Ross, and his nose & chin match Smokey's. Now it's clear why Joe told him he had a fat nose and singled him out so much with the abuse.
MJ does a photoshoot with Katherine, Joe, Diana, and Smokey
Diana Ross calls MJ her child, says she's doing it all for him (skip to 15:56)
Diana Ross jokes about Michael Jackson playing her son in a movie (the intro downplays her role in starting his career, an important part of the coverup)
Diana Ross confesses her relationship with Smokey Robinson, which would have been when MJ was conceived and when Smokey was dating Claudette (skip to 8:40)
Diana Ross jokes about her and MJ having the same facial features and bone structure, ""he could be part of my family""
Diana Ross calls Michael Jackson her baby
Smokey Robinson recounts how MJ used to go golfing with him and Bobby Taylor as a kid
Evan Ross says MJ was like a brother to him and that Diana was a mother figure to Michael
Joe Jackson defends the fact that Michael is his son when confronted by paparazzi
Smokey Robinson reads Diana Ross's letter at the beginning of Michael Jackson's memorial
This theory is from a YouTube channel called An American Scheme. I also created a subreddit with further info on the topic called r/AnAmericanScheme.",1
1538860918871826438,@FurbabiesRmyGo2 ???,"I think I am the last of a dying breed. I much prefer bar soap, as opposed to liquid soap.",0
1579752486394826754,@souryadash Now its gone!,@aratrika_g08 This looks like an approaching apocalypse !,1
1571020251277692929,@toeknee73758039 We hope we passed….? ?,"@Twonaturistson1 I zoomed in on book titles first, I'm such a nerd :)",both
fj52q73,Happy cake day!,Bumping privates,1
fj9qlcn,Why? The replacements list has been utilised.,Bit ridiculous that a by-election isn't called.,0
fjaq70r,I completely forgot I could do that; would've saved me hours of headache! ? Also: Thank you!,"Susannah Wise - https://www.imdb.com/name/nm0936418/
If you take a screen shot of a persons face and use Bing image search it can usually tell you who it is.",0
fj5dn01,KFC Spork?,Spoon and Fork,0
1579719291108483073,@Toshvaibhav @0xPolygon @0xAkashShukla @0xPolyAdvocates @0xPolygonDevs Thank you Vaibhav! Let's rock buddy together and help Ahmedabad with @PolygonAmd,@daxeelsoni @0xPolygon @0xAkashShukla @0xPolyAdvocates @0xPolygonDevs Congratulations @daxeelsoni bhaiya!,0
1580527587167678464,@kimmie_c_ Sad part is going on everywhere,"Lordt. It's not even 7am and someone's already crying at work...

Not me.",both
1579824780530044929,@ACP_SURINDER_K @SURINDERJEET63 100/ सत्य वचन इस बात का गुनहगार मै खुद हुं मैने भी मद्त मांगी थी मद्त करना तो दूर उस बात का लोगोने ढिंढोरा पिट दिया,"मुसीबत में अगर मदद माँगो तो सोच कर माँगना,
क्योंकि मुसीबत थोड़ी देर की होती है और एहसान जिंदगी भर का।
@SURINDERJEET63 @ACP_SURINDER_K",0
fj539in,"That kid wasn't your friend if they were showing you stuff like that, I'm sorry to say","I remember a buddy of mine showed me a snuffpage when i was 9, saw some shit no 9 year old should see, worst was the picture of the gutted corpse of a women with a mans cock penetrating her so that you could see the cock go through the vagina and pop up again inside the gutted part of her abdomen, that picture is still clear as day.",0
fj57mac,"Same, I played soccer in a team when I was younger but hated to watch people play it cause you dont do anything.","As a guy, I hate watching sports. I think its the most boring shit ever, its like watching paint dry. Id rather play than watch. I can't understand how you can watch like 2 hours of guys playing something and get excited over it. Yes you can hate on me all you want thats just my opinion.",0
fj5uw51,"> Up the dole and other welfare payments if you want to do anything reactive.
Ha, funny joke.
This government will never do that sort of thing, it'll bring forward trillions of dollars in tax cuts to the wealthy before adjusting support payments in a positive direction.
I'm sure the government is aware that giving money to the 'lower class' will put money back into the economy and especially the retail sector but it'll never happen unless something huge happens to reshape internal LNP policies.
I expect to see more 'corporate socialism/welfare' before we get any sort of change that helps the 'little person'.","Nothing helps a national response better than further defunding the apparatus of state. /s
Up the dole and other welfare payments if you want to do anything reactive. They’re people who will be most impacted by economic issues (including people who may find themselves on it if this turns to a recessions) and by nature of necessity will be spent to circulate in the economy.",0
fj994h9,They're just reshaped turkey Dinosaurs/Jetters/Drummers. Sad face.,You can get turkey unicorns and things these days.,both
fj63fil,"What is your name : 
Reject.","Come to usa, trump is waiting for you?",0
fj9r0cj,How extravagant?,"I have a company credit card for entertaining customers which I have, on occasion, used to purchase an extravagant selection of biscuits for the office.",0
fj68csh,And the same hat at that.,Why are most of the people in that image wearing a white t-shirt and red cap,both
1578362230302978048,@TheRealRudolfo So damn good,@bcurrall80 Loved it!!! #WerewolfByNight #ManThing,0
1578328763448033280,@danieljayregan ❤️,"Today I recorded people’s lips telling stories of loss in response to my recent film. It was heavy but wholesome: we cried, we hugged, we shared &amp; we said the names of those that are no longer with us. It is an utterly humbling privilege to be with people to tell their stories.",0
1579427186024796161,@JennaZwagil I am calm in every situation,Train your mind to stay calm in every situation.,1
fj6z92z,"> Mostly because of Saudi Wahabbi money coming into India.
> Now, burqas are everywhere and muslims are way more religious
> their younger siblings are far more religious and ""kattar""
Do you have any sources for these?","Liberal side don't like to talk about this (I'm a liberal too) but it is a fact that Indian muslims have changed a LOT in the last 25 years. Mostly because of Saudi Wahabbi money coming into India.
I lived in Lucknow when I was young. That was a very liberal muslim city. You'd never even see a burqa in Hazratganj. Now, burqas are everywhere and muslims are way more religious
Among my muslim friends from back then, there is a shift within their families as well. My friends (all 30 year olds) are mostly irreligious. But their younger siblings are far more religious and ""kattar""",1
fj55u5m,Ouch your butt,"Jason Momoa, i'm straight but if i had to, that guy could tear me up.",0
1538232128214863872,@orlamac21 @Monty_donegal @CiaranNixon2 Forget it! I've just WhatsApped him the link. You may cancel whatever plans you've made for the rest of 2022. And possibly beyond. ?,@tickles23 @Monty_donegal @CiaranNixon2 For the sake of my relationship I’m not going to tell him you’ve tweeted him this ?,1
1572490335023931394,@lizalscott @GMB @MartinSLewis @susannareid100 It hasnt your dd has not the same .Dont do it .,@GMB @MartinSLewis @susannareid100 My energy bill has gone up with British gas from £68 to £242 how is this possible please advice,0
fj6295s,Neighbours came back at 1.30am loud as hell. I banged on the wall and shouted SHUT THE FUCK UP in the middle of my sleep... they went quiet for the rest of the night but the exhilaration kept me up for hours,"Hardly slept because of my dickhead neighbours. Half tempted to go bang on the door and wake them up in return.
Swimming today with little one. Then I will probably need a nap later on.",0
fj5u7zu,"Hahaha, I've been called all three in this thread itself. It's absurd, I thought denouncing those who rape, murder and pillage would unite people rather than have them insult me.","be prepared to be called a Hindu Apologist, a leftish libtard and a weak, beta fiberal.",0
1579106180278136832,@74type181 Thank you ?,"@joelvsarthritis Nope, I often wonder what I want to do when I grow up &amp; I'm in my 40s. Always try new things.",0
1578295258286559232,@PhilHanton @hendygolf How can LIV expect ranking pints when they play a completely different format (easier) than the rest of the other tours.,"@hendygolf Personally, the rankings are flawed for all three tours. Pgatour is rated too highly, European tour too low and LIV should have realised it would take time for them to get on it. Think the picture will be clearer in 12 months.",0
fja7189,posting this again because r/india has taken down two posts under which I made this comment.,Modi is a megalomaniac and attention seeker. He can't keep himself off the mainstream media. This is not happening. Just another PR stunt.,1
fj7j3hq,Not when the D11 exists!,"Looks like a Caterpillar D6, absolute unit of plant machinery.",0
1538273016089661440,"@Clearpreso Did our beach clean this morn, decided not to go in shorts as we were doing the dunes. Man was I glad, I would've been glad of yer man's jacket!!","Sandycove, 16c and overcast, a bunch of lads walking towards the dart station. One of which wearing a northface bubble jacket over a hoodie, one topless ???",0
1538005437693366272,@caie_w @WorldBollard On the @BMW calendar. @WorldBollard calendar will be much better.,@WorldBollard Where are the BMWs?,0
fj7aalg,Til they find out there's a set amount of school dates in the year and they're gonna lose two weeks of holidays somewhere else.,Imagine being a kid and this happens. You’re delighted tbh.,0
fj9iuir,"‘As an American’....the preamble to absolute shite. Your ‘society’ is the youngest in the world and it is a mishmash of different countries’ cultures. Your military/government are the ultimate global terrorists, nobody wants to be like you. You’d get your molotov swiftly rammed up your arse if you start making those threats here. Shut up and keep your aggressive ideologies to yourself","As an American that's been here for awhile now, I do appreciate the idea of not spending the entire budget on tanks every year, but I'm also pretty sure I could take over the country with a good pistol, a few molotovs, and a half decent scarecrow.  A little more funding for the poor lads in the defense force might be appropriate
Edit: Apparently none of you can understand hyperbole and instantly equate more funding with a call for rampant militarism and imperialism. Calm down you knee-jerk slacktivist keyboard warriors.",both
fj9tepx,You are on your own at the beach.  I will panic@home.,"I need to make a jar of pickled onions and also visit the beach. Don't send help, I can manage both.",both
1571533150496460800,@timmyvoe You silly man. Weve had 12 years of a Tory government and police cuts. Ditto funding to the nhs. Youd be dangerous if you had a brain.,"If you want to know what life would be like under a Labour government then look at the crime in London under Sadiq Khan, Look at the NHS in Wales, Look at the police in Manchester, Look at the financial mismanagement in Liverpool

Now imagine it all over the country",0
fj8nj5i,No priest would tell you to not cook food because you shat that day.,"Wrong step.. Hear me out..
The stupid priest want to create a connection between the cooking and the periods. Periods are OK. Cooking is ok. The portrayal of connection is bad. By organising this, they associated food with periods thereby highlighting the connection. Its the same as we have shit in our stomach too all time and we eat food from mouth. But we never choose to notice this fact bcoz this connection is not that good to think on. The stupid priest won in a way",1
fj99anf,PIVOT!,"Got wasted Friday, still feeling rough today.
Did by a new bed though Sunday. Super King... now panicking the headboard won't make it up the stairs into the loft conversion. There's plenty of headroom for it to go 'straight up' as long as it pivots around the first point... wondering if I should go back to the shop but all I could maybe do is cancel within the first 24 hours.
Going to be a long day!",1
fj5cgh5,But there was another Coronavirus in 2008,Coronavirus is so obviously a biological weapon from the Chinese government and nobody is seriously talking about it. China has a long history of market and currency manipulation. Who could have possibly predicted that the media buzzing about a global pandemic would cause markets to crash as we move towards another election?,1
fj7pclx,Why would there be coffee on a £20 note?,The last thing that i had on a £20 note looked like it came from Colombia.,1
fj7xix2,"People always say this after election debates.
""The real winner was the host!""
You have to really fuck up, like Matt and Ivan, to not come across well hosting debates like that.",Claire Byrne deserves credit after the leaders debate. I thought she was unreal on that.,1
1572493331090882560,@RussInCheshire Me too....me too,"My favourite thing about having insomnia for 3 decades is people telling me how to cure it as if I haven't tried everything imaginable to avoid 10,000 sleep-deprived nights.",0
fj5d35y,I don't even think he's dead. There's a bunch of shady shit with his autopsy and he could've easily faked his death.,"The theory that Epstein didn't kill himself. Memes aside, he could've probably exposed a lot more rich people for their sex crimes. They just bumped him off before he could do so.",0
