id_text,text,parent_text,label
fj7p81j,What’s with all the students traveling to Italy during February. Was the school in Maynooth had a load of students over there as well.,"Coronavirus: Dublin school to close for two weeks as student has Covid-19
Closure ordered after student identified as first case in Republic
A scientist works at a laboratory in Israel trying  to produce a vaccine against  Covid-19. Photograph:  Jalaa Marey/AFP/Getty
Paul Cullen Health Editor
Updated: 2 minutes ago
A Dublin school with 400 pupils is to close for two weeks after one of its students was confirmed as having the coronavirus.
The teenager, who is the first person in the Republic to test positive for the virus, became ill in recent days after returning from Italy and is in isolation in Dublin hospital.
Public health officials have ordered the closure of the school in order to minimise the risk of person-to-person transmission of the disease.
The decision was announced by the National Public Health Emergency Team on Sunday evening.
The team announced the first confirmed case of the virus in the Republic of Ireland on Saturday night. Another case was confirmed in a patient in Northern Ireland earlier this week. That woman had also travelled from Italy and passed through Dublin airport. The Dublin-Belfast train was later sanitised as a precautionary measure as it was believed the woman travelled home on it.
Low risk
It is understood the risk to other pupils in the Dublin school is considered low but the closure has been ordered on a precautionary basis. Students are being told to self-isolate at home and to indicate if they start showing any symptoms.
Public health officials plan to maintain daily contact with the students by phone, and will ask them to indicate by text whether they are showing symptoms.
hospital as officials trace contacts
Parents were being informed of the closure on Sunday evening and a helpline for affected people is being set up.
There is no justification for any other schools closing due to concerns over Covit-19, public health officials have advised. No new cases have been confirmed in Ireland today.
The Department of Health released the following statement on Sunday evening:
“Contact Tracing of the confirmed Covid-19 case, in the East of Ireland, has identified and made contact with a secondary school. The principal, staff and parents of pupils of this school have been notified. Following risk assessment, all pupils and teachers are being treated as close contacts of the confirmed case.
The school will close for the duration of the incubation period, which is 14 days.
All pupils and teachers are being asked to restrict their movements until the end of the incubation period and will receive guidance on the meaning of ‘restricted movements’.
Public health doctors will actively follow-up with all students and teachers on a daily basis over the coming 14 days.
Dr Tony Holohan, Chief Medical Officer with the Department of Health, said: “Contact tracing has assessed that close contacts of this patient includes pupils and teachers of a secondary school. Public health doctors are in direct contact with pupils, their parents and the staff involved.
“Patient confidentiality in this case, and in all cases, should be respected. The Department of Health will provide updated information as necessary.”
The Department of Education said: “The Department of Education is available to assist the school in any way necessary. The Departments of Education and Health are in regular contact. The closing of this school was a decision made on public health grounds after risk assessment deemed it appropriate. All other schools will remain open. The Departments will continue to communicate with all schools on this issue.”
Covid-19 is spread through close contact with an infected person’s body fluids (e.g. droplets from coughing or sneezing), or by touching surfaces that an infected person has coughed or sneezed on.
The general public is advised to follow advice from the HSE and the Health Protection Surveillance Centre to protect their health.",0
fjcjax7,Because they're the ones most willing to kick others off the ladder and say whatever it takes to win over people who aren't paying attention.,"Why are so many world leaders absolute dickheads?
> Did you hear? There's a natural order
> Those most deserving will end up with the most
> That the cream cannot help but always rise up to the top
> Well I say, ""Shit floats""",0
1578361210894176257,@queeniepearlau @IsabelleGrey6 That's rude.Surely an invasion of privacy??,"@IsabelleGrey6 I had my name shown on the aircon control panel which I didn't know and I told the client to change 
temperature ?now after I checked in, make sure no name shown on anything including luggage name tag before I start to see clients",0
1580516951427719168,@CurlySue21 Thank you?,"@CSHTexas2022 Be safe, nice song choice.",0
fj84427,This. Used to get a loaf cake and have a slice with a cup of tea. Wasn't old when it was on but it just felt really...nice.,Wild at Heart,0
1538183426230169601,@OneCumberland To the moon,@paulhayesman What does that do to Tesla economy? ?,both
1579055264052846594,"@artistpatlynch Thank you Pat, you too ? ?",@JaneyMa02975900 Have a great day Lana ??,0
1579757446801002496,@ShankhabrataM18 Where is it raining? ?,"@aratrika_g08 Kabhi kabhi toh lagta hain apun hi bhagwan hain jo baarish karata hain. ?
Was in Malda for a week, everyday it rained. Came back today at Eastern part of Calcutta, it’s raining since morning ?",0
1578379044642426881,@JB_AU Feeling’s mutual xx,I love you all ❤️,0
fjb11kt,We have a genius here. Maybe they should make you PM. Dumb idealist centrists are the worst.,"Has nothing to do with Delhi Police. DP is under the Central Govt and they do their bidding. 
Kolkata Police is under TMC and they do their bidding. There will be no arrests if and when a TMC leader speak rubbish and they have in the past. 
They're all the same. The lesson for Police is that they should serve the public.",1
fj75fbc,"Can somebody confirm this? If so, it's huge","Finally! 
This must be the first time in many millennia that the Vatican punished a rapist with anything but reassignment.",0
fj57zba,If this is true he’s way smarter than I would want to give him credit for.,"Donald Trump is purposefully handling the Corona Virus poorly so that it reaches pandemic state and he can declare Martial Law.
Martial law: is the imposition of direct military control of normal civilian functions by a government, especially in response to a temporary emergency such as invasion or major disaster, or in an occupied territory.",1
fj55dg7,You can't spell stupid without tape,Stupid,0
fjc8e73,"Since you can write this long comment, I am going to assume that you can read as long article as well.
GIMS is not for common citizens. It is for officers and the government. It has been in planning for more than a year now.","Secure? Yeah. Their standards are so low that even social media sites would have disagreed to accept that terms and they can't ask the young people to give up social media just like that, they would shove that RSS flag right up their Asshole. They are shifting you to some other platform. That's why that bitch is bragging about giving up social media on Twitter. The fake call scam in Delhi day before yesterday was part of the plan as well, to get an excuse that fake news is doing damage and all that crap. See that interview about that incident on NDTV where they are coming with some more bullshit law for social media explained by some BJP guy himself.",1
fjcj7ta,"Yeah it's those bloody dole bludgers we treat like criminals for being out of work, not the government siphoning billions to their mates.","Wake the fuck up Australia, you're getting robbed.",1
1572552525995470850,@lanelllawson Likewise fam,@Justice_Born Good morning bro have a great one,0
fj72dxo,"Also Matt Morgan's Funny How? 
Unfortunately that podcast doesn't have a fun to shout acronym. 
MMFH!","Haha he was talking about this on RHLSTP, without naming the brand.
Edit: I meant Matt Morgan’s “Funny How?” podcast.",1
fjaty0c,I don't want news to my bias (which I don't deny having). I want an almost algorithmic source of news that is just factual and without opinion.,"It sounds like you're looking for a source of news that conforms to your own expections/political leanings.   That's not what RTE or other non-agenda driven sources are for.
Stick to twitter.",0
1572560952842940417,@uurfavscorpio8 @unicrnrose_ My page,@unicrnrose_ Where can I find them,0
1579647510922297351,"@AdityaMenon22 Rather as a true journalist..it should have been...

Venom spewed are similar to when #Jaitley or #Shushma or #Bipenrawat  expired..

Baba..its their in either side.

And siding one make u also culpable",The kind of venom Hindutva supporters are spewing at Mulayam Singh Yadav on his demise is at another level altogether.,0
1571020407372906496,@RexMasters3 Nothing. He or she just looked at us….imperiously.,@Twonaturistson1 Now I’m curious. What did this fox say?,0
1579888079527034880,@fatimaahjameel Kachaa badaam wali video bana lena?,How to gain followers? ?,0
fj880c5,This is what happens when you don't rake the leaves.,Goddamn leftist greenie terrorists are LITERALLY changing the seasons. What next? FFS.,1
1572525341159354369,@SocialistNHS No in the slightest.,"Would you support NHS workers if they had to go out on strike?

It looks like we will be left with little choice soon! 

If you would support us please reply with a ?.

#OurNHS",0
fj98u2q,A van from a British company. That would be acceptable.,"What van would be acceptable for you? 
WE know what a Union flag is you patronising twat.",0
fj548vr,Weren’t we apart of that then quit?,Sign the Paris Agreement,1
fjarfvp,*dreamed it,"Thought I read somewhere they were shutting down.
Might have imagined it.",0
fj55344,"I live in Denver. I go to the airport a few times a year. For the past 2 years or so they have had the same construction stuff in the same places. They have these big walls to hide whatever they’re doing, with posters that are making fun of the airport conspiracy theory. Whenever I’m waiting in line at security I hear a banging sound that doesn’t sound like construction tools. It sounds like they’re just randomly banging on a metal pipe. I think a lot of the evidence is bullshit, like the murals and the runways being in the shape of a swastika, but it is a little fishy that the queen supposedly owns property near there. And the airport is really far away. I get that Stapleton Airport was too close to the city, but DIA is in what seems like Kansas. So there might be something there.","Epstein didn't kill himself and he hosted pedoparties on some island in the Caribbean
The chemical that can turn frogs gay exists and it could potentially work for humans
The Masons built the current Denver Airport to hide something important
And I'm sure I'm missing some
PS: Top2 have been proven to be mostly true for a fact, 3rd is known except for the ""something important"" thingy",0
1579427186024796161,@JennaZwagil I am calm in every situation,Train your mind to stay calm in every situation.,1
1572500662725873664,"@Badscandal Oh yes, please ?❤️",Who wants another Badscandal Glen power release?,0
1572501692163452928,"@DPJHodges You need to delete this and take another take or two mate...All this just proves you are just as worried as the union, because you are trying too hard to defend!","It's also fascinating to see people on the Left suddenly screaming ""The markets are losing confidence in the Truss plan!!! Look at the pound!!!! Look at the ratings agencies!!!! We have to listen to the markets!!!!"".",0
fj9q9l9,Number of times that my son is woken by some prick who doesn't even live in our road (claims he is allowed to park there because his mum lives about 200 yards down the road and he has to leave his noisy diesel van there for safety reasons) is beyond belief. I have been out and had this out with him and he now parks outside some other poor saps house.,"Usually in a car with 12 doors, all of which need to be slammed.",0
fj65hw2,The penis mightier than the sword.,"It’s to give the impression of them having a weapon(knife, D-lock, etc) so they are more threatening to other teenage bys",1
fj57trd,I like it,Cause car accidents on highways,0
1538527697093140481,@marmybelle @letterbox_joy @FawaShah @littlefabshop @samm_designs @Bravo_Dada @SuesArt @KrasnayaDolls @ACanvasaDay thanks so much ?,@letterbox_joy Some of my favourites @FawaShah  @littlefabshop @samm_designs @Bravo_Dada @SuesArt @KrasnayaDolls @ACanvasaDay @chriscowdrill to name a few ?,0
fj5drkr,Just that description is enough. Pass.,"Can't remember the title, basically a guy is up for a promotion, so him and his wife have the boss over for dinner and they are talking about the promotion. The husband notices his boss looking at his wife and he convinces her to let the boss do her in the kitchen to get the promotion. He sits in the dining room while it happens. Well...... He doesn't get the promotion, husband kills himself, the lady gets back to the guy by sleeping with dudes son and getting him into a lot of trouble. The scene in the kitchen was what messed me up the most. Think the name of the movie was ""Scorned"" or something",0
fj98ye4,"Yes I have seen many bhakts transform. They were just blindly following but some of them are very frustrated inside. They do understand Modis hypocrisy but are too afraid to admit because their own ego comes with it. 
But if one shows clear evidence they can change. I have changed the mind set of my entire family. And it's a big thing because I come from a joint family and two of my family members are in BJP (you can imagine the hate on me ;) 
I'm very happy to say but except two or three most agree with.",I think bhakts are seeing the change in Indian politics and will change sooner than you think,0
1572500215822798849,@HEELMacintosh @City_Suuq He'd walk into virtually every team in the league.,@City_Suuq Blocked,0
1580499888298553349,@es_edwards Thank you Errol.?,@Forgetfulness19 Good Morning Forgetfulness!  Have a fantastic Thursday my friend!??,1
1580526380541878272,@jeemoney1117 ? love this.,"@oliviacola My 7 year old son would buddy up with him in a hearbeat. He always asks me if hes ""weird"" because he doesn't like what all the other kids do.  I say hell no, you do you always!!!",0
fj54rma,Might use that,Get out or get weird,0
fj9dpsr,"'Nuremberg trials', can't wait more for that day!","Just wait until we beat Modi. None of you will be able to show your faces in society.
Burn their names into memory. 


NV Ramana


SK Kaul


Subhas Reddy


BR Gavai 


Surya Kant


Along with Bobde.",0
1572500087158501377,@runaround Actually I heard it go up about half an hour earlier but I was on my mat in the middle of an online Pilates class so didn't look!,"@eatsruns Always down , never up ? I wonder what happens down there",1
fj694ei,Not more on higher incomes. I think we tax roughly the same on high incomes as the nordic countries but less on low and middle incomes.,"There was a discussion on twitter recently where income taxes across various wage levels were compared to other countries. It made it look like we tax more at higher incomes and less on lower earners than  other eu countries with better social services. Is there truth in this? 
It obviously excludes corporation tax.",0
1580538535743918080,@MotherCluckyou Well at least both lips are even now so you don't have to worry about looking lopsided ??,Yesterday I was greedy and inpatient and burned my top lip with my hot tea. This morning I tripped on a kitchen rug and busted the inside of my bottom lip when I slammed into the kitchen counter. I will be taking instant oatmeal to work for breakfast and lunch today ???‍♀️,1
1572561986994728960,@RepLeeZeldin What about the group of guys that were beating on him first?  Shouldn’t they have been arrested as well?,"Cashless Bail MUST be REPEALED!

Judges need discretion to weigh dangerousness.

Criminals shouldn’t be able to chop up tables &amp; walls of a McDonald’s, swinging the hatchet wildly at customers, &amp; be released from custody before the fries get cold.

We must take back our streets!",0
1572556056890601472,@andorofficial @DisneyPlus Yeeesss!,"The time is now. The three-episode premiere of #Andor, an Original series from Star Wars is now streaming only on @DisneyPlus.",0
fj9p69n,Good to hear the real truth.,Shepherds pie is made with lamb.,1
fj66tfr,I think a random sample of all people arriving at the airport would be more informative.,The lack of testing is a bit concerning. I know the tests are expensive but I think it would be worth doing a random sample on people with influenza-like symptoms. Better safe than sorry.,0
1572561263384997895,cause i rlly need to change my number,what time does tmobile fat musty ass open,0
1578282929612279808,@thestategovt This makes sense…,jack black… forever my celeb crush,1
fj5ddym,Apparently the timelines don't match at all. His mother didn't meet him until after Trudeau was born. The rebuttal I saw also had pictures of young Pierre Trudeau to Justin Trudeau and they're similar.,"Fidel Castro being Canadian PM Justin Trudeau's father.
The resemblance really is uncanny (he looks nothing like his supposed biological father) and when you see that the dates his mom was staying with the Castros in Cuba, everything really does line up.  She also had numerous affairs rumors with people like Mick Jagger while she was married.  She really had a history of getting around and partying at places like Studio 54, etc.",0
1572561243130712068,"@BenDTSPodcast Just beat The Bengals, Cowboys Linebacker Core is a Beast!",What is most surprising about your favorite NFL team through 2 games?,0
1572500957480751104,@jimwaterson Also the euro final was only on 2 channels so not really a fair comparison but still it had more!,"Peak TV ratings during Queen's funeral
BBC1: 19.5m
BBC2: 2m
ITV: 5.3m 
Sky News: 934,000
BBC News channel: 831,000

Combined peak of around 28.5m viewers on main channels, final figure will be a bit higher. Excludes streaming.

Massive audience but smaller than Euro 2020 final.",0
1572526293392171010,@SocialistNHS @iAntsaoir Yes I support all workers whatever action they believe required to Remove the Tories ASAP.,"Would you support NHS workers if they had to go out on strike?

It looks like we will be left with little choice soon! 

If you would support us please reply with a ?.

#OurNHS",0
1579721973768552450,@suman_Gurjar_14 Right,"आजकल के लोग गाय चराने में शर्म
 और कुत्ता घूमाने में गर्व महसूस करते हैं",0
1580521729109413894,@hugomh87 A waste of money and time,CryoEM mates: Has any of you a strong opinion about self-wicking grids? #CryoEM ????,0
1538190510405341185,"@Wazza1882 We also need to move Ndombele winks lo Celso Regullion Rodon Bergwin Royal on also....
Decent fees for all...Lose our shirt on Ndombele.....Loan most likely there.....","People think we’ve bough Forster, Bissouma and Perisic for £25m.

We haven’t. It’s £17m as we sold CCV for £8m.",both
fj5dz7n,If only he had better defense,Alakazam. He is just perfect.,0
fj6tz7u,Can you post some sources for that?,"Spruce trees do fuck all to soak up carbon. That's why their claim that they had planted hundreds of thousands of trees for the environment was bullshit.... it's just for logging. 
Native trees suck it in like a chain smoker. We need more of those.",0
fjas9dn,"I'm in one of those places where I might end up with a brick through my window, you know, England.",I'm American. I would definitely go running out there and confront him one morning. Sometimes it makes it worse but sometimes it ends it. It makes you look kind of crazy but that can work to your advantage.,1
1538210031317000203,@grue_tom Thank you ??,@ElaineARoche Class ..As always x,0
fj532hx,I struggle with this as well..... It would be a huge hell of a conspiracy theory.,"""There will never be a cure to cancer because treatment too profitable.""
I hear this one a lot, but it does make a bit of sense.
Chemotherapy, radiation therapy, and all other cancer treatments are extremely expensive. And if a cure was developed, it would be just as expensive. 
But, I don't believe doctors are hidding a cure from the public.l",1
1580525643464261633,"@darealpattimayo That is the truck drivers story, lots of reasons to be skeptical of it.",@MikePerlberg Sighs it’s so tragic how she died. She fell off her bike and then got hit. I feel terribly for her family and everyone who witness this. Truckers don’t listen. He should have been driving down Caton Ave.,1
fj94ouw,"Yep, Labor is just as beholden to the coporations and Murdoch. They act progressive but maintain the status quo. Vote Greens on everything, they actually have policies on the issues and modelling showing how it can be achieved. Although don't they not count your vote if you don't rank at least 8 or something?","Labor was in government for six fucking years and didn't once think 'gee maybe we ought to do something about the giant glaring nepotistic media monopoly in this country'?
Nup. Nothin. No spine in government, no spine out of government. I think they'll win next time but I won't be voting for them. Greens #1 Senate only. Same for HOR if I vote for it. #1 Greens only. If that spoils the HOR ballot tough, change the laws. I will not rank trash.",0
1572373522642526208,@BrianSimsPA @TUSK81 every time i feel bad about myself i remember he's two years older than i am.,@TUSK81 Wait…so am I!,1
1579727861396955137,"@Rohanslucile @AgentSaffron Subbayya Rai, a bhakt started to give a hen to eat every month as a sacred ritual. After his demise ritual stopped and since from that day Babiya didn't eat any chicken/meat, only ate temple naivedyam of Sri Anantapadmanabha swamy of Anantapura!","@AgentSaffron Can’t there be any Exception ! 

I have been going there since I was a kid and I no for a fact that nearby there are lot of homes of Priests and it has never touched a pet and it used to move from one pond to other",0
fj9ajzd,Poke it down with a rod? Wear protection and take off the u-bend and drain it into a bucket?,"My sink was blocked yesterday and the plunger didn't seem to be making much headway, so I went to the supermarket and got one of those cleaning liquidy things to do the job. Leave it overnight and the jobs a good'un. So I wake up this morning and it appears to have not done a thing. 
Now I've got corrosive liquid sitting in the pipes running out of my sink that I can't wash away. Great minds of /r/CasualUK/, what do?",0
fjbyxks,Makes sense. They were literal allies pre independence.,"RSS is actually the B Team of Jinnah.
They are proving Jinnah right.",0
fj6n9vj,Thanks mate,Just google it? qbasic.net,1
fj594sc,"No I'd be dead,  I know my luck.","If they took 50 people, including you, and said they were going to shoot one of you at random, would you be scared?",1
1572561382041874432,@GOPChairwoman Who did the polling?,"According to new polling, Americans think Biden’s student-loan bailout is unfair by a margin of 59% to 32%.",0
1572482214318964737,@mommamia1217 And DC also. It’s not fair the way it is now.,How do you feel about Puerto Rico becoming a state?,0
1572505221385027585,@ianatki75837388 Morning Ian. I’m great thanks hope you are too. Have the best day. Happy Wednesday ?,@benno_85 Morning kirsty how are you this morning am ok.enjoy your day,0
fj87oge,"> .. but serious crimes (murder) would be an issue. 
Shur I'll throw in the application and see how it goes.","I understand only criminal charges show up, and hypothetically if it did mention anything they look at the nature of what occurred e.g. speeding fine NBD, but serious crimes (murder) would be an issue. An admission to a psychiatric unit might be viewed as beneficial to the school because you would have lived experience which is valuable.",0
fj7va1b,It will take Michael weeks of dole payments to replace the broken window on his 2004 Toyota.,Resulting riots in carlow have caused literally dozens of euros in damage,1
1572516182787518464,"@NatHunter_1 @robinmcoach Firmly secure wow is that like a prison secure I mean what about Democracy? What about Human rights?
Do Unionists not believe in such things? Or do they only apply if you're Not Scottish. I mean surely Scots decide their own Future or is that only outside the UK?","With the union firmly secured because the Queen died, what now for the SNP and Sturgeon's Yes movement? We'll ask some unionists.",1
1572330713697091585,"@SQLBits That time, when a huge curtain reveal the whole fun fair at SQL Bits Party Telford","If you could pick your FAVOURITE thing from ANY #SQLBits event, what would you choose?

????☕️?",0
1579734789556666369,@dreamfallart I am 1 winner for it already ?,Should I make a giveaway when I have 30k followers??,0
fj6crcc,Have you seen Arnab?,I swear this dude has the most punchable face,0
fj9yb96,It is one of those books that looks nice on top of the microwave. About the best thing I can say for it.,"£4.99?? 
There are thousands of amazing curry recipes for free on BBC good food. Plus they're user rated by normal home cooks so you get an idea of how realistic it will be to get it right.",1
1578298423371259905,@KoparaFallsKid @TedTratt Been Killing time.,@TedTratt VERY glad they aren't mine!!! ?,0
