id_text,text,parent_text,label
1572499082199068672,@andylong Morning Andy,"Good morning everyone, enjoy your Wednesday",0
1579728461161463808,@SanjayVyas Never thought in this direction. ?,"Why do men stare at women? Women do the same thing in blink of an eye, where as men stare for so long... why? men have slow visual processing? ?",1
1572490735051571201,@JohnSimpsonNews The thing about this is we can’t blink now. We left him take Crimea and he has returned for more territory. I think he’s weak. I hope his own people will bring him down.,"This is a very dangerous moment. Phoney referendums in Russian-controlled eastern Ukraine will mean Russia can claim that Donbas etc is actually part of Russia. If Ukraine continues to advance there, Putin will threaten to use nukes to defend Russian territory. WW3 would beckon.",0
fj9n2u4,Exactly!,Who's Peter Andre?,1
fj539in,"That kid wasn't your friend if they were showing you stuff like that, I'm sorry to say","I remember a buddy of mine showed me a snuffpage when i was 9, saw some shit no 9 year old should see, worst was the picture of the gutted corpse of a women with a mans cock penetrating her so that you could see the cock go through the vagina and pop up again inside the gutted part of her abdomen, that picture is still clear as day.",0
1579792875801698306,@Prabha86763100 @narendramodi @iGopalShetty @VanathiBJP @MadhaviBhuta @umakhaprebjp @SheetalBJP @YogitaNilesh @SujataPadhyBJP @chetanaupadhya2 @BJPMahilaMorcha @BJPMMMumbai @BjpDipti Thank you ?,"@sompura_dipti @narendramodi @iGopalShetty @VanathiBJP @MadhaviBhuta @umakhaprebjp @SheetalBJP @YogitaNilesh @SujataPadhyBJP @chetanaupadhya2 @BJPMahilaMorcha @BJPMMMumbai @BjpDipti Doing great work dear, go ahead ??",0
fj9c184,"It did say fever, cough, and difficulty breathing. Not just cough.",If I have a cough I should seek medical care? This is some needless panic.,1
1572566621730009090,@bigrobistheman 41-33,@DubDotDUBBY Tbf nobody is gonna trust an eagles fans judgement. Half of them eat horse poop on occasion.,0
fj64bhu,"Day well spent already 
Niice :)",Biryani and icecream for lunch. Sunday done right bois and grills.,both
1580539847814811651,@ksdotlewis I would I'm never scared of shit but women are just as crazy as a man these day's ?  real shit ? but I love to try new shit ???✌️,"If your Twitter Crush said “Ima be in your area a couple hours away, can you come and let me take you on a date?” Not a link, a legit date. Would you go? Or no? Are you scared?",both
fj6fmau,Aww thank you!,"You'll fit right in! 
Welcome home! :)",0
1578355277367488512,I said ‘did you tell your (GP projab) wife this story?’ Answer. ‘Hell no. You’re my release button.’ #antivaxxerlife 2/2,"Old colleague rang me today. ‘Just got to tell you this story. My friend who is 68, fit and healthy and still working as a lawyer in Melbourne has just spent 5 weeks in hospital suffering serious neurological symptoms. Doctor told him it was related to his fourth jab. 1/2",0
fj74bq9,Hmmm...,Sometimes i do it on purpose when im in a bad mood. But when it happens to me i get annoyed,0
fjcccqj,"ACAB retards will still think it's the entire police force, the abuse thing is the same as all other shit. Some muslims did some terrorist shit but it doesn't make every muslim a terrorist. Some weebs like the kiddie shit but it doesn't make all weebs pedos. Some cops are cunts but it doesn't make them all cunts. Everytime I see ACAB I instantly picture some filthy bogan living of welfare lol.","Even though 1 offender is too many, to put this in perspective: There are over 11,000 police officers in Queensland, 84 officers is less than 1% of officers. If the problem under-reported and actually 10 times worse, that's still only about 7% of the police force.",0
1572563342270799875,"@StephenMoore Because trump lies 30x more often than Biden. Pretty simple, really","PolitiFact ""fact-checked"" President Trump almost 6 times as often as they do Joe Biden.

Now you know why Americans don't trust fact-checkers.",0
1578638962406862849,@NikMikk @AnnaBarlog Clearly. Man has class.,@AnnaBarlog Was there pineapples on it? ?,1
fj6r3d8,"It does state to ""Exercise High degree of Caution"" in India. However it doesn't tells explicitly the reasons that are there in the article","Check yourself if the above information is written on  Canadian official website 
https://travel.gc.ca/travelling/advisories
If you open the article title and body are contracting each other. 
Edit:.
u/futuoerecutus provided me the url  which has the stated information. 
https://travel.gc.ca/destinations/india
It appears to be genuine.",both
fj92aes,But why did he change his order?,"My son ordered the same pizza from Dominos so often, that once when he changed his order slightly they rang him to see if they had made a mistake.",0
1572561143708938242,@AZ_Brittney @Bwebb12 How come I’ve politely asked you for a boost many times but you ignore me?,"Meet like-minded friends 
Vet and follow anyone that 
gives this tweet a ❤️

Please Retweet",0
1572497898490986501,@whatjamietweets £5 delivery for standard shipping and a week delivery time ?‍?,@andy_cov93 Absolutely scandalous pricing and can't believe they even charge postage!,1
1538444167315083271,@johncollinsUTD Thank you Barbara,@johncollinsUTD So sorry to hear of the tragic loss of a beautiful child to suicide.,0
1579738142860783616,@DelhiPwd @MCD_Delhi @GautamGambhir Thanks hopefully you will take action soon,@nsheth73 @MCD_Delhi @GautamGambhir Your complaint no. is PWD/2022/10/325139,0
1572493016551817218,"@NeedraNmartins Do you remember one day a girl who thinks she is famous on Twitter scolded us a lot for the comment we made,A lot of other girls joined that girl and scolded us a lot, Remember,we kept our mouths shut because we didn't want to overreact.They think that only they are right?",@VindyaPeiris2 Some  says im aggressive .people  lables very  easily .without  knowing   the truth .recently one woman said im over reacting ??,0
fj563fm,Getting someone to read it for them and type a response. Happens sometimes on this sub.,How tf would they read this,0
1579755697281339392,corruption free society &amp; democratic values.?,"ଦୁର୍ନୀତି ମୁକ୍ତ ସମାଜ ଲଢ଼େଇ ପାଇଁ ସେ ଚିରସ୍ମରଣୀୟ ରହିବେ।?

Paying homage to eminent freedom fighter, Bharat Ratna #LokNayak #JayaprakashNarayan on his birth anniversary. The socialist leader will always be remembered for his relentless fight for social justice, ...2",1
1572519220705120257,@DuddridgeLloyd FPTP will mean Labour will never win a majority,"I am pro First Past The Post, because I am pro the Labour Party.

Let's not give the extremes the keys to number ten.",0
1578880371412066304,@keefmullin @DOT_Brew @johncoote @DrinkIrish1 @SeanDefoe @craftybeertweet @j_k357 @fennaldo @sconeaus @CorkBeer The last of 2 doz. Still some in @Aldi_Ireland Athy.,@craftbeersoflre @DOT_Brew @johncoote @DrinkIrish1 @SeanDefoe @craftybeertweet @j_k357 @fennaldo @sconeaus @CorkBeer Where the feck have been you been? Just asking ??,0
1538253852000063488,"Wonder how much that clash of heads affected that fight. Even still, great performance by Dolidze.","Be the hokey!

Roman Dolidze is ruthless. #UFCAustin",0
1580005743620595713,@ShikhaYadav000 Mere pss masg karo..!,"Hii

Good morning ❤️?",0
fj7vcds,"I think there were more days over 40 this last summer here in ACT than there were through my entire time in primary school (90s). Anecdotal of course, purely based off my feels and not the readily available data ^^^off ^^^I ^^^go ^^^to ^^^see ^^^if ^^^I'm ^^^right....
EDIT: I'm having a lot of trouble finding whether I'm correct or not. Can anyone point me directly to data for Canberra that will show me days over 40 throughout the 1990s?",The summers are becoming unbearable now,0
fjbvtbu,"Fuck people like you man. This shit requires 20% of those infected to be hospitalized for 3 weeks and has neurological side effects. Also 20% of those hospitalized die due to ARDS. And these are just the official numbers, and I hear the actual numbers are much worse. Also, the virus survives on dry surfaces for upto 24 days in temperate zones and 9 days in warmer locations and it spreads through air as well after the saliva etc evaporates.
The problem therefore is two fold:


the stress on hospitals


the death rate


And in a country like India with bad healthcare already, and states like UP where gomutra is king, you can only imagine the havoc it will cause. I predict the government will not release the death rate numbers.","Not able to understand this frenzy. Sure it's 2 times more communicable than a flu, but it's a water borne disease. 
Panic if someone sneezes at your face or you touch your face when in public spaces. 
People who aren't showing symptoms are less likely to spread. 
Please wear a mask if you start coughing and sneezing and stay at home.",0
1580368298532708352,@Jason_T_McC @calvin_knapp Well put!,@calvin_knapp Just think you’re off work and he’s still working and was probably up at 4 am to do the milking all so you can have food &amp; milk in your house. ? ? ?,1
1580358360364306432,It's the end of the world as we know it. Who said that?,"51 (!) people with US Gov. security clearances, all prominent, said Hunters lap dance (!) was like Russian Disinformation. Now it comes down to wordplay. Come on guys, 51 isn't American disinformation? Pity the American people who got hoodwinked very very badly.",0
fjalhpq,Conservative. That's a nice way to spell fascists.,So you are mad because the Conservative BJP cares more about Hindu families and customs than other cultures?,both
fj5deds,I think you got it all twisted here pal.,Masturbating,1
1579798619515129861,@_Humakhan ready,I need a boyfriend .????,1
fj576xr,Yeah that would be NICE to know,How many years ago was 1951,1
1580526319833878528,"@Irma_Spikeymama Good morning Irma, happy Thursday have a great day.?☕️??☕️☕️","?Good Morning Friends??‍♀️Welcome to Thursday/Friday Eve?Today is all about preparation⚠️It’s “International Day For Natural Disaster Reduction”???With climate change turning extreme weather into more deadly disasters, it’s vital to prepare for the worst‼️",0
1578333526055063552,@TheProselytiser You're a bit late I started when Barry Cassidy was still hosting,Might I suggest a mass boycott of #Insiders this Sunday?,both
1579747540677054466,@pradyvats मेरे कहने का अर्थ है की सोच ही एक ऐसा माध्यम है जिसके जरिये आपकी ये कमी पूरी हों सकती है,"मनपसंद शक्स की कमी कोई नहीं पूरी कर सकता
दुनिया की कोई ऐसी ताक़त नहीं है.. जो कर सके।
#pransprady #pradumnupadhyay #kb3",0
1578317471081123841,"@HeavenlyAurora @AmandaValentina I occasionally indulge in nanna naps, too. ?","@FMTYEscort @AmandaValentina Go u!
Sleep is what gets me though the day ?
And my dogs ?",1
fj9i0a2,"Wanna see a statesman, look no further than Angela Merkel. No wonder she did not shake hands with Modi. Modi does Mann ki Baat. Hindustan mein ek hi insaan ke paas mann hai. Baki sab to chutiye hain. Modi's problem is his bloated ego. That's what made him wave at no one in Dal Lake and use his raw wisdom in inventing new radar technologies. At the same time, he is a thorough coward. He does not want to face people. He does not want to face questions. He lives in his echo chamber of his flatterers and occasionally caters to modia.
I find Modi to be a very insecure person, scared, vengeful, delusional to an extent. He has another side though, which he presents to his audience,.. Brash, resolute, ambitious, flamboyant, dragon-slaying savior of people image. It is a projection. Such a projection would attract most people. He is a populist. One needs to though focus on what he does not do or does not say. That tells about the real Narendra Modi.",Zero press conference in 6 years. Much statesman. smh,both
fj63vnt,"And, er, where is the mandatory dog tax?","Have three lots of family members visiting at different times today. Don’t intend to leave the house at all, going to sit on my arse and enjoy hot drinks all day, before going back to three walks to school a day tomorrow. My parents want to take the kids to Liverpool today, so might get a chance for some Sunday Xbox. 
I’m halfway through two weeks off work. I totally forgot about work, until now. Il spend the second half dreading going back to work.",1
fj67egv,no idea - he had nowt to do wi sheep anyway,Is it st Davids day today? just wondering.,1
fj51l79,"You beat me by 4 min, I like you dark friend.",All of them,0
1580383671248654337,@ChuckCallesto @PatriotXV11 Prayers for the family ?❤️?  #RIP,"BREAKING REPORT: Marine Recruit, Private First Class Javier Pong – [18 YEARS-OLD] – Dies After Collapsing During a Training Exercise at Camp Pendleton...",0
1580525856597737472,@jsmcmahon21 Good morning hope you have a Terrific Thursday today ☕ ? ?,"Good morning Twitter. Positivity is extremely powerful, let's spread as much as we can today! ☕☕???",0
fj5vjya,That's something even the girl I am currently with does. But instead of watching geopolitics she sleeps on my shoulder in which she murmurs god knows what,"Saturday night ka mera 'sneak in the garden and light up a joint' routine badiya baith gaya hai. Kal mast joint fooka gaane sunte sunte and moon ko dekha and uske baad some geopolitics ke videos. Man, I love saturday nights.",1
fj72ftm,"I dunno man, I'd be sweating at the thought of finding a tenner.","In general, the Irish don't do big expressive celebrations like that. Seems like more an American thing? 
We're too shy.",both
1579715501436981248,#Hyderabad #SingleOccupancy #doublesharing #womenhostel #menhostels #PGS #payingguest #womenshostel #security #hostel #workingwomenspg #Hyderabad #luxury #hitechcity #madhapur #gachibowli #corporate #Kondapur #mumbai #delhi #noida #bangalore #jaipur #maharashtra #tamilnadu,"On demand Hyderabad's luxury hostels/pg's/hostels helper.. #Hyderabad

My Charges are below... In note.. 

NOTE : my charge is only ₹999 which is non-refundable and need to be paid before starting the process. If you are OK with it then only WhatsApp or call me on 9000539552",0
1580540338238009346,@ksdotlewis I would and have. Met some cool ppl in the process,"If your Twitter Crush said “Ima be in your area a couple hours away, can you come and let me take you on a date?” Not a link, a legit date. Would you go? Or no? Are you scared?",0
fj95zf1,"I liked them for a few years, but then Saturday Night Takeaway started getting repetitive. Ant nearly killing a child was the final nail in the coffin for me.","I’m probably going to be downvoted for having my own opinion, but I disagree. I loved their recent program about their DNA and family history. They can be quite funny but more so their banter is fun to watch. They’re just two typical Northern blokes who’ve been best mates since they were kids and it’s nice to see.",1
fj9x5lg,"Tulsi's foreign policy is all over the place
https://youtu.be/eCT1P6cB9yA",Tulsis take on American foreign policy is refreshing. But yes the bottom line is that she is indeed a Sanghi. She was asked about the post-godhra riots and her answer was telling.,0
1578511123762274305,@ReturnofR If I could Turn Back Time by @cher,What SONG did YOU listen to TODAY?,0
fj6fh8n,In the same closet as Philip Schofield.,Where did Gordon the gopher live?,both
fj5aysi,All valid points.,"The NFL is rigged. 
I mean, there’s too much money on the line per game for there not to be someone wanting to fix it. And it’d be so easy to: you don’t need to even tell the players, just have a coach make a bad call in a critical moment or have a ref make a call a certain way on a close play and that’s it. 
The New England Patriots are one of the most successful franchises in history, in one of the wealthiest parts of the country that has a ton of disposable income and a love of football. That’s no coincidence. 
The browns moved to Baltimore because it was more profitable for them. Super Bowls are blowouts or close games based on the highest payers’ time slots in the game. There’s billions of dollars flying around every Sunday for a third of the year, you know someone is going to want to make sure it gets in their hands.",0
fj7ycpm,The religious mobs are into this rort big time. And even though the catholics were busted rorting the system (claiming shit they didn't do.. on top of doing fucking nothing anyhow) - there was no repercussions whatsoever. Just more cheques from tax system to allow them to keep expanding their rorts.,"I went off at my JobSearch provider. The one you’re with gets $500+ per jobseeker, only for them to be useless and I still had to find my own jobs anyway. I asked them “What exactly do you do?!”. 
I literally got no help from them and Centrelink pays them to help me! It’s literally a cash grab.
They told me I was rude for asking them what is their purpose?!
Here’s something they keep hush hush, its your right to choose your own JobSearch provider! If you aren’t happy with the support they give you, you can ask for a transfer to your chosen one.",0
1572395372256829441,@MacroAlf They say in USA is 40% free and clear,"Over 80% of real estate purchases in developed markets are backed by a mortgage

New marginal buyers are being pushed away due to higher mortgage rates coupled with the increase in house prices

Real estate is by far the biggest asset class in the world

Look at the big picture",1
fj594sc,"No I'd be dead,  I know my luck.","If they took 50 people, including you, and said they were going to shoot one of you at random, would you be scared?",1
1579767615291265025,@neilesh_patil Chennai ka hoga but yaha 4 din baad Suraj nikla hai ?,@sleepyhead1892 gand fatati h bhai koi sunny bola toh..Chennai things,0
1578282929612279808,@thestategovt This makes sense…,jack black… forever my celeb crush,both
1578372326479269888,@ashton_avenue @BlairBelrosex Imagine that. ??‍♀️,@BlairBelrosex Lol I’m Indian… would hate if I got cancelled for my race ☹️,1
fjd1tvp,"Thanks, IF.","You will need ID and proof of address. If you already have an account, and you can prove that, you should be OK. They are issuing SSCN codes that you can use to identify yourself as an account holder.",0
fj6e04g,Dont you know that its the oppressive society that forces them to be scumbags ?   Just like being poor forces people to spend all their money on alcohol and cigarettes,"Giving your 2 year old fake guns, cracking parent. Looks about right for the area anyway",1
1579727842455478273,@CharulAgarwalRJ Hppy Birthday Jiju,Thankyou so much all ??,0
1572552226786385921,@Visualfeelz Thank you Nati! You too!??,@Justice_Born Good morning!! Have a wonderful day ??,0
fjairpm,Not experienced that ... Yet. Is Hermes really that bad?,"hermes is worst, they are thieving cunts lol",1
1572504052369625090,"@RussInCheshire @Jacko63788375 Same here. The advice is usually given by people who are good sleepers who assume we are doing something wrong, and includes weird drinks and rituals. Nothing I've ever tried works for me and I have learned to live with it. ?","My favourite thing about having insomnia for 3 decades is people telling me how to cure it as if I haven't tried everything imaginable to avoid 10,000 sleep-deprived nights.",0
1579675889964822528,@IRealIndia Yes mam I agree with you ❤️,"जबसे सुशांत सिंह राजपूत की हत्या हुई है तबसे अब तक 35 बॉलीवुड फिल्मे फ्लॉप हो चुकी है,,

कुछ साल और बहिस्कार और सारी गंदगी साफ़ हो जाएगी बॉलीवुड की !!",0
1579718651166740482,@swadesh93 @XiaomiIndia @amisoumikbolchi @Gaurang321 @MiIndiaSupport Thank you ?,@XiaomiIndia @IamAyan_Sarkar @amisoumikbolchi @Gaurang321 @MiIndiaSupport @IamAyan_Sarkar Congratulations,0
1579876519992000512,@RShivshankar Aur RAM MANDIR K waqt @PMOIndia @narendramodi  yeh donoh kaha the..,Mulayam empowered backward castes through ballot to reshape Hindi belt politics. His opposition to Ram Mandir movement culminated in firing upon Kar Sewaks yielding big political gains by yoking Muslims to Yadavs. But in the end he let Parivarvaad trump Samajvaad denting SP.,0
fje1rba,"A lot of Blanchardstown is really nice. It's a very big area. ITB is closer to Mulhuddart than it is to Blanch village. Mulhuddart, Fortlawn and most of Corduff are shitholes afaik.","eh... have you been to blanch ? lol
I remember arriving at ITB each morning after a weekend there'd be a new burnt out car in the far side of the car park. ""natives getting restless"" - was the best phrase I ever heard.",0
1572499950386417668,@NanouuSymeon Only if it helps you to concentrate otherwise it's a distraction and will lead to unnecessary errors.,Code with music or without?,0
fj5g3c2,"This,
As soon as a sport it goes Foxtel it goes bust.
I Use to follow NBL and went to the games when it was on free to air.
Nup after that","Foxtel acquired alot of the sporting broadcasts, and given the low take up rate of their product, ut has has had a detrimental effect on most sports in Australia, as coverage is limited to sports bars and mad keen arm chair fanatics. I didn't watch cricket on TV in the 90s and early 00s, but even I knew the names of most players back then. It's always been casual viewing around my circles, but like many, I wouldn't pay for premium TV to watch it.",0
fj6f8xo,I will donate the grass seed so we can get the dairy herds going for the necessary milk and clotted cream.,I had heard rumblings that the Mars 2020 Rover has a T sensor provided by the UK Space Agency to analyse any potential flora. Nobody at NASA has yet worked out the T stands for Tea.,both
1572512618988064768,@ConnectionsHope ? I hear you,"When I was suddenly widowed I thought many would come running to my side &amp; we’d reminisce in loving memory about my late husband. This did not happen. Instead, I felt like a ghost. #TuesdayMorning",0
fj72dxo,"Also Matt Morgan's Funny How? 
Unfortunately that podcast doesn't have a fun to shout acronym. 
MMFH!","Haha he was talking about this on RHLSTP, without naming the brand.
Edit: I meant Matt Morgan’s “Funny How?” podcast.",both
fja30n4,Ugh. What are the tabloids saying?,It's sad that she has to get out ahead of this because of scumbag tabloids. Her personal life should be off limits.,0
fj9hvdb,"Nobody gives a fuck about Irish peacekeeping except for our local military fetishists. If your only argument for Ireland having an army is that they can back up front line civil services in an emergency then its already over. Just expand the civil defence and let the guards deal with the IRA as they have done fairly successfully since the beginning of the state.
The only real reason to have an army is to wage war, and ireland would need at least 20 times the current army to survive a determined invasion by any realistic OPFOR for more than a few days, so why bother? A standing army in Ireland just makes it easier for the (non-existant) invasion force to kill our men. 
&#x200B;
Do an Iceland and get rid of it all I'd say, keep a few tanks and guns around for the children and the re-eanctors to ooh and ah over.","A lot of people are saying this is good without any real understanding of what's going on here. We shouldn't be so naive as to think that the lower the better because war is bad.
First of all, defence forces aren't just for fighting other militaries. They're responsible for a wide variety of tasks. They're the last line of defence in cases of armed violence. That has a few different meanings, but one of the main ones is terrorism.
Obviously Islamic terrorism has never been a problem here, but Northern Ireland has had more terrorist attacks than any other region in Europe. The defence forces are the main reason why that violence didn't spill across the border. They were posted along the border in strength and had to repel multiple attempts by the IRA to set up on our side of the border.
Also, in times of emergency, be it from extreme weather or pandemics, the defence forces can also be deployed to fulfil a broad range of roles.
They also fill in for emergency services when people such as prison guards or paramedics go on strike.
And lastly, they're generally regarded as among the best peacekeepers in the world. Ireland is a country that punches above our weight in terms of soft power and our commitment to peacekeeping is a huge part of that. The value of the soft power from peacekeeping vastly outweighs its costs.
These are all essential services that we all take for granted. However, with expenditure at 0.3% of GDP, the defence forces are critically underfunded, which has left them in a crisis. Members are not getting fair pay and they're struggling to carry out their duties. With extreme weather and covid19 on our doorstep, we may find that the defence forces are not in the position to fulfil their emergency roles.
We can still have among the lowest expenditure in the EU and increase funding to ease all of these problems.",both
fj5uhwb,This is such a stupid idea we don't need to ban shit....just show people it doesn't make sense instead.... Convince them.... More and more people are turning atheists anyways.... Religion is going to have a slow death till the end of the century,"Islam is cancer. It must be banned in India. P.S: I hate RSS too. It must be banned too. All religions, religion affiliated 
organizations must be banned for a decade.",both
