id_text,text,parent_text,label
fj77zkk,"> P1 swears at me and then proceeds to call the police. He was only on the phone for 60 seconds so I assume 999 binned him off and no police showed up.
that's crazy, in the US they'd come and arrest him put him in jail, thousand dollar fine maybe 6 months in jail and 5 years probation for a wad of coke. Weed not so much.","Guy tries to call police on himself. 

Young gent P1 comes to the door. Regular knows we search. Hands over his wallet, boom bag of cocaine . 

B1 “Sorry mate that’s getting destroyed, and you’re not coming in, however you’ve not caused issues before so come back next week and all is forgiven” 
Sounds fair right? 
P1 “ok I’ll go, can I have that back?”
B2 “err no mate”
P1 “ why not?”
B1 “because we’re not drug dealers! Of course you can’t have it back we’re all under cctv and this will be destroyed under camera too”
P1 “ I don’t believe you’ll destroy it!”
(Note: Many people seem to think bouncers either all take or sell gear, it’s not true and even if one of us wanted drugs we’re not gonna trust something that you could have got anywhere and done anything to)
B1 “it’s not my job to convince you of anything mate, been nice, been fair now please listen to your GF and go home”
P1 “ I’m gonna call the police and tell them you’re in possession of drugs”
B2 and B3 laughing I take the lad away from door to chat more discreetly. 
B1” look mate I know your annoyed but you’re saying you’re gonna call the police to tell them we’re in possession of drugs? That we took from you!
P1 swears at me and then proceeds to call the police. He was only on the phone for 60 seconds so I assume 999 binned him off and no police showed up.",0
1578335235535933440,@FalloNed14 @piesource1 How much was the lowball offer Ned?,@piesource1 If Collingwood rate him so highly why did they low ball him with their contract offer? Actions speak louder than words,0
fj9de3m,God bless British Leyland and all the plants on the hard shoulder their broken down vans watered,"In fairness, a British van would be on the hard shoulder.",1
fj6g4vy,How is it next to useless when it still catches people? Anything that slows its spread is useful.,"Most people are asymptomatic in the early stages,and something like eighty percent of carriers only get mild symptoms.
So, scanning might look good,but is next to useless.",both
fja7187,They shouldn't be sent out to get them. Just give them a cheery wave from the shore and get a cup of tea in.,Make it legal for the Coastguard lads to be allowed to batter them once they've gotten them ashore.,1
fj5cvos,"I love this!
But why?","Dr. Claw is Inspector Gadget. 
Edit. Dr Claw is human inspector and Inspector Gadget is obviously a younger “clone” of him",0
1578373740135878656,@Dr_BellaR This is the dream for many ? hope you get it,one thing about me is that I want a FT salary on PT hours,0
fjcqqnz,Why do you think this is over prepared?,That's good. Much better to be over prepared in these cases.,0
fj51l79,"You beat me by 4 min, I like you dark friend.",All of them,0
fjam6cj,Yea Dyer was there for a bit. I'm from the same school!,"General Reginald Dyer studied in Bishop Cotton School, Shimla. I just got to know that.",0
fj6hzjt,"Before, these people would have their 15 minutes of fame, maybe appear in a few magazines and TV programmes, then promptly be forgotten about.   
Now these videos hang around forever and are constantly linked to and referenced, so that 15 minutes of fame is extended in perpetuity.   
Good if you're famous for something admirable. Not so good if you're basically being laughed at by everyone.","There’s a sort of mini documentary on YouTube about him. I feel bad for the guy, not sure he likes the fame",0
fjbvkyc,"The embassies you listed are acknowledged by DFAT as official embassies but the acceptance of an embassy isn't a sanction of that nations conduct by any government anyway. This ""consulate"" is not recognised by DFAT and is self designated. Notice that the premier or any ministers of the government aren't present. The consulate will be nothing more than a phone number and a part time receptionist and given Barundi's importance and relevance, I doubt there will be much for them to do.","This is literally just click bait, I mean look at that title, its an article just to make people angry.
I mean, we have embassy's of Saudi Arabia, Iran, Afghanistan ect, all of which execute people for being gay. Why are we not outraged at them? Many, many other countries also imprison gays and we still have ties with them. What about countries accused of war crimes and genocide? 
The only thing in this article that makes it any different is that a well known highly disliked conservative Australian has helped in the process of setting it up.",0
1572368269792940032,"Getting in protein, fiber, antioxidants &amp; the vitamins/minerals from whole food/plant food choices can make a huge difference.

@nutrition_facts has an amazing book called “How Not to Die”. I’m not saying to follow it directly, but it is definitely worth getting some ideas from.","As I dive more into health challenges that are prevalent within my family &amp; friends (heart disease, auto immune diseases, neurological diseases), research points to improving food choices for better nutrient density.",1
fj591zm,"On the assumption that everything is a chemical, can you elaborate?",It's a type of chemical to disinfect stuff. I don't know what exactly it's called. Not exactly healthy to breathe in though.,0
fj7dggb,I just saw few other tweets as well which are false including Rajdeep Sardesai's tweet,"Propoganda it is ..!!! https://mobile.twitter.com/thedailyswitch?lang=en 
They only have 76 followers and this profile was made in Oct 2019 PLUS see the tweets they are doing like the interview of Swara with Abp news (cropped so as to suit bjp narrative) ... 
I don't believe you should trust these Sites.",0
1579753411146579969,"@swamianandswaro ये हिन्दुत्ववादी नाम मात्र की सरकार है।  हिन्दुओं के हित मे कौन सा काम किया है ??
हमारा देश धर्म प्रधान देश है।  जहां साधु संतों का आदर नहीं, वह देश कैसे वास्तविक तरक्की कर सकता है।
जहाँ चीतों का स्वागत और असमय गायों को मारा जा रहा है, धिक्कार है।",बड़े बड़े आतंकवादियों अपराधियों को परोल और बेल मिल रहा है लेकिन लगभग १० साल से जेल में बंद आसाराम बापू को ना परोल मिलता है ना ज़मानत ये हिंदुत्व की सरकार है ..,0
1579834121706409985,"@suman_Gurjar_14 Yes am,I ok best'friends","सुना है सबकुछ मिल जाता है गूगल पर
 वफादार दोस्त चाहिए लोकेशन भेजना मुझे",0
1578317271956529152,@MundayJessica They clearly know your aesthetic ?,When your kids friend comes over for a sleepover and brings you a gift… and it’s a “f*ck the patriarchy” necklace she’s made. The kids are alright #feminism #patriarchy,both
fjc575e,"> I'm autistic and cannot stand that kind of language, he decided to rape and murder her because he wanted to, that's all there is to it.
I totally agree with you.","What an evil little tool. In the article they said his lawyer is claiming his behaviour wasn't entirely his fault because of his autism...I'm autistic and cannot stand that kind of language, he decided to rape and murder her because he wanted to, that's all there is to it.",0
1580526036919279618,@cryofthesheetz Signing off on this,Let me interview Fenriz on Hot Ones,1
fj65bgj,Done with embaressing typo.,Try posting in /r/helpmefind,0
fj9t97l,"Who knew the brother of Ekta Kapoor, the sanghis favourite TV producer, was a RW zombie. 
Tusshar (why there are two s in his name is beyond me) is a Akshay Kumar clan fixture. This was expected.","another jobless bollywood sanghi found
https://twitter.com/TusshKapoor/status/1234327063860928512?s=19",0
fjcbdfu,He needs a distraction from sports rorts based on senate estimates last night.,Would it have hurt him much to just say this in October? He has managed to Streisand effect something that not many people would have given a shit about.,1
fj9vo66,"I love Good Food and get most of my recipes from there but I’m yet to find a Curry recipe on there that tastes anything like a takeaway one (even the ones billed as ‘takeaway style’).
You can find many of these recipes on his website but they are quite complicated and I found them a pain to follow on my phone.","£4.99?? 
There are thousands of amazing curry recipes for free on BBC good food. Plus they're user rated by normal home cooks so you get an idea of how realistic it will be to get it right.",0
1579123689366654977,"@IanJacklin1 @007 Was there ever any truth to the rumour that if Amy Winehouse had gotten clean and sober for a year, Eon were prepared to give her a crack at a Bond song?",Who do you think should sing the next #JamesBond @007 title song?,both
fj9vzxr,"The same teachers in my school ""volunteered"" each year for the ski trip, it was definitely a free holiday.","Trust me, taking 60 teenagers away, is no fucking holiday. Not many of the teachers volunteer for these trips abroad.",0
1572561216928874498,@sigmonwrestling ???same,"? I will never become full on vegetarian/vegan, BUT the more I expand my knowledge on improving nutrition &amp; overall health, the better that approach looks.",0
1579896862667993088,@SonuSood Right ? sir #sonusoodsuperhero,"उदास फिरता है,
मोहल्ले में बारिश का पानी,
कश्तीयां बनाने वाले बच्चे
मोबाइल से इश्क कर बैठे।",0
fj9sxd3,Faith bad,"ITT: Many folks complaining that the title is misleading since there have been no actual tests conducted - because the scientists are irritated that they have to spend time and resources behind such a wild claim - rather than undertaking more important research.
so my new question is - if there is a large scale experiment where the effects are actually monitored & documented - do you reckon people will actually sign up for it.... and willingly put themselves in the mix ""for science"".",1
1579967874567122947,@musing_monica How can,"I am a founder, I found you?",1
1578372780747526144,"For those at the margins of society, cultivating hope can be done through pathways (e.g., religion, family) that sustain hope. They cannot speak up like the other group because they don’t have a voice. Even when they do it may not matter! 

(One more tweet) 3/4","For the privileged, acknowledging that things are hard and speaking up about it is easy. This can be an example of how they cultivate hope.

However, the same cannot be said of those at the margins of society who may simply pacify their adversity and oppression.

(read on) 2/4",0
fjb0bif,"If this happened within Sinn Fein, we’d never hear the end of it.
Just reinforces the need for change.","""“TDs and Senators were given blank nomination forms at this week’s parliamentary party meeting. They had to sign them and hand them back. The National Executive then decided which candidates to select, filling in names on the pre-signed documents”
""
>Tweet publisher: Seamusdo",0
1572499503743369218,@mariellevolz There are certainly exceptions.,"@IonaItalia I don't think it's as dichotomous as that. Lots of men start up new relationships with the women they're cheating with too - and I find that worse, actually! Lots of public examples (Matt Hancock springs to mind!)",0
fjcebim,Would suggest avoiding Singapore as of now. Not too sure how it would be in April though.,Will travel to Australia via Singapore for about a week in mid April. Anything to worry about?,0
fj5a75c,"I think it has more to do with the rust belt and how they were tired of outsourcing deals signed by Presidents. Ironically, the Donald is singing the USMCA",Trump conspired with the Clintons and ran the worst imaginable campaign in order to make Hilary more palatable and get her elected. It backfired miserably because they underestimated the number of racist idiots in this country.,1
1572503659703074816,"@DeeOneAyekooto @PeterObi, your people are so desperate that they planted people to be forcing bus drivers to buy ticket by force and start recording them.

If you go so low sir, we will go 18 feets with you. 

@Qdpaper2 @AjuriNgelale @duchessmabboud @kofoshiomogeeko","So Peter Obi lied to Nigerians when he said ""I studied Philosophy"".

There is no subject called Philosophy in GCE.",0
1579720277877223424,@ThePawanUpdates Congratulations ?,"जय श्री राम! हे तुमचंच सगळ्यांचं हँडल आहे. म्हणून, तुम्हाला प्रत्येकाला आज मी 25K वेळा मनापासून धन्यवाद देतो. नमन..?",both
1578229749864075265,@TheVoodooQueen I know!! Lost 3 &amp; now gained 2 in one year???❤️???,@Sal_of_Lourdes Wow Sal.?????,1
1538191876389580800,@sorcham12 There you go,Get Shane Meahan on the pitch #clare,1
fj5b6xo,42 grounds thats all,First you have to figure out.... how much ground could a groundhog hog if a groundhog could hog ground.,1
fjebuk0,"I work in a pharmacy. We sold out of masks nearly a month ago and out of hand sanitiser last week. People have thrown a freaker every bloody day over it. 
We got extra hand sanitiser in and it's the stuff no one ever buys because it's like €15 cost price. It still sold. People will pay anything.","The cynic in me decided to take a peak at Adverts/Donedeal earlier to see if Irish folks were buying up masks/hand sanitiser for profiteering from a public health crisis. 
Price gouging confirmed. Dickheads be dickheads I suppose. Fuck all those people...",0
fjb5zjn,"Population of NSW: 7.544 million
Population of Sydney: 5.23 million
Percentage of NSW residents who live in Sydney: 69.33%
Where would you do production on an ever diminishing budget to service the most people possible?",The ABC stopped being “Our ABC” when they stopped doing original production in the regions.  It’s just a Sydney thing now.,0
1580407510208430080,@samanthamarika1 A predator will never stop.  Putin is a predator.  Fully fund Ukraine.,NO MORE MONEY TO UKRAINE!,0
fjceu5w,"Real life is not a game. You kill someone in red team, Red team kills someone in blue team. Revenge match is only better in game. More than the Red & Blue, people need to think that both are people with family, kids. Only thing different is the team.
Stop forming group for stupid things. Modi group, Congress group, Everyone is forming fucking cults. You don't vote people to support the cult. You vote to ensure everyone gets to live without any fights.
DeleteReligion",What about those other things that Hindis did do?,0
1579734973690806273,"@_ThirdSide_ Where did you see Rs.16 dividend?

I think they haven't announced yet. Could be higher perhaps.",Any idea why Infosys futures is at 24-25 buck discount to spot? Dividend is only around 16 or so?,0
fj9dpsr,"'Nuremberg trials', can't wait more for that day!","Just wait until we beat Modi. None of you will be able to show your faces in society.
Burn their names into memory. 


NV Ramana


SK Kaul


Subhas Reddy


BR Gavai 


Surya Kant


Along with Bobde.",1
1538253676292210688,"@ScouseBirdBlogs Dignity is in tact until you give up closing it and just let it flap, imo xx",Is there a dignified way to fasten a bodysuit?,0
fjakxaw,"Yeah, I think I might cancel, I'm pretty sure I know who I picked this up off as well, and on the phone they told me they were under the weather, and I was like ""we should cancel our meeting then, and you should get some rest and we'll meet when you're 100%"", but then they were insistent they were okay and we should still meet, and I was reluctantly like ""okay"", and they turned up and they clearly weren't okay.
Not gonna lie, I'm a bit pissed off at them, so yeah, don't want to be that person!",Have you been to the Far East or Northern Italy for eg. ? If not then probably statistically low risk. Frankly though if I were one of your clients I wouldn’t thank you for turning up with a stinking cold or standard flu either.,0
1538097943923900416,@paddyennis27 I may know someone interested. Are the physical tickets or electronic?,Selling 3 Gerry cinnamon tickets face value for tommorro malahide castle #ticketfairy,0
fj9bxar,"This was horrible for the environment 
Millions possibly billions of animals have died
Small fires are indeed good for the environment but huge fires like this are not","It's great for the environment and people who live out in the bush. But being realistic, it's only a short break from when the season resumes. This is the new normal. It's only how much of it is uncontrollable.",0
fjcomfb,Yikes!!!,Fuck yeah. Means I don’t have to ration my toilet paper anymore whenever I have a pull,1
1538247149451878403,@bigkenreid @Aideen_Reporter God bless Aideen RIP ?,Tonight the thought @Aideen_Reporter is no longer with us is just heart breaking. A decent soul who suffered too much. The news has stunned many of us. We all need to take care. God bless her. RIP.,0
fj8a5b2,"Because it’s outstanding at low temperatures! Since it’s -14 here today, it should perform incredibly well.",Why,0
fj5cjw2,His name was Seth Rich,Clinton body count. There are too many “robberies gone wrong” and “suicides” surrounding their political controversies that it is surely them calling the hits.,0
fj9cufe,For humor,"I'll do you one better, 
WHY did this???",1
1538518313407549441,@Wonderful_Ed Bible study.,What was your favorite Saturday morning cartoon?,1
fjd32h2,"I mean, technically you can buy a house with as many cosignees as you want.",Guess we'll need to legalise polyamorous marriages then.,1
fj68s8r,"I’ve thought about thst myself but the unfortunate thing is most guys in my work are older than me, so there’s only so much I can do. Most don’t do anything after work","I think it's harder to make friends as you get older and most of your childhood friendships that you maintain into your 20s and 30s are built in those turbulent teenage years and nostalga plays a big part .
The best you can hope for is drinking buddies after work well that's as far as I will let myself get with work colleges",0
fj66rnr,"Patty is a burger. So I think it's ""Saint Hamburger Day"".",What's St Pattys?,1
1578295008834166784,"@KymLouC Thanks Kym, doing ok. ?","@dotrat The best you can do is beautiful lol

Lovely.
I hope you are feeling okay x",0
fj57oat,"There is also the fact that he said that he wanned to disepear when he will be rich 
But i can belive artist can fake their death, they know how sad their fan are gonna be if they disepear, just like with juice wrld
Rip","juicewrlds death, the lyrics from legends “we ain’t making it past 21”, the juicewrld challenge where people would have seizures and he died from such, there’s others im forgetting",0
fj80xkr,Hence the picture - Spring is around the corner,It’s the day nineteen days before Spring starts?,1
1578464524033699840,@bluewolfpack1 Thanks G-unit.,@Bellehos Can’t be an easy trip - sorry to hear Oscar . Thoughts are with you mate .,both
fj742xt,Sugar doggy tax.,It's the doggy sugar tax,1
fj6935l,"Steeps not even the worst of it, try Motherby Hill. Ouch.","Ive got respect for that, I can do canwick and lindum hill but not steep. Well played.",0
fj6eilp,Yeah but stopping sediment delivery downstream is bad news for coastal deltas and can lead to subsidence. Also disastrous for fish,"We need more hydro. I mean look at all of the opportunities to relieve flooding, control levels and generate power at the same time.",0
fj72p1r,"I hope so. I know there are a lot of Hindutva trolls online but I've noticed a lot with Bengali names, and they don't look uneducated/unemployed.","Ah, looks like BJP is going to lose Bengal as well.
This man loses the BJP elections in every state he interferes in, and then tries to bribe MLAs.",0
1579741648925659141,@Rakeshkumarray8 ❤️ ଭଲ ଲୋକ ସଫଳତା ପାଇଲେ ଭଗବାନଙ୍କ ଉପରେ ଭରସା ଆସେ ଓ ବଞ୍ଚିବାକୁ ଇଚ୍ଛା ହୁଏ,"U have problem with ur life

Look at him
ତିନି ବେଳା ରୋଷେଇ କରି, 
ମଉସା ମାଉସୀ ଙ୍କ ସବୁ କଥା ବୁଝି 
ଗୋଟେ ମାସିକ ପତ୍ରିକାର ସମ୍ପାଦକ ହେଇ
 ସୋସିଆ ମିଡିଆ ରେ ଯଥେଷ୍ଟ ସମୟ ଦେଇ ବି ଆଜି ସେ OAS ପାଇଛନ୍ତି।
ତାଙ୍କ ସଫଳତା ଯେମିତି ଲାଗୁଚି ଆମ ପରିବାର କାହାର ସଫଳତା।
ପ୍ରେରଣାର ଉତ୍ସ ସେ
❤️ ତାପସ ଭାଇ",0
fj642ot,We know what the f*ck you're saying.,You can just say fuck.,0
1572512595453816838,"@OcPabloH So we're left living in a country that thinks we have democracy under this Government.  Sinking in league tables, no real trade deals, the pound sinking, rates up - high inflation  - freedom of movement lost - I see nothing good!  A  dictatorial country for the rich. Wake up!","Reminder Brexit really wasn’t about a US trade deal, it wasn’t really about an economic doctrine. It was really about believing your nation state is where the highest form of govt should lie. It was basically about democracy.",0
fjbvye6,Hopefully enough people see this that the motel owners feel the consequences of their actions,"> A motel on the New South Wales South Coast has charged a guest $50 for writing what it described as a ""defamatory"" review.
> 
> Sharon Graham spent two nights at the Mollymook Ocean View Motel last week, and gave the motel a score of six out of 10 on the website Booking.com.
> 
> Ms Graham said the location was good but a bit noisy, and that she was unsure whether the motel offered daily room service.
> 
> ""I thought it was quite a fair review,"" Ms Graham said.
> 
> Ms Graham was shocked when, having checked out, she received a second invoice which listed a $50 credit card fee for leaving a ""false review"" online.
> 
> The motel said the $50 will be refunded when the review is taken down.
> 
> ""Social media bookings false review will be refunded if removed within 24 hours,"" the invoice read.
> 
> Motel management claimed the review was misleading and harmed the business's public image.
> 
> ""The score is not even close to the average rating,"" the motel said.",0
1578356264723415044,@Detr1tu5 This is no good…,"Headache and stomach ache, my legs gonna fall off tomorrow.",0
1578321357921980416,@TGUZ72 I think a few drivers were regretting not starting the race in their tinnies.,"@Se77Evans A wet race is the ultimate.
That’s when you find out who can really drive.",1
fj94uqq,It will be a good friend of the LNP.,"I work in the industry, whoever gets to run these buses is going to be insanely rich. 
The first thing that will suffer is hygiene.",0
1578185247371726848,@frippet @thebooksdesk @PolygonBooks Thanks Jane! X,"@PaulDalgarno @thebooksdesk @PolygonBooks yes, this is great!!",0
fj55ra6,We learned in science class,Me,0
1572501469349425152,@LCFC You’re on the wind up here.,#lcfc today unveils a new range of merchandise from King Power International’s ‘LCFC x Community Power’ initiative; the ‘Thai Song Dum’ collection ?,0
1578372326479269888,@ashton_avenue @BlairBelrosex Imagine that. ??‍♀️,@BlairBelrosex Lol I’m Indian… would hate if I got cancelled for my race ☹️,1
fjckvhw,Its social media afterall. Everything is a gimmick,Looks like yesterday's tweet was a gimmick,0
1578372556658118656,@Duneemperorpaul No one will give him a dime..,"Brumby bhai tu kitni garibi mein raha hai ki tere par koi ch€€nk bhi maare to tujhe bas ""Haaye paisa, Haaye paisa"" r0na aa jaata hai

Abe train mein ""tum to thehre pardesi"" gaata hua paisa maangta tha kya jo iske alawa kuch aata hi nahin

Community rejected them my ? 
?",both
fjatdvv,"EXACTLY THIS. I could send an anonymous passive aggressive letter actually. 
Make it old skool by cutting out each letter individually from magazines and threaten his garden gnome if his mate keeps honking","Also, the clown being picked up should be literally waiting at the window or door so there’s no need for driver to honk said horn. 
BE ON TIME PEOPLE!",1
fj9znya,"Maybe they aren't bright enought to get into IITs and IIMs, but surely they will get much better education there.","They aren't bright enough to get into IIts/IIMs !
So they go abroad where anyone with money can buy a seat",0
1579751959023996931,"@ashleyxxdancer @JessLouRainford Neither do people light a lamp and put it under a bowl. Instead they put it on its stand, and it gives light to everyone in the house. In the same way, let your light shine before others, that they may see your good deeds and glorify your Father in heaven.

Matthew 5:15-16","“For I am not ashamed of the gospel, because it is the power of God that brings salvation to everyone who believes: first to the Jew, then to the Gentile.”
Romans 1:16",0
1578306652083625987,@Mountaingoat55 Jaysus ?,The guy accused of cheating at chess using vibrating anal beads might also explain Irish dancing.,0
