id_text,text,parent_text,label
fj99x5r,"I make mine out of Pork Bellies, hang it in the garage.  It's probably fairly salty. I used to use Nitrite to get it pink but just use plain salt now as the butchers don't like giving it out.","Cheap supermarket bacon is overseas pork, processed here into bacon. Cheap shitty product, buy local.",both
fj9r0cj,How extravagant?,"I have a company credit card for entertaining customers which I have, on occasion, used to purchase an extravagant selection of biscuits for the office.",1
fj52bhi,"I’m sorry to hear, I’m in the same boat","Tried to get my mom to stop drinking when I was a teen, she got really upset.  She still drinks alot.",0
1580560131993272322,@joncoopertweets The Catholic Church,What is one company you'll never do business with because of their horrible politics?,1
1578281922098532352,@SableTinex I couldn't remember the names. I know it was shocking to watch. If social media had been popular then it would have blown up.,"@50to39 I agree and I Chelsea and Jamus reminded me of that exact couple too, I think Sherri was her name, I forgot her husband’s name.",0
1546162227773771777,@elonmusk It is more dangerous than people think!,Is TikTok destroying civilization? Some people think so.,0
1572279538989801472,"@LuckyHeronSay Nah, it's very silly. Mixture of Disney and Eton",Is it because I'm not British (though I've lived in the UK since arriving from Ireland as a young child) that I can't relate to this mass 'grief' around the death of the Queen?,both
1580526367309205505,@HallieJ72 Hahahaha my reaction everytime!,@briannawrist OMG ?????,0
fj5cmby,"Its not even a theory anymore, its basically accepted as fact by anyone who has at least two brain cells and no vested interest in defending him.","Has no one mentioned Epstein? It’s like the one conspiracy theory I can think of that is probably thought to be true by the majority of all normal people
Edit: thank you all of reddit for telling me that I missed the previous comments like mine",1
fj9de3m,God bless British Leyland and all the plants on the hard shoulder their broken down vans watered,"In fairness, a British van would be on the hard shoulder.",1
1578380301096472577,@SophieQin_ @DAFFgov @Agri_Aus @Austrade ! @SophieQin_ nails it again,@AusAmbVN @DAFFgov @Agri_Aus @Austrade Bet you’re glad you can now do beer tweets ?,0
fj81rl2,100% these will show up for sale on fb marketplace and gumtree soon with killer markups.,"How much are people using? I use it for work, after each shift. Have this massive bottle, used basically none of it and been using it for months. Are they washing their whole bodies with it?",0
fjcsnvb,"Look at this one...
Paul xxxx 2/5
a month ago on Google
I was very disappointed with this Motel when I was stranded there in the recent bush fires and had to stay for a night along with other motorists. They took advantage of the situation and charged almost double their normal rates.. I think it was a very low act.","Some of the reviews for this place are... thrilling:  
\> [After smoking allegations:] For your false review we will be reporting your misconduct of behaving badly and breaking house rules to immigration and to the regulatory authorities. [..] If you do not edit this review . Your review will be recorded on your records and you will not be *welcomed back to Australia.*
https://i.imgur.com/yMKZ8hU.png
\> We were told that it is $50 per hour for early check in. This is ridiculous and meant that we would have paid more for 3 hours than for the entire room. Needless to say we declined
\> The staff at check in was quite rude and suggested I would be coming back half drunk if I was going to a wedding. I’m a non drinker. 
and on and on... Time to freshen up the management I suspect.",0
fj51fe6,"I know this sounds like a stupid question, but the guy I’m currently seeing said he’s not seeing anyone else and agreed to let me know if he does see someone else, and the same vice versa. Does that mean we are exclusive for now? I’m new to all this lol (I’m 25, just got out of a long distance relationship)",You're exclusive when you stop seeing other people.,0
1538145169282945024,"@ElaineARoche ?????? Well done , relief","BabyDoc passed all 4th year exams, that’s made my week #grateful ??",0
fj7va1b,It will take Michael weeks of dole payments to replace the broken window on his 2004 Toyota.,Resulting riots in carlow have caused literally dozens of euros in damage,1
1579854079001767943,"@Nationalist1101 #No way ,no hatred please ,who are you to boycott now ?","सभी सबूतों को मद्देनज़र रखते हुए फैसला लिया जाता है कि बॉलीवुड के द्वारा बनाई जाने वाली सभी फिल्मो को बॉयकॉट किया जायेगा, सहमत हैं तो YES लिखकर पुरजोर समर्थन करें..???",0
1578427756790308864,@303_CJ Not really,@terrystuckshop Can it just be branded as electronic music and then differentiate by calling it good or bad?,0
1572443367283527681,@VishwaJ1988 ?You know me very well,@VindyaPeiris2 Can't say no ??,0
fj80xkr,Hence the picture - Spring is around the corner,It’s the day nineteen days before Spring starts?,1
fj6f53j,"Very short answer is no. 
Longer answer : can’t be bothered to type it out without context. Did a bouncer actually search your “friends” pants and you want to know if that was ok?","Are bouncers allowed to search inside your underwear?
Asking for a friend",0
1579727861396955137,"@Rohanslucile @AgentSaffron Subbayya Rai, a bhakt started to give a hen to eat every month as a sacred ritual. After his demise ritual stopped and since from that day Babiya didn't eat any chicken/meat, only ate temple naivedyam of Sri Anantapadmanabha swamy of Anantapura!","@AgentSaffron Can’t there be any Exception ! 

I have been going there since I was a kid and I no for a fact that nearby there are lot of homes of Priests and it has never touched a pet and it used to move from one pond to other",0
fj56pf2,"And at work I have battles with the filthy pigs all the time.  These are the people who think that washing up in the lunch room kitchen sink is OK. The worst ones are the ones who go to the toilet, then walk out and want to wash their hands in the lunch room sink, till I see them. 
Then there are certain cohorts who think that clearing and blowing their noses and shotgun blasting the hand basin with snot  and blood is normal behavior. These are the grubs that think that after a toilet visit you need a full head wash and to expunge every hole into the wash basin including endless spitting. What is it  with these filthy people and their habits? 
I  get this issue raised at all toolbox and occupational health safety meetings. There are people that are uncivilized, filthy and uncouth that need to be  educated. It might be okay in certain countries to act like a grub but not in Australia.
Then lets talk about the people with colds and flu who walk around like babies with dripping  noses sniffing and sucking up their drips into their noses up like kids. They seem not to know what a tissues or handkerchief is  for. Maybe its time to reintroduce hygiene  classes at schools again because there seems to be a generation of adults who have no idea what basic hygiene is!","No, the time to start good hygiene was  BEFORE the spread, not after...",0
1572500295309217793,@Susanseekshope The years of self-destruction?,What will this period of our political history be called? The muddled years?,both
fj81425,"I literally had one of these people tell me to take my PhD, lab experience and bachelors off my resume so that I could apply for jobs in retail. I was very happy to land a job by the time these fucktards were able to call me again","Ugh Newstart was the WORST. I moved states and had to be on it for a little while. They tried to send me to a literacy program, one to ready you for work, and one for writing CVs. I escalated through the useless people there finally to a manager and she was the only one who listened when I told her I had a bachelor with honours and had just left my PhD to move. That I had worked in the industry already and my CV was great but it was grant season, and jobs wouldn't start being advertised for two months or so.  Literally the ONLY person who listened.
Like, those courses were filled withand directed at people who hadn't finished school. How do you look at my details and not think 'yeah probably no need for literacy and basic math for this person'.",0
fj625uz,"Order while in-line, pay before/at the end on the counter is glorious.",I’ve recently moved to New Zealand and the culture at restaraunts here is to go and just pay at the counter instead of asking for your bill. It’s incredibly liberating and just makes so much more sense than having to wait for your waiter who’s probably horrendously over worked to deliver your bill to your table!,1
1572510897398251520,"@RJPcoach @CoachingFamily @coachingbadges @TheS_Resource I continue coaching to try and give the players I work with the most enjoyable experience, I possibly can. Help them grow into decent human beings, and for a minority, professional athletes","Some questions for everyone?

Why did you start coaching?

Why do you coach now?

If the answers aren't the same what changed and why?

@CoachingFamily @coachingbadges @TheS_Resource",0
1572501175903354880,@bakari_fils @LawrenceAkanang And eat achu,@LawrenceAkanang Bore bad…normal day to sit with guys drink,both
fjcj7ta,"Yeah it's those bloody dole bludgers we treat like criminals for being out of work, not the government siphoning billions to their mates.","Wake the fuck up Australia, you're getting robbed.",1
1580535898667503616,@thesledge1969 Good morning to you my sweet friend! Lots of rain here. Have a great Thursday and thank you on my Tribe! Big hugs ??⚾️☕️☕️???⚾️,@SlK0907 Gm my sweet friend happy Thursday to u. Hope u have a amazing day and keep safe and warm. Enjoy your coffee and breakfast . Gd luck to ur tribe tonight. Big hugs ☕️☕️????????,both
1579520741984587778,@srihari3529 @IndiGo6E What do you expect from a third class airlines.? Indigo airlines is worse than the village town bus,"Dear @IndiGo6E 

 I was returning from the National Games held in Gujarat, and the staff not only behaved badly, but also charged us a hefty amount for excess baggage which was the medals and goodies that we athletes had won.",1
fjf36wi,Glow of big Mick warms the heart and the hearth.,"Apropos of nothing, that fireplace hasn't seen many fires.",0
fj9v51t,He was right that would have been brilliant,"GF used to work there in marketing they get these requests daily.
A former director wanted to bring them back but marketed as Oliver Twists. He was advised this probably wasn't a good idea.",0
fj96ufb,"It is incredibly authoritarian/Orwellian. 
I am equally dumbfounded that the Liberal government would consider such a bill and that the Labor party would agreed to support the governments bill when it appears such an obvious move to vote it down with the cross bench. You would think that ""the liberals coming for your savings account"" would have more of an impact on supporters than this ""sports rort"" saga.",Locking money down just in time before the next recession... ahhj yeah!,0
1572521023303712769,@dmfotoni @trussliz @UN Have you not seen the insane amount of money they have spent on official photographers?,@trussliz @UN Who is paying for the role of International PR Photographer to the PM..?,0
1579742664349876224,@Dfo_Ds Too ab loge or to kya ?,@Heart_stolen07 Maine nahi liya ♥️de ??,0
fja2pci,why? what did you do to the poor guy?,We went to Glasgow and nearly got stabbed by some fella in his 40's,both
fjcuo9i,"Its a good point. 
If we are going to arrest every man who raises a threat, there will be scores of people to arrest - starting from Anurag Thakur and Kapil Mishra to local goons. 
If cops were willing to arrest anyone who says anything provocative, no riot would have happened. 
But their balls have shrunken to atomic size.",Javed Akthar is asking why only Shahrukh was singled out and arrested!,0
fj57trd,I like it,Cause car accidents on highways,1
1537755647441350662,"@VaTuomas Thank you, I’ll do my best to catch up the schedule and then into the voice work process! ❤️","@FymmG There he is! Miss the big fella, can't wait to voice him again.",0
fj9bdej,They are testing and they are isolating just not publicly announcing this.,"Just started watching Dr. John Campbell’s videos on YouTube, he’s a no bs approach to this ordeal and just telling the facts as we know so far. Just put out a video of global isolation and containment where he spoke about a paper in The Lancet. How to best control the outbreak by isolation of cases and isolation of the contacts of said cases. The R0 of Covid-19 is 2.6, meaning for every case, that person will infect 2.6 and so and so forth. 
So basically the paper is saying the only way to contain this is to slow the process as much as possible and completely isolate cases and contacts. Imo we’ve already fucked it with the way we’ve handled our first case. In a small country like ours it should be easier to contain but if not acted upon properly it can spread faster. I think we are gonna be at Italy levels in the coming weeks.
I’m not trying to fear monger because the majority of us should be fine but it’s so frustrating to see it not taken seriously by people. Look at Vietnam and how they have handled it, looks like they have stamped it out fast and actually took serious measures to stop it spreading from the get go.",0
fj9a4in,"Oh I agree, we've reduced and we reuse the things we can. And I recognise that a Brita filter is mostly unnecessary, but given that we use one for now I was pleased to see they can be recycled (and ashamed to say we have binned them in the past due to our ignorance). We also use them for longer than it says on the pack.","It's Reduce, Reuse, Recycle.  
They're ordered that way intentionally, with the most preferred option being reduce, and recycle being the least preferable out of these three options.
With that in mind, I am definitely doing my part, instead of recycling my Brita filter, I have opted for reusing the same one side many many moons ago.",0
1578154604302565376,"...I'm already practising due to the mental illnesses. I think what would really help is, while we do impactful research, an expected full time load, we should be financially supported adequately in line with the increase cost of living so we don't spread ourselves too thin. 3/3","...so I don't have the security of large life savings. On top of this, I have depression and ASD which add to the challenges. I went to @UTAS_'s mental health support program for HDR students, but it was mostly teaching us about mindfulness - which I appreciate, but... 2/3",0
1578129800728023040,"@Lustfullman75 Je suis aller en nz avec un niveau 0 et j’en suis ressorti quasi bilingue, c’est justement le but

Faune et flore fait être au courant je peux pas nier ça, mais historiquement les mort/problème sont ultra rare maintenant",@florent_boc Le niveau anglais ainsi que la faune et la flore la plus violente recenser sue terre,0
fjcmgr1,Exactly bruh hop in that shower and wash that ass for 30 seconds and be super duper clean,Greed and panic. I have no problem using rags or hopping straight in the shower if need be.,0
fjad45w,It's not very typical but the sky fell down..,What about this one? https://i.imgur.com/1ILAUII.png,1
fj5d3fo,Agreed. Just worried it may cause one to overlook someone or go with another option. If that makes sense.,"Doesn't matter and it shouldn't matter, ""loving"" someone for money isn't actual love.",0
fj5cvog,The nearest gay bar is like an hour and a half away. Haha. I’m trying the social media thing. My marriage just ended and I didn’t come out as bisexual until we were already committed and now I’m just trying to see what’s out there I guess.,"Gay bar? I mean worked for my friend, or you can have a friend talk to another friend. Meet over social media, perhaps",0
1579647510922297351,"@AdityaMenon22 Rather as a true journalist..it should have been...

Venom spewed are similar to when #Jaitley or #Shushma or #Bipenrawat  expired..

Baba..its their in either side.

And siding one make u also culpable",The kind of venom Hindutva supporters are spewing at Mulayam Singh Yadav on his demise is at another level altogether.,0
1578308352408707072,"@davesayys It’s ok, wine has fixed everything",@asjdivad Oh dear,1
1538183310760976385,@boulderosmp @mitchellbyars Will do!,"@EileenKJ1 @mitchellbyars @eileenKJ1 Thabk you for this. Loose cattle were put back in the closure yesterday. If there are others still loose, can you please contact 303-817-1143",0
fj5a9n4,"How, excuse my french, the f r i c c could you actually beleive that 9/11 was faked, there is very conclusive footage, and proof that it was real, and live video of it was recorded on the news, with several witnesses how is it that despite all of that the government could still get away with it? Nobody noticed any fallacies? And why would the government destroy a major financial asset, what motivation do you think they would have for that? The thing about your argument is that it makes no logical sense what so ever, and I guarantee that the person who kamikazed into a building wasn't found perfectly fine afterwards, and the plane crashing into the building looks doctored? What kind of bs is that, you can analyze the footage yourself, or maybe ask a professional to look at it and see it definitely isn't doctored.","There are way too many iffy occurrences before, during, and after 9/11. We can safely say the USA govt were incompetent in its prevention at least, and had a knowing hand in it at worse. 
The plane crashing into the towers appears to be doctored. 
All camera footage of the area was confiscated by the govt. Any footage you see online is state sponsored. 
The Air Force bases were ordered to run airline hijacking drills the morning of 9/11 by Dick Cheney (The devil) himself 
Proof that it was a controlled demolition was melted down and erased. 
The third tower, obviously, came down as a result of explosives. 
(I’ve been saving the biggest for last) - one of the alleged pilots of that flew into the towers was found alive and well shortly after and had nothing to do with the events. He’s no where to be found today. 
I hope no one believes in conspiracy theories. They’re just unanswered questions with not enough data to reach a conclusion. 
The troubling thing is, when the data you need comes from the source you suspect of wrong doing then you can either take their word for it, or not trust the data.",both
fjcqqnz,Why do you think this is over prepared?,That's good. Much better to be over prepared in these cases.,both
1538216015938600962,@Tayto_sandwich True that ?,@DubberTrevor You are badly due a wash!,1
fj97qz1,"Same. It makes me quite angry that many outlets, including the BBC, previously compared it to seasonal flu, when know that the case fatality rate is much higher. As a result, I’m having a hard time convincing my 75 year old father, who has heart issues, to take it seriously...",I think it's a serious threat to our society. But I've known quite a few still think it's just a flu.,0
fj59ir4,I came here to say this,Avatar: the last airbender,1
fj9j9q2,"I don't think it's slowing down. I walked past earlier, they seem to be getting a huge amount of support and encouragement from students and everyone in general.",Looks a lot have stopped. The cold and storms I suppose. Hopefully it picks up again.,0
1579744939713662977,@ChaubeySK21 Thank you so much?,"@BibhaProfessor जन्मदिन की हार्दिक बधाई, मैम",0
1580526259456516097,@brixtronix @The5thAccount I'm listening.,"imagine being so fragile that the thumbs up emoji fucks you up

at least i have real problems",both
fjcelsw,"This article doesn't shy away from calling it a pogrom tho. In fact it emphasizes on calling it so. All it says is, acknowledging that some Hindus also lost their lives at the hands of Muslims doesn't discredit the fact that this was state sanctioned violence - a pogrom.","Everyone already knows about the states complicity in whatever is happening and has been happening. This isn’t a case of both sides. Hindu supremacists were voted into power, they introduced an anti-Muslim bill, Muslims in Delhi and other parts of the country protested, the centre sent mobs to indiscriminately kill Muslims, loot them, rape them and destroy their properties. Mosques were destroyed and they raised a Hanuman flag on top of a mosque. The police also took part in this. 
Then why is it so hard to say that this is a pogrom against Muslim people? There is overwhelming evidence, and has been for a while now. You’re looking at Kashmir, UP, Delhi. All of the statements coming from the government are blatantly islamophobic, BJP supporters are blatantly islamophobic. So why can’t the obvious be stated? Why does every story in the news cycle have to be about both sides, when it’s just one side that is disproportionately affected?
The basis of this entire article is bullshit.",0
1579767721746903040,@afcwazzie North me rimjhim baarish ho Rahi hai,@sleepyhead1892 Here it's been raining since 3 days ffs,0
1580489096291459072,@Andy_Lea1964 Hello Andy happy Thursday my friend. Good to see you have a fabulous day.???,@Forgetfulness19 Good morning Lee. Have a good day. Take care ?,both
fj91y0b,"I've never watched a football game in my life. Used to play touch footie though.
I like watching tennis.","I don’t follow AFL, (as well as soccer or rugby or union or any other ball sport).
I wouldn’t know half the teams in the league. I don’t care who wins or loses. I hate how it takes up half the newspaper on a Monday, and was excited for electronic news- so I can skip past it. 
I wouldn’t recognise a single player, and never watch or listen to a game. Actually I don’t think a sporting game has ever been watched by either myself or my kids in our house. 
We play sport, we are all good at sport and all games but don’t care to watch others play it.",0
fj5a75c,"I think it has more to do with the rust belt and how they were tired of outsourcing deals signed by Presidents. Ironically, the Donald is singing the USMCA",Trump conspired with the Clintons and ran the worst imaginable campaign in order to make Hilary more palatable and get her elected. It backfired miserably because they underestimated the number of racist idiots in this country.,0
fjclxzc,There was this one guy who drank straight from the pump and then stuck his tongue into the money dispensing slot while it was open and then lit his tongue. He was fully sick.,"Name me one person in the history of humanity that got sick from using an ATM or petrol pump, I'll wait.",1
fj58h4k,The opening scene to one hell of a movie.,"When I was younger, was working in an old high end hotel with a preacher who was a plumber, as he pulled out a circa 1950’s rubber dildo",both
1538273986311766026,@rohde1_3 No. They licked them and then put them back ?,@irishelt Did they like the chocolate tools?,1
1579153582775234561,@Kathlee90791502 Thanks!,@HerbertSchuber2 Well said!,0
1579716607030751233,@shivaniACH Ho ka,एवढया वर्षे झाले ट्विटर वापरते पण like ला चार वेळा प्रेस केल्यावर स्क्रिनशॉट निघतो हे आज समजले ?‍♀️?‍♀️,0
1571021458738147332,"@BarkerTully No rabies in the uk, fortunately. It looked healthy. They’re just scavengers and came in to have a look round.","@Twonaturistson1 er, if that's a wild fox, that's so abnormal that you should be concerned and cautious.  it may be ill, as in  . . . rabies . . ..",0
fjcijon,precisely the reason they won't ever get to know what happen beyond infiltrated whatsapp groups.,"Seems like many Indians on Reddit are as likely to ignore/deny these posts as are the ones sitting at home and receiving their news from WhatsApp. 
DissapointedIndian",0
1538335536196247552,@TheRajGiri She's close with snoop can aew afford her,"I've said this many times on the pod, but losing Sasha Banks is losing someone who can legitimately be a crossover star. Big fail on WWE for that",1
1572493331090882560,@RussInCheshire Me too....me too,"My favourite thing about having insomnia for 3 decades is people telling me how to cure it as if I haven't tried everything imaginable to avoid 10,000 sleep-deprived nights.",0
fj66vzh,We are.,Look at all those chickens.,1
1572501408443936769,@ConnectionsHope Dreadful..best wishes!,"When I was suddenly widowed I thought many would come running to my side &amp; we’d reminisce in loving memory about my late husband. This did not happen. Instead, I felt like a ghost. #TuesdayMorning",both
fjenbqj,It wont hit cork because people don't travel to that shithole.,We need to build a wall around Leinster. It’s all fun and games now but what if it hit Cork? We can’t take that risk.,1
