id_text,text,parent_text,label
1578341679119024128,@Bev4TeamSussex Harry seems to be constantly unhappy. I don’t understand why he’s not living his best life with all that privilege.,"While Prince Harry fights the tabloids that destroyed his mother and abused his wife, his brother Prince William works with the same tabloids to fight his SIL and offers his children pictures to keep the same tabloids happy… The Windsor Princes.",0
1578297078140129280,@Borto74 @ChrisDuley7,RIP my neighbour who told his wife he was popping out to get some sewing thread but got distracted and went to the pub instead. Gone but not for cotton. #dadjokes,both
1538416637338177536,@jeffthered1 Beans would have been better for him as there’s a lot of fat In cheese even though it was probably Edam,"Frenkie de jong has turned down beans on toast for his tea tonight and has opted for cheese on toast instead …… yes you get what I’m saying!!!
I know about as much as the other cnts on Twitter who claim to know what’s going on ?‍♂️????",1
1538247335905574913,@threeredkings SA team winning probably the best thing to happen. Makes the rest hungrier. Cannot wait for next season already ?,"Your domestic league will only be a success when it is viewed on its own terms, not as some preamble to prepare for Europe. 

English clubs don't think that way. French clubs don't think that way. 

We need to think that way too.",0
fj57zba,If this is true he’s way smarter than I would want to give him credit for.,"Donald Trump is purposefully handling the Corona Virus poorly so that it reaches pandemic state and he can declare Martial Law.
Martial law: is the imposition of direct military control of normal civilian functions by a government, especially in response to a temporary emergency such as invasion or major disaster, or in an occupied territory.",1
1579887732700385280,"@stufflistings Q4) D. 120Hz ?

#FlipAtFlipkart #GalaxyZFlip3 #GalaxyZFlip3Giveaway
#stufflistingsarmy 
@stufflistings","Q4. What is the refresh rate of the #GalaxyZFlip3 display?
A. 60Hz
B. 90Hz
C. 80Hz
D. 120Hz
#FlipAtFlipkart #GalaxyZFlip3 #GalaxyZFlip3Giveaway #stufflistingsarmy",0
1578321633236127744,"@wewatchu2 Poor bugger,did you have to take out a lone. Ian","@xskinn Chilling on Twit, while recovering from 3 dental extractions. Call me Gummy.",1
fj7qbb7,"No prisoners are being released, Ghani Said.","Trump took whatever deal to cut bait in Afghanistan so he can campaign on it for re-election. Doesnt matter to him how it effects everyone else who has been part of this situation.
This will be terrible from India. A bunch of terrorists will be released. Now a decent amount of them will try to join the mainstream and seize power through the government. However there will be a large amount of brutes who are too radicalized or not competent enough to be part of the government. So what happens with them. Well alot of them will be recruited by the ISI for Kashmir. 
Remember the late 80s-90s when battled hardened jidahis rolled in from Afghanistan. Yeaaaah well the Modi government in their eternal wisdom gave Kashmir the middle finger at the worst possible time. Thankfully border crossings are much better controlled however we depended on a lot of information from locals to prevent terrorism and I just dont see them willing to cooperate",0
1572500760684011522,@thomasforth @Mr_John_Oxley The Nimby paradox. Housing no. Energy no. Airports no. Anything no?,@Mr_John_Oxley I'm quite excited for that West Lancashire by-election if Truss really does go all in on fracking. We may see a negative score in an election for the first time ever.,1
1537824575718932482,@dunkingwithfish ?,@ElaineARoche Hurrah! ???? well done that boy!,1
1538155462729793536,@batemanjason I was lucky enough to not watch OZARK until this year so I got it pretty much all at once. It took me two months. Two wonderful months. I loved every character and their “badness”.,Just want to say hi and a sincere thank you to all the nice folks out there that gave OZARK a spot in their lives over these past few years. Thanks for liking what we loved making for y'all!,0
1579740493373927424,@mganguly133 Rightly said,Why Indian aunties have weird obsession to know when we will get marry or when we (married couple) will conceive a child?,0
fj776nz,Ignore the salty downvoters man,"(Unpopular opinion, though I do hope it's not taken too close to heart) We, both as Northerners and Southerns, need to stop romanticising people like this if we are to seriously develop as 2 countries who can look back on history and not have a miniature verbal civil war",0
1579722626234470400,@Rifkas_cake_ GM GM ??,@Deckle_Edge Gm ???,both
fjatv9b,"Might not be a death sentence, but to a country of 1.3 billion, if it spreads and people to not listen to health officials, it can cause serious damage that will be very expensive in terms of recovery. 
We all have China as an example, see how much of the businesses are struggling and how much it is impacting the economies. With only 2 cases confirmed in India, the the sentiment if the investments have been affected today.
So I definitely would suggest to chill, but also to be prepared....","One thing to understand is, that this cannot be contained, all analysts are saying that countries can only buy time, while they get prepared. So it will definitely come, it is even spread to US and Canada. 
Also this is not a death sentence, chill and follow best practices.",0
fj6b4a8,"Panels and inverter cost me £4k all in , fitted.  (4KW system)
Immersun (hot water / heat diverter device) cost me £200 fitted, already had an electric element in the hot water cylinder. 
thinking about going for a battery next, but that will cost more than the whole setup cost. We've had our system for 5 years almost (bought it in 2015) and it's already paid for itself both in savings and the income generated and in theory at least, there's 15 years left to go on my FIT contract (payments) and a life of about the same left on the panels","What did this setup cost you. Would love to go solar but all of the solar panel ""grants"" sound a lot like scams. Not in the conventional sense but that it's not actually the person with the panels who ends up saving anything for 20 odd years",0
1579256147831586816,@Bitboy_Crypto @IOHK_Charles Calling out government corruption and manipulation does not mean you have to take sides with a particular digital asset Ben..?,"Gotta say when #ETHGate dropped I was about at the same place @IOHK_Charles is. He makes many valid points in thread.

However, William Hinman certainly accepted bribes. It’s CLEAR. 

My 3 biggest holdings are $XRP, $ADA, &amp; $ETH and I refuse to take sides. They all win.",0
1578404639187140608,"@NathanpmYoung If you view eating animals as a negative externality, or animal welfare as a public good (or both), then the free market is not the solution.","the problem with EAs is that they hold some of the largest vegan conferences in the world, but also think that at least some of the time, the market is the solution. 

this gives bad vibes to everyone",1
fja3paf,Who and what,Must feel good to be Adama Traoré right now.,0
1579876519992000512,@RShivshankar Aur RAM MANDIR K waqt @PMOIndia @narendramodi  yeh donoh kaha the..,Mulayam empowered backward castes through ballot to reshape Hindi belt politics. His opposition to Ram Mandir movement culminated in firing upon Kar Sewaks yielding big political gains by yoking Muslims to Yadavs. But in the end he let Parivarvaad trump Samajvaad denting SP.,0
1538222849512685569,"@Albion43S No I don't deny that Jesus had followers! They were all Jews, As I said, Christianity did not exist nor the Gospels, Good night.",@ImamNoonan Do you deny there were followers of Jesus in the 1st century?,both
fj50jvj,Agree.,The Brave Little Toaster™,1
1579713935644950528,@MirhaAfridi I m here,Mera koi dost nhi hai yaha?,0
fj9j1pm,I still have it ingrained from Irish college,"You just need to know the first line, then mumble along with the rest of us!",0
fjcgery,You're probably on the money.,"What's going on is probably you look like a scruffy motherfucker.
Wait, I checked your post history:
>Charged with Dangerous Drugs Possession
Well there we go then. Bullshit charge or not you're on a list boyo.",0
1572561013173809153,@FoxNews But I won’t call them names I’ll leave the name calling to Stephen Colbert and the Democrats.  It just reflects on them.  For every action there is an opposite and equal reaction.  It’s a physics law.,@FoxNews I have never seen or heard such hypocrisy before.  They can fly illegal immigrants in the VERY early morning anywhere they want but fly them to a Democratic run sanctuary city and they say horrible things about you.  Duh!  I’m confused with their logic?,0
1572521023303712769,@dmfotoni @trussliz @UN Have you not seen the insane amount of money they have spent on official photographers?,@trussliz @UN Who is paying for the role of International PR Photographer to the PM..?,0
fj58zz0,Glad we cleared that up.,I suppose that they're afraid of succumbing to it and dying.,both
1579586005518385152,"@VaibhavBehl4 @AFnewsroom @AirFranceUK @airfrance @AirFranceKLM You are the worst airline!! You lost my luggage, can't find it, only gave me a $100 voucher, a number to call at JFK that doesn't work, and a tracking number that also doesn't work! Where is my luggage???",@AFnewsroom They were supposed to find my luggage. It’s been 4 weeks and I have no clue about it. Definitely worst airlines ever. @AirFranceUK @airfrance @AirFranceKLM,0
1578331679613079552,@LilSushiAU Yerp! Near the escalator,@PeteCurulli Ohh shit petey you're here too !?!?!,0
1579777156359802882,@ArvindKejriwal Navra kam mat karvao sir or berojgaro ki madad karo,दिल्ली की जनता को पानी के बकाया बिलों से राहत दिलाने के लिए सरकार ने बड़ा निर्णय लिया है. पानी के बकाया बिलों पर लगने वाली लेट फ़ीस( लेट पेमेंट सरचार्ज) 31 दिसंबर 2022 तक के लिए 100% माफ रहेगी. यानि आप बिना लेट फ़ीस की चिंता किए अपने पुराने बकाया बिल भर सकते हैं.,0
fjci1zs,"Well, that argument doesn’t make sense.
Just what is going to stop someone from hacking this service?
Or if it’s a private firm, just hack the private firm?
In contrast WhatsApp and signal are used by billions everyday, are regularly tested for bugs and breaches by a huge number of cyber security experts.
How precisely will this solution actually be safer, or as feature rich as any other product on the market?
And why the heck are we blowing money on this when we have a whole economy up in flames?","Officials are relying on Whatsapp and other private messaging apps for daily information exchange.   Even the sensitive ones.
Given the nature of these apps , sending highly sensitive information is very risky, 
So govt want to design a similar platform for its officials aiming at  security and keeping the data with in india. 
WhatsApp and other messengers store data in their own deta centers which are not often situated in india. 
Givin the techical literacy of many official,  third party apps are  too risky to transfer sensitive information",0
fj7q9rw,Ah no. I didn’t mean that you’d catch something by buying one of these. Just funny.,"I'm pretty sure unless one of the workers putting it on the shelf has the virus, and you then touch a product that was contaminated you may get it, as your not gonna get it from the food travelling from Italy and/or China?
I hope",1
1578353005254291463,@lancelotspram Not ideal,@GlennHampson Oh bloody heck!,both
fj7jedh,I really want to use this one more when I run into people haha.,Story?,0
fj8hx05,More likely looking for the undersea internet/other communication cables so they know where to cut if/when...,Nothing to see here just a Chinese vessel mapping the ocean to prepare for a possible china America war.,1
fjc3mzk,"Nah, I’m making it about parliamentary and judicial sovereignty, not the monarchy. The Queen can stay in England and have fuck all to do with Australia, thanks.
Australia is a de facto republic anyway (‘commonwealth’ is actually a synonym for ‘republic’) and while I’d like to become a real republic, I reckon the Australia Acts are way more constitutionally important to us as a sovereign country than the arrival of the first fleet.","You are still making ""Australia Day"" about the British monarchy so I don't think changing the date to today is going to fly with the people protesting about the current date... of course I don't think any date is going to suit them.",0
fj5bpte,r/missing411,"I believe that the U.S government has men in black that make people ""disappear"" if they know more than what's good for them",0
1579526427955056641,@Paytmcare Just getting replies only and not getting support for the same.,"@balapc05 Hi, we have replied to you via direct message. Please check for more details. Thank you.",both
1572461042973966336,@sayhitolyss @itsalyssuhlove Me 2 .. I’m like I’m not interested! You know anyone who wants to buy a PS5 ?,I hate the kind of people that every time you talk to them they’re always trying and sell you something.,1
fj9ycnm,"OK, so, assuming for some reason that we do get a major fucking outbreak with say 200-300,000  infected, people are going to have to be treated at home  while holed up in their rooms. 
Mild cases just need food, supplies and maybe money - middling cases should be treated by community nurses and a few doctors (freed up by the canceling of all elective procedures) who check in on them wearing a full set of NBC protection).  Their transport would be arranged by the army, who'd take charge of hosing them down between visits.   
The Civil Defense would be in charge of distributing supplies like anti-inflammatories and food, fresh water etc.
AGS would take care of civil order and all limits on overtime for all branches would be lifted. 
That's a broad-brush look at how we might tackle things, and while we're honestly not familiar with this type of regime and it'd be a very odd time I think on the whole Irish people would help pitch in and be helpful.","What do people think the worst case scenario is with COVID-19? Like do people think we'll get the country shut down for two weeks or what? Genuine question, I know it's something the government/international bodies don't want to talk about yet/at all so I'm curious what people imagine it to be",0
1572507344193605635,@mmckenzieonline @PJMooreAndCo Fabulous work Mike - well done :),@nickbb7 @PJMooreAndCo Thank you so much!,0
1572499496688570370,@JoanaFFPViana Samesies,@NoisyBits Odeio-a tanto.,1
fjb0utc,"Oh aye I mind hearing about the revisited one before, I'll have to give it a lash.","Blood On The Tracks is a great music podcast
The Parapod is releasing new episodes and is one of the funniest podcasts I've ever listened to. Only about 30 episodes but it's gold
(Berkhamsted) Revisited has a big back catalogue and is basically two early 30 something women reading their teenage diaries/emails/facebook messages etc and reminiscing about the early part of this century. Far more interesting than it has any right to be and full of nostalgia",0
fj8gbgt,Real won,"Hu toh Bayern fan but El Clasico me Real Madrid ki gand lgte dekh maza ata he.
Too bad TV pe nhi aega ye saal La Liga.
Too tired for Facebook Live or stream.",both
fj6chfo,Thank you for your kind words but I'm still eating my Sunday roast with a side of mortification.,Nah its OK you were just being neighbourly,1
1539175009729527809,@Mijcan57Jim Thanks Jim… my free spirit has been tamed over time but not tide!,@mtully21 Maybe she’s a free spirit like her mom-Good Luck and keep us posted ???,0
1538242050541375488,@ajamesgreen @elisaodonovan @LkCycleDesign @davidtobin100 @righttobikeit @ShaneHoganD16 @cianginty @CassidyBJ @sarsfieldsride @alanstrainor @OConnorOisin @EoinBuckleyLmk @galwaycyclist Does that cover you when you're out and bike gets lifted?,@MacL0ve @elisaodonovan @LkCycleDesign @davidtobin100 @righttobikeit @ShaneHoganD16 @cianginty @CassidyBJ @sarsfieldsride @alanstrainor @OConnorOisin @EoinBuckleyLmk @galwaycyclist Home insurance. Named item,0
1579755697281339392,corruption free society &amp; democratic values.?,"ଦୁର୍ନୀତି ମୁକ୍ତ ସମାଜ ଲଢ଼େଇ ପାଇଁ ସେ ଚିରସ୍ମରଣୀୟ ରହିବେ।?

Paying homage to eminent freedom fighter, Bharat Ratna #LokNayak #JayaprakashNarayan on his birth anniversary. The socialist leader will always be remembered for his relentless fight for social justice, ...2",both
1578547698386419715,"@ThatEricAlper ""never ever say never ever"" Macgruber giving advice to a ""rookie' before creating a distraction by confronting the enemy -naked with celery up his bum",What is a quote from a fictional character that has stuck with you ever since?,0
1572511023005048838,@tompearce49 Yes moi,Is there anyone else on twitter today that didn't watch any of the pageantry on the TV.,1
1579749278201044993,@Pun_Starr It is a brain child of Pradhan Sevak that his godi media is trying to propagate. Also this law believe me would only be valid till this feku is the pradhansevak.,"Zee News demands there should be a law for contempt of PM.

If the law is extended to former PMs, even the present PM might be held in contempt.",0
fja52qx,I think you might be missing a big red flag there...,"Ex-pat in China. The Union Jack is printed everywhere in China.
On e-bikes and cars, clothing, stationary, merch, shop logos, handbags, advertising, EVERYWHERE.
The only time I've ever seen any other flag is the Stars and Stripes on a pair of skimpy running shorts some sweating half-naked yank was wearing.",1
fj9i0pd,"What are they supposed to do?
Realistically they can't close everywhere.
People still need to go to work to get paid.
We still need medication and foods.","Why is the HSE so incompetent? My girlfriends mam works in a school and they have a student coming back from a trip to Italy.
They got advice from the HSE who told them if she feels fine just let her attend classes. Are they actually that incompetent?",0
1578207991802855430,@StevieBanter @ayuninotayutu Saaaame,"@ayuninotayutu I'm not quite 40 yet, I'm 36 but still feel like I'm transitioning quite late.",0
fj576zt,Thats your realistic and correct information but like you're still wrong,"The idea of superpowers has been around for a long time. A google search show the Poper Puff Girls was created in the 90s. But comicbooks have been around for a while. Marvel had comics during WW2, and DC comics was made in 1934 my a US Major in the army. 
The idea of superpowers, supernatural powers, and powers given to humans by god, has existed for thousands of years. We can't really say who created these ideas first. But, we can say that it wasn't the creator of the Power Puff Girls, sorry.",1
1577573234412687360,@macsween_prue @SBS @AlboMP Thanks I'll take a look on SBS on Demand.,Viceland on @SBS is currently screening a doco on the IS brides. Many of the hard core are giving the IS finger sign and continue to be ISIS supporters. The interviewer has protection as some of the brides are lethal. And @AlboMP wants them to come here,0
1538201707410227201,"@SheehanAideen @WalleyRay @SaturdayRTE @roinnslainte Same in Olol Drogheda. Navan, Dundalk, Drogheda cottage hosp and Monaghan all downgraded. I spent Sunday evening and night on a trolley in a+e. Scanned Monday morning, 2 brain aneurysms sent to Beaumont. Was grand till last night. Nothing happens at weekends apparently ?","@WalleyRay @SaturdayRTE @roinnslainte I'm from Limerick. Limk Reg Hosp Ed has been like that as long as I can remember! And closing Ennis and Nenagh EDs resulted in the predicted clusterf**k. Friends, who have been in the ED, have had horror stories for years.",1
1572561084741226496,@xojo @PuckettsGrocery I hatched a Pokémon egg on that walk.,"Dinner at Pluckett’s Tonight! @PuckettsGrocery 

Meet us in hotel lobby in 30 minutes to walk over at 6:45p (Distance 0.6 miles, 12 minute walk)",0
1578743968535232512,@RockNRoLL_85 Jesus Christ Super Star,What’s the Greatest Double Album of all-time…,0
fj58m4g,"That air conditioner, man",The Brave Little Toaster™,0
fjcwm82,My mum told me that the farm made a profit one year. Just one. Dad immediately went and bought more cattle and was back to the usual loss the next year.,"there are 120 acres of land in front of my house and ive been told i can do whatever i want when its mine, but no forestry, funny considering the farm made no money last year",0
1579755680902578176,@kinnarmehta9 True,@RajendraWadher First check if how many subsidiary co they have. Most of MNC have cent percent subsidiary co and all new business goes there in many such cases,0
1578339522013646848,@utdben1 Do we have to follow the a league religiously cause I kinda ditched it after GCU folded,"I’m making a ?? Sokkah gc, reply to be added X",0
fj5g3c2,"This,
As soon as a sport it goes Foxtel it goes bust.
I Use to follow NBL and went to the games when it was on free to air.
Nup after that","Foxtel acquired alot of the sporting broadcasts, and given the low take up rate of their product, ut has has had a detrimental effect on most sports in Australia, as coverage is limited to sports bars and mad keen arm chair fanatics. I didn't watch cricket on TV in the 90s and early 00s, but even I knew the names of most players back then. It's always been casual viewing around my circles, but like many, I wouldn't pay for premium TV to watch it.",0
fj97wfo,Sealing off the Irish Sea would be far easier thannthe North Sea,Also were outside it...,0
fj5c0s6,hell yeah,Mint chocolate chip.,0
1578322601445064704,@nathunt1982 The series?   It’s incredible.,Watching Chernobyl for the first time.,0
1578604139529240576,@JBarney1994 I'm a Collingwood supporter but after Buckley sent half a dozen premiership players out the door nothing else amazes me these days! I like Ollie but if he wants to go to Geelong so he can play with his brother SO BE IT! END OF STORY!! KAPUTSKI!!,Have to laugh at the Collingwood fans on here who have been talking down Ollie Henry ever since he requested a trade now suddenly complaining that a pick in the mid-20s isn’t enough,0
1579723088933294080,@sehgalripu @cotoapp @aparna24 @tarunkatial @PoorviGupta08 Thank you ?,@aartimahajan_20 @cotoapp @aparna24 @tarunkatial @PoorviGupta08 Many Many Congratulations... @aartimahajan_20,both
1572499245940486145,@MerielMyers Entertaining house guests! I feel glad when people have gone and I can get back to just doing my own thing.,What are you starting to like less and less the older you get?,0
fjcj3me,My theory - All of the above.,"My theories ..
.Modiji is Celebrating April 1st in March 
Yoga baba is coming out with a new app ../ or he's going to make tik Tok videos 
Last..humara bada khatnewala Hein ..",0
1572482214318964737,@mommamia1217 And DC also. It’s not fair the way it is now.,How do you feel about Puerto Rico becoming a state?,0
1579708046896660481,@pradhan_lilu Thank you,@lokipalauri Congratulations!,0
fj9gz8e,Correct answer,4 or 5. Nothing else qualifies. When hot rub some butter on them and let it melt. Mmm.,0
1572560952842940417,@uurfavscorpio8 @unicrnrose_ My page,@unicrnrose_ Where can I find them,0
fj5u88m,"That's not even the issue though, it's the fact that someone feels entitled to the understanding and empathy of others without having an open mind themselves.
It's hard to have a discussion when someone is so convinced that they are in the right they are blinded to even listening to everyone else. Nobody is 100% right. Not this guy, not Western liberalism, not any of us. So we could all do a better job at keeping our egos in check and listening to what someone has to say.",Y'all can't cope with the fact that not everyone in the world supports Western liberalism.,0
fj97eqs,I always thought it was weird that gambling winnings are taxable in the US. No need for it here.,The fuckers aren't even taxed on the money in this country.,both
1578332761253097473,@CdrHBiscuitIII @AlboMP He is pure evil. A bully and a narcissist. Malicious too,"I wouldn't be surprise if @AlboMP told the Premiers to drop protections ahead of the Federal election. Not make Labor ""part of lockdown"", Gets it both ways. Let it rip under Scott then pretend hands are tied. Premiers held out for so long",0
1572505075767193604,@TheGunnersPub Gary’s a right stunner ain’t he.,@Neale Beautiful ?,0
fj7aozz,"As someone who has had to drive deckers across multiple times, I assure you, the driver seat is worse especially when you get a slight side wind, almost needed to change on the other side",At least you’re not upstairs on a double decker stuck on the Redheugh bridge. That’s the stuff of nightmares.,0
fj5b1br,r/iamverybadass and also that’s not your immune system that’s thinking with your spine,By banning vacationers/travelers and striking people who intentionally infect others with the butt of a rifle.,0
fjf14hv,"It's easy to be a well liked President in Ireland, as the role is mainly ceremonial. That said, Michael D is particularly well liked. To the point where the entire country refers to him by his first name out of affection. 
The Taoiseach, Leo Varadkar is the one most equivalent to the US president. He's not well liked, and recently lost a general election. They're trying to form a new government as we speak, but basically he and his party were voted out.","As an american dealing with the cheeto, is the Irish president generally well supported?",0
