id_text,text,parent_text,label
1572499815728312320,@PianoAvengers @HaroldHss3 Beautiful voice ❤️❤️❤️,@BobbiBicker @HaroldHss3 He just makes me happy ?,0
1572561360432803843,@DannieD01 I’d  eat the fries if I was hungry,Hi if someone bought you Chick-fil-A would you eat it or throw it in the garbage?,1
1538691397041135616,@CassidyBJ @KenmareFoodies Agree there. Sonetimes I have to use 4.,@KenmareFoodies And sugar in the tiniest sachets ever...have to open 3 just to get a teaspoon...totally wasteful,0
fjcfqjx,He's dancing like a cephalopod...,"Is the unit in the jeans and t-shirt some random dude who walked in off the street, or did he actually attend a wedding in that?",0
fj92aes,But why did he change his order?,"My son ordered the same pizza from Dominos so often, that once when he changed his order slightly they rang him to see if they had made a mistake.",0
1580514361046536193,@KnoxvilleMoths We have restrictions when we can and can’t hold up traffic ???,@calvin_knapp Just like sitting in traffic for a road paving project.,1
fjcpnr3,yeah like heinekens ads are literally all about not drinking and driving.,"They are aren't they? I always see on alcohol ads ""always drink responsibly.""",0
fj65m1n,Why is someone with there hands down there tracksuit annoying you,"It's not just a London thing, it's annoying as hell. You just want to tell them it's not gonna fall off! They don't have to keep guard of it just incase haha",1
1580554409682997249,@TheLeoTerrell I say the Dems will hold the line…,Election Predictions: Republicans will win the House! Stacey Abrams will lose in Georgia!   Any takers?,1
fj5e561,Yup,Probably BoTW and Minecraft,0
1579719596625776644,"I will wait patiently until my day 
Currently I was an underdog without a district medal
Definitely I will win Olympic gold and silver or bronze and I will be the fastest man on earth

I WILL WAIT UNTIL MY DAY","This nation doesn't have proper infrastructure facilities for athletes.
Even my home ground Indira ghandi municipal stadium was spoiled by meetings conducted by cheif minister from the time of NARA CHANDRA BABU NAIDU until now that was until YS JAGAN MOHAN REDDY.",0
1578543450428874753,@RpsAgainstTrump No,"Do you think Saudi Arabia is our ally?

YES or NO?",0
fj5dxhi,I mean paying as few taxes is possible is a good thing especially if it’s not even ur citizens benefiting,Brexit is just a bunch of rich cunts fucking over a nation so they can avoid the incoming EU tax laws,both
fjbavys,What about people that need to choose between eating and working?,">-If you are sick STAY at home
This! FFS",both
1536234046648369152,@ricettatore1968 ???,@FedericaPito Sexi,0
fjdk01c,Okay.,That boy at bottom left can't be more than 14 years old.,0
1572476064185651201,@Janet_A_P Definitely,@alexthepage Floella Benjamin,0
1536814486715346945,"Wordle 360 4/6

?⬛??⬛
⬛???⬛
⬛???⬛
?????","Wordle 359 3/6

⬛?⬛⬛?
???⬛?
?????",1
1572355728815554560,"@UndrgroundHH @_BobbyBlair_ Can’t hate a man that gets jumped by 20 heads and still doesn’t get dropped or his shit snatched. 

Dudes not catching any Ls really. He really going against the grain and making it work",@_BobbyBlair_ I just said this. Off mic dude be moving kinda funny but he out rapping everybody who's hating on him,0
1538166424216252416,"@SoniaHarrisPR Fresh mint, proper peppers and melons, the list is long ?","@ProperFood_ie I would only add Buffalo Mozzarella and / or Burrata. (Who am I kidding, I mean both). Tomatoes… grilled peaches… the stuff of dreams.",0
fj55pg5,Oabf soq6t 69s f siwyr ishrb fuck me daddy jdvdk didve kavsvr7d UConn of e,He's speaking the ancient language,1
fj5deds,I think you got it all twisted here pal.,Masturbating,1
fja30m3,I don't find him funny either. I watched a video of his to try and understand the appeal and I almost fell asleep,"They're like that Pewdiepie fella for me. Nothing against them, don't dislike them, but they're not at all funny and I cannot comprehend how they are popular as they are.",1
fj537f7,That’s really wholesome and sweet :),My boyfriends arms,0
fj6qvsz,Also works well on first dates,"Give it the sniff test, people really underestimate the accuracy of it",1
fj59l1a,So what's the conspiracy theory? Why would this behavior occur?,"Google Maps only asks you for feedback on its navigation when it knows it did a good job.
I use navigation all the time, and I find that when it gets me to the destination on time or earlier than predicted, I get a notification asking to rate the trip. But if it gets me there after it originally estimated, I never get that notification.",0
1579767721746903040,@afcwazzie North me rimjhim baarish ho Rahi hai,@sleepyhead1892 Here it's been raining since 3 days ffs,0
1579393309617053697,"@asharamjibapu_ Great  spiritual knowledge. 
Sant Shri Asharamji Bapu

#AsharamjiBapuQuotes","Man creates bondage, grief, tension and problems through action. He creates enemies through action; and when he performs good action, he achieves God through action. #AsharamjiBapuQuotes",0
1538257586700664840,@peterp0204 Lacking a potato cake.,@PhilipLynn4 Is that a full Irish?,1
fjac7b8,"That’s such a stale debate at this moment. Of course caa on its own is only against Indian values but not discriminatory to any Indian citizens. The trouble is when you combine it with nrc. 
That assclown of a home minister has already said they plan to implement it nation wide. All it takes to calm the people down is to come out with a statement saying that he was wrong when he said that and the government has no plans of implementing nrc nation wide in the form in which it was implemented in Assam.",The law is designed to fast-track citizenship for religious minorities being systematically persecuted in neighboring Muslim countries. Why is that discriminatory?,both
1572368269792940032,"Getting in protein, fiber, antioxidants &amp; the vitamins/minerals from whole food/plant food choices can make a huge difference.

@nutrition_facts has an amazing book called “How Not to Die”. I’m not saying to follow it directly, but it is definitely worth getting some ideas from.","As I dive more into health challenges that are prevalent within my family &amp; friends (heart disease, auto immune diseases, neurological diseases), research points to improving food choices for better nutrient density.",0
fjcgcga,There’s no point now. Cats out of the bag,"Can we perhaps upgrade the travel advice for all these countries please? 
A ban, sure but most of them are “returning” from holidays",0
fj903ht,Most likely because of they constitute only 14% of the population? (According to wiki),"If Muslims are prone to crime, and Indian police is biased against Muslims, then why are only 16% of convicted prisoners are Muslims?
That statistic does not show that Muslims are disproportionately criminal",0
fj85x0z,"I remember summer 14/15 as being the worst summer I'd experienced for Brisbane/Redlands area. It really did feel like summer kept going til mid May.  I don't know where this summer ranks, but it does feel like the worst one since then as the previous years have felt mild by comparison","I've 'felt' summers getting longer but couldn't really prove it (or bother to prove it more like it). I know in Brisbane even though we're now in 'Autumn' (ie. late summer), our actual cold period didn't usually start until 1 May (which you could set your watch to). Last few years it started getting really cold in min June. That is AFTER the start of winter. 
All those global warming/climate change deniers can fuck right off. More summer = more energy usage (esp electricity to run aircons) = more coal being burned in coal fired power stations = more carbon in the atmosphere = contributing to climate change = More summer. 
Thats the theory. Oh wait....
(Now I'm going to sit back with popcorn and watch the flaming) :) Happy Monday everyone. Its Autumn and I'm sweating at my desk after the 10 min walk from the bus station.",0
fj5ue74,will wait until I hear that ScoMo has left the country for Hawaii before I panic buy anything,Panic buying. It’s the same in Canberra and Gundagai and Melbourne. Overbuying is a self fulfilling prophecy and will cause a food supply shortage. Not good.,0
fj5e6q9,How crude.,10w-30.,0
fjeolh4,Ordinary Britain is in France,"I know it says great, but all I see is ordinary Britain.",both
fj6vxmn,"> am dangerous bird expert
As in...an expert on dangerous birds, or a bird expert who is dangerous?","Don't go near them, they are really dangerous!
source - am dangerous bird expert :)",0
1538178719898009602,@MarkACoughlan Up and down in 3 hours but that was going at the pace of the slowest in the group....you'd want to be reasonably fit as it's steep enough in places,@kommc How long did that take mate? Home next month and want to do a few climbs with the kids. Did Diamond Hill 3 years ago easy enough but there older now.,0
fjbb4w9,Canada: Telling their citizens to not travel to India seeing current situation.,"Bangladesh: Openly critical of India. 
Nepal: Embroiled in a border dispute. 
Bhutan: Limiting Indian tourist access. 
Sri Lanka: Rajapaksa ousts pro-India incumbent.
Afghanistan: Americans are rehabilitating the Taliban. 
Iran: See above.
Pakistan: Pushing forward with a concerted diplomatic offensive. 
China: Making ingress into Indian territory by building infrastructure to change facts on ground. 
But at least watching Jaishankar give tactless aggressive responses to foreign dignitaries provides bahkts enough material to jack off over a “strong India”.
Wonder what happened to his “look east policy”, I’m assuming planning guided tours to Kashmir is taking up all of the foreign ministry’s time.",1
fjaj4aq,That doesn't sound right at all,A bhakt friend told me that untouchability was designed to prevent such communicable diseases as the lower caste ppl who do the dirty work are more likely to have virus infections and such customs and traditions in Hindu religion that are criticised by ill informed liberals have a sound scientific reasoning behind them..,0
1579304230401511424,@JoannaNoBanana That there is anything else wrong with me other than my legs not working.,"Hi fellow chronically ill and/or disabled friends,

What's something about your chronic illness and/or disability that people around you don't understand?",both
fj6f53j,"Very short answer is no. 
Longer answer : can’t be bothered to type it out without context. Did a bouncer actually search your “friends” pants and you want to know if that was ok?","Are bouncers allowed to search inside your underwear?
Asking for a friend",both
1578617017443045376,@jasonsnakeblake Almost like a non existent budget surplus the LNP announced before a federal election.  See how that works?,Anyone else find it a coincidence Covid ended in Victoria a month before the state election? It’s a miracle.,1
fj9r7h0,"If they had the capacity for reason, they wouldn't be bhakts. Save your time, ignore him.",A bhakt friend told me that untouchability was designed to prevent such communicable diseases as the lower caste ppl who do the dirty work are more likely to have virus infections and such customs and traditions in Hindu religion that are criticised by ill informed liberals have a sound scientific reasoning behind them..,0
1572561434604871681,@OrrellAEI This one doesn’t seem to have made me feel bad.,"@RobertaLavin Got mine today, too. Feel like crap!",0
fj53pql,"Smart one, you are.",Washing my hands more.,1
fj576zt,Thats your realistic and correct information but like you're still wrong,"The idea of superpowers has been around for a long time. A google search show the Poper Puff Girls was created in the 90s. But comicbooks have been around for a while. Marvel had comics during WW2, and DC comics was made in 1934 my a US Major in the army. 
The idea of superpowers, supernatural powers, and powers given to humans by god, has existed for thousands of years. We can't really say who created these ideas first. But, we can say that it wasn't the creator of the Power Puff Girls, sorry.",1
1571842103893807105,@DailyStuffMag Its not a tragedy. Its life. It goes on. He's fine.,"Everyone Is Still Grasping Jonathan Scott Tragedy, here is the full story",0
1579746615254220800,@Yoonothing_ @uneven88 I wnna listen once ?‍?????,@uneven88 Khairiyat,0
1578307775276322816,"@osullivankate @pinny_arcade @PAXAus Apologies for the delayed reply, I believe the Doctors have wrapped up for the day. But hopefully we can help out tomorrow!",@prescribedspawn @pinny_arcade @PAXAus Still at the pub?,1
1578209082569379841,@SaveAmerica206 Yep,Musk could own Twitter some time the next two weeks. Will u leave if he starts charging a fee to use it?,0
1580114656869613568,@Rocking_Nainaa Mujhe tum,"मुझको बारिश पसंद है...?️

और तुमको..? ?",0
1538255178498990083,@DanDartsDawson Shocking tactics by them Dan,"Jose is genuinely the best counter in this team, and by quite a distance as well.",0
1579737400074702853,@TheSoulSpartan It's already cold already,Can’t wait for T20 World Cup and then Qatar 2022. F*ck October and F*ck the October Heat. ?,both
fj6253f,Thanks but he is in NSW. I should have mentioned in my post.,"If he’s in prison in Victoria, Box Hill Institute offer courses. Their teachers come into the prison and meet with prisoner and do lessons and then give them stuff to work on til their next lesson ect and they can get qualifications. Obviously the options aren’t huge but there’s a few good useful courses and if nothing else it’s something to pass time.",0
1572500537064689665,@asmir1 The kids here need it plus there's loads of talent in small heath park lool,@asmir1 Do one in small heath next,both
fj6oqtt,"I mean, I live near MK, some of the quarantines are there, I'm still not panicking.","we are not at this point yet. Unless you live in an area which has had an infection, its not worth you start to panic yet.",0
fj71864,MI5: Big fans of the IRA.,Feck off with your PIRA/MI5 propaganda will ya.,1
fj6gx6e,Green Lay's are bettet,"Binge watching Vox channel ke videos with the tastiest chips of all time ( Blue vale Lay's, not looking for a debate here) is a healthy coping mechanism",1
1579767615291265025,@neilesh_patil Chennai ka hoga but yaha 4 din baad Suraj nikla hai ?,@sleepyhead1892 gand fatati h bhai koi sunny bola toh..Chennai things,0
1538218602444337152,"@beerkarmanyc I may have missed this, are you very anti seltzers?","No promises, but I think I’m going to finally drink a hard seltzer today as one of my shifties.",0
fj91y0b,"I've never watched a football game in my life. Used to play touch footie though.
I like watching tennis.","I don’t follow AFL, (as well as soccer or rugby or union or any other ball sport).
I wouldn’t know half the teams in the league. I don’t care who wins or loses. I hate how it takes up half the newspaper on a Monday, and was excited for electronic news- so I can skip past it. 
I wouldn’t recognise a single player, and never watch or listen to a game. Actually I don’t think a sporting game has ever been watched by either myself or my kids in our house. 
We play sport, we are all good at sport and all games but don’t care to watch others play it.",0
1580525757474168832,@KaylaAndersonTV Good morning beautiful,The play out music is ???,0
fjcijon,precisely the reason they won't ever get to know what happen beyond infiltrated whatsapp groups.,"Seems like many Indians on Reddit are as likely to ignore/deny these posts as are the ones sitting at home and receiving their news from WhatsApp. 
DissapointedIndian",0
1580526165676019712,@lauriesmcintosh @DrJCarrington Jody is amazing (as you know). Equally amazing is her work training teams of clinicians and educators to build their capacity for human-centered and healing-centered work. #inspired,@Greg_Moffitt @DrJCarrington YAY! This makes me so happy ❤️,0
fj7nw2j,Doesn't South Africa have a high HIV population,"Many interesting things in this map.


Surprising to see Spain and Italy having better life expectancy than Germany and US. 


Chile and Iran performance looks amazing when you take into account the performance of its neighbours. 


Given its GDP, unexpected to see south Africa doing so bad :(


Japan is incredible

",0
fj7gyro,WASHING MACHINES LIVE LONGER WITH CALGON!,">    classic tv jingles: Hastings Direct, Calgon
As a 50 year old Brit, I can tell you I have no idea what those sound like.
I could tell you what Shake’n’Vac does though.",0
1538199371543678981,"@ShaneSaint Absolutely should  that I know it could’ve been a game changer Wexford injuries through the game cost them in the last 15 minutes ,Well done Clare no arguments",Black card and penalty?,0
fj5a75c,"I think it has more to do with the rust belt and how they were tired of outsourcing deals signed by Presidents. Ironically, the Donald is singing the USMCA",Trump conspired with the Clintons and ran the worst imaginable campaign in order to make Hilary more palatable and get her elected. It backfired miserably because they underestimated the number of racist idiots in this country.,1
1572500487873892355,"@tompearce49 Me and all my family and friends..massive, cultish mournfest.",Is there anyone else on twitter today that didn't watch any of the pageantry on the TV.,1
1579919170661408769,@katona_barbara Happy birthday,Hello everyone. Today is my 73rd birthday. Haven't heard from family. Can I  please get some birthday likes?,0
fj59x9r,And Hillary is really just a puppet for Bill to pull the strings ...... So Bill is really the current president.,Hillary is really the president. Trump is there to catch all the blame.,both
1572553634575175681,@Bad_Money29 Thanks Money,@damnimwild Happy birthday Fat Bul,0
fj6zgz6,"Tell that to employers.    
And after u get a good job with ur toilet papers, make a post on reddit.","Uneducated fucks.
This country's education system is a joke.
My toilet papers are at least useful to wipe ass. Those degrees are useless.",0
1580547622925848576,"@joncoopertweets Chick-fil-A, Jimmie John's, Hobby Lobby, and Home Depot",What is one company you'll never do business with because of their horrible politics?,0
fjbf6mw,Cutting ice,"it's disgusting. I've been trying to get dettol and Epson salts for my dogs infected foot for 2days now. I've been to around 10shops so far and everyone just laughs when you ask about having it in stock  
wtf are people doing with so much Epson salts!",1
1578246879455780866,@adamsh24 @musicglue @darrenhayes So glad it’s not just me. I see it as a good problem to have. An album so hot it’s creating a meltdown. ??,@DaneWhybrow @musicglue @darrenhayes I haven’t been able to download it from music glue either,both
fj6v3nv,"It’s a great watch. My dad gave me his vintage one as a gift to me.
Here’s us wearing our favorite watches at my wedding...",Someday I'll buy myself a rolex oyster perpetual datejust.,1
1538784833312378880,@Bandraidoir She's a social climbing slapper,What type of woman is Carrie Symonds?,0
fj65fyu,"Technically the wind doesn't fuck off, it fucks in, from high pressure areas to low pressure areas.","The wind is fucking off, the problem is that it's fucking off very quickly, which makes it very windy.",0
fj9yldn,"Is that the verse that comes after ""If you sprinkle / When you tinkle, / Please be sweet / And wipe the seat""?","We all remember the nursery rhyme. ""After the poo or pee has landed, do make sure that you're clean handeeeeaahhhd""",1
1580012196519899136,@naseeli_aankhen Food,"Food, sex, sleep what would you like ?",0
fj5qb5h,You guys missing the point BJP is a party which creates communal violence like this and will gain benefit.,Political parties should never be tied so closely with religion. BJP should never have been a hindu party . All this bullshit would have never happened. Fuck religion for causing so much hate in this world.,0
1580540763171336193,@IAmSteveHarvey Meeting a person ?,"If you could “Delete” anything from your past, what would it be?",1
1580527587167678464,@kimmie_c_ Sad part is going on everywhere,"Lordt. It's not even 7am and someone's already crying at work...

Not me.",0
1579064866916405248,@alwaysdaydreAMY Is it even a word??,"@johnj2555 Mine was awful lol Wordle 477 6/6

⬛⬛⬛⬛?
⬛??⬛⬛
?⬛⬛?⬛
??⬛⬛?
??⬛??
?????",1
fjce5vo,Didn't meant to get you down voted.  I asked a question and you replied.  Thank you for the response; edited my reply to reflect that.  Cheers!,You need margarine.,0
fjej2ag,It'll go viral,I'd say it'll be sickening,0
1572502860600057856,@LCFC Whos going to want to buy when your not willing to sack rodgers and putting in rubbish performances?,#lcfc today unveils a new range of merchandise from King Power International’s ‘LCFC x Community Power’ initiative; the ‘Thai Song Dum’ collection ?,0
fjb4r1p,"I don't understand how people say he has been silent when many of AAP MLAs including Kejriwal have made many speeches and statements about the riots. 
As for the relief efforts, seems like they have been slow. But they are continuing to do the work.","

Being silent on Delhi genocide.


Granting permission to file case against KK.


Didn't provided any relief funds to affected people and area (Centre, Delhi Govt Yet to Provide Relief to Riot-Affected People: Fact-Finding Report).


You know what worse? We have AAP bhakts who are defending Kejriwal with their flimsy excuses, as if BJP bhakts weren't enough.",0
1572500762391105536,"@EmmaPinky83 Have a great day.  I got up, bought vodka, came back, ordered MacDonald’s breakfast, poured vodka into coffee.

I may be under a level of stress and anxiety at the moment. I also bought a massive slab of clotted cream fudge designed to be chopped up that am just biting into.","Wank morning, (before any pervs think I meant that literally I didnt) thank fuck I've been called into work earlier I'm off to see if I can shake this shitty feeling ?",0
1538193993401606146,@Dimpconvery @bbcniweather @angie_weather @WeatherCee @barrabest @linzilima @Ailser99 @cherylwoods33 @TanyaDa00922232 @CarolN657 @MariesnotMaria It is Indeed ?,"@JamesCarlislef1 @bbcniweather @angie_weather @WeatherCee @barrabest @linzilima @Ailser99 @cherylwoods33 @TanyaDa00922232 @CarolN657 @MariesnotMaria That is a beautifullly preserved old station, I could hardly believe my eyes.",0
1580557916855099393,@joncoopertweets @ChickfilA will never get my business due to their CEOs stance on LGBTQ+ rights.,What is one company you'll never do business with because of their horrible politics?,0
fjdenhl,I've been listening to RTE Lyric and loving it,"I can't listen to newstalk/rte1/today FM anymore, it's wall to wall Corona virus shite repeating itself over and over. I started listening to LBC, it's pretty good.",0
fj5boop,"How did the cashier not notice it? Probably had a bad day, well not you, you got free bread.","Me, Not child.
Accidentally stole a loaf of bread. Went in for milk and bread. Held milk and money in one hand. Bread in another. Put milk up paid and walked out. Got to car. Checked receipt because i got more change than expected and realised I just held the bread in left hand and only gave them the milk and money with right hand. Completely unaware.",0
1577624401679634432,@IppyQLDGuy Thanks bro,@aussie_twunk_ Looking good?,0
fjawrv9,"or anywhere else including the Maldives https://www.kuredu.com/webcams/, this headline is a scaremongering farce.",Yet strangely the seas are not rising in Sydney Harbour,1
fjcgery,You're probably on the money.,"What's going on is probably you look like a scruffy motherfucker.
Wait, I checked your post history:
>Charged with Dangerous Drugs Possession
Well there we go then. Bullshit charge or not you're on a list boyo.",0
1538200978243059715,@Liampcahill That’s a whole lotta lube lol,Not me spending €60 in Boots when all I needed was toothpaste.,0
fj6vpav,Rajouri Garden is more than 10km away from where I live. Why play with peopl's safety with these?,"Police confirmed that all these are rumors.
I am right now in Rajouri Garden market.  ALL PEACEFUL.   Yes, there is panic. All shop owners have shut shops and gone home as a precautionary measure. Police deployment has been done.  All metro stations are functional and running smoothly. No damage or disturbance reported 
https://twitter.com/htdelhi/status/1234143157371064321?s=20
https://twitter.com/saahilmenghani/status/1234135601181528065?s=19",0
1579285575600775168,No update on this!!,@nykaafashion hey team. Order placed on 30 Sept. Items remain Unshipped after 8 days. Sales offers misleading if items are not going to be shipped. Should I DM order number?,0
fjcsrjy,Welcome to the glorious world of shifting in the shower,"I ran out of TP and there was absolutely none at my local Woolies
Dangerous times my friends dangerous times",0
fj8ka5o,"I’ve actually noticed that too, comparing Brisbane and Melbourne though as my sister in law was down there. If it’s gonna be a hot day in Brisbane, you can tell as soon as you wake up. 
Melbourne also seems to have greater range in the maximums for the weekly forecast. If we have a minor heatwave, you’ll see a few days increasing, a few days super hot then back down. Melbourne seems to sometimes up and down really fast, I saw one day that was going to be like 35 and the next was only getting up to 26.",What I found was that Melbourne got as hot as Sydney but it takes longer. E.g. Sydney will be muggy and 35 by 9 am but Melbourne will take until 2 to get there. Still 35 in the end but the day on average was cooler.,0
1538592309385777155,@jadedcreative It hasn't ended. I had Covid last week,"What happened to the pandemic? 

The ending seemed awfully anticlimactic, no?",0
fj6vpmn,"""wherever I went""?","The three great universities are Oxford, Cambridge and?",0
