id_text,text,parent_text,label
fj9kya9,"Durians kill people in Asia, never walk in a durian area at night as that’s when they fall out of trees when ripe. Also holy shit did your dad throw the durian at him and got him?thay shit would hurt.","This reminded me of a story my dad told me when I was younger. My dad and uncles owned an Asian grocery store, one with fruit, veggies and a butcher in the back. One day (some time in the 90's) a guy goes up to the front counter where my aunt was, pulled a knife on her and tells her to give him all the cash. Naturally, she starts screaming at the top of her lungs. So my uncles in the back start running out with giant cleavers. The guy freaks and starts running. My dad was closest to the front of the store, runs out grabbing a durian and hurls it at the guy.
So yeah, don't mess with Asian grocery stores if you don't want to get maimed!",0
1580525491294916611,"@RealCandaceO Lol. Another misinformation in 3,2,1…","I am about to share something that is so shocking to me that I feel I need to simply share the information, and then withhold comment until I can fully process…",1
fj6uzbk,"70% of the total hindus are actually SC/ST/OBC so if he is able to have that vote, he will be GOLDEN",If he can consolidate Dalit and Muslim vote then it will be a massive blow to BJP. Dalits have been veering towards BJP inspite of it being a traditionally upper caste party.,0
1538272307843674112,@MiseryVulture But you can't swear in Irish... ???⚰️☠️?,There should be a gaeltacht slasher movie that functions exactly like an American summer camp slasher only it's entirely in Irish.,1
fj99nkq,Which one? The one from Mexico or China?,Great. Grab a corona before the virus closes the pubs and stores.,0
1572501412168478720,"@AvantiWestCoast No worries. It's not your fault at all, and clear announcements, just frustrating.","@philsi Hi Phil, sorry to hear that, unfortunately, this is due to the overhead wires being damaged. - Pete",0
1572500136085061632,@Matt_Law_DT I admire your honesty in revealing you’re in your 50s.,@johncrossmirror I agree with you but interesting that both my kids (8&amp;7) LOVE the home shirt and suspect that’s more relevant than one 40-something and another 50-something…!,both
fj5bw12,"This is a very misleading comment. Trump got 63m votes, but Hillary only got 65m votes. On top of that, not all 320m are eligible for voting, because a large percentage are under 18, non-naturalized  immigrants, or felons.","He lost the popular vote, he was only elected by 60m votes in a country with 320m people. So he got less than 20% of the ""people"" to vote for him. Luckily the electoral system is shit so he won.",0
fj60r5j,Nice try u/byepolerbare. We can all see your name above your comment.,"Wow my name is Sapphire and I didn't really even know they came in green...
This is embarassing.",1
fj6bgqo,"yes thats what I want it for. I used to carry around a small bottle of some pink stuff that we used to clean hands out and about. At home, I just use soap.",Soap and hot water is all you need. Hand sanitizer is only useful if  you are out and about,1
fjcn60e,">Fighting each other?      
We don’t really have a choice in that, its a state sponsored contest with the aid of certain media agencies.  
And our regressive culture is helping all this shit.",Because we as an Indian fighting with each other over religious stuff instead of working towards the growth of the economy.,0
1579873425610670080,@ft_canaanland Amen,"In the name of Jesus, new order of exploits shall begin to happen in your life!",0
fjb9e5r,And most of that gets spent setting to the new joint. Ingenious plan,">It was conservatively valued at about $330 million but would probably be  worth more if sold to a property developer. This could allow the ABC to  consider a more affordable location such as Parramatta in Greater  Sydney for its headquarters, the sources said.
We now know how big the next budget cut will be . . .",1
fj9cmjh,"Yeah I didn’t get their license plate, they weren’t driving slow. Its ok though, karma will do their thing.",I think they can get points on their licence for that but if you didn't get the plate your just have to try and forget about and get dry using those hand dryers at work.,0
1572561084741226496,@xojo @PuckettsGrocery I hatched a Pokémon egg on that walk.,"Dinner at Pluckett’s Tonight! @PuckettsGrocery 

Meet us in hotel lobby in 30 minutes to walk over at 6:45p (Distance 0.6 miles, 12 minute walk)",0
1572561013173809153,@FoxNews But I won’t call them names I’ll leave the name calling to Stephen Colbert and the Democrats.  It just reflects on them.  For every action there is an opposite and equal reaction.  It’s a physics law.,@FoxNews I have never seen or heard such hypocrisy before.  They can fly illegal immigrants in the VERY early morning anywhere they want but fly them to a Democratic run sanctuary city and they say horrible things about you.  Duh!  I’m confused with their logic?,1
fj57cv3,Don't want any of that anti-crisis support,When you are a necrophiliac and want to know if she can get pregnant.,1
1572362751913381895,@Logically_JC *from,@Logically_JC A party platform other than what they scabbed grom the KKK and Proud Boys.,0
1538144806639108099,"@quejesuisbete He noting compared to The Bible, you won't find a single verse of the Quran they orders genocide , rape only in the Bible and who gave these prophet's they permission? If you say God, then it was Jesus who you believe is God","@ImamNoonan I've read the Bible, thank you.

Who gave Muhammed permission to do all the things he did?

Raping women is part of Islam, it's not what the Lord God commands or has ever commanded.

But he will judge, sometimes in this life &amp; definitely in the next. Don't you fear God?",0
fj8hx05,More likely looking for the undersea internet/other communication cables so they know where to cut if/when...,Nothing to see here just a Chinese vessel mapping the ocean to prepare for a possible china America war.,0
1579731617597501440,"@the_Bong_one I actively dislike how they look, never ☠️",@Anushka86160115 Dyson is amazing! You can also look at Berkinstock as well?,0
1572572064158224384,@812Diddley Have a good one,@Justice_Born Good morning bro,0
1572556849588891648,@Achilles6996 Thank u cuz,@damnimwild Happy birthday my Bloggers favorite Blogger.,0
fjc3mzk,"Nah, I’m making it about parliamentary and judicial sovereignty, not the monarchy. The Queen can stay in England and have fuck all to do with Australia, thanks.
Australia is a de facto republic anyway (‘commonwealth’ is actually a synonym for ‘republic’) and while I’d like to become a real republic, I reckon the Australia Acts are way more constitutionally important to us as a sovereign country than the arrival of the first fleet.","You are still making ""Australia Day"" about the British monarchy so I don't think changing the date to today is going to fly with the people protesting about the current date... of course I don't think any date is going to suit them.",0
fj72tx3,Do you have a wiki link? I can only find some scripted shows.,Think it's called filth,0
1572479239856979970,@IanMcDo30734360 @MyArrse No one seems to care ??‍♀️ who will hold them to account? They’ve literally got away with murder.,@MyArrse @LynnMcMillan123 They're all crooks sooner they are held to account the better im sick of the lot of them,0
1572563342270799875,"@StephenMoore Because trump lies 30x more often than Biden. Pretty simple, really","PolitiFact ""fact-checked"" President Trump almost 6 times as often as they do Joe Biden.

Now you know why Americans don't trust fact-checkers.",0
1578547698386419715,"@ThatEricAlper ""never ever say never ever"" Macgruber giving advice to a ""rookie' before creating a distraction by confronting the enemy -naked with celery up his bum",What is a quote from a fictional character that has stuck with you ever since?,0
1572511137358565377,@DeeOneAyekooto No matter how long it takes falsehood to journey truth will prevail and overpass it. Their messiah has gotten to a free slope that may slide him into political obscurity IRE O.,"So Peter Obi lied to Nigerians when he said ""I studied Philosophy"".

There is no subject called Philosophy in GCE.",0
fj54pwp,"I bought 10-11 packs of 24 roll sorbent about a year ago and store it in the garage. Time to buy some more. As a wise man once said ""Never buy just 1 roll.""",You can never go wrong with more shitter paper. You'll miss that when you run out.,0
1578652086576680962,@jrpmusicinc Both. Just as long as it’s Laurel Scudder’s All Natural.,Chunky or Smooth Peanutbutter?,0
1579836151644684288,@TeeDTweet And you get a reply for responding to that tweet…,@GabbbarSingh Then you got 2000 likes just talking about her post...,both
fjaij2s,"You can freeze it and it’ll be fine. 
I always have 3/4 loafs of bread frozen, handy if you forget to pick some up or if something happens, like the snow. Unusual but handy a few times a year.","It will all be stale ina week too, but the shops will still be open...",0
fje9gil,"problem is gardai ombudsman does fuck all, guessing the same for some other ombudsman but even more with the gardai one.","You can report them I'm pretty sure. Is it the ombudsman, all youd need is the plate and the time.",0
fj9dp8x,You have no idea what OP os talking about. Do you?,I think it’s better to use Skype when travelling abroad.,0
fjckmcr,"Question here is , is citizenship a right of  a migrant? .
Whe have a constitution defining the citizenship.
Constitution will take precedence over UNHRC  in terms of deciding on citizenship as unhrzc declaration is nonbinding and we are a sovereign country.",Internal matter? ...But India is a signatory to the universal declaration of human rights?..Isnt it ?,0
fj65q6g,That sentence contains a logical contradiction.,A nicely brewed Yorkshire tea !!,0
fjb3kiw,Daniel Day Lewis really can do everything can't he,I didn't know they got an actor to play Ted's height... that's impressive. Maybe I missed my calling as a height actor?,1
fj5153d,I like the way you think,"isopropyl
YOLO, bb",0
fjdzh8j,?,Reptiles,0
fj5cknd,Maybe they want you to think hes dead when the real conspiracy is he is still alive,"The theory that Epstein didn't kill himself. Memes aside, he could've probably exposed a lot more rich people for their sex crimes. They just bumped him off before he could do so.",both
fjc4gnz,"The RBA lends money to other banks who then lend money to you and I. For the last six months or so, it's at an interest rate of 0.75%, and so a bank might charge you say 2.75% for a loan.
Because our econmical outcome is looking worse and worse and the government isn't or can't do anything about it, the RBA has decided to lower the interest rate to 0.5%. This in turn is suppose to force your bank to lower your interest rate to 2.5% and you then use that extra 0.25% to go out and spend or invest it to try to stimulate the economy.
>how this affects me?
Unless you have a mortgage or a bank loan, you're not really going to feel the impact immediately and even then, that's if the banks pass the rate cut.",What does this mean? Can somebody ELI5 to somebody who has literally no idea how this affects me?,0
1572501203753504768,"@VindyaPeiris2 sometimes, but i dont care, no one can judge others by tweets","Someone I don't know sent me a message saying I'm a very arrogant girl,Do you also think that I am such a person???",0
fj5by0n,"....yes, but here, you're not going to get shot by someone who thinks they have the right to own a military weapon, and if you do get hurt, you can be taken to hospital and treated without having a crippling bill follow you out of the hospital and having to declare medical bankruptcy; you can go to university without being laden with debt as soon as you get out and we have elections that are run by an impartial independent body, not potentially by the incumbent.
Sorry, I'll take here, thanks, over that lunatic asylum.","Big difference is that land is cheaper in Texas and governments dont  interfere with private property rights once zoned. Australia is a locked up country, locked up bureaucracy, nanny state laws and endless regulations that rarely achieves its objectives. From my experience in Texas is that they have a  greater desire to protect the natural beauty and wilderness values than  just about all our governments  while still making Texas the cheapest places to build  a house or own land.  We have lots of potential but we squander our opportunities because of our stupid politicians.",1
fj62ntm,Time machine with the ability to traverse all parallel universes otherwise it didn't happen...,"Video or it didn't happen.
/s",1
1572501191384518656,@beingmybest44 Bless. Hope you feeling better soon. I'll send you lots of motivation to get you going and throughout the day. Here for you. Take care. Lots of love ? ? ? ? ? ? Xxxx ♥ ♥ ♥ ♥,Have to get ready for work but my motivation is at a 0....this cold has been kicking my ass..my nose is plugged up and my chest is full...but no covid thank god...just pushing through it...,0
1577779385301872640,@xskinn @softhardworker Ready on your mark … get set … now RUN away lol ?,I’ll be 62 in 15mins #Ians62. Ian,1
fjccvy3,Jaysus Mary. That crowd down the laundry are really taking the piss. I hear they annexed Poland. Michaeleen was always a nice lad. What would his poor mother day Lord rest her.,"Funny how for a generation, the people of Ballsbridge would’ve associated the swastika with that truck and every subsequent generation it’s associated with you know, fascism, genocide etc
Edit: shite grammar.",1
1579751959023996931,"@ashleyxxdancer @JessLouRainford Neither do people light a lamp and put it under a bowl. Instead they put it on its stand, and it gives light to everyone in the house. In the same way, let your light shine before others, that they may see your good deeds and glorify your Father in heaven.

Matthew 5:15-16","“For I am not ashamed of the gospel, because it is the power of God that brings salvation to everyone who believes: first to the Jew, then to the Gentile.”
Romans 1:16",0
fj54twc,Elaborate,When I’m the little spoon ?,0
1538181440386609152,@LeilaTavibird Thank you Leila. None of it is my work! ??,@Sheila38426081 Lovely,0
1572561392263364615,"@MarkYou97329590 @lavern_spicer Well first of all you have to be educated to the extent that you can differentiate between, facts, opinion and total insanity! Your gullible and grossly misinformed there Vern!",@lavern_spicer One caveat. Most of the things Biden says are lies.,0
fj9d1eq,"It's projection, as most any truthful statement about their behaviour results in howling butthurt.",Lol. To think they’re the one who keep calling others “snowflakes”.,1
1538542300753809409,@SharonNiBhriain @DCU @TheHelixDublin @rte_co I’m waiting for life membership!,@MGMolony @DCU @TheHelixDublin @rte_co You should just bring a sleeping bag and camp there! ?,1
fj6ag9n,More evidence the  LNP are sociopaths.,"I couldn't believe it when I watched him say this in question time.  What an absolute numpty.
Not only what his stupid joke unfunny, he repeated it again the next day with a smug face, looking back at his colleagues as if he was a school yard bully.
What is wrong with measuring how happy a society is instead of just looking at monetary figures?
I think it's a great idea in this modern age.  We could use the results and data to focus funding on improving quality of life for people instead of just looking at the books.
It's a no brainer yet this clown and his party are taking the piss out of a great idea simply because it came from the ALP.
If you do not accept an idea from an opposition party and at least consider it, then you are not running the country to benefit its citizens.",0
fjczn4u,"They get paid a fuckton of money. That's all the morale they need. The scandals are their own doing, including the scandal of threatening to go on strike in 2016 for even higher pay, and penalty points scandal where the entire lot of them committed fraud.
No accountability, early retirement and massive pensions and a average weekly pay packet of 1200 euro a week in a job for life.","To be fair now, I came across an accident on the N17 today and they were all over it. Gardai on the scene, followed by medical teams and the fire brigade. 
I suppose it just depends on the Garda, same as any job. 
Some of them are useless, indifferent jobsworths and others are committed people dedicated to serving the community. The lack of resources and the recent scandals can't be very good for morale, either.",1
1579740493373927424,@mganguly133 Rightly said,Why Indian aunties have weird obsession to know when we will get marry or when we (married couple) will conceive a child?,0
1578332761253097473,@CdrHBiscuitIII @AlboMP He is pure evil. A bully and a narcissist. Malicious too,"I wouldn't be surprise if @AlboMP told the Premiers to drop protections ahead of the Federal election. Not make Labor ""part of lockdown"", Gets it both ways. Let it rip under Scott then pretend hands are tied. Premiers held out for so long",0
1578362230302978048,@TheRealRudolfo So damn good,@bcurrall80 Loved it!!! #WerewolfByNight #ManThing,0
1578339522013646848,@utdben1 Do we have to follow the a league religiously cause I kinda ditched it after GCU folded,"I’m making a ?? Sokkah gc, reply to be added X",0
fj58oz7,Yep. Exactly what I was gonna say. Insect chaos .,Mosquitos take over the planet,0
1579517352441712644,"@ajay43 People those who feel bharat is broken, do #BharatJodoYatra ? . Isn't not Shame on #congressitoolkit and #RG . If it would have led by Proposed presidential candidate or current president makes sense. Let thim.first stick to one constituency for the betterment of locals.","The more you see it, the more you realise that the ordinary citizen thirsts for a more inclusive and humane India. This is why the #BharatJodoayatra is gaining more traction by the day",0
fj7jedh,I really want to use this one more when I run into people haha.,Story?,0
1572556268702961666,@kittytriplet I was in the beginning but now I fly a lot so not so much,Are you Afraid to fly? I am.,0
fj517dh,"Peaceful life, eh?","Pokemon Sword, so pretty good since I never get hurt and there are revives and potions everywhere",0
1579751751674363904,"@Subhank78426804 A memory of a flower is not in the essence that lingers somewhere in the palm of hands, but whiff of fragrance nostrils caught, with the humble wind! It's the petals that are now dry, the prickly thorn! A bubbly rose now exist in some other sphere","It is one of the most touching bereavements!
That bring unremitting torments
To one's soul!
And fill the heart with thoughts, fair and foul!
I know not how long 
Shall I bear this irreparable loss,
That hath hit me strong
To the core,
A memory, that gathers no moss!",0
1572307371472596992,@gettagrippe97 ?? cant stand u,My ex has the highest chance of dating me so caught feelings at your own risk,0
fj9xw9k,Lmao I think that’s a bit of an over reaction. It’s only a bit of water. I don’t think the guy had malicious intent.,Should have a word with your local police since it's assault.,0
1572507344193605635,@mmckenzieonline @PJMooreAndCo Fabulous work Mike - well done :),@nickbb7 @PJMooreAndCo Thank you so much!,0
1572511023005048838,@tompearce49 Yes moi,Is there anyone else on twitter today that didn't watch any of the pageantry on the TV.,0
1572493331090882560,@RussInCheshire Me too....me too,"My favourite thing about having insomnia for 3 decades is people telling me how to cure it as if I haven't tried everything imaginable to avoid 10,000 sleep-deprived nights.",0
1578268768593059840,This whole thing was tampering and reeked of salary cap shenanigans. At no point did the other clubs have the right to talk to a player under contract for another whole season. The system needs reform and strong penalties for these types of actions.,"Now that the dust is settling on Munster staying in Melbourne, can we revisit the fact that the Dolphins, Tigers or ANY other #NRL club were not supposed to be making any offers to Munster (or Anasta as his manager) until 1 November 2022.",0
