id_text,text,parent_text,label
fj515xd,Hahahaha I guarantee this will happen. I'll eat my socks if it doesn't.,What a revelation.,0
fj7n1d8,"Then they wouldn’t really be Muslims living devoid of any influence from the Quran or Islamic teachings, I sincerely hope you don’t assume that all the Quran and Islamic teachings are bad and cause mayhem. Also I don’t think you get the meaning of the word secular by the way you framed the question, secular doesn’t mean abandonment of religion in regards to individual practice but that law should not be based on religious teachings which have no basis in fact, i.e. ban on cow slaughter or blasphemy laws 
I won’t say islamophobia but the way your question is phrased astounds me, can Muslims be secular? Go ask that to all the Muslims protesting to remove a religious delineation on a law. Smh","Can Muslims be secular?
Can devout Muslims be happy living in a state devoid of any influence from Quran or other Islamic teachings ?
That's an honest inquiry, not an Islamophobic comment.",0
fj52rff,Well you can't have a 'cure for cancer' because cancer is an umbrella term for many diseases. That's like saying about cure for lung disease. Also several forms of cancer can essentially be 'cured' due to improving therapies.,"""There will never be a cure to cancer because treatment too profitable.""
I hear this one a lot, but it does make a bit of sense.
Chemotherapy, radiation therapy, and all other cancer treatments are extremely expensive. And if a cure was developed, it would be just as expensive. 
But, I don't believe doctors are hidding a cure from the public.l",0
fj9a0ts,What else do you suggest them to do?,Why the heck do people even do engineering from a 3rd tier college lmao?,both
fj5cdjs,Is that the new. Bitch I'm madonna?,I'm bald bitch,1
1572498962841735169,"@wayne_brockie @pharm_ruthie Nothing wrong with asking for input from a support network. I worry about those who don’t ask for support when needed. 
Understand worries about preparing false narratives, however if it isn’t built on foundation of truth should be able to spot with gentle probing","@pharm_ruthie Not a fan, giving questions out before hand enables the candidate to obtain help from others. I’m in favour of giving the questions to the candidate while in the interview rather than asking the questions.",0
1578335235535933440,@FalloNed14 @piesource1 How much was the lowball offer Ned?,@piesource1 If Collingwood rate him so highly why did they low ball him with their contract offer? Actions speak louder than words,0
fj593ca,not that bad,"A Cause Des Garcons by Yelle it's a French Dance/Electro pop song i randomly found
The name translates to Because of the boys",0
fj7fnlw,"I remember they were on a show with Jack Dee. Jack Dee said ""The only reason why people watch you is because it's the only time that two geordies are not having a punch up""",They don't raise any emotion from me. Which may be worse than hating them.,1
fjbavys,What about people that need to choose between eating and working?,">-If you are sick STAY at home
This! FFS",0
1571533150496460800,@timmyvoe You silly man. Weve had 12 years of a Tory government and police cuts. Ditto funding to the nhs. Youd be dangerous if you had a brain.,"If you want to know what life would be like under a Labour government then look at the crime in London under Sadiq Khan, Look at the NHS in Wales, Look at the police in Manchester, Look at the financial mismanagement in Liverpool

Now imagine it all over the country",0
fjc6zgx,"Bernie is overrated. Warren and even Buttigieg was a better option than him.
Edit: I meant Warren, not Sanders.",Seeing the rest of the Democrats show Bernie Bros what’s up has been delightful.,0
1572501123348455426,@gold123win @earlthedyer @EUtopean The weather looks pretty promising Reg.,@mulldog Good news for “Luxenbourg” for Arc as long as rain keeps away it should be fine A class act should have been unbeaten only one mishap when he stumbled coming out of the stalls in 2000 gns at Newmarket did really well to finish 3rd Now back to his best @earlthedyer @EUtopean,0
1538336797494681600,"@MCinHD My mom sends me job advertisements from where I grew up as well. Might be less about earning more or less, but about desire to have the kids all closer. Might be the same with your mom.",My mom has been beating the ‘you make less money in Germany so you need to move back and earn more’ drum since I landed. She just asked my rent and I think she will stop pestering me now that she heard how much bang for my buck I’m getting.,0
fjb4r1p,"I don't understand how people say he has been silent when many of AAP MLAs including Kejriwal have made many speeches and statements about the riots. 
As for the relief efforts, seems like they have been slow. But they are continuing to do the work.","

Being silent on Delhi genocide.


Granting permission to file case against KK.


Didn't provided any relief funds to affected people and area (Centre, Delhi Govt Yet to Provide Relief to Riot-Affected People: Fact-Finding Report).


You know what worse? We have AAP bhakts who are defending Kejriwal with their flimsy excuses, as if BJP bhakts weren't enough.",0
1538183426230169601,@OneCumberland To the moon,@paulhayesman What does that do to Tesla economy? ?,both
1538575018275135488,"@salemmohalesh75 Trainspotting

Watching this film at a very young age, I was never interested in trying drugs growing up. So glad I watched it! ?",Best Film About Drugs??,1
1580114656869613568,@Rocking_Nainaa Mujhe tum,"मुझको बारिश पसंद है...?️

और तुमको..? ?",0
fj9cq0b,Ye thoda zyada merko lag raha hain.,"Here is my conspiracy theory
I think that IB officer who died in delhi riots, know something of important and tortured to get that information. Delhi riots are being used as cover up for his death.",0
1572568373703352320,"@chrissyteigen otr dweller, Bagelry or Lils in cov for breakfast, lunch is sparse in otr but if you go to the banks E19 has a kale brussels sprout salad they’re famous for and they should be. Dinner at Che Argentinian or Wodka bar","Coming to Cincinnati for a couple days tomorrow! Would love to know what to eat, please!",0
1579723088933294080,@sehgalripu @cotoapp @aparna24 @tarunkatial @PoorviGupta08 Thank you ?,@aartimahajan_20 @cotoapp @aparna24 @tarunkatial @PoorviGupta08 Many Many Congratulations... @aartimahajan_20,1
fjac52d,Sab anti-national international hai ji...,"Bangladesh: Openly critical of India. 
Nepal: Embroiled in a border dispute. 
Bhutan: Limiting Indian tourist access. 
Sri Lanka: Rajapaksa ousts pro-India incumbent.
Afghanistan: Americans are rehabilitating the Taliban. 
Iran: See above.
Pakistan: Pushing forward with a concerted diplomatic offensive. 
China: Making ingress into Indian territory by building infrastructure to change facts on ground. 
But at least watching Jaishankar give tactless aggressive responses to foreign dignitaries provides bahkts enough material to jack off over a “strong India”.
Wonder what happened to his “look east policy”, I’m assuming planning guided tours to Kashmir is taking up all of the foreign ministry’s time.",0
1579727380608077824,@sreestfu @Arsenal Will take time,Bench cam where @Arsenal admin???,0
1579745007745273856,@Ooye_Alii Oky ?,Let's Follow Each Other ???,both
1578275596517675008,"@Wanderlustin @SarahDemp Right?
I know enough to be dangerous about that franchise but not enough of all of that so I’m just enjoying an incredible show",@SarahDemp i am living in wonderful bliss having shit all knowledge of the timelines ?,0
fjcl727,Physical money is fully gross.,"Knew someone who worked in a bank, their hands would get black with dirt after handling money",0
fj91i05,Ben Cousins wants a word.,"""Once a crim always a crim"" 
Unless you're good at footy.",0
1578271105084575744,"@amarsidhu_ As long as no one messes with us, leave us in peace","@TheDadhiwala ?
Most peaceful people on the planet",both
1579060232030158848,@Nell496 @RadioBrendanRTE Yep very much from the heart,@urlofcork @RadioBrendanRTE It was powerful Urlo. Made me cry.,0
1579037055115358208,@linseygibson @Ryan_McCready @RobbieButlerMLA @BeattieDoug @uuponline It certainly has been!,@iamfifig @Ryan_McCready @RobbieButlerMLA @BeattieDoug @uuponline My memory was the conference last year too fi! What a rollercoaster of a year it’s been ?,0
1579746198201982976,"@arcomedys @Swiggy Have you eaten 

Gujarati language",@Swiggy what does that mean?,1
fj6ru7e,Climate Change does not allow me to be optimistic,Anyone optimistic about the future?,0
1579064544588025857,"@wee_walshy24 Had that and was actually great, but they have come back for a visit. No craic at all","@nbrez I suffered them years ago, was given an injection of some sort...possibly a steroid (sorry useless info, but it was like 20 years ago ?) They should be able to give you something, they're a balls and exhausting ?‍?",0
fj5ndxs,"^ good info.
It's sad to see our gov using SMS for MFA, it's a bad practice for several reasons.
The mygov scam emails/SMSes are quite common: https://www.ato.gov.au/General/Online-services/Identity-security/Scam-alerts/","It isn’t the same contact per se, it’s just that the Govt agency responsible for myGov sends the messages from a name, and not a registered phone number. This makes impersonating them stupidly easy as you’ve seen.
Further, there’s no real global standards for verified SMS which increases the likelihood of people being phished. While Google has made some in-roads for their customers in select countries, it isn’t rolled out in Australia or other major nations. And Apple just keeps hoping more businesses will use their iMessage for business platform, but their rollout of it is as slow as a wet week.",0
fj9j1pm,I still have it ingrained from Irish college,"You just need to know the first line, then mumble along with the rest of us!",1
1538249687173578757,"@JessKebbell Hope you got to see the URC final, was an absolute cracker of a game!","I thought that was going to be a really boring game after the first 20 minutes, but that turned into one hell of a final to be fair. Congratulations Leicester.",0
1579753411146579969,"@swamianandswaro ये हिन्दुत्ववादी नाम मात्र की सरकार है।  हिन्दुओं के हित मे कौन सा काम किया है ??
हमारा देश धर्म प्रधान देश है।  जहां साधु संतों का आदर नहीं, वह देश कैसे वास्तविक तरक्की कर सकता है।
जहाँ चीतों का स्वागत और असमय गायों को मारा जा रहा है, धिक्कार है।",बड़े बड़े आतंकवादियों अपराधियों को परोल और बेल मिल रहा है लेकिन लगभग १० साल से जेल में बंद आसाराम बापू को ना परोल मिलता है ना ज़मानत ये हिंदुत्व की सरकार है ..,0
1572547584094502915,@LindaPe94835146 @ThaJewelryStore 21 deep breaths in and out,What do you do for stress relief ?,0
fj63vmv,"A key theme of the minister’s discussions with government ag ..
Read more at:
http://m.timesofindia.com/articleshow/74421762.cms?utm_source=contentofinterest&utm_medium=text&utm_campaign=cppst",Would it not be a great chance to actually start Making in India,0
fj50oqj,I'll try,"Stop thinking, just do it.",0
fj67dj2,"Wow. Someone has a case of tall poppy syndrome. 
If you had an ounce of economic knowledge then you would have sympathy for this AUSTRALIAN business....","Yea-no. I have no sympathy. You could have sold locally and avoided this (tbh no one knew it was going to happen), but like EVERY investment; it's never 100% secure.",0
1578199289435521024,"@PeterDutton_MP People are genuinely upset for the families in Thailand who are grieving the death of their innocent loved ones. Truly a horrifying, senseless loss of so many lives. 
However I do question the sincerity of Peter Dutton's words when he is trying to show 'his nicer, caring'side.","Our thoughts and prayers are with the families of those killed in this senseless massacre at the nursery in Thailand. Thai people are peace loving with a beautiful nature, which makes this crime even more difficult to comprehend.",0
1538243402483089408,@KenmareFoodies Usually end up sticking the fork or knife into them and squeezing sauce out.,@KenmareFoodies They are a pain in the hoop,0
fj85x0z,"I remember summer 14/15 as being the worst summer I'd experienced for Brisbane/Redlands area. It really did feel like summer kept going til mid May.  I don't know where this summer ranks, but it does feel like the worst one since then as the previous years have felt mild by comparison","I've 'felt' summers getting longer but couldn't really prove it (or bother to prove it more like it). I know in Brisbane even though we're now in 'Autumn' (ie. late summer), our actual cold period didn't usually start until 1 May (which you could set your watch to). Last few years it started getting really cold in min June. That is AFTER the start of winter. 
All those global warming/climate change deniers can fuck right off. More summer = more energy usage (esp electricity to run aircons) = more coal being burned in coal fired power stations = more carbon in the atmosphere = contributing to climate change = More summer. 
Thats the theory. Oh wait....
(Now I'm going to sit back with popcorn and watch the flaming) :) Happy Monday everyone. Its Autumn and I'm sweating at my desk after the 10 min walk from the bus station.",0
fj7o2vt,"Could have been around mullaghmore either, think that's a favourite for them when it's stormy","I going to take a guess and stay this was on strandhill beach, amazing surf beach but fuck me the pull in that water.",0
fj7xuh9,This made me chuckle,Do you live in the 1950s?,0
fj6kq5q,Henry Numatic,Who would have thought that the humble Henry Hoover would be responsible for our planets interplanetary diplomacy!?,1
1580539593551536128,"@IAmSteveHarvey You would only choose to delete something tragic from your past. Which would completely change who you are today. So if you're unhappy with who you are today, delete away.","If you could “Delete” anything from your past, what would it be?",both
1579066339280687106,@joewroe At the 3pm show,Just back from seeing a great play in the Civic Theatre in Tallaght called ‘No Magic Pill’. It’s about the life of Martin Naughton the late great disability activist. Highly recommend it.,0
fj53b3u,How do you feel when you are having a lucid dream? I want to experiment it but I'm also scared of it,"1)Get your dream recall up. This is the hardest part. You have to realize you’re dreaming so to do that you need to find Dream signs, common dream themes for you, etc. 
You can do this by keeping a dream journal. 
Also practice all day awareness. Ask yourself randomly if you’re dreaming throughout the day and perform dream checks. There are lots. The easiest and most discreet are the index finger through the palm (in dreams it goes through) and holding your nose and breathing which allows breathing in dreams. 
2) Practice different techniques. 
DILD-Dream induced. This one is the easiest but less reliable. By this point you should know some Dream signs (electronics malfunction, lights don’t work, words in books are strange, your mirrors reflection) and you just notice you’re dreaming. 
WILD- Probably the most reliable, but many people report Sleep paralysis with it.  It’s a wake induced LD. Essentially you time your sleep cycle just right and try to enter during REM or closer to it. 
There are others too FILD- Finger induced, DEILD- dream exit induced. There’s tons but those are probably the most common. 
3). You’re lucid!  But you’ll probably find the dream world instantly disappears or spins or you wake up (also look up false awakenings, those are fun). To do this you need to learn stabilization. 
So calm down and slowly spin around. This stabilized the dream for most people. Another one is to rub your hands together slowly. 
Think that’s about the basics. Don’t buy anything like masks.  They don’t work. Supplements have different effects for everyone. Melatonin helps me recognize my dreams but just because it makes them so vivid.",0
1579751331279273985,@thepawanbishnoi They're supportive in some things and not in some,@WrongMissyHere U said they re supportive,0
fj91qqg,"Its also the most likely point of attack for china if they want to secure the strait of Mallacca and/or invade Australia properly, which is why people are so interested in it mapping the sea floor at that particular location even if it is international waters.","Lol Christmas Island is like next to Indonesia, hardly next to WA.",both
fj5b1br,r/iamverybadass and also that’s not your immune system that’s thinking with your spine,By banning vacationers/travelers and striking people who intentionally infect others with the butt of a rifle.,1
1579718935687335937,@TECH__MUKUL @XiaomiIndia @amisoumikbolchi @Gaurang321 @MiIndiaSupport Thank you ?,@XiaomiIndia @IamAyan_Sarkar @amisoumikbolchi @Gaurang321 @MiIndiaSupport Congo @IamAyan_Sarkar bro,0
1538237887354896384,"@Minceirbeoir Shocking , God rest those poor children, it’s time for some intervention ?","Travellers have been lobbying for a national health strategy,mental health strategy for over a decade our State and its organs failed us. Now look where we are our children dying by suicide at a shocking rate. ?",1
1579718981027475456,@Anikha1123 @Kavitha19310128 Hi,@Anikha1123 @Kavitha19310128 Super cute Nani bangaram,0
fj55pg5,Oabf soq6t 69s f siwyr ishrb fuck me daddy jdvdk didve kavsvr7d UConn of e,He's speaking the ancient language,1
1579994514592518144,"@_ThirdSide_ Buyback and dividend ???

Why are they emptying cash reserves in such conditions for nothing?

Isn't this the time to stay in cash and grow by takeover due to precarious interest rate situation.

Something isn't right!!!!",Any idea why Infosys futures is at 24-25 buck discount to spot? Dividend is only around 16 or so?,both
fjc6r5j,the best is when the sign says it'll be there in 2 minutes and then suddenly switches to 6,Buses simply not showing up. Happened to me probably 8 times in a year where I’m late for a lecture or just anything really because a fucking bus decided to disappear.... legit happened to me today so needless to say the wound is still fresh :(,1
fjcn41f,Who could forget that moment? ?,"""The winner... is... Sydeney""",both
fjanz55,Thats a fair distance from Garforth. Dorset is lovely though but I don’t know what it’s like for cycling other than the time me and my wife took our tandem to Blandford Forum and set off only to be surrounded by hedges twelve foot high for what felt like hours! I’m sure we could have picked better routes !!,"Ha ha. I’ve been there. Used to ride out from Garforth via Bramhope, Otley, Ilkley. If it was freezing or wet the Abbey was as far as I got. Moved to Dorset now and missing my old haunts. Enjoy",1
1579572190672224256,@Paula_White I am delivered of known and unknown demonic attacks in Jesus precious mighty name amen and amen,When something is a demonic cycle in your life- you can't counsel it- you must be delivered from it by the blood of Jesus!,0
fj7ydim,"When strange things happen, are you going round the twist?",Have you ever... ever felt like this?,0
1578345731160621056,@WAAMBMEDIC It’s very convenient for everyone else though,@GarnAlan Housing all the uncontrolled clinical risk in one place harms patients and clinicians.,1
fj7mvzp,Only bought it yesterday though. On a Saturday so tax office would have been closed anyway.,"You need the book to tax it, explain to a guard and you should be grand, legally they can not take it, however dont be a prick or they might not believe you and cause you a bit of lost time",0
1572499846971490307,"@uk_georgina @tractorgirly @AlanDuncan1971 @sallymdonald @theSNP She’s on something, that’s for sure ????",@tractorgirly @AlanDuncan1971 @sallymdonald @theSNP Is Sally still on the Gravy Bus?,1
fj7wpj5,I've heard Hill end is good for gold. I've only ever hunted there though. Wasn't into fossicking last time I went.,"Parents used to go fossicking for gold decades back on weekends, would pull a couple of hundy with a homemade sluice box every trip. Can't remember the exact place - somewhere between Bathurst and Hill End. What I remember most was the absurd amount of flies and red belly black snakes. 
Took the dog with us once. Was sick from all the fly eating. She couldn't help herself..",1
1572502716597039110,@Joeytaylor123 Was about £1.61 all in the jokers,"@andy_cov93 Saves you what, £2,50??",both
fj8870j,Oh no...,"0800 double 0, ( fill in blank)",0
fj8zpnu,"The News Corp article is a bit rubbish. I'm going to plug this video from the Royal Institute on the topic of young people getting screwed, especially on housing, and how much harder they have it.","They come out with these articles every few days, boomers still bitch how they had it harder. Politicians do nothing and we await the next article to tell us this again. Depressing, but this is what Australia votes for and they will do it again next election, its the ""fuck you, got mine"" mentality of the old.",0
1538431245289459712,"@BishopSteiner Thanks, that means a bunch coming from you!","@KhanElgran that is a very very sweet paintjob, mate!",0
fj8jgz4,Open University on BBC2 at 3am?,"The three great universities are Oxford, Cambridge and?",0
1572561263384997895,cause i rlly need to change my number,what time does tmobile fat musty ass open,1
fj7vi0l,It really doesn’t. But what makes you feel that way,"Or they’ve never been to London. Or they’ve never been anywhere other than london.
London sucks.",0
1572561148721102849,@McLovinCakes Thanks love! ?,@TheGreatKingSIR Happy birthday,0
1580132988410478592,@Apejetgames Jay APEJET,"$250 give away to who leaves the most comments &amp;  $250  to whoever leaves the last comment ‼️
Ends in 3 days &amp; post must reach 5,000 comments to trigger this giveaway.....
Comment “ #apejet “  and teg your 2 friends",0
fjchey5,"ahh ok, that's a shame. thanks for the insight","Depends on how the shipper sends it.   If they send it via post, then Aust Post handles it here.    But if they use a courier service like DHL or Fed Ex, then they handle it all the way to your door.
Most couriers will not deliver to a post box either.",0
1578317271956529152,@MundayJessica They clearly know your aesthetic ?,When your kids friend comes over for a sleepover and brings you a gift… and it’s a “f*ck the patriarchy” necklace she’s made. The kids are alright #feminism #patriarchy,0
1579804823494746112,@harjind66859698 Jrur bhaine... Dso kdo ayie?,@Kdhillxn_ Jalandhar ajo,0
1578470666017177600,"@thepaulwilliams I always look at the front row first then locks, then the 7, 9, 10 and 15, before saying a silent prayer ??","When you're looking at team sheets, which section to you look at first?

I don't look at the team sheet in order. 

I always go front row.

Then backrow.

Then locks.

Then centres.

Then the rest.",0
1579518475881807878,"@asharamjibapu_ Sant Shri Asharamji Bapu कहते हैं शरीर की मृत्यु यह तुम्हारी मृत्यु नहीं, शरीर के जाते हुए भी तुम इतने के इतने ही पूर्ण हो । #Bapuji #AsharamjiBapuQuotes","Man creates bondage, grief, tension and problems through action. He creates enemies through action; and when he performs good action, he achieves God through action. #AsharamjiBapuQuotes",0
fj7q6fz,Thanks :),Oh yes.,0
1572566576972562434,@mmpadellan That just made my day,"Start your day off right, with the stimulating news that Alex Jones is no longer allowed to run his InfoWars company, per a federal bankruptcy judge.

ENJOY!",both
fj54lo2,Xnxx,redtube,0
fj71lon,Must be a teacher on school trip.,"RTÉ coverage: https://www.rte.ie/news/coronavirus/2020/0301/1119467-coronavirus-ireland/
Connected to the confirmed case reported yesterday.",1
1579736922578366464,"@Royal000111 @RahulGandhi @HaricharanMudg1 @mangellife29 @Anilawadh1 @IamMitesh86 @Shrilek79943500 @Faiz_INC @BagwaniPawan @AbhimanyuSilwal @shamshad031463 @kumarmanishsd @PremBakshi10 @nasirkha879548 Respected Sir Ji,

Very Very Good Afternoon To You Too Also ????

Happy Tuesday ????

Have A Blessed Day ????",@Shrilek62669983 @RahulGandhi @HaricharanMudg1 @mangellife29 @Anilawadh1 @IamMitesh86 @Shrilek79943500 @Faiz_INC @BagwaniPawan @AbhimanyuSilwal @shamshad031463 @kumarmanishsd @PremBakshi10 @nasirkha879548 Good Afternoon,0
1572500266309779456,@dresdendoll So you want a spinHob?,"i need them to expand on hob gadling’s storyline and give him flashbacks. i want roaring 20s hob, world war ii hob, flower-power 60s hippie hob, 70s glam rock hob. give me all the hobs. 

#hobgadling #ferdinandkingsley #sandman #thesandman #thesandmannetflix #renewsandman",1
