id_text,text,parent_text,label
1572500647328755712,"@lupisdelupis That's right. Still, very impressive",@visit_leicester If I’ve read the press notes correctly doesn’t he get free coffee for a year or something for being there first?,0
1572561148721102849,@McLovinCakes Thanks love! ?,@TheGreatKingSIR Happy birthday,0
fj5aysi,All valid points.,"The NFL is rigged. 
I mean, there’s too much money on the line per game for there not to be someone wanting to fix it. And it’d be so easy to: you don’t need to even tell the players, just have a coach make a bad call in a critical moment or have a ref make a call a certain way on a close play and that’s it. 
The New England Patriots are one of the most successful franchises in history, in one of the wealthiest parts of the country that has a ton of disposable income and a love of football. That’s no coincidence. 
The browns moved to Baltimore because it was more profitable for them. Super Bowls are blowouts or close games based on the highest payers’ time slots in the game. There’s billions of dollars flying around every Sunday for a third of the year, you know someone is going to want to make sure it gets in their hands.",0
1578328763448033280,@danieljayregan ❤️,"Today I recorded people’s lips telling stories of loss in response to my recent film. It was heavy but wholesome: we cried, we hugged, we shared &amp; we said the names of those that are no longer with us. It is an utterly humbling privilege to be with people to tell their stories.",0
1572501133779955712,@DPJHodges Richard Edward,"It's also fascinating to see people on the Left suddenly screaming ""The markets are losing confidence in the Truss plan!!! Look at the pound!!!! Look at the ratings agencies!!!! We have to listen to the markets!!!!"".",0
1579886133617758209,@trafficchd @DgpChdPolice @Balramchd123 @Jitende09571247 @Balram39293137 @HinaRohtaki @nagarkoti @chandigarh_admn @aajtak Nothing happened and neither any PCR were came. What type of complaint you did?,"@VikasPandey_Chd @DgpChdPolice @Balramchd123 @Jitende09571247 @Balram39293137 @HinaRohtaki @nagarkoti @chandigarh_admn @aajtak @VikasPandey_Chd Sir, thanks for the information. We have informed PCR-112 for further action in this regard.",0
fj58l9e,What did she/he say?,You look like a stripper,0
1580368298532708352,@Jason_T_McC @calvin_knapp Well put!,@calvin_knapp Just think you’re off work and he’s still working and was probably up at 4 am to do the milking all so you can have food &amp; milk in your house. ? ? ?,0
1572553634575175681,@Bad_Money29 Thanks Money,@damnimwild Happy birthday Fat Bul,0
1580526465816616962,@Jaz4DT Followed,"Hey patriots can you please retweet and help me get to 4k followers.  I follow all back that follow me.
?? ?? Love all you Patriots
Bless you!!! ???  ??",0
fj60g4m,life is not a videogame buddy,"Idk why should I be afraid of someone coming to kill me. Fear keeps us from dying. I'm going to die anyway so rather than cower and beg like a pussy, I might just fight back the hardest I ever have because that same fear is going to tell me ""you must kill this guy or you'll die"" so I'll fight ten times harder. 
And I've seen these deffusers or pacifists get beaten to a bloody pulp while begging. That ain't gonna work. Either run, fight or do both. You're not fighting alone",1
fj5qb5h,You guys missing the point BJP is a party which creates communal violence like this and will gain benefit.,Political parties should never be tied so closely with religion. BJP should never have been a hindu party . All this bullshit would have never happened. Fuck religion for causing so much hate in this world.,0
1538155462729793536,@batemanjason I was lucky enough to not watch OZARK until this year so I got it pretty much all at once. It took me two months. Two wonderful months. I loved every character and their “badness”.,Just want to say hi and a sincere thank you to all the nice folks out there that gave OZARK a spot in their lives over these past few years. Thanks for liking what we loved making for y'all!,0
fj5a8t5,"Counting calories as a strategy to lose weight generally never works.   
Plus your eating low calorie ranch,  which is probably worse for your health at the end of the day.","The secret is to count your calories for everything you eat. Calories in - calories out. If you eat an actual portion of ice cream, that’s maybe like 120 calories which isn’t too bad. But if you eat the entire tub or a full bowl you’re in trouble. If you’re looking for casual snacks: veggies. I do celery with low calorie ranch, cherry tomatoes, broccoli, or carrots. I can eat so much for a relatively low amount of calories and it’s very satisfying. Also cut out all soda or drinks except water.",1
fj553he,Wow that is gruesome.,"The guys were fucking about crushing things with a 3"" thick slab of lead that's about 18"" x 12"" (metalwork class) with the teacher away somewhere. Mostly pens, but one of the guys forgot to move his hand, and it dropped on him, literally bursting his thumb wide open. It was a bit gruesome, and he went a bit feint. He was OK after it healed though.",0
1572383605598617601,@Logically_JC Cruelty is their policy. And hatred.,"It would be nice if Republicans could find just one candidate who isn’t a criminal.

Then we could focus on policy disagreements like adults, instead of their various crimes. 

It would also be nice if they had policies.",0
1537824575718932482,@dunkingwithfish ?,@ElaineARoche Hurrah! ???? well done that boy!,1
1538092701677146112,@PhilipPullman You mean the only European leader who has backed him unequivocally?,Boris Johnson ignores his responsibilities here and goes scuttling off to Ukraine in a desperate bid to be photographed next to the only person in the world who  likes him.,1
1572562145904295938,@readfrontier And you’re taking the press release from Norman Public Schools as factual to say she was fired for making political statements rather than sharing the book code.  The school took a lot of bad press and it appears they are trying hard to rewrite the narrative.,@readfrontier Question regarding the Norman teacher that remains unanswered.  Was she or was she not removed from her class that day?  That’s the real ask.,0
fj6woye,Other way round bud.,Didn’t know we had mountains named after rashers!,1
1580526302930821120,@turtlepace8 Lmfao I’m definitely muting all of it,@TaylorDeuce Just wait until people don’t hit on them ?,0
1538331758512447490,"@MalyndaHale Lol, yes. Not often. But yes.",Just curious. Does anyone ever use the back left burner?,0
1578390625833058304,@londyloo Yes and very easy. I think I made my appointment for the next day.,"Have you gotten the Bivalent covid vaccine? 

If so, how easy was it for you to schedule and get to the vaccine appointment?",0
1572562046075666434,@GeorgiaJaguar @Cubs Awe well thank you!! I really appreciate that!! ♥️,@TayDoll1010xl @Cubs I’m so glad you got away Miss Taylor and it ended well. You’re story is an inspiration to women all over the country and they need to hear it ? Plus you’re my favorite on 1010xl. ☺️,0
1579745007745273856,@Ooye_Alii Oky ?,Let's Follow Each Other ???,0
fj556r4,Ross?,"A different girls name, i called her Rachel and that was my-ex, she wasn't over the moon.",1
1538755893692604417,@cZrotot999 @MufcWonItAll @bobskino @EK3N3 This is the reason why most of these guys don't give access to fans. Why record him?,@MufcWonItAll @bobskino @EK3N3,0
1538618005726412800,@HangBlaa Only on bendy country roads without a hard shoulder.,"Would it be a good idea to require would-be drivers to do a few months of cycling, before they were given driving licences?",1
fj5ck2l,I do not believe that an obvious and fairly openly committed conspiracy happened to coincide with Epstein also deciding to take his own life.,"The theory that Epstein didn't kill himself. Memes aside, he could've probably exposed a lot more rich people for their sex crimes. They just bumped him off before he could do so.",0
1538539516981653504,@LiamMorgan2022 Ain't that the truth ?,"@KenmareFoodies You need to get yourself a hunting knife now that your camping in the wilds of Ireland in your camper.
It’ll come in handy for opening those packets ?",0
1579706714559238144,@PunjabGovtIndia ਸਰਕਾਰ ਬਹੁਤ ਵਧੀਆ ਕੰਮ ਕਰ ਰਹੀ ਹੈ| ਹਾਲੇ ਹੋਰ ਵਕਤ ਦੀ ਉਡੀਕ ਕਰਨੀ ਬਣਦੀ ਹੈ|ਸਰਕਾਰ ਆਗਾਮੀ ਸਮੇਂ ਵਿੱਚ ਹੋਰ ਵਿਕਾਸ ਦੀਆ ਨੀਤੀਆ ਲਿਆਏਗੀ|,"Vigilance Bureau arrested Davinder Kumar, Assistant Registrar, Co-operative &amp; Marketing Societies, block Dasuya, District Hoshiarpur red-handed for accepting a bribe of ₹20,000. Accused has been supervising 70 Cooperative Societies in block Dasuya including above said at Tanda.",0
1579116372239400961,@caitlinginley1 I haven’t found anything yet unfortunately. Just hustle through it,"@nbrez Been having them for weeks now, thought it was stress or weather related. Any good remedies?",0
1572499456322605061,@BritstoMotoGP Good shout.,@alexthepage Bob Mortimer,0
1572499247416901632,@Matt_Law_DT @johncrossmirror ❤️❤️❤️,@johncrossmirror I agree with you but interesting that both my kids (8&amp;7) LOVE the home shirt and suspect that’s more relevant than one 40-something and another 50-something…!,0
1578511123762274305,@ReturnofR If I could Turn Back Time by @cher,What SONG did YOU listen to TODAY?,0
fj5dzqh,Peter?,Push them down and fart in their mouth to assert dominance,0
1538005437693366272,@caie_w @WorldBollard On the @BMW calendar. @WorldBollard calendar will be much better.,@WorldBollard Where are the BMWs?,0
1580553251505643521,@CalltoActivism ??????,"BREAKING: Officer Fanone demands that Donald Trump be “held accountable” for the actions that led up to January 6.

Who stands with Officer Fanone and agrees with him? ✋",0
1572323966768877568,"@carl_lane @bevcraig @burohappold @StudioEgretWest @layer_la @OfficialTfGM @LCR_Property @civicengineers @PP_OConnor @uandiplc @ManCityCouncil @LandsecGroup The park will sit within the wider Mayfield neighbourhood. Around the 6.5-acre park will be new homes, offices, retail and leisure space.",@MayfieldMCR @bevcraig @burohappold @StudioEgretWest @layer_la @OfficialTfGM @LCR_Property @civicengineers @PP_OConnor @uandiplc @ManCityCouncil @LandsecGroup What's going to happen with the empty space on the left of photo (south of thr park)?,0
fj5cug1,"I feel the same way
The best roasts I've seen have been a creative and funny way to make fun of someone's appearance, the worst just come off as playground insults.","Roastme
Unfortunately, because The idea is great. But the actual situation is missing the point that it’s supposed to be about humor.",1
fj6a3pp,Probably an ocular patdown,"What sort of screening did they do? Blood tests?
There is no screening happening on flights to/from Ireland. The focus is currently on ensuring travellers are informed and having people self-report concerns.",1
1538542300753809409,@SharonNiBhriain @DCU @TheHelixDublin @rte_co I’m waiting for life membership!,@MGMolony @DCU @TheHelixDublin @rte_co You should just bring a sleeping bag and camp there! ?,1
1537708468345479170,@SueR10504678 Morning Sue thanks for the follow,@ElaineARoche Beautiful...so peaceful. Good morning.,0
1580525856597737472,@jsmcmahon21 Good morning hope you have a Terrific Thursday today ☕ ? ?,"Good morning Twitter. Positivity is extremely powerful, let's spread as much as we can today! ☕☕???",0
1572493016551817218,"@NeedraNmartins Do you remember one day a girl who thinks she is famous on Twitter scolded us a lot for the comment we made,A lot of other girls joined that girl and scolded us a lot, Remember,we kept our mouths shut because we didn't want to overreact.They think that only they are right?",@VindyaPeiris2 Some  says im aggressive .people  lables very  easily .without  knowing   the truth .recently one woman said im over reacting ??,1
fj71lon,Must be a teacher on school trip.,"RTÉ coverage: https://www.rte.ie/news/coronavirus/2020/0301/1119467-coronavirus-ireland/
Connected to the confirmed case reported yesterday.",1
1578282929612279808,@thestategovt This makes sense…,jack black… forever my celeb crush,1
1579646720656703488,"@RedmiIndia Ans. 5 &gt; 
Brainstorming made you build your own sweet paper pile. 
Opt for ""20,000"" pages on the #RedmiWritingPad instead.

#RedmiWritingPad #WriteClearRedoRepeat 
@RedmiIndia","This is your last shot to win today's #GIVEAWAY!

Q5. Brainstorming made you build your own sweet paper pile. Opt for _______ pages on the #RedmiWritingPad instead.

Comment with #RedmiWritingPad and #WriteClearRedoRepeat to win!",0
1572500148961378306,@RyanHoliday I've read this tweet and now plan to reply with a witty riposte,"When intelligent people read, they ask themselves a simple question: What do I plan to do with this information?",1
1579719291108483073,@Toshvaibhav @0xPolygon @0xAkashShukla @0xPolyAdvocates @0xPolygonDevs Thank you Vaibhav! Let's rock buddy together and help Ahmedabad with @PolygonAmd,@daxeelsoni @0xPolygon @0xAkashShukla @0xPolyAdvocates @0xPolygonDevs Congratulations @daxeelsoni bhaiya!,0
fj548os,Maybe you should give him more treats? :D,Dog barks at me every once in a while for no reason. New bad habit.,1
1578372326479269888,@ashton_avenue @BlairBelrosex Imagine that. ??‍♀️,@BlairBelrosex Lol I’m Indian… would hate if I got cancelled for my race ☹️,1
1572552063250477056,@thatMGOBLUEgirl Have a great day!?,@Justice_Born ?Good Morning!!✌️,0
1572373468280422401,@thetimes Shameful and embarrassing,"More than a million people lined the capital’s streets; four billion are thought to have watched worldwide. Her last farewell was an astonishingly colourful national ritual, Ben Macintyre writes",0
1572500762391105536,"@EmmaPinky83 Have a great day.  I got up, bought vodka, came back, ordered MacDonald’s breakfast, poured vodka into coffee.

I may be under a level of stress and anxiety at the moment. I also bought a massive slab of clotted cream fudge designed to be chopped up that am just biting into.","Wank morning, (before any pervs think I meant that literally I didnt) thank fuck I've been called into work earlier I'm off to see if I can shake this shitty feeling ?",0
1572502716597039110,@Joeytaylor123 Was about £1.61 all in the jokers,"@andy_cov93 Saves you what, £2,50??",1
1538275939171418112,"@PPeaksy ❤️??

Thanks as always xx",@Mel_Navan Wow!  Just Wow! ???,0
1572561388475920385,@zenshortz GM thanks for the reminder ?,Gm Gm anything is possible ☀️,0
1578600958992392192,"@iiNet Hello, thanks for getting back to me. Everything seem to be working find now. Thank you","@vishalcanberra Hey Vishal, there was a known issue that our engineers were able to sort out last night. How's your connection this morning?",0
1572557749841727488,@BenDTSPodcast Patriots defense is better than I thought it would be,What is most surprising about your favorite NFL team through 2 games?,0
1538455672291004417,@MUFC1908 100 per. Cent. He didn't have a good season but no one around him ran into good positions either. It's hard to pick people out when they're stationary,"I can understand the frustration towards Bruno Fernandes, but to HATE him and send him abuse is just WEIRD!
He’s an EXCEPTIONAL player, tries things others don’t and when the come off is beautiful to see.
Hence the Assists &amp; Goals.
Class Act. Love him me!
#MUFC #ManUtd",0
1578281747342823425,@merry_burke @ACTA_org @JanelleBowden can you help?,@ACTA_org I have filled in the application form from my phone and it isn't clear what I need to do next. Do you have it??,0
1579847273663827969,@amansingh27_ You were there that day? This was during Soshti morning?,"@subhrankarmakar I also noticed her at Daw Bari. Infact, all the photographers who went there to shoot Durga Puja has noticed her too because she's such a cutie. ? 

Loved the photograph!",0
1579175936422912000,@TLRatSaltaire @blaireve @PlayhouseDerry @joecoombsguitar @Jamienarco @scottwarmanbass @stradaagency @Medicinemusic @BalorArtsCentre @derryjournal It was our absolute pleasure! We Hope to come back again :),@AnnieKeatingNYC @blaireve @PlayhouseDerry @joecoombsguitar @Jamienarco @scottwarmanbass @stradaagency @Medicinemusic @BalorArtsCentre @derryjournal Well done on your tour. Thank you for your brilliant gig with us!,0
1579729940236636162,@Aisha11ug Hoooo,"I am not an addict. I just have a f*cking  problem. When I want, I don't take no for an answer.",0
fj5ywjs,You should try asking in /r/whatisthisthing,"Reverse image searched it. The result was ""Firearm"". oof sorry couldn't find anything.",0
1579742180264284160,@chef_rk @spmayurbhanj @DM_Mayurbhanj,"Us to book two rooms as they still practice ""unmarried couples not allowed"" ancient rule. How does one say ""Odisha by Road"" when this is a major problem.For a young working couple coming to say Mayurbhanj where do they stay?? Why not activate the Dak Bungalow circuit",0
1572500162882449409,@paulrtrotman I can't believe people are still moaning about vaccines. If u don't want one.. don't get one.. but please.. spare us the complaining.,"In the UK ?? there is no more track and trace, no more masks, mandatory vaccines for jobs, no restrictions. So, no emergency. So why is a ""vaccine"", that is only licensed for emergency use, still being pushed!? Isn't it illegal to do that? ?",0
fj7btdx,"Completely understand your sentiment. It's tough. You're always overthinking some aspect of said friendship be it straight or gay guy. Very frustrating. 
Absolutely, I'm loyal to a fault and if I make plans with someone I will always stick to them unless I'm sick or something. Very rare nowadays to get someone who will do that for you.","Making mates as a fully fledged adult is a widely shared challenge. Being a gay lad also has its own unique problems attached to the challenge. I agree with your sentiments with regards to other gay guys. It’s very difficult for many, myself included, upon knowing someone new is gay, to separate their sexuality and not consider having sex with them. Just thinking of someone in that regard is going to really skew the foundations of a friendship developing organically.
On the other end, becoming mates with straight lads, I’ve gotten great at shutting down notions of dating or sex with a guy once I find out he’s straight. Yet there is a general sense of unease when I meet new straight guys, I think most of it stems from me being overly cautious to  ensure they don’t think I’m in any way coming on to them at all, I would hate to make someone feel uncomfortable in that way. So baseline friendliness is reduced as a result because I’m over-compensating for them knowing I’m gay and being perhaps sensitive to anything I may do or say.
Clearly I’m reading a lot into it here, but I ask myself similar questions as you appear to be. The friends I have made as an adult have been through work and one guy I did briefly date that we managed to transition to a good friendship. 
Whatever your avenue, gaming, sports, acting etc. so much of life, of success and of friendship is just solely about showing up, being present and demonstrating that you are reliable. Flakiness abounds in society lately so defying this trend says a lot nowadays. I think many people say and state they are into this that and the other, but say it simply to appear and fool themselves as being interesting engaged people but who rarely if ever actively participate in their stated hobbies.
Instead, actually go to that event, attend that talk, enter that competition, in the words of the great Shia La Beouf; “just do it!”",1
1578269432861757440,@9_Moley Back to bush footy,"BREAKING NEWS!
Former NRL player Curtis Scott has been found GUILTY of three charges against his former partner, Tay-Leigha Clark.
Details to follow.",0
fj5e561,Yup,Probably BoTW and Minecraft,0
fj713xj,"LOL! She's priceless, though she may not say the same about me.",What sort of Missus are you looking to replace her with?,1
1572577189312483329,@bluertwo Prince,Queen or Prince?,0
1579725059555753984,"@angadc @nandz It is just some beer, most of the fat has been worked off by running behind Boyzilla who is getting damn fast now!","@kushanmitra @nandz For what it’s worth, the best way to work a belly off is calorie counting",0
1546162227773771777,@elonmusk It is more dangerous than people think!,Is TikTok destroying civilization? Some people think so.,0
1579037055115358208,@linseygibson @Ryan_McCready @RobbieButlerMLA @BeattieDoug @uuponline It certainly has been!,@iamfifig @Ryan_McCready @RobbieButlerMLA @BeattieDoug @uuponline My memory was the conference last year too fi! What a rollercoaster of a year it’s been ?,0
1578344522698100737,"@BronwynHill1 It’s disgusting,some men are predators and they will do absolutely anything to rape a woman,dirt bags of the highest order. Ian",The blame put on women for not stopping themselves from being raped will never not shock and disgust me.,0
1580526144017006593,"@yaitskayy If we talking OG starts, I got my squirtle squad!",fuck your zodiac sign what pokémon do you start with,0
1572500144805007364,"@ANR_Precision @MarketingR50 @AerzenMachines @mehrabdhar @NuGroupSL @DipSlides @The_Expert_Eye @ami_dank @SuperDivineWeb @DiskelLtd @RFLogisticsltd @WACookeGroupLt1 @IntegratedLogi5 @DotsandIs @Mobileshopco @RTBellCo1 DIVERSE
REWIRE
CREEDS

(I can't see anything else for the last one!)","@MarketingR50
@AerzenMachines
@Mehrabdhar
@NuGroupSL
@DipSlides
@The_Expert_Eye
@RuariJM
@ami_dank
@SuperDivineWeb
@DiskelLtd
@RFLogisticsltd
@WACookeGroupLt1
@IntegratedLogi5
@DotsandIs
@Mobileshopco
@RTBellCo1
How many can you get?",0
1579059229511802881,@GuyLodge @philford There’s an episode of Seinfeld that hangs around the characters not knowing what mutton is.,@philford One time I was cooking dinner for friends in the US and the way I had to *hunt* for it in the supermarket,0
1572500487873892355,"@tompearce49 Me and all my family and friends..massive, cultish mournfest.",Is there anyone else on twitter today that didn't watch any of the pageantry on the TV.,1
1538456342813458432,@mcnamara_aidan @DLynchSport Twas no penalty! Watch replay u see at least 2 clare backs ar there.,@DLynchSport Good win against a very average Wexford team. Subs &amp; fitness were the difference. FB line quite poor though. Wexford denied a stone wall penalty at the end. Both Clare midfield taken off too. Won't be good enough in the semi,0
fj545yk,His music doesnt seem so good in my opinion. It is just bland and the same.,Drake,0
1572561265297620996,@RonnyJacksonTX Have another drink,"If Kamala thinks a bus full of migrants outside her home is a crisis, she needs to see what Texans are living with EVERY DAY. Sorry the immigration crisis finally makes you feel uncomfortable, Kamala. IMAGINE HOW WE FEEL IN TEXAS!!",1
1580040527558287364,@anujtiwari11 Doctors' community themselves had made antibiotics a norm rather than an exception. Sad state of affairs. Patients now need anti-antibiotics councelling.,"Two most difficult areas in counseling in medicine -
1. Convincing a patient with widal positive test that they don't need an antibiotic
2. Convincing patient to start/switch to insulin when the situation demands.
#MedTwitter
Any other issues frequently faced in counseling?",0
1572191892846301184,@_HowSweetItIs__ What is it please let me know,"Scientists have discovered a way to combat anxiety disorders: This breakthrough remedy also helps people cope with depression, fibromyalgia, chronic pain, nervous exhaustion, and other conditions. Don't put it off any longer because demand is increasing by the day.",0
1537914172360445952,@grainfole @ShaneSaint I hope to God Wexford show up tomorrow or it ll be like the Kerry game with Wexford playing the part of the Kingdom men.,@ShaneSaint Wexford had a tougher league campaign than Kilkenny etc. And we've beaten all the other 5 teams left in the championship this year,0
fj50bdp,"Shat my pants only looking at the title, never scare me like that again man",Finding Nemo. That shit was scary as fuck,1
fj656z3,"But with more global warming we can have more freak storms.
Invest in coal. Invest in the future.","You are in the middle of storm Jorge!
Not taking away from the increased input of green energy into the grid, that's awesome, just pointing out that what you are seeing isn't the norm and we still have a ways to go until it is!",1
1572480856056561666,"So, i woke up just before 6am in this house my friend is renting.... We arrived last night after dark with a car absolutely stuffed to the roof with every wordly possession &amp; 12bt of wine #WinemakerThugLife","A question: is it typical that people in Frome drive like absolute arseholes at pre-7.30am ? 

Because I'm going to tell you a little story:",0
fj537f7,That’s really wholesome and sweet :),My boyfriends arms,0
1538140637937147906,@SButlerHughes ?Sharon x,@NoeleenMcLaugh2 Sending love Noeleen ❤️,0
fj5preb,"I think people should appear for a test based on politcal knowledge when it comes to voting.And I kid you not,only 25% would pass it.
And if something like this would to happen,you'd see a different party in power. For the good.
I don't know how a democracy is supposed to work with so many illiterates and uneducated people in the country...who vote for things like Balakot airstrikes,and sanctions on Kashmir.
This is why Socrates hated democracy with so many illiterates in a country/place.
Just a friendly reminder that 30cr people voted for BJP,which is why theyre in power dictating 130cr+ people.","I agree. RSS and BJP, eat gobar and fuck yourselves. Itna gobar bhara hai dimaag mein inke. Poora brainwash ho chuka hai.",0
