id_text,text,parent_text,label
fj9gh4x,"Not sure of the downvotes, that sucks regarding your friend","I have a friend in the RFS and he did not once get a call out for the bush fires over the summer despire being available, he has been in the RFS for over 5 years. I think the RFS management needs to get their act together.",0
fjcsy63,"I'm of two minds about this - on one hand, people are obligated to abide by their visa conditions no matter how long they've lived here - if you don't your visa will be revoked.
For most immigrants, the pathway to citizenship is fairlystraight forward, so if they choose not to become citizens,that's their own fault. 
The dame can't be said of our kiwi brethren for them it is difficult if neigh on impossible to gain citizenship.  That we allow them to come here and live indefinitely without giving them a chance to become citizens is morally wrong.","We shouldn't be deporting people to countries they've never lived in or only lived in briefly as a child and have no connection to.
Dutton is just another fool trying to be a hard man at the expense of basic empathy.",0
fjcsw8b,No it's not.,"Once people think that everything is created by God, thinking stops.
Whatever happens, is the work of Gods",1
fj9hatt,That's phase two if the containment fails actually! They prioritize only those who have serious symptoms and let everyone else ride it out.,"Seems to me that it's probably been spread in the dublin region but most people would not attend the doctor to be diagnosed if it was a minor cold. 
I can't see any real decisive action from the health officials until people start getting seriously ill.",0
fj9py68,4 is the perfect cup. Any stronger and you might as well not have milk and any weaker and you might as well not have tea.,I'm a 4 and I get dog's abuse for it.,1
fja3paf,Who and what,Must feel good to be Adama Traoré right now.,1
fjcj63z,"It's always going to be ""our"" fault for voting them in.
Never their fault for being corrupt PoS that shouldn't be near government at all.","It's not an exaggeration to say that Australia has been slowly creeping towards ideological totalitarianism. As the media landscape shrinks even further, I despair that we may drift even further to the right as a nation with an endless stream of corrupt neo-liberal sociopaths in charge for the foreseeable future.",0
fja4309,"Ive seen them all, dont recall that one to be honest? :P You sure you wernt watching Halloween?",I remember an episode where someone stabbed someone through one of those vented wardrobe door things like this and it shit me up so badly I couldn't go near the one at my Nan's.,0
fja1ayv,I am sure this is it.,"Is this to gain sympathy or what? He is a showman, he aint going nowhere.",0
fjcgopx,With that attitude. We still would have been slaves of britishers.,"Lol. They said they will demand resignation of HM. 
Aiming for the stars I guess",1
fjcn60e,">Fighting each other?      
We don’t really have a choice in that, its a state sponsored contest with the aid of certain media agencies.  
And our regressive culture is helping all this shit.",Because we as an Indian fighting with each other over religious stuff instead of working towards the growth of the economy.,0
fjaswms,I don't understand why people can be so selfish.,"Our old neighbour used to have a Nissan skyline he used to rev the shit out of between 5am and 6.30am every damn day. I thought it would stop when he swapped it for a land rover discovery 3 but nope. He would rev the shit out of that too and then leave it to ""warm up"". Where he parked used to be more or less directly under my bedroom window. He was such a wanker. So glad we moved.",0
fje48l5,Most Brits I know are fairly sound and if anything are more just uneducated about the not so nice parts of their history. Its them-uns up North that have a hard on for the Monarchy that I would be worried about.,Anybody want to check /r/unitedkingdom to see if they have a shit fit about this traitorous act,0
fje1rba,"A lot of Blanchardstown is really nice. It's a very big area. ITB is closer to Mulhuddart than it is to Blanch village. Mulhuddart, Fortlawn and most of Corduff are shitholes afaik.","eh... have you been to blanch ? lol
I remember arriving at ITB each morning after a weekend there'd be a new burnt out car in the far side of the car park. ""natives getting restless"" - was the best phrase I ever heard.",0
fjcelsw,"This article doesn't shy away from calling it a pogrom tho. In fact it emphasizes on calling it so. All it says is, acknowledging that some Hindus also lost their lives at the hands of Muslims doesn't discredit the fact that this was state sanctioned violence - a pogrom.","Everyone already knows about the states complicity in whatever is happening and has been happening. This isn’t a case of both sides. Hindu supremacists were voted into power, they introduced an anti-Muslim bill, Muslims in Delhi and other parts of the country protested, the centre sent mobs to indiscriminately kill Muslims, loot them, rape them and destroy their properties. Mosques were destroyed and they raised a Hanuman flag on top of a mosque. The police also took part in this. 
Then why is it so hard to say that this is a pogrom against Muslim people? There is overwhelming evidence, and has been for a while now. You’re looking at Kashmir, UP, Delhi. All of the statements coming from the government are blatantly islamophobic, BJP supporters are blatantly islamophobic. So why can’t the obvious be stated? Why does every story in the news cycle have to be about both sides, when it’s just one side that is disproportionately affected?
The basis of this entire article is bullshit.",0
fjanam4,Someone said Shell but no confirmation on that.,Can they name the fucking company so the employees know to look for any sign or symptoms.,0
fj9mnc9,Hes very good to listen to.,"Tested my 1RM on Saturday. I usually train fasted out of preference. It was not a good idea to go try hit my maxes with no food since the night before.
By the time deadlift came around I was fucking spent.
Squat: 180KG
Bench: 110KG
Deadlift: 170KG
OHP: 70KG
at 80KG bodyweight.
Pretty disappointed with DL, but others were pretty much what I expected.
&#x200B;
Also went into Thrive Festival. Not a bad setup. Listened to a talk by Daniel Davey the Leinster Rugby/Dublin GAA nutritionist. Was a good talk",0
fjbz8p1,Unlikely.,Can we expect Indians to start getting tested by government soon?,0
fjcqrzs,Brainless comment.,"Be the change you want to see, don't just moan",0
fjaxkkj,It’s a joke you dim witted spastic.,"Bullshit, that definitely didn’t happen.",0
fjd1tvp,"Thanks, IF.","You will need ID and proof of address. If you already have an account, and you can prove that, you should be OK. They are issuing SSCN codes that you can use to identify yourself as an account holder.",0
fjcnqgy,I asked the same question.,how can they just rule out the possibility that the guy got it from China just because he spent 14 days overseas when there are cases where the incubation period is much longer than that?,0
fjaij2s,"You can freeze it and it’ll be fine. 
I always have 3/4 loafs of bread frozen, handy if you forget to pick some up or if something happens, like the snow. Unusual but handy a few times a year.","It will all be stale ina week too, but the shops will still be open...",0
fjcnqsu,By killing the bourgeoisie either financially or even literally.,The cow lovers sprinkle cow piss. How do communists 'purify' a place?,1
fj9el71,That's the one.,"If it's a chesty, phlegmmy cough, I'd recommend exputex",0
fjbksjh,Why are you downvoting him? He’s right!,"Pretty sure one bigoted person made that decision and it’s gotten a lot of bad press and the people have reacted badly. 
Be surprised if it’s not all overturned.",0
fja2pci,why? what did you do to the poor guy?,We went to Glasgow and nearly got stabbed by some fella in his 40's,1
fjciksy,"Then you don't want to think about bus and train poles, public bathroom doors/knobs (like Central station) and 711 hot dogs!",I am a germophobe and ATMs and shopping trolleys definitely make me uncomfortable.,1
fj9x2hm,So would you never pay for any recipe book then?,"£4.99?? 
There are thousands of amazing curry recipes for free on BBC good food. Plus they're user rated by normal home cooks so you get an idea of how realistic it will be to get it right.",0
fj9tcyy,"I was told it was a contraction of “by our lady”, ie the Virgin Mary. So technically swearing, but the BVM’s view on the matter has not been recorded so I can’t say whether she minds.","I got into deep shit  for saying this as a kid, it was explained to me at the time that it was an oath/sweary word  that was derived  from ""the blood of christ"" not as in eat my body, drink my blood for wafers and wine, but the dripping blood as he was tortured and was dying on the cross, representing the sacrifice made, So as George Carlin would call it in his seven words you cant say on TV, its dirty, but only part of the time.
Side note this was from a family where  a ex-coal-miner grandfather would frequently say 'bucking' with the same context and vehemency as fuck,  eg) ""bucking hell!"" or ""bucking television!"", that was perfectly accepted because he didn't actually say fuck, your chosen deity forbid you actually fucking swear!",1
fja3wfg,Probably to the USA ..best hospital there .,I wonder these people go to pharmacy or gau sala,1
fjcbrt0,"MOVE ON FROM THE PARTITION 
The descendants of people (myself included) that experienced the partition have moved on. Why can't you people?",less discriminatory than partition though.,0
fjesqhh,">  don't give into the fearmongering 
>but if you ask me it's pretty sensible to stay the fuck outta Dublin rn
....","I know everyone is saying don't give into the fearmongering by the media, but if you ask me it's pretty sensible to stay the fuck outta Dublin rn. The only two cases are there, and tho they've been ""contained"" there could be more, especially if they've only tested 392 people. It'll obviously get worse as the weeks go by, Paddy's day will be a melting pot for spreading it even further. It's not looking positive lads.
Fucking hell it's only March, can 2020 just fuck off?",0
fjcn8cw,"Most catholics I know in Ireland have a brain and are compassionate & accepting towards others, unlike in America where they just use religion to hide their hate.","Many Irish Americans who care about parades are still card carrying Catholics. So yeah.
Are the super Catholic old schoolers in Ireland also lgbtq+ allies? Or do they also go with what the Church says?
Or have even the old school over 50+ folks turned away from the Church at this point?",0
fj9hynz,There's a ton of useful info in your post! Thank you so much!,"Tinder - People are mostly looking for casual relationships and are very out there about wanting to hookup. Because of how famous it is, it attracts all sorts of crowd. Personally I thought it had a creepy vibe.... more scope of getting pervy messages. I would be a little careful here.
Hinge - Hinge is the most favored one, the crowd is fairly decent. The platform itself encourages open discussions and keeps the conversation fun and engaging. Men on hinge are better at conversations and it has less creepy vibe. Though they are good I didn't find many guys who were looking for ""marriage"" they were open to dating, meeting and taking it from there. Hinge felt like a safe space to talk to cute guys and work on your dating skills, and you do end up meeting cool people.
Matrimony sites - Shaadi.com involves creating an extensive profile with lots of details. It allows you to restrict your search related to caste, religion, veg - non veg, smoking drinking etc. The agenda is very clear so everyone on that site knows they are looking for a life partner... conversations are more honest and open... Though there will be lots of people who will reach out to you , dont be surprised if some guy's mom or brother reach out. Have clear boundaries about how much you want to engage, and set the expectations from the get go. There are some good guys there, but you gotta keep looking!
Overall - Have an open attitude, meet people , talk to them and be safe!",0
fja30m3,I don't find him funny either. I watched a video of his to try and understand the appeal and I almost fell asleep,"They're like that Pewdiepie fella for me. Nothing against them, don't dislike them, but they're not at all funny and I cannot comprehend how they are popular as they are.",0
fjc3mzk,"Nah, I’m making it about parliamentary and judicial sovereignty, not the monarchy. The Queen can stay in England and have fuck all to do with Australia, thanks.
Australia is a de facto republic anyway (‘commonwealth’ is actually a synonym for ‘republic’) and while I’d like to become a real republic, I reckon the Australia Acts are way more constitutionally important to us as a sovereign country than the arrival of the first fleet.","You are still making ""Australia Day"" about the British monarchy so I don't think changing the date to today is going to fly with the people protesting about the current date... of course I don't think any date is going to suit them.",0
fjdzgd6,I got a letter from Cadburys with a town that doesn't exist as well as a county that doesn't exist. I've no idea how An Post got that letter to me.,"Unfortunately, while Bus Éireann and Iarnróid Éireann accept the Student Leap Card as proof of your student status, Dublin Bus, Luas, Dart and Commuter only accept it.
An Post are usually very good at getting things to the correct person. If you're at 50 Fitzwilliam Street and they send it to 15 Witzfillian Road, I'd say it'll get to you.
There's not much that they can do to trace you, but if the same inspector catches you again, he might call the guards. If you're found guilty in the District Court of deliberately evading your fare (and while the inspector has accepted you acted in error, rather than fraudulently, by purchasing a student ticket you weren't entitled to and gave you a Standard Fare Notice instead of prosecuting; if you've given him a false name and address that is an attempt to evade your fare) you face a fine of up to €1000 plus costs.
What is the reason code on your notice? 
If you appeal it right away it's frozen at the lower rate of €45 instead of going up to €100 (if not paid in 28 days) until the decision is made, so if nothing else this will allow you some time to get the money together.",0
fjc575e,"> I'm autistic and cannot stand that kind of language, he decided to rape and murder her because he wanted to, that's all there is to it.
I totally agree with you.","What an evil little tool. In the article they said his lawyer is claiming his behaviour wasn't entirely his fault because of his autism...I'm autistic and cannot stand that kind of language, he decided to rape and murder her because he wanted to, that's all there is to it.",0
fjccvim,"Look mate, who cares about people's health and well being when our institutions are going broke. /s","It was such a brilliant idea to have the students back. 14-day offshore quarantine works so well. Who thought this could be coming, right",1
fjcs7ym,Can't tell if this is sarcasm or not....,"I'm sure someone who describes themselves as a ""professional lover of movies, games, TV, etc"" won't be out of work for too long.........",1
fjbyxks,Makes sense. They were literal allies pre independence.,"RSS is actually the B Team of Jinnah.
They are proving Jinnah right.",0
fjcpqhj,u/catwhamen Mera bhi kata tha usne,"NOTICE
&nbsp;
SHARMA-JI-KI-LADKI MISSING
This is to inform you that Sharma-ji-ki-ladki working  in catfish.org has been reported missing from December 2019 evening around 7 pm. She is 4'7"" tall, medium built. She has a katega scar above the left eyebrow. She was last seen in RDT catfishing innocent boy.  Anyone who sees her or gets any infomation about her is requested to please inform me or sharmaji.",0
fjb3m9g,"Market and also Muslim countries didn't say much about Xinjiang as well and didn't do much about rohingya genocide. 
The middle east is kinda like in a cold war like situation.","Legit question: if shit does hit the fan, can Muslim countries refuse to sell us oil? Or is our market just too big for that? We get most of our oil from Saudis and Iraq
Historically, has it ever happened?",0
fj9v51t,He was right that would have been brilliant,"GF used to work there in marketing they get these requests daily.
A former director wanted to bring them back but marketed as Oliver Twists. He was advised this probably wasn't a good idea.",0
fj9g7ms,"Based on the WHO report yesterday, of people who have contracted Convid 20% require hospitalisation (5% require artificial respiration & 15% require only concentrated oxygen). If it spreads our hospital system isn't going to be able to cope.
""Severe cases are defined as tachypnoea (≧30 breaths/ min) or oxygen saturation ≤93% at rest, or PaO2/FIO2 <300 mmHg. Critical cases are defined as respiratory failure requiring mechanical ventilation, shock or other organ failure that requires intensive care. About a quarter of severe and critical cases require mechanical ventilation while the remaining 75% require only oxygen supplementation. ""
And from page 12:
""Approximately 80% of laboratory confirmed patients have had mild to moderate disease, which includes non-pneumonia and pneumonia cases, 13.8% have severe disease (dyspnea, respiratory frequency ≥30/minute, blood oxygen saturation ≤93%, PaO2/FiO2 ratio <_300 and or lung infiltrates>50% of the lung field within 24-48 hours) and 6.1% are critical (respiratory failure, septic shock, and/or multiple organ dysfunction/failure).""</_300>","I know a few people who are acting like it is doomsday stocking up on everything.
I know several people that don't give a shit.
I know some people that are just avoiding crowds/sick people/using common sense and washing their damn hands.
Honestly, if you didn't give a shit about flu season for the past two decades, why are you acting so scared or proactive around covid virus?",0
fja3l7b,Chinese McDonald's >> any McDonald's elsewhere. Especially their fried chicken steak and the grilled chicken burger (坂烧鸡腿堡) is amazing and only sold within China.,"I've done a similar thing.
I live in China and McDonald's deliver 24/7, but at the time, after 10pm they only do a limited menu, and you have to buy whole meals.
Well a few of us drunkenly went back to a friend's at about 2am, all hungry, one guy wanted two Big Macs but nothing else, someone else wanted a double cheese burger and nuggets and I wanted nuggets and chicken wings, plus god knows what else 
I explained its meals only and everyone was alright with that, and then the guy turned up and we must be have about 8 large cokes and fries and then all these burgers and nuggets and chicken wings.
Next day I guess the guy woke up forgetting what we'd done as we all got texts asking when the fuck did he open a McDonald's franchise
Good times.",1
fjcpqg3,I'm not sure how you can read social media and think we're not,The powers that be really think we are thick as fuck.,0
fja6wxy,Time to ask your crush out now,The first corona virus death in the US was in the town next to mine.,1
fj9kbdx,"Most of the article is behind a pay-wall, but the first few paragraphs are suitably appalling.",Abuse of teachers and school admin (particilarly female staff) is chronic.,0
fjcv6yu,"Did you even read the article?
> GIMS, which is currently under testing, will be used by govt departments for secure official communication","so they can monitor all messages ? lmao
a SARKARI whats app what a joke",0
fja2ujq,"beep. boop. I'm a bot that provides downloadable links for v.redd.it videos!


Download via https://ripsave.com


Downloadable soundless link


Audio only


First link is active for 6 hours. Mention me again if it is down

Info&#32;|&#32;Support&#32;me&#32;❤&#32;|&#32;Github",u/VredditDownloader,0
fjaty0c,I don't want news to my bias (which I don't deny having). I want an almost algorithmic source of news that is just factual and without opinion.,"It sounds like you're looking for a source of news that conforms to your own expections/political leanings.   That's not what RTE or other non-agenda driven sources are for.
Stick to twitter.",0
fja8z2o,Yeh superpower mujhe bhi chahiye,I am just going to fap as many times as I can and then go to sleeeeeep,0
fjaxmrt,"The first study I found suggests otherwise, giving a figure of 0.73mm/year.",Yet strangely the seas are not rising in Sydney Harbour,0
fj9t02q,Should she have chucked em in the bin or something?,"Like they way the theft of the wood and for use as burning in her home is skipped over so easily. Sure look it, I've planted a few saplings in its place your honour.",0
fjc6r5j,the best is when the sign says it'll be there in 2 minutes and then suddenly switches to 6,Buses simply not showing up. Happened to me probably 8 times in a year where I’m late for a lecture or just anything really because a fucking bus decided to disappear.... legit happened to me today so needless to say the wound is still fresh :(,0
fjcwm82,My mum told me that the farm made a profit one year. Just one. Dad immediately went and bought more cattle and was back to the usual loss the next year.,"there are 120 acres of land in front of my house and ive been told i can do whatever i want when its mine, but no forestry, funny considering the farm made no money last year",0
fja37z2,Aur mai?,Happy Birthday to pyaare redditors :* u/rorschach34 u/gumnaamflautist,0
fj9i0a2,"Wanna see a statesman, look no further than Angela Merkel. No wonder she did not shake hands with Modi. Modi does Mann ki Baat. Hindustan mein ek hi insaan ke paas mann hai. Baki sab to chutiye hain. Modi's problem is his bloated ego. That's what made him wave at no one in Dal Lake and use his raw wisdom in inventing new radar technologies. At the same time, he is a thorough coward. He does not want to face people. He does not want to face questions. He lives in his echo chamber of his flatterers and occasionally caters to modia.
I find Modi to be a very insecure person, scared, vengeful, delusional to an extent. He has another side though, which he presents to his audience,.. Brash, resolute, ambitious, flamboyant, dragon-slaying savior of people image. It is a projection. Such a projection would attract most people. He is a populist. One needs to though focus on what he does not do or does not say. That tells about the real Narendra Modi.",Zero press conference in 6 years. Much statesman. smh,0
fjdk01c,Okay.,That boy at bottom left can't be more than 14 years old.,0
fjan1dk,Oh please stop that kind of talk. Xenophobes exist everywhere in the world. You don't need to stoop to their level when calling out their xenophobia and bigotry.,Ironic how the European is the diseased immigrant when they complain so much about diseased Asians destroying their society.,0
fj9pwcn,Its not an India only problem though,"Fuck man, in India we have serious mental health issues.",0
fj9s79z,"I often wonder if anyone watching is a lip reader, as I usually swear at the little fucker","But it IS the slab's fault, little fucker.",0
fjca6sv,Pretty sure it didnt,it definitely  licked the saliva from the corner of your mouth while you slept..,0
fjaodk0,? the state of this twatter profile...,"> Reviewer. Theatre. TV. Film
Sure, but it sounds like you've got quite the back log of movies because this one came out about 3 and a half years ago.",1
fjc2scn,That’s why the real people who control this country deemed they had to go,This is really sad. These guys are effectively neutral and independent and provide primary news to most other media organisations.,0
fjaj4aq,That doesn't sound right at all,A bhakt friend told me that untouchability was designed to prevent such communicable diseases as the lower caste ppl who do the dirty work are more likely to have virus infections and such customs and traditions in Hindu religion that are criticised by ill informed liberals have a sound scientific reasoning behind them..,0
fjaq70r,I completely forgot I could do that; would've saved me hours of headache! ? Also: Thank you!,"Susannah Wise - https://www.imdb.com/name/nm0936418/
If you take a screen shot of a persons face and use Bing image search it can usually tell you who it is.",0
fjciuic,Bus driver sounds like he was on a power trip.,"Aside from tourists sitting in the priority season and ignoring me standing with a nine months pregnant belly, or the bus on New Year's with a bunch of young kids drinking who then started shouting ""Let us off! Emergency!"" while one of the boys vomited all over the bus floor, here's my favorite.
About a month ago I was leaving the GP with my daughter who was 4 months old and sick, so I had the pram with me to put her in if it started raining and she was strapped to my chest in the carrier because she needs a good cuddle when she's not feeling well. I get on the bus with my pram and go to sit down when the bus driver starts shouting at me that ""all unoccupied prams must be folded and stored!!"". He won't move the bus, and the pram doesn't really fold easily, not to mention how am I supposed to fold it down with a sick baby strapped to me?? I go to explain I can't fold it and the driver just keeps telling me ""all unoccupied prams must be folded and stored!""
I had no choice, I pulled my daughter out of the carrier, apologized to the people around and let them know she was going to cry and put my now screaming sick baby into the pram and said ""it's not unoccupied now.""
If I could have held my screaming baba up to that man's ear like a seashell, I would have. I get that rules are rules, but it was kind of ridiculous.",0
