id_text,text,parent_text,label
1572500435398979587,"@BlackScarfMarc I block and mute, most of the time it works. 

There’s loads of Arsenal that appear to want to see AFTV, talk ? and Sky only to rant back, it tedious and boring.","@willow1886 It’s hard not to bite against such arseholes to be fair, but people have to try.

Now Richard Keys is doing it to try and get clicks. The twatty journalist having a pop at Gabriel’s tweet the same recently. Straight from AFTV’s shameless ‘act like c**ts for clicks’ playbook.",0
1577779385301872640,@xskinn @softhardworker Ready on your mark … get set … now RUN away lol ?,I’ll be 62 in 15mins #Ians62. Ian,1
1572499713039167490,@RussInCheshire (Joke - it doesn’t work either),@RussInCheshire But have you tried magnesium though? ?,1
1572500629440049156,@suebeesley @trussliz Ah didn't see that. Still figuring out how bankers bonus will help us?.,"You can see how this plays out: @trussliz cuts swathes of taxes, mostly benefitting better off. Loses 2024 election (sewage/care homes/economy/NHS/sewage). Labour has to put taxes up to restore UK finances. Right wing press goes nuts. Tories get back in in 2028..",1
1580526031316078594,@BarryOnHere yeah you’re a ho,Retweet this if you think the NFL should suspend Brett Favre for his role in the Mississippi welfare scandal!!!,0
1538410758966587392,"@thepaulwilliams Yes agreed @thepaulwilliams, the URC will have a different focus next year and hope the Welsh regions get the support they need from the @WelshRugbyUnion","Loved the first year of the URC.

South African teams have literally changed the game.

Brilliant.",0
1578412887483199488,@Libaral_india Perfect…you nailed it….???,"पहिला सेट उद्धव ठाकरे यांनी जिंकला आहे नक्की ! 

शिंदे गट अंगावर येऊन देखील उद्धव यांनी फक्त शिंदे गटाच्या शिंगात शिंग अडकवून त्यांनी सेट केलेल्या अजेंड्या पुरते मर्यादित राहायला नकार दिला?",0
1580489340559376390,@Sharon48110 Happy Thursday Sharon. Have a fabulous day.??❤,@Forgetfulness19 Good morning ??‍♀️?☕️,0
fj54ip2,?,"PLEASE READ THIS MESSAGE IN ITS ENTIRETY BEFORE TAKING ACTION.
Hi there, your post has been removed for one of the following reasons: 


Rule 3: You must phrase the question to require more of an explanation than just ""yes"" or ""no"".


Rule 3: Questions with a single correct answer, that can be researched elsewhere are not allowed on AskReddit.


Rule 1: You must post a clear and direct question in the title.  The question must be a full sentence.  Try including question phrases like ""What is..."", ""What are..."".


If you have any queries or concerns, please feel free to contact the mods. Thank you.
I am a bot, and this action was performed automatically. Please contact the moderators of this subreddit if you have any questions or concerns.",0
1580383671248654337,@ChuckCallesto @PatriotXV11 Prayers for the family ?❤️?  #RIP,"BREAKING REPORT: Marine Recruit, Private First Class Javier Pong – [18 YEARS-OLD] – Dies After Collapsing During a Training Exercise at Camp Pendleton...",0
1572494111235624962,@DrRabbitfunk You should have heard the Russian bloke screaming on Radio 4 ? and I thought out politicians were batshit!,Fuck me! The Russian Gollum has announced partial mobilisation!,0
1580500580971094016,@m2dalew777 Good morning Dale.?,@Forgetfulness19 Happy Thursday ❤️,0
fj51lks,That's a lot of money,"Half of all the entertainment profits (movies, books, tv shows)",1
1572500212886773760,@amandanat Absolutely!,"People think optimizing for impressions means ignoring business goals.

But it really just means ensuring that your content gets seen.",0
1580525745688178688,@frecklequeen45 Good blessed morning luv.. hope you had a great evening,"Damn, I'm exhausted
What the hell's this all for?
Is this where it mends or it breaks?
Between a rock and a hard place
For the record, shit
Throwin' in the towel takes some effort
So I'd rather ride it out for better weather
Together ?",0
1538074159053516802,@Liverpoolfc8285 @cjhumanrights Are you trying to divert the debate or kid yourself?,@cjhumanrights If you ever wondered how the republican movement was brought to it's knees. Just read these replies. I'm actually embarrassed for them.,0
1580526367309205505,@HallieJ72 Hahahaha my reaction everytime!,@briannawrist OMG ?????,0
1578337228777918464,@ugcbymaia I have seen a bit of them in new York!,I want to do hospitality/travel ugc but I see little to no black creators doing this for ugc. It just has me wondering if it’s even possible. Brands do not champion the diversity they say they do.,0
1538242590738456576,"@Matt_Koury Wow - Well done South Africa for showing us some all attacking exciting rugby. Great game and well done the Stormers, had you wrote off at halftime?","Wow - Well done, Stormers! #URCFinal  ??",0
1579767615291265025,@neilesh_patil Chennai ka hoga but yaha 4 din baad Suraj nikla hai ?,@sleepyhead1892 gand fatati h bhai koi sunny bola toh..Chennai things,0
1579767181528961025,Mai yeh sounch kar tweet kiya koi traditional Dress batate ga?,no one looks good in traditionals lets just say it together...,0
1538294392942895107,@chunky66 @229london @SeaFeverBand @DimpleDiscs @DefinitiveGaze1 @ShamelessPR_ @Dannydeathdisco @MuteElephant @iwangronow @PhilCmusic @al_maguire @8RadioIreland @hotpress Thanks Garry! X,@KEELEYsound @229london @SeaFeverBand @DimpleDiscs @DefinitiveGaze1 @ShamelessPR_ @Dannydeathdisco @MuteElephant @iwangronow @PhilCmusic @al_maguire @8RadioIreland @hotpress safe travels guys and have a great time!,0
fj55dg7,You can't spell stupid without tape,Stupid,1
1578332890126905344,@reyannamaria Reyanna Sleepria,slay slay all day,0
1580520535066574848,"@MotherCluckyou Be Careful. Saw a show once where a guy tripped in his shop, hit his head on a table and knocked himself out. He had something in his hand that started on fire. Shop burned down.",Yesterday I was greedy and inpatient and burned my top lip with my hot tea. This morning I tripped on a kitchen rug and busted the inside of my bottom lip when I slammed into the kitchen counter. I will be taking instant oatmeal to work for breakfast and lunch today ???‍♀️,0
1578295258286559232,@PhilHanton @hendygolf How can LIV expect ranking pints when they play a completely different format (easier) than the rest of the other tours.,"@hendygolf Personally, the rankings are flawed for all three tours. Pgatour is rated too highly, European tour too low and LIV should have realised it would take time for them to get on it. Think the picture will be clearer in 12 months.",0
1572502685789868034,"@Ian_Burnett_ Spout what you like. It doesn’t take a nuclear scientist to see that Scottish people are much more able, smarter, caring, clever and compassionate. Beats me why anyone would want to be governed by the parcel of rogues that is Westmonster.","The people of Scotland had a vote on devolution in 1997.
They voted clearly in support of devolution and that vote has been respected with it's implementation.
Time for another vote to see if they still want devolution.
A lot has changed since then.
Is that how it works?",0
fj5df9v,Totally got sucked down the rabbit hole on this.,"That Diana Ross and Smokey Robinson are Michael Jackson's actual parents. That's why he was the talent in the Jackson family and why there were rumors that he was Evan Ross's father (they both look like Diana). Smokey would've been 18 and Diana 14 years old when Michael was born so Berry Gordy arranged to have the kid given to his old boxing buddy and fellow musician from Chicago, Joe Jackson, who he would fund leading to the formation of the Jackson 5. Joe had a big family where Michael would get everything he needs while training him to be an entertainer and Motown could protect their image by taking the child out of the picture.
It turns out the kid is a talent and as we all know the Jackson 5 make it to Motown, but even before that there were several documented instances of Diana Ross in Gary, Indiana such as at the school talent show where the Jackson 5 performed. She has said multiple times on live television that Michael is her baby/child, says she's doing it all for him, and joked about him playing her son in a future movie. She has also said publically she was in love with Smokey Robinson growing up, living on the same street as him in Detroit, which is odd because he had a girlfriend during that time who he later married. Diana also changed high schools around the time Michael was conceived (when she would have gotten pregnant). She was going to Cass-Tech to study home economics and Smokey also enrolled in an engineering college around this time, because they were soon to be parents and Motown hadn't broke big yet. A decade later the Jackson 5 auditioned for Motown in Detroit, then did a second performance at a Motown get-together at Berry's house, and Michael has stated that at that point Diana told them she wanted to take special interest in their career.
There's a movie called Double Platinum which stars Diana Ross and is about how she gave up her kid for her career and later reveals to the kid she's her mother when she sees that the kid has talent, then goes on to help her with her career which would parallel the real life story with Michael. Her daughter in the movie also wears a dress that has the same design as the shirt Michael wore for Billie Jean at Motown 25. It's written by Michael in his autobiography Moonwalk that he and the Jacksons lived with Diana Ross in Hollywood Hills when the Jackson 5 first signed to Motown and moved to LA, and her and Michael used to go out almost every day, just the two of them. This would have been when Diana Ross revealed to Michael she's his mom, he would've been about 10 years old and that's why he became quiet and shy from then on. (This wouldn't be her only time doing this, when she had a daughter with Berry Gordy she didn't tell her who her father was until she was 13.) Smokey Robinson also stated when he was leaving the Larry King interview shortly after Michael passed away that one of his fondest memories of Michael was when he used to go golfing at the age of 10 or 11 with him and Bobby Taylor, who is said to have discovered the Jackson 5 even though their first album at Motown was presented by Diana Ross. 
This was also what Michael meant in the song Billie Jean when ""this happened much too soon, she called me to her room"". Diana was the one who said ""I am the one, but the kid is not my son"". She meant I am your mother but you're not my son, you're a Jackson now. Diana Ross is Billie Jean (Diana plays a character called Billie Holiday in 'Lady Sings the Blues' which came out a few years before 'The Wiz' with MJ). This is also what the song Dirty Diana is about, it's about Diana Ross the groupie who seduces Smokey Robinson, who she grew up on the same street as, conceiving Michael. Then there's the song Who Is It which is about a mystery person who abandoned Michael, and in the music video he holds a card that says 'Diana'. The song Wanna Be Startin' Somethin' also talks about how ""if you can't feed your baby, then don't have a baby"" and again refers to the mystery Billie Jean character. He references Ain't No Mountain High Enough in the song Leave Me Alone and says ""Don't you come walkin' beggin' back, mama"". He also references Ain't No Mountain High Enough in the songs Baby Be Mine, Speechless, and Keep The Faith. This is all also why you see a weird sexual dynamic between Michael Jackson and Diana Ross but you will never actually see a picture or video of them making out.
Recently a video surfaced of Diana Ross singing You Are Not Alone to Katherine Jackson; just like how she probably used to sing Ain't No Mountain High Enough to Michael when he was living with her. This is seen in the aforementioned movie Double Platinum as well, Diana sings her lost daughter to sleep with a famous song. And in TMZ's video ""The Last Time We Saw Joe Jackson"" an old senile Joe says ""I raised Michael, he's my son and Quincy Jones knows better. I don't talk about it, no way."" He's defending the supposed fact that Michael is his son for a seemingly unknown reason, and even in past interviews he always emphasized ""he's a JACKSON"". After MJ's death, Joe when interviewed said he was doing great, meanwhile Smokey Robinson went on the Larry King show and praised MJ as an artist.
This theory explains why Michael not only looks like Diana Ross and has the same features and eyes as her, but also explains why his facial structure looks like Smokey's & their profiles and ears are completely identical, and why he was a musical prodigy who had the stage presence and songwriting abilities of his real parents (Diana, Smokey & Michael are the only three musicians besides the Beatles who have two stars each on the Hollywood Walk of Fame - one for being a member of their original groups and one to celebrate their success as a solo artist), as well as having a very soft voice which both Smokey and Diana (and Evan Ross!) have in common. Here you can see how much different his eyes looked from his brothers and how much they look like Ross eyes. Now you can see why his personality developed the way it did. It's why he acted like an orphan and called himself Peter Pan and built Neverland to help disadvantaged kids, why he isolated himself from his family and could never manage to have a normal relationship with women. It absolutely explains why he had such a severe identity crisis. And it explains why Diana Ross is second to Katherine Jackson in his will regarding who would take care of his children, and why Joe Jackson has been known to dislike Diana Ross. At Michael Jackson's public memorial the first person that comes out is Smokey Robinson reading a letter from Diana Ross, who writes that she's mourning so hard that she cannot attend the memorial and that Michael was ""part of the fabric of her life"". When Smokey speaks about MJ later he calls him his little brother, which would imply blood relative. In the movie Hitsville USA: The Making of Motown, Berry Gordy jokes with Smokey about how some of the babies that the groupies were having were his & that MJ reminded him of a little Smokey. Also, the movie An American Dream was about the Jackson 5 and would've been propaganda to reinforce the coverup story. 
So, it wasn't that Michael was ever trying to look like Diana Ross like people thought, he was actually displaying features and mannerisms that he INHERITED from her. In one of the clips below she says he has the same features, skin tone, and bone structure as her. Now you might say well Janet looks a lot like MJ, but growing up in his shadow she adopted many of his mannerisms and used makeup and plastic surgery to replicate his appearance (like Latoya did) but their vanity was merely deception. Joe and Berry branded and marketed the Jacksons a certain way to make Michael seem related, such as with the matching outfits and afros, but if you look at their features it's clear the only similarity to Michael is the way they smile (a learned trait). MJ has much more defined features and is rail thin like Diana Ross, and his nose & chin match Smokey's. Now it's clear why Joe told him he had a fat nose and singled him out so much with the abuse.
MJ does a photoshoot with Katherine, Joe, Diana, and Smokey
Diana Ross calls MJ her child, says she's doing it all for him (skip to 15:56)
Diana Ross jokes about Michael Jackson playing her son in a movie (the intro downplays her role in starting his career, an important part of the coverup)
Diana Ross confesses her relationship with Smokey Robinson, which would have been when MJ was conceived and when Smokey was dating Claudette (skip to 8:40)
Diana Ross jokes about her and MJ having the same facial features and bone structure, ""he could be part of my family""
Diana Ross calls Michael Jackson her baby
Smokey Robinson recounts how MJ used to go golfing with him and Bobby Taylor as a kid
Evan Ross says MJ was like a brother to him and that Diana was a mother figure to Michael
Joe Jackson defends the fact that Michael is his son when confronted by paparazzi
Smokey Robinson reads Diana Ross's letter at the beginning of Michael Jackson's memorial
This theory is from a YouTube channel called An American Scheme. I also created a subreddit with further info on the topic called r/AnAmericanScheme.",1
1572561635633692673,@bluertwo Tough one but I’ll go for Queen.,Queen or Prince?,0
1572482066759188481,"Unsurprisingly, we were both exhausted (having driven over from Meopham during bloody rush hour on the M26/M25/M4/M3 (so yes, the absolute pinnacle of driving good sense and calm behaviour)","So, i woke up just before 6am in this house my friend is renting.... We arrived last night after dark with a car absolutely stuffed to the roof with every wordly possession &amp; 12bt of wine #WinemakerThugLife",1
1580499888298553349,@es_edwards Thank you Errol.?,@Forgetfulness19 Good Morning Forgetfulness!  Have a fantastic Thursday my friend!??,0
fj7emio,"Up here in my pseudo-hillbilly corner of the Rockies, our Safeway has an entire cooler section just for the 1 gallon jugs of whole milk. It’s a staple of 90% of everybody I know’s fridge and unofficially, it’s our number one hangover cure, too. If a friend opens his door holding a gallon of milk, I know he’s in the middle of regretting the night before. My ex and I broke our refrigerators middle shelf because of the combined weight of his 2 gallons of 2% and my 2 gallons of whole milk that we bought weekly. (No, neither of us were or are obese. Lol)
I once laughed with a friend of mine at his Dad for offering his deck builders milk while they worked in 90°f (32.2°c) heat. 3 guys took him up on his offer, choosing it over Gatorade. 
In shop class in highschool, I built a 1/2 gallon milk container holder with a handle for my Nanna because she was struggling to lift them anymore.  Our local restaurants have giant milk chillers next to the waitresses soda stations. 
I dunno what part of the U.S. you’re from but milk is... MILK, here. Haha",From the U.S.  and I know no one that drinks milk.  Not one person.   A weird take sir.,1
fj5411q,Thank you I'll definitely try this,"Throughout the day (maybe once an hour or so) ask yourself ""Am I dreaming?"" Then, look around and logically think why you are not dreaming. (""I jump but I am not able to fly. That is my cat which I've had for 4 years. I normally eat soup every day for lunch, etc"") Whatever it is, think through it logically.
Eventually, when you are dreaming, you will be able to recognize that you are dreaming because you have done this line of questioning so much. I used to do this and was able to control my dreams because of this technique.",0
1579716774899355648,"@MousumiMohanty2 Jaha kahile ddy …
Ebe women reservations uthijiba darkar","ଅର୍ଚନା ନାଗ ସର୍ବଦଳୀୟ ବୁଦ୍ଧିମତୀ ମହିଳା ଟିଏ ଥିଲେ
ବିଜେଡି,ବିଜେପି, କଂଗ୍ରେସ ସବୁ ଦଳର ନେତାଙ୍କ ସହ ସମ୍ପର୍କ ସ୍ଥାପନ କରି ରଖିଥିଲେ
ଯାହା ଫଳରେ ଏତେ ବଡ଼ ଘଟଣା ଉପରେ ଏବେ କେହି କାହା ବିରୋଧରେ  ଆନ୍ଦୋଳନ କରିବେନି
ସମସ୍ତଙ୍କର ତ ଏଠି କେଂ,କିଏ କାହା ବିରୋଧରେ କହିବ....??",0
1538428264666079234,@NaughtonElaine @HSELive Elaine this is the norm in there @ULHospitals can you help with this???,My almost 90yr old dad is in A&amp; E in @HSELive #UHL He arrived by ambulance at 10pm having had a cardiac issue at home... WHY THE HELL is it ok to have him then sit in a chair for 7hrs (and counting) waiting 2 b seen by a doc &amp; getting more and more anxious by the minute? ????,0
1572135832320086018,"3/ Memory verse: Daniel 9:3
“And I set my face unto the Lord God, to seek by prayer and supplications, with fasting, and sackcloth, and ashes:""",2/ Daily Reading: Psalms 49-50; Acts 20:1-16.,0
fj6qin9,"I love the board in the Cathedral with the various incarnations of the Cathedral over the years. ""That one burned down, fell over and then sank into the swamp, but this one stayed up!"" (until the spire fell off).","everyone from Lincoln simultaneously: 'Did you know the Cathedral was once the world's tallest building?' 
Source: from Lincoln.",1
fj6dox2,No he’s the guy who took the muffin,Did you lose a fiver yesterday?,1
1543253646963523587,@Pskennedy666B ?,@Twonaturistson1 I see nothing but love in this photo,0
fj517dh,"Peaceful life, eh?","Pokemon Sword, so pretty good since I never get hurt and there are revives and potions everywhere",1
fj5d35y,I don't even think he's dead. There's a bunch of shady shit with his autopsy and he could've easily faked his death.,"The theory that Epstein didn't kill himself. Memes aside, he could've probably exposed a lot more rich people for their sex crimes. They just bumped him off before he could do so.",0
1572558550832152577,@kylemckelv It will either have to have a tight parking garage as its base or…?? But yea it’s also gonna stick out like a sore thumb. But I guess the realty bros see a future where NG is just a bunch of high rise apartments. ?,@coreydeanstone This is such a bad idea. I can't think of a worse thing to go right there,0
1579740993318182913,"@Dr_Uditraj As you said, enough is enough. Borne the burden for 8 1/2 years. Time to throw these guys out. Establish true democratic principles.","Delhi is capital of India &amp; BJP MP is giving public call to boycott Muslims economically, is he custodian of all Hindus?  I call upon dalits , OBC &amp; secularists to increase transactions with Muslims &amp; vice a versa. Enough is enough!",0
1578477335044444160,@McFaul Are you a warmonger?,"These days, I have the privilege of interacting almost daily with Ukrainians — senior government officials,  journalists, diplomats, NGO leaders, soldiers, business leaders, academics, students. &amp; every time I do, my awe for their spirit, intelligence, bravery &amp; convictions grows",1
1578549420962250752,"@KoimiaX Well, the only major complaint",@TheSp33d3mon Then you haven’t been looking hard enough if that’s the only complaint you’ve seen.,0
1579723088933294080,@sehgalripu @cotoapp @aparna24 @tarunkatial @PoorviGupta08 Thank you ?,@aartimahajan_20 @cotoapp @aparna24 @tarunkatial @PoorviGupta08 Many Many Congratulations... @aartimahajan_20,0
fj5sf0v,"Weird how in yesterday's post on here the 2nd highest upvoted comment was how the government was racist for announcing the travel ban on Iran but now people are complaining it's too late?
https://www.reddit.com/r/australia/comments/fb8b5u/australia_announces_iran_travel_ban_amid/fj335sa/","Too slow to travel ban Iran, unfortunately. They should have done it as soon as it was clear that Iran couldn't deal with their outbreak. As a result of the delay, returnees from Iran have already led to 2 AU cases and 1 NZ case.",1
1538510455802585089,@Michell74626003 Too kind ?,@FJOByrne Too early for that Frank!,1
1572368267880054785,"As I dive more into health challenges that are prevalent within my family &amp; friends (heart disease, auto immune diseases, neurological diseases), research points to improving food choices for better nutrient density.","? I will never become full on vegetarian/vegan, BUT the more I expand my knowledge on improving nutrition &amp; overall health, the better that approach looks.",0
1579052493589614592,"@bottomlineibd My life is so restricted since last year, diet, trips, events. I haven’t found any real balance with medication and I’m on weekly doses of immunotherapy injections and no improvement! ?","? #IBD patients - what bothers you most about your IBD at this particular moment in time?

Whether related to disease, service, cost, quality of life... whatever... The mic is yours! ? Take it away...",0
1538592309385777155,@jadedcreative It hasn't ended. I had Covid last week,"What happened to the pandemic? 

The ending seemed awfully anticlimactic, no?",0
fj5cmby,"Its not even a theory anymore, its basically accepted as fact by anyone who has at least two brain cells and no vested interest in defending him.","Has no one mentioned Epstein? It’s like the one conspiracy theory I can think of that is probably thought to be true by the majority of all normal people
Edit: thank you all of reddit for telling me that I missed the previous comments like mine",1
1578577192938000384,@willchamberlain Same thing,"I don't know about you but I voted to make America great again, not for nuclear armageddon",0
1579506705926610944,@GALPAKABITA ଧନ୍ୟବାଦ ଭାଇ??,@lokipalauri ଅନେକ ଅଭିନନ୍ଦନ ଭାଇ ???,0
fj594sc,"No I'd be dead,  I know my luck.","If they took 50 people, including you, and said they were going to shoot one of you at random, would you be scared?",1
fj5bd2o,"Obviously that's not true.., unless I'm not a person... existential crisis ensues",Nobody cares about black history month including a large percentage of blacks .,1
fj52xeu,Why would you say that with no context?,Jimmy neutron an donkey Kong have the same haircut,1
1580429137268723712,@niftyportal @betty_nft Unacceptable,@betty_nft What if it is a Nifty NFT?,1
fj5b1br,r/iamverybadass and also that’s not your immune system that’s thinking with your spine,By banning vacationers/travelers and striking people who intentionally infect others with the butt of a rifle.,0
