id_text,text,parent_text,label
1538412836983955456,"@MichaelLev Incredible place, Michael. It tipped  down with rain as we left. Lucky to get it in sunshine.",@FergRanson Never seen the Undertones in Ireland but been there! Loved it.,0
fj6gx6e,Green Lay's are bettet,"Binge watching Vox channel ke videos with the tastiest chips of all time ( Blue vale Lay's, not looking for a debate here) is a healthy coping mechanism",1
fj515xd,Hahahaha I guarantee this will happen. I'll eat my socks if it doesn't.,What a revelation.,0
1538243735707955204,"@MindMeMindYouIE @CelticRossHotel @WildIreland We are - a soft re-opening with homemade Quiche, Rosscarbery Sausage Rolls, cakes, scones and Stone Valley coffee. 10-5pm.",@Grantie79 @CelticRossHotel @WildIreland We are heading your way on Sunday Neil will Craft be open?,0
fj5dg1h,Lovely!,"Pronounces Jalapeno as it's spelled, whenever anyone says stop he starts singing, ""rough riders roll"", pronounces bologna as it's spelled, pronounced Italian as eye-talian, constantly calling me "" honor student"" whenever I do anything stupid, ""are you sure? Are you positive? I thought you were__!"" Etc.",1
1579747706716975105,@MarennavarAnant @POCOGlobal @Xiaomi @IndiaPOCO this my insta I'd DM me bro @ms__akshay,@AkshayM83330496 @POCOGlobal @Xiaomi @IndiaPOCO Hello bro iam also facing same issue on my poco X2 .. so what is next your move... Plz help me,0
1578718554580725760,@HMeloWriter The Isle of Arran on the west coast of Scotland! Avril X,What’s your favorite place to which you’ve traveled?,0
1572525710878838784,@SocialistNHS The whole Nation needs to go on strike… except for Bankers and Energy Corporations of course???,"Would you support NHS workers if they had to go out on strike?

It looks like we will be left with little choice soon! 

If you would support us please reply with a ?.

#OurNHS",0
fj56n5c,Did you swallow?,"I’ve sucked a dick before, I’ve earned the right to make gay jokes",0
1572484326742261763,"@jimwaterson Unless you had the tellybox switched off at the wall, it was impossible to avoid. I’d love to know how many actively watched. I didn’t turn my TV on to watch MasterChef on catch up until later. Didn’t want the pageantry flashing before my eyes","Peak TV ratings during Queen's funeral
BBC1: 19.5m
BBC2: 2m
ITV: 5.3m 
Sky News: 934,000
BBC News channel: 831,000

Combined peak of around 28.5m viewers on main channels, final figure will be a bit higher. Excludes streaming.

Massive audience but smaller than Euro 2020 final.",1
1572500233401278464,"@almostconverge There never is, of course experience tells me that its entirely dependent who and what you are.","@Lordofthevan there's literally zero shame in writing ""B was the first time I became aware of X, as it turned X mainstream"", especially compared to ""B was tbe source of X""",0
1579767615291265025,@neilesh_patil Chennai ka hoga but yaha 4 din baad Suraj nikla hai ?,@sleepyhead1892 gand fatati h bhai koi sunny bola toh..Chennai things,0
fj5y7ma,It's my head torch but it looks awesome with the lighting.,"What's the container you've got it in? Nice find, btw.",0
1538302844129923074,"@gripgrand I've never me your Gabe, but I've been a fan of your music for a long time now after hearing about you from Flip, Prozack, Stretch and Design. I genuinely believe tings will get better for you. You made some of the best hip-hop of my formative years. To me you're a legend. ✊","to all my friends who are going thru it or down bad, it gets better. 

not for me, shit is bonkers out here, you’ll be fine tho",0
1579175936422912000,@TLRatSaltaire @blaireve @PlayhouseDerry @joecoombsguitar @Jamienarco @scottwarmanbass @stradaagency @Medicinemusic @BalorArtsCentre @derryjournal It was our absolute pleasure! We Hope to come back again :),@AnnieKeatingNYC @blaireve @PlayhouseDerry @joecoombsguitar @Jamienarco @scottwarmanbass @stradaagency @Medicinemusic @BalorArtsCentre @derryjournal Well done on your tour. Thank you for your brilliant gig with us!,0
1538510455802585089,@Michell74626003 Too kind ?,@FJOByrne Too early for that Frank!,1
1578198967569240064,@susanfranciswr1 @thebooksdesk @PolygonBooks Thanks Susan! ❤️,@PaulDalgarno @thebooksdesk @PolygonBooks Best news Paul. Massive congratulations. This is very exciting❤️,0
fj5b7q0,"It's actually Benecol Camembert, surprised you'd make that mistake.",It's Benadryl Custardbath-get it RIGHT!,1
1579390307028041728,@SBICard_Connect I'm still waiting guys,"@Chitranshjain25 Hi, we don't want you to have such unpleasant experience with us. We will connect with you at the earliest.",1
1580035289006817280,"@team_hyv तुम जैसो की गोली तो नहीं
.... """"!""""
समझ लो क्या मार ली जाएगी","शव यात्रा में अगर कोई 'राम नाम सत्य है' 
बोल दे तो उसे गोली तो नहीं मार दी जाएगी ?
?",0
1579742444081799169,@ItsDustin1992 Jesus is with you,Please say a prayer for me for I feel very alone tonight.,0
1572500130489847808,@Omo_orimolusi GCE degree certificate ke? Nothing we no go hear from Naanu!!,Peter Obi submitted GCE Degree certificate and I have been cracking my head since yesterday to understand what exactly they mean by GCE Degree? Na question I ask oh,0
fj50rzk,Good answer thanks!,"You don't have to hate someone to break up with them.  Be firm and honest.  This relationship isn't working for you and the two of you are not as good together as you had hoped.  They may think you are being a dick, or they may realize you are right, or they may have been thinking the same thing. you can't control their reaction, just your actions.",0
1572538122172534784,@_kim_mik @LelandSage Yes but with harder nipples,@LelandSage @SueJ1973 But will Bill Bailey rock this same show in the snow though? ?,1
1572499931721789440,@seddSaad Ok lemme text you?‍?,j waiting for that one text,1
1579750140017278976,"@AravindRajaOff Very correct.  Only I miss daily comedy  !!   All times happy is good for health but i miss only Because of Mr Adu Ammamalai, sorry come back soon and make TN happy.","ஆடு இல்லாத தமிழ்நாடு அமைதியா தான் இருக்கு!?

Verified ?",0
1580536472582918145,@JoJoFromJerz If you seriously think that's going to result in anything other than more of our tax dollars wasted you're dreaming,F*CK YES! Ron DeSantis is under federal Investigation by the US Department of Treasury over his use of COVID Relief Funds to fly migrants to Martha’s Vinyard.,0
1572561433304637440,"@MikeMiracles If the Titans man up and win this weekend, they’re right back in it this season. It’s way too early to write them off completely! But my confidence is low after what we saw the past two weeks ?

Colts vs Chiefs
Jags @ Chargers",Anybody got a parking pass they won’t be using for Sunday’s Titans-Raiders game?,1
1579746215138586624,@YoursSatya @GudumbaCares007 Go girl anali,"@GudumbaCares007 Same tweet reverse lo oka ammayi veste, Appudu em cheyaali ?",0
1572558691064508416,@ew55p Better wear some earplugs lol,@coreydeanstone lmao can you IMAGINE the backyard as your backyard ??,1
1569996671358238720,@VtvGujarati Chotila hiway par pan che jo daya aave to tya pan koye javu.,"વડોદરાના સલાટવાડા વિસ્તારમાં રખડતા ઢોરે ગર્ભવતી મહિલાને અડફેટે લેતા ગર્ભમાં રહેલા બાળકનું મૃત્યુ, મનપાએ ઢોર માલિક સમજતા નથી એમ કહીને હાથ ઉંચા કર્યા

#Vadodara",1
fj51gtd,Actual 3%,"Coronavirus has spread to many countries in such a short amount of time that it’s a worldwide threat. Even though there is a <~10% chance of dying to the virus, it has a very high infectivity",0
1578286059452256256,@benteek131 Cheers??Ian,@xskinn Cheers Ian and everyone ?????,1
1572500293425975298,"@claireroberts01 Happy Birthday , what a wonderful family ❤️❤️❤️","Today is my birthday, I have balloons ???I want to thank my donor and family who 24 years ago decided that they wanted to donate their kidneys and I was one of the lucky recipients. #forevergrateful ❤️",0
1579525516759306240,@SahabazAli4 Thank you Sahabaz,@lokipalauri Congratulations ?? sir,0
1538126608774709249,@ConnemaraFarmer I'm not too worried about where it comes from as long as it keeps coming?,@1noeloconnor Looking at government money?,0
1538202451370823681,@PenzRob Thanks very much Rob. Hope you’re keeping well ??,"@AlexMcHenry97 Congratulations Alex, plenty of game time is the key mate!  All the best… unleash ?",0
1572561265297620996,@RonnyJacksonTX Have another drink,"If Kamala thinks a bus full of migrants outside her home is a crisis, she needs to see what Texans are living with EVERY DAY. Sorry the immigration crisis finally makes you feel uncomfortable, Kamala. IMAGINE HOW WE FEEL IN TEXAS!!",1
fj54qiy,Dang,Friend ran into a door divider and I think he got stitches. That was Grade. 5 or so and on a day where thenschool brought everyone Subway.,0
1578295258286559232,@PhilHanton @hendygolf How can LIV expect ranking pints when they play a completely different format (easier) than the rest of the other tours.,"@hendygolf Personally, the rankings are flawed for all three tours. Pgatour is rated too highly, European tour too low and LIV should have realised it would take time for them to get on it. Think the picture will be clearer in 12 months.",0
1578310321575702528,@Erin_Mariner Pathetic officiating already?,"There was no foul there… surely? ?
#MCYvWUN",0
1579725796461412352,@iSaraPilot Tumko to cm banana he pele nhi ta ke pta jo aaj cla,अशोक गहलोत जादूगर नहीं कांग्रेस को बर्बाद करने वाले कारीगर हैं।,1
1538237887354896384,"@Minceirbeoir Shocking , God rest those poor children, it’s time for some intervention ?","Travellers have been lobbying for a national health strategy,mental health strategy for over a decade our State and its organs failed us. Now look where we are our children dying by suicide at a shocking rate. ?",0
fj55pg5,Oabf soq6t 69s f siwyr ishrb fuck me daddy jdvdk didve kavsvr7d UConn of e,He's speaking the ancient language,1
1580474056100306945,"@shannonsinsc @IngrahamAngle Come on then, Laura seeing you and your fascist ilk have done nothing for the veterans, for the last decade, why the false interest now?",@IngrahamAngle Racist Traitor.,1
1580514361046536193,@KnoxvilleMoths We have restrictions when we can and can’t hold up traffic ???,@calvin_knapp Just like sitting in traffic for a road paving project.,1
1572561292887724037,"@TerryWatkinsJr1 Hopefully, the end of four decades of a theocratic banana republic.",What’s happening in Iran?!?,1
1578481949315776512,@WillyAitch On my way to Australia so I can watch the eagles game lol..,"Good morning world, enjoy your Saturday ?",0
1538201707410227201,"@SheehanAideen @WalleyRay @SaturdayRTE @roinnslainte Same in Olol Drogheda. Navan, Dundalk, Drogheda cottage hosp and Monaghan all downgraded. I spent Sunday evening and night on a trolley in a+e. Scanned Monday morning, 2 brain aneurysms sent to Beaumont. Was grand till last night. Nothing happens at weekends apparently ?","@WalleyRay @SaturdayRTE @roinnslainte I'm from Limerick. Limk Reg Hosp Ed has been like that as long as I can remember! And closing Ennis and Nenagh EDs resulted in the predicted clusterf**k. Friends, who have been in the ED, have had horror stories for years.",0
1578284557270323201,@Steeberino @_hissy Will need to see the happy snaps,On leave until Thursday - @_hissy and I are going to cabin retreat in Daylesford for a few days for some R&amp;R ?️,0
1578307398695280641,@pjroane @laddbbq ??? Me too,@laddbbq I dont believe you just send me a rack and i will let you know.,0
1578273717670461440,@drsophielewis @MarkusMannheim I should have tuned in - I have so many feelpinions about potholes.,@MarkusMannheim surprised by all the non-pot hole talk. some so big today they could eat my bike.,0
fj58nc6,"Nah it’s always been attractive, people just say it proudly now",Having a big butt,0
1579222655320064000,@untanglednowcom Well done ??,@joelvsarthritis I went back to Uni at 50 and changed my career so 38 is very doable.,0
fj5preb,"I think people should appear for a test based on politcal knowledge when it comes to voting.And I kid you not,only 25% would pass it.
And if something like this would to happen,you'd see a different party in power. For the good.
I don't know how a democracy is supposed to work with so many illiterates and uneducated people in the country...who vote for things like Balakot airstrikes,and sanctions on Kashmir.
This is why Socrates hated democracy with so many illiterates in a country/place.
Just a friendly reminder that 30cr people voted for BJP,which is why theyre in power dictating 130cr+ people.","I agree. RSS and BJP, eat gobar and fuck yourselves. Itna gobar bhara hai dimaag mein inke. Poora brainwash ho chuka hai.",0
1578154604302565376,"...I'm already practising due to the mental illnesses. I think what would really help is, while we do impactful research, an expected full time load, we should be financially supported adequately in line with the increase cost of living so we don't spread ourselves too thin. 3/3","...so I don't have the security of large life savings. On top of this, I have depression and ASD which add to the challenges. I went to @UTAS_'s mental health support program for HDR students, but it was mostly teaching us about mindfulness - which I appreciate, but... 2/3",0
1572501692163452928,"@DPJHodges You need to delete this and take another take or two mate...All this just proves you are just as worried as the union, because you are trying too hard to defend!","It's also fascinating to see people on the Left suddenly screaming ""The markets are losing confidence in the Truss plan!!! Look at the pound!!!! Look at the ratings agencies!!!! We have to listen to the markets!!!!"".",0
1578880371412066304,@keefmullin @DOT_Brew @johncoote @DrinkIrish1 @SeanDefoe @craftybeertweet @j_k357 @fennaldo @sconeaus @CorkBeer The last of 2 doz. Still some in @Aldi_Ireland Athy.,@craftbeersoflre @DOT_Brew @johncoote @DrinkIrish1 @SeanDefoe @craftybeertweet @j_k357 @fennaldo @sconeaus @CorkBeer Where the feck have been you been? Just asking ??,0
1579718935687335937,@TECH__MUKUL @XiaomiIndia @amisoumikbolchi @Gaurang321 @MiIndiaSupport Thank you ?,@XiaomiIndia @IamAyan_Sarkar @amisoumikbolchi @Gaurang321 @MiIndiaSupport Congo @IamAyan_Sarkar bro,0
1538255178498990083,@DanDartsDawson Shocking tactics by them Dan,"Jose is genuinely the best counter in this team, and by quite a distance as well.",0
fj55344,"I live in Denver. I go to the airport a few times a year. For the past 2 years or so they have had the same construction stuff in the same places. They have these big walls to hide whatever they’re doing, with posters that are making fun of the airport conspiracy theory. Whenever I’m waiting in line at security I hear a banging sound that doesn’t sound like construction tools. It sounds like they’re just randomly banging on a metal pipe. I think a lot of the evidence is bullshit, like the murals and the runways being in the shape of a swastika, but it is a little fishy that the queen supposedly owns property near there. And the airport is really far away. I get that Stapleton Airport was too close to the city, but DIA is in what seems like Kansas. So there might be something there.","Epstein didn't kill himself and he hosted pedoparties on some island in the Caribbean
The chemical that can turn frogs gay exists and it could potentially work for humans
The Masons built the current Denver Airport to hide something important
And I'm sure I'm missing some
PS: Top2 have been proven to be mostly true for a fact, 3rd is known except for the ""something important"" thingy",0
1579720394873122817,@AshwiniMS_TNIE Many congratulations ??,"Completed 18 years in Journalism today! 

#WorkAnniversary",0
1538224217757519874,@KojoKoram Hello. and congratulations,"Been working since 16 and I’ve never been promoted in my life. Debenhams, Next, McDonalds, more pubs than I can count, every manager I’ve had rightfully looked at me and thought “you are lucky to even have this job.” 

Until now! Say hello to Birkbeck’s newest Senior Lecturer!!",0
fj59qw7,Y hide score?,Hitler. Oh wait.,0
1579727842455478273,@CharulAgarwalRJ Hppy Birthday Jiju,Thankyou so much all ??,0
1578349845727051778,@maorisidol1 @HarnessCharity Might of forgot to take off,"Ballarat
Race 10  No.8
DAN MIELICKI
$100 WIN       #DAY7
@harnesscharity #harnesscharitychallenge 
#TrottersOnly     
Was $6.50 Fixed early ☹️",1
1578487962316066816,@CardsNation13 “Baston” at dah sevens,"Cardinals Nation roll call!

Let's see how far Cardinals nation stretches around the globe! Where are you watching today's game from?",0
1572556268702961666,@kittytriplet I was in the beginning but now I fly a lot so not so much,Are you Afraid to fly? I am.,0
fj5djnf,Wth? Which part?,Jump street 21,0
1580526096323579904,@deegreatestt I knew I shoulda called in,The rain woke me up early.,0
fj55clv,Great movie.,The end of Arrival had me confused about timespace causality stuff,0
1579059786997370880,@allaboutbeerirl @WWolfBrewery @8degreesbrewing Most likely.,@craftbeersoflre @WWolfBrewery @8degreesbrewing Vic Secret??,0
fj5cp7w,Yes.  They have the meats.,There is something off with the restaurant Arby’s. Do you personally know anyone who eats there?,1
1572562046075666434,@GeorgiaJaguar @Cubs Awe well thank you!! I really appreciate that!! ♥️,@TayDoll1010xl @Cubs I’m so glad you got away Miss Taylor and it ended well. You’re story is an inspiration to women all over the country and they need to hear it ? Plus you’re my favorite on 1010xl. ☺️,0
1578316966426980352,"@rockstartheory @terrypunter5 @essendonfc Yes, a fit and confident HJ could be anything","@terrypunter5 @essendonfc All fairly untapped quantities. If anything I feel Duzza has the heart and effort instilled so just reckon he’s gonna come on nicely next year. HJ was glowing in 2021 but had injuries this year which clearly ruined his self confidence. He could be anything.
Cox I’m not sold",0
fj5e222,Interesting have you tried this?,"Water and Mio drink mix. No sugar, plus you're drinking water.",0
1572500273485971457,@sallytottle Did u get message I left you thanks,@resandmag @suggy67 Available from…?,0
fj6e04g,Dont you know that its the oppressive society that forces them to be scumbags ?   Just like being poor forces people to spend all their money on alcohol and cigarettes,"Giving your 2 year old fake guns, cracking parent. Looks about right for the area anyway",1
1579854079001767943,"@Nationalist1101 #No way ,no hatred please ,who are you to boycott now ?","सभी सबूतों को मद्देनज़र रखते हुए फैसला लिया जाता है कि बॉलीवुड के द्वारा बनाई जाने वाली सभी फिल्मो को बॉयकॉट किया जायेगा, सहमत हैं तो YES लिखकर पुरजोर समर्थन करें..???",0
1579888079527034880,@fatimaahjameel Kachaa badaam wali video bana lena?,How to gain followers? ?,0
1578348641801994241,"@Kon__K Best you had home to Greece with your family then,  hand your house back if you feel so strongly.",Every time I come to Alice Springs and visit First Nations townships &amp; remote communities I’m given most important reminder of how colonisation &amp; systemic oppression &amp; disenfranchisement of First Nations peoples remains pervasive. Truly our national shame and a stain on us all.,0
1572355728815554560,"@UndrgroundHH @_BobbyBlair_ Can’t hate a man that gets jumped by 20 heads and still doesn’t get dropped or his shit snatched. 

Dudes not catching any Ls really. He really going against the grain and making it work",@_BobbyBlair_ I just said this. Off mic dude be moving kinda funny but he out rapping everybody who's hating on him,0
1572508251090194432,"@buhakmeh Just the perspective, I wish we had giant stickers ?",@t_redactyl Is it the perspective or are those stickers enormous?!,0
fj5b4l7,"Where Chinese assembled it as a biological weapon that killed about 2800 people in 40 days? Mostly old people with previous diseases? Man, what a shitty weapon!",That Covid-19 is an escaped virus from the Wuhan military biological research facility.,1
1579735070617006080,@GyaaniCricketer @BCCI @SDhawan25 Lets give chance to Rahul Tripathi. Or else team will be same which played in ODI in second match.,"I hope India will not make same mistake to add Ruturaj Gaikwad in playing 11.

Simple formula:
Play without Ruturaj and you will win!!
@bcci @SDhawan25 #INDvSA",0
1578589281463197696,@VanessaPirotta Thanks Vanessa! ?,@Yuri_Niella Welcome back!,0
1578517877799256064,@LIVEpositivity Cars,What addiction is seen as completely normal by society?,0
1572467489535295488,@RedMedusa13 @yoghurteater Sloths? I NEED some of those,"@yoghurteater I got some cool ones in Matalan (cream with black stars), &amp; Peacocks, (sloths) ?",0
fj5nsod,I swear a lot of waiting staff deliberately try and avoid eye contact precisely to stop you signalling them. It’s taken me 15 minutes at times despite constant effort.,"Literally signal us or ask for it? We are wait staff, not mind readers. Between taking orders, seating new tables, running out food, sorting drinks, sorting wrong orders out, helping out with the usually understaffed kitchen, cleaning out done tables, getting clean cutlery back on the floor, doing dishwash, answering questions, dealing with rude customers all day and having to daily deal with people looking like you just punched their baby when you try to turn a table and they want to sit and chat for an hour after you have cleared their table, please, just fucking ask for your bill when we are near and clearly not carrying shit loads of plates. We are very happy to get you out of the restaurant and on your way home if you literally just ask us. 
Never click your fingers though. You click your fingers at me, you sir or madam, are the biggest shovel mouthed streak of piss I can meet in a day.",0
1572499676225753088,@Mel_M8 Thank you ??❤️,@BobbiBicker Love this! Gorgeous ??,0
fj5tdy2,"If areas get quarantined for a few weeks (or god forbid months) because this thing hits you'll be eating nothing but your words.
Who will be stupid then?","Not just Aldi - there were a remarkable number of enough shelves at Woolies when I went shopping this morning - a lot of canned food and dry stuff empty, or almost so.
Stupid people panicking for no reason.",0
1538427376794800128,@Finnoozy Irish tourism sector @Failte_Ireland @dfatravelwise @IrishAviation need to advocate for management changes @DublinAirport it's a disgrace ppl not fools plenty of travel options to Belfast and Derry very busy ? #Belfast #DerryGirls #GameofThrones #Titanic ✈,Just arrived in T 1 Dublin Airport last night. Gosh it is an absolute disgrace. Toilets manky. Toilet paper all over the place. The arrivals hall full of litter. Luggage hanging around all over the place. Absolutely so management evident at all. I’m thinking about our tourists…,0
fj5bpte,r/missing411,"I believe that the U.S government has men in black that make people ""disappear"" if they know more than what's good for them",0
1538243680150163459,"@IrishGolfDesk . @clonmelgolfclub v @westwaterfordgc in the Barton Shield, 20 years ago. The day a Star was born……?⛳️",Séamus Power eagles 7 and he's one-under for the day and T20 on Ev. This has been some start to his major career.,0
fj53dmt,I agree with u but it said people who like school,Eff no. It is pointless what passes for education these days,1
1538299467505577986,@peterswellman Puck outs still need work. Not sure it's on him.  Could be better at winning the second ball from longer puck outs.,"As you can see with Patrick Collins and Eibhear Quilligan, the smallest errors carry huge weight when you’re the man between the sticks.",0
1580526334836584448,@Hoodplugcomedy2 I was ctfu when I saw that ????,@OoOSheCold I'll definitely never will miss lol,0
1572450026814869506,@WushanDarshana There is definitely truth in what you say,@VindyaPeiris2 I really don't know...I mean I can't say anything about anyone is true until I meet him or her. People are way different in reality. So no conclusions ?,0
1579732702693330947,@Busy_gurl_ Good afternoon ??,"समय इंसान को सफल नहीं  बनाता, समय का 
 सही इस्तेमाल इंसान को सफल बनाता है... ✌
##Goodmorning?",0
1579721973768552450,@suman_Gurjar_14 Right,"आजकल के लोग गाय चराने में शर्म
 और कुत्ता घूमाने में गर्व महसूस करते हैं",0
1572508219381280770,"@YvonneBurdett3 What, the rees mogg who wouldn't serve under another prime minister after johnson? Perhaps he's going to announce his Damascene conversion to trussism.",Apparently Reece Mogg will be making a statement within the hour. It's not going to be his resignation is it,1
1578470336399519745,@BurnwoodAmelia Thank you so much ? ?,@James_Patrick88 I'm happy for you. Congratulations!!! I hope you will reach more people because you're awesome,0
