id_text,text,parent_text,label
1572488102274285569,@BradMcM06206700 @ScotlandSky You might not but the stigma around gay players in football is real if you like it or not.,@ScotlandSky Nobody cares about your sexuality,0
1572501168001290242,"@andy_cov93 Saves you what, £2,50??","England shirt £75 on England Store

Free delivery on orders over £20 

10% off with code ESC10 … they then add on £5 delivery ?",1
1538232510634663936,"@MikeNeylon1 Couldn't agree more. Even during the game for large stretches, they'd no luck. Two of Wexford's goals were free outs for instance. But they kept their heads which is great to see. They'll be sharper for it the next day.",@eoinneylon Clare were lucky today. The subs made a big impact. Too many times Clare didn't get the rub of the green but had it today. A good situation for Clare as that game will have grounded them prior to KK semi.,0
1538431172614791172,"@icyestretro Pat fuckin edderry
He could get a rocking horse up on the line in listed company",At their peak who was/is the best?,0
1572561052742848512,@Ivan_Maxwell19 It’s not easy but it sure is worth it. I quit 11 years ago and never looked back.,Wish it was as easy to quit smoking as it was to quit cokes.,0
1538617090319564802,@mattjwoodturner @Djmc76 Hahaha...nit fir himself though.?,@Djmc76 Prawn sandwiches,1
1538457149390606338,"@PropertyClodagh @C_DiscoveryPark Clodagh, he got such a surprise. A wonderful day",@Sheena_Mu @C_DiscoveryPark Fantastic! Bravo Des! ?,0
fj5df0f,Boooo this guy,Save it,0
1580525856597737472,@jsmcmahon21 Good morning hope you have a Terrific Thursday today ☕ ? ?,"Good morning Twitter. Positivity is extremely powerful, let's spread as much as we can today! ☕☕???",0
1572500618081882113,"@cjcheesecake Same, I started drawing a ? when signing cards etc, who new so many things are made in the form of snails!!","All the Paddington Bear gifts and marmalade sandwiches the Queen received reminds me of the time I said that the snow baby ornaments where kind of cute to my mum, then she told everyone and for the next fuck ton of years every fecker bought me snow baby ornaments.",1
1578549420962250752,"@KoimiaX Well, the only major complaint",@TheSp33d3mon Then you haven’t been looking hard enough if that’s the only complaint you’ve seen.,0
fj5ddym,Apparently the timelines don't match at all. His mother didn't meet him until after Trudeau was born. The rebuttal I saw also had pictures of young Pierre Trudeau to Justin Trudeau and they're similar.,"Fidel Castro being Canadian PM Justin Trudeau's father.
The resemblance really is uncanny (he looks nothing like his supposed biological father) and when you see that the dates his mom was staying with the Castros in Cuba, everything really does line up.  She also had numerous affairs rumors with people like Mick Jagger while she was married.  She really had a history of getting around and partying at places like Studio 54, etc.",0
fj5bw12,"This is a very misleading comment. Trump got 63m votes, but Hillary only got 65m votes. On top of that, not all 320m are eligible for voting, because a large percentage are under 18, non-naturalized  immigrants, or felons.","He lost the popular vote, he was only elected by 60m votes in a country with 320m people. So he got less than 20% of the ""people"" to vote for him. Luckily the electoral system is shit so he won.",0
fj6zgz6,"Tell that to employers.    
And after u get a good job with ur toilet papers, make a post on reddit.","Uneducated fucks.
This country's education system is a joke.
My toilet papers are at least useful to wipe ass. Those degrees are useless.",1
1572499547485777921,@xxSDBxx Will do,@Ambutigger Sending you big hugs Les.  You are doing so well. Send Mrs C a hug from me too xx,0
1579123689366654977,"@IanJacklin1 @007 Was there ever any truth to the rumour that if Amy Winehouse had gotten clean and sober for a year, Eon were prepared to give her a crack at a Bond song?",Who do you think should sing the next #JamesBond @007 title song?,0
1572460294835961857,@SDishanthan Hell yeah,@VindyaPeiris2 Most of people judge the book by its cover,0
1580525745688178688,@frecklequeen45 Good blessed morning luv.. hope you had a great evening,"Damn, I'm exhausted
What the hell's this all for?
Is this where it mends or it breaks?
Between a rock and a hard place
For the record, shit
Throwin' in the towel takes some effort
So I'd rather ride it out for better weather
Together ?",0
1538272307843674112,@MiseryVulture But you can't swear in Irish... ???⚰️☠️?,There should be a gaeltacht slasher movie that functions exactly like an American summer camp slasher only it's entirely in Irish.,1
1579751751674363904,"@Subhank78426804 A memory of a flower is not in the essence that lingers somewhere in the palm of hands, but whiff of fragrance nostrils caught, with the humble wind! It's the petals that are now dry, the prickly thorn! A bubbly rose now exist in some other sphere","It is one of the most touching bereavements!
That bring unremitting torments
To one's soul!
And fill the heart with thoughts, fair and foul!
I know not how long 
Shall I bear this irreparable loss,
That hath hit me strong
To the core,
A memory, that gathers no moss!",0
1538297027175620608,@ShaneSaint Surely linesman could have given a prompt..really believe we need qualified inter county referees as umpires for these games,Black card and penalty?,0
1578229749864075265,@TheVoodooQueen I know!! Lost 3 &amp; now gained 2 in one year???❤️???,@Sal_of_Lourdes Wow Sal.?????,1
1572503030855245824,@TomLondon6 @Brown666W Of course not!,Has Lord Lebedev of Siberia and Johnson been sanctioned yet?,1
1537824575718932482,@dunkingwithfish ?,@ElaineARoche Hurrah! ???? well done that boy!,0
1538092701677146112,@PhilipPullman You mean the only European leader who has backed him unequivocally?,Boris Johnson ignores his responsibilities here and goes scuttling off to Ukraine in a desperate bid to be photographed next to the only person in the world who  likes him.,0
1572503090645061636,"@Trudipomfret @platt95788721 My pleasure Trudi, hope your day is kind to you xx",@_AngelLady_ @platt95788721 Thank you. I'll block him. Have a good day. T x,0
1572501191384518656,@beingmybest44 Bless. Hope you feeling better soon. I'll send you lots of motivation to get you going and throughout the day. Here for you. Take care. Lots of love ? ? ? ? ? ? Xxxx ♥ ♥ ♥ ♥,Have to get ready for work but my motivation is at a 0....this cold has been kicking my ass..my nose is plugged up and my chest is full...but no covid thank god...just pushing through it...,0
1538244300340862978,@michaelcoren That is true…we saw him attempt a ramp ?,"Before the usual suspects mock #JoeBiden for falling off his bike, remember that if #DonaldTrump fell over he'd never be able to get up again.",1
fj57qqd,"Jeepers, no need to shout!","No, you are what you are born as. 
NO IDENTIFYING",1
1578273487776407552,@ThisBuds4UNMe @lemontea_nft Gm ☮️,@lemontea_nft GM ??,0
1578334992027250690,@rhettrospective Brian Taylor waived for salary cap space.,"The media love to throw up trade scenarios.

So let's do the same for them.

Who would trade in/out from the footy media on TV/Radio/Paper.

(Mega super deals accepted!)",0
fj5r68c,"Just waffle stomp your shit down the drain, lol.",You can never go wrong with more shitter paper. You'll miss that when you run out.,1
1578281922098532352,@SableTinex I couldn't remember the names. I know it was shocking to watch. If social media had been popular then it would have blown up.,"@50to39 I agree and I Chelsea and Jamus reminded me of that exact couple too, I think Sherri was her name, I forgot her husband’s name.",0
fj52rff,Well you can't have a 'cure for cancer' because cancer is an umbrella term for many diseases. That's like saying about cure for lung disease. Also several forms of cancer can essentially be 'cured' due to improving therapies.,"""There will never be a cure to cancer because treatment too profitable.""
I hear this one a lot, but it does make a bit of sense.
Chemotherapy, radiation therapy, and all other cancer treatments are extremely expensive. And if a cure was developed, it would be just as expensive. 
But, I don't believe doctors are hidding a cure from the public.l",0
1572330713697091585,"@SQLBits That time, when a huge curtain reveal the whole fun fair at SQL Bits Party Telford","If you could pick your FAVOURITE thing from ANY #SQLBits event, what would you choose?

????☕️?",0
1572446742779691011,@VarunaSL I thought it must be a බයියෙක්? They can't show me?,@VindyaPeiris2 It can be some innovative pickup line ?,0
1578374883922575360,"@Pele_amada @andersostlund Жива і  вилізла так само, як і папа, і маск та інші. Пішло лайно просто водоспадом.",@andersostlund @nadyusha1203 Ця стара хвойда ще жива?,0
1578331679613079552,@LilSushiAU Yerp! Near the escalator,@PeteCurulli Ohh shit petey you're here too !?!?!,0
fj55u5m,Ouch your butt,"Jason Momoa, i'm straight but if i had to, that guy could tear me up.",1
1579036824122851330,"@emma_web3 @BeefyBlokes @fxtson Haha  wanted to  “practise what I preach” 

Having spent close to 3 hours advocating people to support aus based projects, would be a shame not to show some support especially when I like the art ❤️ 

On a side note, hoping to fly down to brissy for the event :)",@shanicucic96 @BeefyBlokes @fxtson Classic Shan W ?,0
1572499965896970240,@neillyfabi Morning Neil,@andylong Morning Andy,0
fj52k70,By date you mean date of birth?,Name and date,1
fj6h14n,"Ahh yes the trickle-down economics. If you feed enough oats to a horse, it would eventually shit enough undigested oats to feed the birds.","It a a good thing he is spending all this money in wedding.
Read it as, Politician infuses Rs. 500 crore in local economy.
It will create lot of job and employment.
Edit: it is a light hearted fun comment.",1
fj54a6w,"I've never met one either, but I don't go out much. They're out there. There must be loads of em.","While I can find plenty of them online, I've never met another Expanse fan.",0
fj57kfa,Don't know what you just said but sounds like a zombie threesome,ITT males fucking female zombies. What if a female fucked a male zombie? Would zombie spooge get her pregnant?,0
1572561388475920385,@zenshortz GM thanks for the reminder ?,Gm Gm anything is possible ☀️,1
1579520741984587778,@srihari3529 @IndiGo6E What do you expect from a third class airlines.? Indigo airlines is worse than the village town bus,"Dear @IndiGo6E 

 I was returning from the National Games held in Gujarat, and the staff not only behaved badly, but also charged us a hefty amount for excess baggage which was the medals and goodies that we athletes had won.",1
1572566621730009090,@bigrobistheman 41-33,@DubDotDUBBY Tbf nobody is gonna trust an eagles fans judgement. Half of them eat horse poop on occasion.,0
1572560283964669954,"@NftDavidson W or.w out sugar ,?",@NFTGANGBIZ i like iced,0
1578658488498421760,@mmpadellan Imagine being this fake,"DEAR MEDIA: Please devote EQUAL time to Raphael Warnock as you are giving to Herschel Walker. You're giving Walker all the free coverage you gave trump back in 2016. STOP IT.

DON'T MAKE THE SAME MISTAKES.",1
1579718651166740482,@swadesh93 @XiaomiIndia @amisoumikbolchi @Gaurang321 @MiIndiaSupport Thank you ?,@XiaomiIndia @IamAyan_Sarkar @amisoumikbolchi @Gaurang321 @MiIndiaSupport @IamAyan_Sarkar Congratulations,1
1538796947636633602,@WOpinionated Song,@CaroMThomas the song or the place?,0
1578317271956529152,@MundayJessica They clearly know your aesthetic ?,When your kids friend comes over for a sleepover and brings you a gift… and it’s a “f*ck the patriarchy” necklace she’s made. The kids are alright #feminism #patriarchy,1
1572561073215242241,@AdamWolf77 Yerp.,@OhNoRobertLuke Does that start tonight?,0
1578304623605006338,@ToddJDavey ?Money for nothing and your chicks for free?,So you're saying Geelong got Tanner Bruhn for nothing and Jack Bowes for free?,1
1538444167315083271,@johncollinsUTD Thank you Barbara,@johncollinsUTD So sorry to hear of the tragic loss of a beautiful child to suicide.,0
1578171892057640960,@olivia_brisbane @DiQld @Harley_Roze_BBW Thanks Ms O,@GeorgeSz12 @DiQld @Harley_Roze_BBW Beautiful!,0
fj54nyw,"That Las Vegas shooting was weird, and it disappeared from the news so fast.","That the las vegas shooting had multiple shooters. There's literally mountains of evidence to support it.
&#x200B;
Also 9/11 was orchestrated. I think most people accept that now on some level, though.",0
fj57o1f,"I have had people comment about the economy and i agree with you, while other parts dropped massively other parts rose, however i am interested to know now what your oppinion is on the actual virus and a possible mass outbreak?","I was scared initially because I wasn't sure how the stock market would react.  I lost money when the stock market dropped massively in the past few weeks.  Got out of those positions, switched mindsets, and now I'm back to making money.  In fact, coronavirus spreading has actually benefitted me.  Not saying that is a good thing, just trying to make the most of a bad situation.",0
1578319848333246465,@chrissymonal 28 percent deductions,Liked one tonight at the home deck. Thought Zarem was ready to win. Wish I saw the $10!,0
1578332890126905344,@reyannamaria Reyanna Sleepria,slay slay all day,0
1578332599876915200,@WillyLax That’s word #2,@smokiedawson Surely it’s “wantaway” a word that only gets used during trade period,1
1538222849512685569,"@Albion43S No I don't deny that Jesus had followers! They were all Jews, As I said, Christianity did not exist nor the Gospels, Good night.",@ImamNoonan Do you deny there were followers of Jesus in the 1st century?,1
1579749408358666242,"@salonivxrse It is not that serious. We are use to such in port areas of Kolkata.
Clashes will be resolved in a friendly way.","Spine chilling visuals of Islamists attacking Hindus in Mominpore, West Bengal  are being reported.

Bikes &amp; Shops of Hindus in Maila Depot, where they celebrated their festival were attacked and vandalised.

Involvement of TMC leaders and their aides is also suspected. ++",0
1572499803229110280,@WildAtlantic55 Lol. Bedclothes in the uk are a safety feature. We’d freeze to death without them! ?,"@Twonaturistson1 So you DO wear bedclothes?    As for the fox walking through - no thanks, the cat is bad enough!",1
1572499568260157440,"@stupidgirl45 I tell myself I’ll never be as successful as Agatha Christie. And therefore always a failure. Once you’ve accepted your failure, the success goal posts move an awful lot closer.","So I've written 25k of new book since end of July.

This is good yes?

My brain constantly tells me I'm a writing failure.

Also launched massive marketing campaign at work. 

#ImposterSyndrome #adhd",1
1538336797494681600,"@MCinHD My mom sends me job advertisements from where I grew up as well. Might be less about earning more or less, but about desire to have the kids all closer. Might be the same with your mom.",My mom has been beating the ‘you make less money in Germany so you need to move back and earn more’ drum since I landed. She just asked my rent and I think she will stop pestering me now that she heard how much bang for my buck I’m getting.,0
fj53b7b,;),What in the actual crap is wrong with you,1
1580526358249472000,@SarahGraff13 @PeteButtigieg How awesome!,"Just ran in to @PeteButtigieg in the Charleston SC airport! Couldn’t help myself.. as he went by I yelled, “I love you Pete! You’re awesome dude!” And he turned around and smiled and waved. I’m a fan ?",0
1578306887472119808,@MartyMariner They did show a replay to be fair ?,Bugger I missed that Glover save let me just rewi….oh never mind #MCYvWUN,0
1579739895391977474,@AdityaMenon22 A tragic chapter in the history by Indian Democracy shall come to an end soon. The Hindutva groups &amp; the body media will be paying a price for their Unconstitutional blunders. Jai Hind,The kind of venom Hindutva supporters are spewing at Mulayam Singh Yadav on his demise is at another level altogether.,0
1578381046839590913,@SamanthaRatnam How about doing something vaguely constructive in terms of improving peoples lives instead of virtue signalling for the Green's political bemefit,"The First Peoples’ Assembly just delivered a petition signed by over 50,000 Victorians to the Premier’s office.

It calls on him to reverse the Government’s disrespectful decision to rename Maroondah Hospital.

If this Government is serious about Treaty, they'll listen.",0
fj576zt,Thats your realistic and correct information but like you're still wrong,"The idea of superpowers has been around for a long time. A google search show the Poper Puff Girls was created in the 90s. But comicbooks have been around for a while. Marvel had comics during WW2, and DC comics was made in 1934 my a US Major in the army. 
The idea of superpowers, supernatural powers, and powers given to humans by god, has existed for thousands of years. We can't really say who created these ideas first. But, we can say that it wasn't the creator of the Power Puff Girls, sorry.",1
1580547622925848576,"@joncoopertweets Chick-fil-A, Jimmie John's, Hobby Lobby, and Home Depot",What is one company you'll never do business with because of their horrible politics?,0
1578626416169451520,"@KateEclair Lawrence Fishburne was staying in same hotel in Sydney and helped me with my crossword in the hotel bar. I had no idea who he was &amp; asked what he was doing in Aus. He said filming a movie. It was the Matrix. (My friend was in it too, she played the woman in red dress) nice guy","Ben Mendelsohn just quietly sitting on my train this morning and no one else recognises him, the man has played the most iconic scumbags, done Star Wars and Marvel, and just travels as a civilian in Melbourne",0
fj56m9y,This is just a fact?,The NFL manipulates it’s games just enough in order to get the best product out of their season because they are a business with billions of dollars on the line.,1
1579067226006884352,@Gillian275Gm And there’s still some abbreviations that I am unsure of!,@Gillian275Gm I was a lot older than that!!,0
fj5ue74,will wait until I hear that ScoMo has left the country for Hawaii before I panic buy anything,Panic buying. It’s the same in Canberra and Gundagai and Melbourne. Overbuying is a self fulfilling prophecy and will cause a food supply shortage. Not good.,0
1579135502594105345,"@rockstarsani @jdmulniwasi @RajniGa89602955 @SaumyaBaudh @TanyaRNC @Sanpriya1995285 @HINAGAUTAM4 @Bahujan_Sherni @Amita30103965 @PoonamS27299337 #मान्यवर_कांशीराम_साहेब 
#कांशीरामजी_को_भारतरत्न_मिलना_चाहिए 
#बहुजन_महानायक","@RameshR09138630 @jdmulniwasi @RajniGa89602955 @SaumyaBaudh @TanyaRNC @Sanpriya1995285 @HINAGAUTAM4 @Bahujan_Sherni @Amita30103965 @PoonamS27299337 #मान्यवर_कांशीराम_साहेब 
#बहुजन_महानायक",0
fj6sjy6,That's not what I was referring to riding over. If you knew the area you would get that.,These are setts not cobbles.,1
1579059229511802881,@GuyLodge @philford There’s an episode of Seinfeld that hangs around the characters not knowing what mutton is.,@philford One time I was cooking dinner for friends in the US and the way I had to *hunt* for it in the supermarket,0
1538434786615648256,@HangBlaa @ScottMoore0 What's the TD salary?,"@ScottMoore0 The Dáil pays TDs FAR MORE than the Assembly does MLAs.
What do reckon?",0
1578333786567495681,"@VLeopablo 44, possibilité de travailler le samedi matin ce qui peut être 49h au plus mais faut que je fasse la demande",@florent_boc Tu taff combien d'heure la semaine mon boug?,0
1538253676292210688,"@ScouseBirdBlogs Dignity is in tact until you give up closing it and just let it flap, imo xx",Is there a dignified way to fasten a bodysuit?,1
1537880567529603073,"@BatlethBabe He is literally the Fox News of fandom &amp; the person *most* in need of being quoted lines like —

SPOCK: “Are we so old that we have outlived our usefulness?”

&amp;

KIRK: “Come now, Mr. Scott. Young minds, fresh ideas. We must be tolerant!”

— if only he could grasp their meaning.","No, I will not give into the desire to mock a has been with negative opinions about current Star Trek, but I really do wonder what someone’s life is like when they spend it barfing gatekeeping nonsense on the internet.",1
1572501133779955712,@DPJHodges Richard Edward,"It's also fascinating to see people on the Left suddenly screaming ""The markets are losing confidence in the Truss plan!!! Look at the pound!!!! Look at the ratings agencies!!!! We have to listen to the markets!!!!"".",0
fj6p7ut,Or a box full of dead puppies.,"At least it wasn't a dead cat...
Anyone else seen Man like Mobeen?",1
fj5ywjs,You should try asking in /r/whatisthisthing,"Reverse image searched it. The result was ""Firearm"". oof sorry couldn't find anything.",0
1572514088089165824,"I'm not setting up my own justgiving page, I'm just going to join in the walk, walk in Gail's memory &amp; ask all you amazing people who have been so supportive to me over these last couple of years that if you'd like to make a donation, then please donate to Elspeths page.","This Saturday is the Brain Tumour Research Walk of Hope, it falls exactly 2 years to the day since we lost @ClaretGaily on 24th September 2020, to this terrible disease. I can't believe it will be 2 years. It feels like a life time ago &amp; yesterday at the same time.",0
1572476064185651201,@Janet_A_P Definitely,@alexthepage Floella Benjamin,0
fj5egzs,Lol. Nice one.,Pretty sure that’s mine. I dropped one in nsw recently... please pm to return /s,1
1572561475667099648,@dannyv427 Let’s go !,Someone go to fright fest with me next weekend! It’s Halloween season and I’m trying to do spooky shit bro!,0
1572500607126347777,"@hawrth That’s awful, so sorry to hear that. I hope you’re doing okay.","I was in A&amp;E yesterday. I cant go into details but I was treated inhumanely. They couldn't give me the care they should have but wouldn't admit that either. I also saw 4-6 elderly emergency patients on beds in the corridor, no lovely ones able to stand with them :(",0
1572485938747478017,@TonyP146 Morning Greg,@andylong Morning Both. Have a good day.,0
1538272680465649665,@ActingTheGom @stevepcarroll ‘in’ the real world,@ActingTheGom @stevepcarroll Wouldn’t last a minute I the real world. He’d be run out of town,0
1578293585006325760,@raunakhajela Thank you mate!,@chrisrickard Great read ??,0
1538193993401606146,@Dimpconvery @bbcniweather @angie_weather @WeatherCee @barrabest @linzilima @Ailser99 @cherylwoods33 @TanyaDa00922232 @CarolN657 @MariesnotMaria It is Indeed ?,"@JamesCarlislef1 @bbcniweather @angie_weather @WeatherCee @barrabest @linzilima @Ailser99 @cherylwoods33 @TanyaDa00922232 @CarolN657 @MariesnotMaria That is a beautifullly preserved old station, I could hardly believe my eyes.",1
fj6j93j,"Liverpool lost and I forgot my homie's bday
Sucks","3 of my ex colleagues from my previous company quit yesterday, 2 I was on very good terms with, including a guy that was among the top performers who couldn't handle the politics any more.
Meanwhile David de Gea (and Jordan Pickford) are collecting their paychecks.
Another mate (my bestie at work and said top performer's roomie) just spilled the beans today on why HR encouraged me to quit during probation period itself so he could save 185000 for the company.
Sucks.",1
1538416637338177536,@jeffthered1 Beans would have been better for him as there’s a lot of fat In cheese even though it was probably Edam,"Frenkie de jong has turned down beans on toast for his tea tonight and has opted for cheese on toast instead …… yes you get what I’m saying!!!
I know about as much as the other cnts on Twitter who claim to know what’s going on ?‍♂️????",1
1538860918871826438,@FurbabiesRmyGo2 ???,"I think I am the last of a dying breed. I much prefer bar soap, as opposed to liquid soap.",0
fj5e7dj,What the actual fuck?!?,my mom made me watch i spit on your grave (the first one) when i was 7-9. shit was traumatizing. a 7-9 year old watching a woman got raped even though it was acting.,1
1580525955449118721,@PalletFllipper FAM the sauce was straight fye no ?,@M_McFlyerThanU HELL YEA THATS A FACT!,0
1580525757474168832,@KaylaAndersonTV Good morning beautiful,The play out music is ???,0
fj5kug6,"That's not my point at all. Hinduism, like most religions is a set of ideologies. And those ideologies do not promote the kind of hate and violence being perpetuated in our country now. Thus, people who do perpetuate said hate and violence in our country calling themselves hindu for doing so are in fact, not.","The whole point of secularism and humanitarianism is that religion does not define our morality. Saying someone is not a real Hindu is like saying that a good hindu's morality comes from the correct ""practice"" of Hinduism. But anyone from any religion can say that about literally any moral stance. If good hindu's are humanitarian and bad Hindus are violent because they're bad Hindus then where does that put atheists?",0
1578289055263252480,So sad to see it go!,"From next season, the next generation Chevrolet Camaro will replace the Holden Commodore, while the next generation Mustang will line up for Ford. Much of Australia’s recent history has been tied up in the ‘Ford Vs Holden’ rivalry, with households split evenly for a long time.",0
1538464715462025219,@UnaMcCaffrey @MFBJura Great cake,@MFBJura Our older sibling barely got off the sofa to say hello to the returning gaeilgeoir.,0
