id_text,text,parent_text,label
fj5borf,aight ill go first,End life on Earth,1
1572500762391105536,"@EmmaPinky83 Have a great day.  I got up, bought vodka, came back, ordered MacDonald’s breakfast, poured vodka into coffee.

I may be under a level of stress and anxiety at the moment. I also bought a massive slab of clotted cream fudge designed to be chopped up that am just biting into.","Wank morning, (before any pervs think I meant that literally I didnt) thank fuck I've been called into work earlier I'm off to see if I can shake this shitty feeling ?",0
fj6fh8n,In the same closet as Philip Schofield.,Where did Gordon the gopher live?,1
1572498656661733377,@RihaabMowlana Thank you so much for your kind words?,"@VindyaPeiris2 People are quick to assume. I'm always smiling, yet people say I'm stuck up.??‍♀️ 

But the key point is, it's someone who doesn't know you personally that said it. Let them keep assuming. Don't let it bother you. It used to bother me. Not anymore.",0
1580540338238009346,@ksdotlewis I would and have. Met some cool ppl in the process,"If your Twitter Crush said “Ima be in your area a couple hours away, can you come and let me take you on a date?” Not a link, a legit date. Would you go? Or no? Are you scared?",0
1579753850764161024,@Aisha11ug Can be your boy friend,"I am not an addict. I just have a f*cking  problem. When I want, I don't take no for an answer.",1
1579718836265230337,@Aisha11ug What happened. M.C,"I am not an addict. I just have a f*cking  problem. When I want, I don't take no for an answer.",0
1572483153184407553,@iam_paulash @Omo_orimolusi ?,"@Omo_orimolusi My sister is comma that is your problem, pls add it to make it complete",0
1579755680902578176,@kinnarmehta9 True,@RajendraWadher First check if how many subsidiary co they have. Most of MNC have cent percent subsidiary co and all new business goes there in many such cases,0
1579747540677054466,@pradyvats मेरे कहने का अर्थ है की सोच ही एक ऐसा माध्यम है जिसके जरिये आपकी ये कमी पूरी हों सकती है,"मनपसंद शक्स की कमी कोई नहीं पूरी कर सकता
दुनिया की कोई ऐसी ताक़त नहीं है.. जो कर सके।
#pransprady #pradumnupadhyay #kb3",0
fj53yin,"Ive had the opposite experience with fans of the metalcore and punk/metal scenes in general. Ive never had an issue, and like anything it's a few bad apples that ruin the whole scene. 
Now I have seen douche bros countless times act like this towards people of varying genders, cultures and sexualities.","That’s just the culture of pop punk and metalcore though, music for those who are mentally 13.
(sorry if you like metalcore)
EDIT - gonna keep this comment up because apparently people can’t discern that pop punk/metalcore is vastly different scene to all the other types of metal. 
It’s an extension of 2000’s scene/emo kid culture and is far more toxic than any actual punk/metal shows.
To anyone in Brisbane think The Brightside vs Crowbar and the different crowds there.",0
fj5dtr7,"The church of scientology is screwy anyway, I wouldnt doubt it.","David Miscavige, the chairman of the Church of Scientology definitely murdered his wife and is getting off scott free for it. Him and his wife got into a pretty heated argument in 2007, and she hasn’t been seen since. Lawyers hired by David claim she is still alive and devotes 100% of her time to work at the church of scientology, which is why she hasn’t been seen since August 2007. In 2013, a former member of the church had filed a missing person report that was closed after a few officers had “spoken and seen Mrs.Miscavige”, even though there’s no evidence whatsoever of this meeting. All missing person’s reports now are turned down since this investigation is forever closed.",1
1579719919822073856,@BabyLillian5 @Osbert_Khost Plz brothers,@BabyLillian5 @Osbert_Khost 7464094674 plz phone pay number fever and money,0
fj545yk,His music doesnt seem so good in my opinion. It is just bland and the same.,Drake,0
1579744939713662977,@ChaubeySK21 Thank you so much?,"@BibhaProfessor जन्मदिन की हार्दिक बधाई, मैम",0
fj54ip2,?,"PLEASE READ THIS MESSAGE IN ITS ENTIRETY BEFORE TAKING ACTION.
Hi there, your post has been removed for one of the following reasons: 


Rule 3: You must phrase the question to require more of an explanation than just ""yes"" or ""no"".


Rule 3: Questions with a single correct answer, that can be researched elsewhere are not allowed on AskReddit.


Rule 1: You must post a clear and direct question in the title.  The question must be a full sentence.  Try including question phrases like ""What is..."", ""What are..."".


If you have any queries or concerns, please feel free to contact the mods. Thank you.
I am a bot, and this action was performed automatically. Please contact the moderators of this subreddit if you have any questions or concerns.",0
1579526427955056641,@Paytmcare Just getting replies only and not getting support for the same.,"@balapc05 Hi, we have replied to you via direct message. Please check for more details. Thank you.",0
1580356314827366400,@SarahGraff13 @paularadell @PeteButtigieg Good for you!,"Just ran in to @PeteButtigieg in the Charleston SC airport! Couldn’t help myself.. as he went by I yelled, “I love you Pete! You’re awesome dude!” And he turned around and smiled and waved. I’m a fan ?",0
1579744307963400193,@ranjeetnature Good info,@Deepakk75058621 A beautiful partial melanistic Leopard. There is another partial melanistic one at Pench -Madhya Pradesh too ?,0
1572444931326906369,@Wijesinghe85 You made my day??,@VindyaPeiris2 You are one of the loveliest ? people I've ever met. So ignore this unknown person.,0
fj5dbha,Aww :),My cat,0
1578275596517675008,"@Wanderlustin @SarahDemp Right?
I know enough to be dangerous about that franchise but not enough of all of that so I’m just enjoying an incredible show",@SarahDemp i am living in wonderful bliss having shit all knowledge of the timelines ?,0
1534737502254374912,@TwitterBlue The badge would be interesting. I’m sticking with #TwitterBlue regardless. ?,"? back at it again with another #FeatureFriday ?

today we want to know: what feature would you love to see from Twitter Blue?

reply below if there’s something else you want to see ?",0
1579919170661408769,@katona_barbara Happy birthday,Hello everyone. Today is my 73rd birthday. Haven't heard from family. Can I  please get some birthday likes?,0
1572501130260905986,"@RJPcoach @CoachingFamily @coachingbadges @TheS_Resource Started as a block of Duke of Edinburgh  stuff. Volunteering I think.

Now there's a whole range of reasons. I think most of all I find it intellectually stimulating and challenging, interspersed with some great moments, memories and bonds","Some questions for everyone?

Why did you start coaching?

Why do you coach now?

If the answers aren't the same what changed and why?

@CoachingFamily @coachingbadges @TheS_Resource",0
1577875175684509696,@drewey10 And rego for season?,@DamianArsenis Kilsyth is $25,0
1579483270487629825,@Lawyer_Kalpana @DKSHARM59671277 यह तो कल ही मालूम होगा....जय श्री राम,बस इतना पूछना है साहब कि शव यात्रा में अगर कोई गलती से 'राम नाम सत्य है' बोल दे तो उसे गोली तो नहीं मार दी जाएगी ?,1
fj64v9q,"OkayJanu, for sure.","Sorry if awkward, but does anyone else here masturbate to their classmates ?",1
fj54o53,"Yeah, if it kicks off the chemists will  struggle with symptom relief and temperature control drugs.","I think we all need to hold our nerve. Experts are saying just buy a little EXTRA each week, don’t try to have your own Woollies at home and do all your shopping for a year. We don’t want what’s happening in Germany - entire shelves bare - to happen to us. Remember we’re a remarkably self sufficient nation. Have a pantry and have enough; but let’s not make the tragedy of the commons happen for our neighbours. 
That being said, I keep a steady supply of pasta, canned tomatoes, beans, rice, canned citrus fruits and frozen food at all times. I grew up rural and lived in a survivalist community part time in my late teens, so having a well stocked pantry is never a bad thing. 
Remember: even in Wuhan right now, everyone has access to delivered groceries. Expensive and with some shortages, but no one is starving and even the Chinese government is sending in free food. 
Remember: often food shortages are created by overbuying! It’s a self fulfilling prophecy. Food makers aren’t expecting every citizen to suddenly need a six month supply and here’s the thing, you probably don’t. 
What you do need - hand sanitiser (harder to come by - was just in Canberra and Gundagai and all supermarkets are wiped clear), thermometer, ibuprofen, hospital grade disinfectant. If it runs out in stores because people are being Chicken Littles, vinegar kills 80% of germs. As someone else said, toilet paper is great and you’ll miss it when you don’t have it. Garbage bags too. 
Prepare for possible power outages, the same way we did for the bushfires. Get a power bank for $20 from Kmart (and a back up one if you really can’t stand your own company ?), a solar powered battery power bank and a hand crank radio. Batteries as well for LED lights and a radio. Pillar candles or tea lights as a back up and some matches.",0
1579153582775234561,@Kathlee90791502 Thanks!,@HerbertSchuber2 Well said!,0
1579741648925659141,@Rakeshkumarray8 ❤️ ଭଲ ଲୋକ ସଫଳତା ପାଇଲେ ଭଗବାନଙ୍କ ଉପରେ ଭରସା ଆସେ ଓ ବଞ୍ଚିବାକୁ ଇଚ୍ଛା ହୁଏ,"U have problem with ur life

Look at him
ତିନି ବେଳା ରୋଷେଇ କରି, 
ମଉସା ମାଉସୀ ଙ୍କ ସବୁ କଥା ବୁଝି 
ଗୋଟେ ମାସିକ ପତ୍ରିକାର ସମ୍ପାଦକ ହେଇ
 ସୋସିଆ ମିଡିଆ ରେ ଯଥେଷ୍ଟ ସମୟ ଦେଇ ବି ଆଜି ସେ OAS ପାଇଛନ୍ତି।
ତାଙ୍କ ସଫଳତା ଯେମିତି ଲାଗୁଚି ଆମ ପରିବାର କାହାର ସଫଳତା।
ପ୍ରେରଣାର ଉତ୍ସ ସେ
❤️ ତାପସ ଭାଇ",0
1572307371472596992,@gettagrippe97 ?? cant stand u,My ex has the highest chance of dating me so caught feelings at your own risk,0
fj5ykry,"Might depend on your suburb I guess. In Carlingford, Sydney the aisles of long life products were like this.","I've seen a stack of these photos but when I go down to Woolies or Aldi,  the only thing that's missing from the shelves is Aeroguard. Not just at the nearest one to me but the two other suburbs I regularly stop at to buy stuff as I travel past.",0
fj656z3,"But with more global warming we can have more freak storms.
Invest in coal. Invest in the future.","You are in the middle of storm Jorge!
Not taking away from the increased input of green energy into the grid, that's awesome, just pointing out that what you are seeing isn't the norm and we still have a ways to go until it is!",1
1579757771448537088,@ChaserKohli_18 @imVkohli 123 at perth,Comment down your favourite SENA century of @imVkohli ?,0
1579744864618811392,@arsla_fatima Aap shi bole,मर्द के शब्द झूठे हो सकते हैं मगर आसूं कभी नहीं..,0
1538247149451878403,@bigkenreid @Aideen_Reporter God bless Aideen RIP ?,Tonight the thought @Aideen_Reporter is no longer with us is just heart breaking. A decent soul who suffered too much. The news has stunned many of us. We all need to take care. God bless her. RIP.,0
1579725663254482944,@tanvishah140 Thaaanks :D,@adityaoberai1 Damn this photography skills?,0
1572492316908060672,@joannabrennan76 Search SNCTA on here ?,@mulldog Oh hopefully that’s true. Flying to Spain in the 30th.,0
fj51539,Always good!,I can't pick a song but definitely The Score.,0
1539312220118872064,@mtully21 You must be very proud of your brilliant daughter.  Only 2 days to go.,"Update on #TheLittleRedDot. Now off the coast of North Mayo,the Atlantic hasn’t been kind to them BUT they are still in the race, yesterday’s sun helped dry their v wet gear.
Hoping to make it back by Thursday..thanks everyone for the uplifting support! #MammysVoyageBeginsAgain",0
fj6tgjs,"This is India, we dont give a damn about women. They are property. Our ministers say ""we will abduct their 100 woman if they take our 1 woman"" like they're tender meat. That's what they are to us.","iirc, women were also the biggest victims in Gujarat Riots...",1
1579675889964822528,@IRealIndia Yes mam I agree with you ❤️,"जबसे सुशांत सिंह राजपूत की हत्या हुई है तबसे अब तक 35 बॉलीवुड फिल्मे फ्लॉप हो चुकी है,,

कुछ साल और बहिस्कार और सारी गंदगी साफ़ हो जाएगी बॉलीवुड की !!",0
1579708046896660481,@pradhan_lilu Thank you,@lokipalauri Congratulations!,0
1538005437693366272,@caie_w @WorldBollard On the @BMW calendar. @WorldBollard calendar will be much better.,@WorldBollard Where are the BMWs?,0
1572328946125111296,@shainadenny @wildearthpets @dogdropco We 100% should do a fun taste testing with @dogdropco pet parents!,@RyanBethencourt @wildearthpets This is amazing! Would love to get these in the hands of some @dogdropco parents,0
1572369421108408321,@DanielOerther I’d rather have one sore arm than two,@RobertaLavin Two in one arm! You are a trooper! I got one in each : ) Hope you feel great! Looks like a great day! Dan,0
fj5tryl,"> BJP should never have been a hindu party .
That is all they have. Without religion angle, BJP is nothing.",Political parties should never be tied so closely with religion. BJP should never have been a hindu party . All this bullshit would have never happened. Fuck religion for causing so much hate in this world.,1
fj5a8t5,"Counting calories as a strategy to lose weight generally never works.   
Plus your eating low calorie ranch,  which is probably worse for your health at the end of the day.","The secret is to count your calories for everything you eat. Calories in - calories out. If you eat an actual portion of ice cream, that’s maybe like 120 calories which isn’t too bad. But if you eat the entire tub or a full bowl you’re in trouble. If you’re looking for casual snacks: veggies. I do celery with low calorie ranch, cherry tomatoes, broccoli, or carrots. I can eat so much for a relatively low amount of calories and it’s very satisfying. Also cut out all soda or drinks except water.",0
1579898625412726784,@JhaSanjay कुछ पागल कुत्ते जरूर भौंक रहे हैं।,"There is a call for a total boycott of a community. It is made publicly by a BJP Member of Parliament. 

But Modi Ji is silent. As always. 

And everyone is quiet. The media barely speaks up nowadays. Radio silence. 

Tragic state of affairs in India.",0
1572560235264614400,@HempMillionaire Black or cream ?,@NFTGANGBIZ Hot at home and iced if goin to starbucks,0
1538574829942718464,@st3v0m @SammyRB81 We love you Steven ?,@ericbrennan_ @SammyRB81 The unfortunate thing about me is I don’t care I care today but every other day I don’t give a fuck,0
1578268768593059840,This whole thing was tampering and reeked of salary cap shenanigans. At no point did the other clubs have the right to talk to a player under contract for another whole season. The system needs reform and strong penalties for these types of actions.,"Now that the dust is settling on Munster staying in Melbourne, can we revisit the fact that the Dolphins, Tigers or ANY other #NRL club were not supposed to be making any offers to Munster (or Anasta as his manager) until 1 November 2022.",0
1579718981027475456,@Anikha1123 @Kavitha19310128 Hi,@Anikha1123 @Kavitha19310128 Super cute Nani bangaram,0
fj5r9q3,"Funny how coal is our second biggest export but take a lump into parliament and you are a social pariah.
""Look everyone! This is what allows us to be a first world country!""
""Geez Scomo put that thing away. That's disgusting. No-one wants to see that.""","The man walked into parliament with a lump of coal and said don't be afraid of this.
Why on earth do people suddenly have this expectation of him turning away from his support of fossil fuels?",0
fj56gb2,Yes unfortunately it can be either parent that leaves. Sometimes even both.,Its not always the father.,0
fj51hp5,I would hang out with you,Nobody wants to hang out with me and I understand.,0
1579481512311132162,@FirmiBRO Valverde,Bring on transfer rumours atleast #LFC,0
1580513059231043584,@m1kecasper I will tell him ? thank you.,"@oliviacola ? Tell him, weird is cool!!! From all of us here in Twitter world",0
1579722626234470400,@Rifkas_cake_ GM GM ??,@Deckle_Edge Gm ???,0
1580441593529921537,@SarahGraff13 @PeteButtigieg Now that is really cool!!!  Thanks for sharing that,"Just ran in to @PeteButtigieg in the Charleston SC airport! Couldn’t help myself.. as he went by I yelled, “I love you Pete! You’re awesome dude!” And he turned around and smiled and waved. I’m a fan ?",0
1578372556658118656,@Duneemperorpaul No one will give him a dime..,"Brumby bhai tu kitni garibi mein raha hai ki tere par koi ch€€nk bhi maare to tujhe bas ""Haaye paisa, Haaye paisa"" r0na aa jaata hai

Abe train mein ""tum to thehre pardesi"" gaata hua paisa maangta tha kya jo iske alawa kuch aata hi nahin

Community rejected them my ? 
?",0
fj5be4e,Username checks out.,Resist going down the rabbit hole of any ideology including religion. Keep an open mind.,0
1578527018496323584,@sallymcmanus Over to you Sally. Albo can’t be held to ransom by the past (Gillard) and the threat of broken heart rhetoric. There are more important issues at stake!,"The Stage 3 tax cuts are both unfair and completely unaffordable. 
They were a bad idea at the time and a terrible one now",0
1578285644056780800,@capebanks Wet? Almost flooded in some parts of the track. Ian,@xskinn Is the track wet Ian?,1
fj6b2ck,Yes but the state only picks on easy targets . Too much hassle for them to go after someone with resources,"Going the other way:€50k fine for blatant pollution of Cork lagoon; 2,000 truckloads of builders rubble dumped",1
1579792875801698306,@Prabha86763100 @narendramodi @iGopalShetty @VanathiBJP @MadhaviBhuta @umakhaprebjp @SheetalBJP @YogitaNilesh @SujataPadhyBJP @chetanaupadhya2 @BJPMahilaMorcha @BJPMMMumbai @BjpDipti Thank you ?,"@sompura_dipti @narendramodi @iGopalShetty @VanathiBJP @MadhaviBhuta @umakhaprebjp @SheetalBJP @YogitaNilesh @SujataPadhyBJP @chetanaupadhya2 @BJPMahilaMorcha @BJPMMMumbai @BjpDipti Doing great work dear, go ahead ??",0
fj51t6k,"Calm down Greta, earth will be fine, we won’t be, life will go on.","The self-perpetuating warming effect we have put in place. Things are thawing, specifically tundras that trap methane and other greenhouse gases. The more they thaw, the more the earth warms, so they will thaw even faster. If humanity's carbon footprint ended entirely right now, the earth would still continue to heat up. This will kill off the ocean phytoplankton and stop 2/3 of all oxygen production on earth. All other oxygen-breathing life larger than a tardigrade will die. All life relying on a food chain based on plankton will die. In all likelihood, very little multicellular life will continue to exist on this planet.
And all that will happen even faster if humanity continues to exist.",1
1578297078140129280,@Borto74 @ChrisDuley7,RIP my neighbour who told his wife he was popping out to get some sewing thread but got distracted and went to the pub instead. Gone but not for cotton. #dadjokes,0
1572419808242835457,"@datnicedude @JSterlingCalls Redsox fan,Your team is in last place and the Yankees are in first. GFYS !",@JSterlingCalls Tey winning against a real baseball club. K thanks maybe like Astros? Oh wait.. lol,1
1578332896724516864,@bloggerjesh @PhDVoice @academicvoices @AcademicChatter @AcademicDilemma Depends on the context? Nothing in Biology is 100%. Do you need to be 100% sure that you sterilised the laminar flow before working with cultures? Absolutely. Does a result 100% prove a hypothesis? Not necessarily! It's all part of the fun ?.,"In research, it's not enough to be 99.9% sure, you have to be 100% sure. How many of you agree? @academicvoices @PhDVoice @AcademicChatter @AcademicDilemma",0
fj556r4,Ross?,"A different girls name, i called her Rachel and that was my-ex, she wasn't over the moon.",1
1579729940236636162,@Aisha11ug Hoooo,"I am not an addict. I just have a f*cking  problem. When I want, I don't take no for an answer.",0
1580519196928008192,@JasonCulberts10 @JulieJulesLamb Happy Thursday ❤,@Forgetfulness19 @JulieJulesLamb Good morning Ms Lee ??☮️?,0
1580484147843596289,@BetoORourke Money won’t get you elected,"We just outraised Greg Abbott — again.

Now we’re going to defeat him. That’s how we overcome his extremism and move Texas forward.",0
fj59atm,The older you get the less your own death should scare you. You worry about other people more than yourself eventually. I'd rather outlive everyone in my life if it will cause them less pain.,Those worries are superseded by worries of your own death.,0
1578345731160621056,@WAAMBMEDIC It’s very convenient for everyone else though,@GarnAlan Housing all the uncontrolled clinical risk in one place harms patients and clinicians.,1
1578406232632664065,@mariewalsh18 @NannaCath2 Well definitely your sons,"@NannaCath2 ""Lock Up your Sons &amp; Daughters..""",0
fj69you,One of us has to be the miserable bastard.,NO fun on MY subreddit,1
1578512029786120192,@sara_carrion_ How to disect a frog ?,Name something you learned in school that you’ve never used in your adult life….,0
1579753297002758146,"@jafarali1366 We can't retwitt you 
It's lock","مچوم‌تویت های مره کسی میبینه یانه؟
اگر دیدید یگان ریتویت بزنید مطمئین شوم
#StopHazaraGenocide",0
1572521023303712769,@dmfotoni @trussliz @UN Have you not seen the insane amount of money they have spent on official photographers?,@trussliz @UN Who is paying for the role of International PR Photographer to the PM..?,0
1578356264723415044,@Detr1tu5 This is no good…,"Headache and stomach ache, my legs gonna fall off tomorrow.",0
fj5dzqh,Peter?,Push them down and fart in their mouth to assert dominance,0
fj5c607,Then claim to be a human right activist. Problem solved.,Whip out my dick and eat. What of it?,1
1572459001908178944,@DefenceU @DevraMaza ? Slava Ukraini.,Ruscist reconstructionists in the occupied territories never tire of repeating the Nazi referendum on the Anschluss of Austria. They are expecting 1938 results. Instead they will get Hitler’s 1945 outcome.,0
1572468535456305155,@Susanseekshope The criminal years!,What will this period of our political history be called? The muddled years?,0
1580489340559376390,@Sharon48110 Happy Thursday Sharon. Have a fabulous day.??❤,@Forgetfulness19 Good morning ??‍♀️?☕️,0
fj5dn01,KFC Spork?,Spoon and Fork,1
1538116771990974464,@TheCouchtripper You are an obsessed freak. Seek help.,@YeSecondPost How do you know he's a dude? Is it because he's got a cock?,1
1579720341601255424,@mohith__45 All the best bro❤️,The day im waiting for finally it came .going to write a exam which decides my future need all ur wishes ?,0
fj50u6n,That must be the UK version of our Dollar stores haha. Never even considered that.,Poundland (if I had 20 pounds not dollars),0
1579196857263493120,"@magnumlady A  Creeslough lad in Australia started a gofundme for the people if the village with a target of 60k. As I write, it has raised 225k so I think that's probably the place to go.","Wouldn't it be a lovely gesture if the electricity bills for the businesses giving the emergency services, journalists, and volunteers, free refreshments in #Creeslough was paid for them.
Any idea how this could be organised so that people could donate some money?",0
1578337525584007168,@mugspunting @7horseracing Where is SS these days?,@7horseracing Ahh cmon fam why you gotta do us dirty like that ??,0
1579967874567122947,@musing_monica How can,"I am a founder, I found you?",0
1579749957128851457,@swarupdas You are a good question.,Can understand PM expressing condolences on the death of MSY but why are random RW guys crying bucketful!,0
1578353281335988224,@stephenised1 Some people say I look like me dad,@pittworldwide Why does Monica look like she could have joined B*witched?,1
1580005743620595713,@ShikhaYadav000 Mere pss masg karo..!,"Hii

Good morning ❤️?",0
1578492728555757568,"@ReturnofR REM what's the Frequency, Kenneth ?",What SONG did YOU listen to TODAY?,0
1572488326879518721,"@wise0w1 Unfortunately not, you going?",@markturner06 Top tune. You going to Moondance on Saturday?,0
