id_text,text,parent_text,label
fj9sc8o,A sensible bit of legislation would be to require all incoming calls and SMS messages to be blackholed if they contain a name of an Australian government agency or any Australian phone number unless the holder of that number or the relevant agency has approved the spoof.,"It isn’t the same contact per se, it’s just that the Govt agency responsible for myGov sends the messages from a name, and not a registered phone number. This makes impersonating them stupidly easy as you’ve seen.
Further, there’s no real global standards for verified SMS which increases the likelihood of people being phished. While Google has made some in-roads for their customers in select countries, it isn’t rolled out in Australia or other major nations. And Apple just keeps hoping more businesses will use their iMessage for business platform, but their rollout of it is as slow as a wet week.",0
fjco8kc,"Just be rich, duh.","Yeah, I'm hoping to by this year in Dublin, by myself, and new homes are a complete non-starter. There is no way I could afford any of them in Dublin.",1
fjanz55,Thats a fair distance from Garforth. Dorset is lovely though but I don’t know what it’s like for cycling other than the time me and my wife took our tandem to Blandford Forum and set off only to be surrounded by hedges twelve foot high for what felt like hours! I’m sure we could have picked better routes !!,"Ha ha. I’ve been there. Used to ride out from Garforth via Bramhope, Otley, Ilkley. If it was freezing or wet the Abbey was as far as I got. Moved to Dorset now and missing my old haunts. Enjoy",1
fj9jbjn,"I used to always order food when hungover from the closest take-away (of which it's literally on the road behind my house) and thought they'd just walk it round.  
Did take me a while to realise they seem to have a LOT of drivers and it always takes them fucking ages.
They always drove it too. Because they're not actually from the takeaway, it's just ""crowd sourced"" delivery","Could be worse mate, my pal just moved to Chelmsford and ordered pizza hut from deliveroo his first night.
He didn't realise the Pizza Hut was literally under his flat and got a terribly judgmental look from his delivery rider.",0
fj9ycnm,"OK, so, assuming for some reason that we do get a major fucking outbreak with say 200-300,000  infected, people are going to have to be treated at home  while holed up in their rooms. 
Mild cases just need food, supplies and maybe money - middling cases should be treated by community nurses and a few doctors (freed up by the canceling of all elective procedures) who check in on them wearing a full set of NBC protection).  Their transport would be arranged by the army, who'd take charge of hosing them down between visits.   
The Civil Defense would be in charge of distributing supplies like anti-inflammatories and food, fresh water etc.
AGS would take care of civil order and all limits on overtime for all branches would be lifted. 
That's a broad-brush look at how we might tackle things, and while we're honestly not familiar with this type of regime and it'd be a very odd time I think on the whole Irish people would help pitch in and be helpful.","What do people think the worst case scenario is with COVID-19? Like do people think we'll get the country shut down for two weeks or what? Genuine question, I know it's something the government/international bodies don't want to talk about yet/at all so I'm curious what people imagine it to be",0
fjaf5w3,Boyslut,What's the boy word for slut?,1
fjd8yhi,"Hard to carve the islands of mayo without them breaking off, easier to do 2 stages of relief.",Why does Mayo extend into the ocean but everywhere else stops at the coast?,0
fjc800q,Totally becoming a Satanist if this legislation goes through.,">The statement must be made in good faith and is a belief that a person of the same religion could reasonably consider to be in accordance with the doctrines, tenets, beliefs or teachings of that religion. This has been dubbed the “phone a friend” clause as the person only needs a single other person to vouch that the belief is part of their shared religion.
Nah, there's no way this could backfire spectacularly.",0
fj9hatt,That's phase two if the containment fails actually! They prioritize only those who have serious symptoms and let everyone else ride it out.,"Seems to me that it's probably been spread in the dublin region but most people would not attend the doctor to be diagnosed if it was a minor cold. 
I can't see any real decisive action from the health officials until people start getting seriously ill.",0
fj9bxar,"This was horrible for the environment 
Millions possibly billions of animals have died
Small fires are indeed good for the environment but huge fires like this are not","It's great for the environment and people who live out in the bush. But being realistic, it's only a short break from when the season resumes. This is the new normal. It's only how much of it is uncontrollable.",0
fjb29f5,TBF Codeine shouldn't be commercially available,"Honestly there's this bizarre attitude with pharmacy staff that anyone who knows annything about these drugs must be a drug dealer or something.
They have the same attitude with codeine/rikodeine.
I'd wager they did have it but just wouldn't sell it to you.",0
fjae6dj,"Exactly, it's this wish washy fantasy stuff that distracts from the realistic projects like Metro, Dart expansion and underground and the expansion of rail and bus services in Cork.
Why is this fantasy a headline grabber while any time the projects above are mentioned it negative Nimby articles?",IMO there are far more important and pressing infrastructural issues to build right now than a pipe-dream high-speed rail to places that are sparsely populated. A metro for Dublin or any semblance of good public transport in Cork would be a start.,0
fja4f98,Seems legit. 10/10 would recommend.,"The only way this works is that you apply one kilo of dung, and one litre of urine, of cow, per person. Works better if the cow is red in colour. White cow is the weakest, black is a little better, red works best.
This has to be layered, so the first day, you apply. And wait for it to dry. The next day, DO NOT WASH OFF. Apply the new stuff over the old stuff as a layer.
You have to do this until the summer comes. ~~Or Shivraathri [Feb 20/21, 2020].~~ This process needs to be continued right through summer into the rainy season, and you have to wash it off in the first rain.
And you have to go about your business. Sitting at home aggravates the symptoms.",1
fjaddij,"Thank you!
Upvoting this not because I totally believe you but for the simple fact that there are a lot of factors and variables involved wrt immunity including local environment, genetics, temperatures etc. It's a very interesting read.
OP mentioned a couple of published parameters and promptly concurred hand sanitizers are the best! (read sarcasm). Well, I need proof and references for the same, to objectively and conclusively prove or reject it. Otherwise, it's in the same league of those UN WhatsApp forwards.  
Hygiene is common sense but immunity is a different ball game.  
I mean, there are actual people writing their thesis on the same as we speak and along comes a  Google powered research paper.  
Till then, I think it would be best to leave the deductions to the specialists.","Human immune system learns through trial and error. The thing is western world is too fragile for Indian conditions, conditions highly optimal for growth and proliferation of infectious microorganisms (which includes the germs). Also we do not have a cold cycle (at least in the parts southern to regions where it snows) which can wipe out almost all of the infectious microbes. In Europe and America, the immune system of the people is not worked out as much as an Indian's immune system. Half of the year the immune system of western population is chilling owning to the environmental conditions favouring humans over microorganisms. 
The memory of the way to defend the  body from the microorganisms (henceforth microbes) is short lived (for about 30-50 days). Hence as soon as the cold cycle ends and the conditions turn favourable for the microbes and all the memory of the immune system of how to defend itself from the microbe is gone. All the microbes are aliens to the body even though there might not be a significant change in the microbes characteristics. Hence there prevention is best and hence the sanitizers , extreme safety precautions etc are brought about.
In case of India where the environmental situation is highly favourable to the microbes than the humans. We taking extreme precautions (like sanitizers for one) is just a waste of money and time. This habits truly makes you immunologically weaker & compromised. 
Hence we can say that we are inherently stronger than our western counterparts.
If theres any query regarding this please feel free to ask me any questions. I will answer what i know to my fullest.",0
fj9yb96,It is one of those books that looks nice on top of the microwave. About the best thing I can say for it.,"£4.99?? 
There are thousands of amazing curry recipes for free on BBC good food. Plus they're user rated by normal home cooks so you get an idea of how realistic it will be to get it right.",1
fjdct7p,Along the doddery! Love it,"Until relatively recently I think that was a laundry in Ballsbridge I believe, name changed slightly around the war I think. You can still see one of the old red brick chimneys if you walk along the doddery from Ballsbridge towards Lansdowne Road on the left in the middle of a load of newer buildings (its a protected structure)",0
fje48l5,Most Brits I know are fairly sound and if anything are more just uneducated about the not so nice parts of their history. Its them-uns up North that have a hard on for the Monarchy that I would be worried about.,Anybody want to check /r/unitedkingdom to see if they have a shit fit about this traitorous act,0
fjavv0m,Maybe that is the case. I went shopping and half the beans had already been bought already,"Exactly my point in another sub. If someone said smearing baked beans on your naked body prevents the coronavirus, guess what? Sold out.",1
fjcfiut,wouldn't really say being prepared for a possible supply chain disruption is stupid... it not like toilet paper expires,If stupidity doesn't get them first.,0
fja4zlq,"Have a virtual hug.
It's always darkest before the dawn
I am sure someone who needs to after reading your post would also find not everything is lost & it's never too late to turn your life around.
:)
Regards
Buntoley",Thank you guys for making me feel so welcome. And being so helpful! This is a nice space.,0
fj9drjo,WAR SESS TER SHY ERRRRRRR,"Americans. 
It’s wooster shuh.",0
fjbmoq8,"Having spent a bit of time in Grafton, it probably didn't help.","No one in your country sought to abuse Australia publicly yes, but Australians, such as myself, have certainly been on the receiving end of snide remarks and hateful comments about it across the Tasman. 
That being said, that man left Australia with an open mind, to backpack through the subcontinent and was then radicalised backpacking through Europe. He was radicalised by social media, not by fucking Grafton, NSW.",1
fjcbjiu,Link a peer reviewed journal for these claims please.,"There is a great deal of research done on the efficacy of homeopathy, and you can google some meta studies on the subject. From my experience, (and the studies support this), homeopathy works on several ailments that main stream medicine has difficulty in treating, like respiratory diseases such as asthma, especially in children. It also has shown to be effective in reducing discomfort and pain from the side effects of cancer treatments like chemo, removal of warts without surgery, etc. 
The problem occurs when some homeopaths make outlandish claims on its cures. Homeopathy has its place in treating several chronic problems, but if people start believing it can cure cancers and the like, then they will run into major problems. So look at homeopathy as an effective alternative to some ailments that cause discomfort which main stream medicine cannot cure. But looking at it as an effective and complete alternative to allopathy will mean one will do so at one’s own peril. However, there is always the problem of finding an experienced and effective homeopath, since so many of them are just not upto the mark.",0
fja4rc1,It's a freemason sex wink,Does he wink the wrong way or is it just me?,1
fjas7ta,"No, but obnoxiously shouting about it every chance you get is a pretty good indicator.","""Being British and loving your country means that you HAVE to hate all other nations"".",0
fjcmgr1,Exactly bruh hop in that shower and wash that ass for 30 seconds and be super duper clean,Greed and panic. I have no problem using rags or hopping straight in the shower if need be.,0
fjcpnr3,yeah like heinekens ads are literally all about not drinking and driving.,"They are aren't they? I always see on alcohol ads ""always drink responsibly.""",1
fjdgros,I'm not sure about that comment with the greens. The Nordic systems rely on exploitation of vast amounts of natural resources to fund a lot of what they do. If you copy pasted those systems into Ireland we'd have a massive shortfall in the budgets.,"If the Irish people actually wanted change to a more Nordic system as Bernie envisages, they'd have voted for the Greens or the Soc Dems.
A vote for SF is just a vote for 'let someone else pay for me'. Our selfishness is just based on monetary lines, not racial or ethnic lines.
Ireland is a very different country to America. Here we have the 2nd most progressive tax intake in the OECD with the top 10% contributing 60% of our taxes.
https://www.thejournal.ie/irish-tax-system-inequality-4975546-Jan2020/",0
fj9gh4x,"Not sure of the downvotes, that sucks regarding your friend","I have a friend in the RFS and he did not once get a call out for the bush fires over the summer despire being available, he has been in the RFS for over 5 years. I think the RFS management needs to get their act together.",0
fj9d1eq,"It's projection, as most any truthful statement about their behaviour results in howling butthurt.",Lol. To think they’re the one who keep calling others “snowflakes”.,0
fjbfbcv,Is that for real?,"This whole sequence is unintentionally hilarious.
Edit: Philip Schofield is now describing the challenge she has to do.",0
fjcv6yu,"Did you even read the article?
> GIMS, which is currently under testing, will be used by govt departments for secure official communication","so they can monitor all messages ? lmao
a SARKARI whats app what a joke",0
fjdv5qw,"Judge Michael White's universe.
That said, 2 years for killing someone seems about as low as you can go, I think.","> He did not see any point in suspending any part of the sentence as Alexander Whelan is not a drug user and does not require rehabilitation as he has no history of violence.
So a child with no history of violence or substance abuse is pushed to the point where he can haul off and kill someone (to protect his mother) gets the full wallop with no psych help, but if he was coked off his tits he'd have gotten a reduced sentence?
In what universe does that make sense?",1
fjad8po,It is but sounds like he will give it up starting Sunday. He's going to keep us posted .,Giving up just for Sunday or forever starting Sunday? The sentence is confusing.,1
fj9mvtp,Tomorrow morning leave a half milk/half piss bottle sitting there.,"Bit of context, reasonably nice part of town would probably be described as ""up and coming"" in estate agentese. Problems with things being nicked from front gardens and backyards started several months ago, hence the camera. 
Shame as we used to be able to ask delivery people to just leave things out of sight. 
Milk seems like a new low...",0
fjbvtbu,"Fuck people like you man. This shit requires 20% of those infected to be hospitalized for 3 weeks and has neurological side effects. Also 20% of those hospitalized die due to ARDS. And these are just the official numbers, and I hear the actual numbers are much worse. Also, the virus survives on dry surfaces for upto 24 days in temperate zones and 9 days in warmer locations and it spreads through air as well after the saliva etc evaporates.
The problem therefore is two fold:


the stress on hospitals


the death rate


And in a country like India with bad healthcare already, and states like UP where gomutra is king, you can only imagine the havoc it will cause. I predict the government will not release the death rate numbers.","Not able to understand this frenzy. Sure it's 2 times more communicable than a flu, but it's a water borne disease. 
Panic if someone sneezes at your face or you touch your face when in public spaces. 
People who aren't showing symptoms are less likely to spread. 
Please wear a mask if you start coughing and sneezing and stay at home.",0
fj9dfyj,Very Good Lord!,Good Lord!,0
fjeolh4,Ordinary Britain is in France,"I know it says great, but all I see is ordinary Britain.",1
fj9j9q2,"I don't think it's slowing down. I walked past earlier, they seem to be getting a huge amount of support and encouragement from students and everyone in general.",Looks a lot have stopped. The cold and storms I suppose. Hopefully it picks up again.,0
fjchxx3,...and all non-blue eyed people too.,">God's blue-eyed boys and girls.
WHOA... That might trigger some atheists.",1
fja7189,posting this again because r/india has taken down two posts under which I made this comment.,Modi is a megalomaniac and attention seeker. He can't keep himself off the mainstream media. This is not happening. Just another PR stunt.,0
fjc4gnz,"The RBA lends money to other banks who then lend money to you and I. For the last six months or so, it's at an interest rate of 0.75%, and so a bank might charge you say 2.75% for a loan.
Because our econmical outcome is looking worse and worse and the government isn't or can't do anything about it, the RBA has decided to lower the interest rate to 0.5%. This in turn is suppose to force your bank to lower your interest rate to 2.5% and you then use that extra 0.25% to go out and spend or invest it to try to stimulate the economy.
>how this affects me?
Unless you have a mortgage or a bank loan, you're not really going to feel the impact immediately and even then, that's if the banks pass the rate cut.",What does this mean? Can somebody ELI5 to somebody who has literally no idea how this affects me?,0
fjbsgxd,"They get deported after they do the time for their crime.
Which defeats the purpose of jail, because if theyve paid their debt to society then they should be welcomed back",Its a lot cheaper to deport them than to keep them in jail...,1
fjaesss,Will take care! And take my time. Thanks!,Hah 28 is not old. Heck my mother got married at 28 and this was 32 years ago. Yes it's not usual but dont let your age make you rush into something so important.,0
fj9iibr,How can you not recall the episode where the magic lipstick makes girls kiss him...even his sister ?,"I only remember 3 things from this:
1) The kids finding bones and talking about them while crying or something.
2) Something involving a goat.
3) The theme tune in its entirety.",0
fjcjlfn,This is what would really stimulate economy,"Fu#$ing eye watering.
But we can't afford to increase Newstart.
Trump would be proud.",1
fj9evy7,We have legislation permitting a safe injection facility on the cards for the last 5 years. It's been blocked multiple times from planning permission objections. Hopefully it will eventually get built. Once we have one others will follow. One day we'll hopefully have a place like this for drug users to go and access harm reduction facilities.,"Watched a documentary (think it was in Canada) a while back where they had safe centers where people could get clean needles, be supervised by medical staff while using controlled substances and offered rehabilitation programmes and not be threatened by police 
None of the drugs had been decriminalised but the state has recognised an epidemic and offered a safer system to those at the highest risk levels.
I don't think at this point decriminalization would do shit. we've an rooted black market supply chain that isn't going anywhere, best thing the state can do is provide early education into the long term effects of drug use, heavily change the support infrastructure for those caught in addiction cycles and stop treating em like dregs and leaving em in back alleys.",0
fja37z2,Aur mai?,Happy Birthday to pyaare redditors :* u/rorschach34 u/gumnaamflautist,0
fjaxmrt,"The first study I found suggests otherwise, giving a figure of 0.73mm/year.",Yet strangely the seas are not rising in Sydney Harbour,0
fjauwp1,You could of gone with anything but you went with chevrons! Now I feel like I’m on the M1 between J26 and 30. 10/10 good sir.,"Wooooooaaahhhh mysterious girl, I wanna ~~get close to you~~ remain at least 2 chevrons apart from you.",1
fjcrt1y,Same here. Literally visiting every corner of the country in the next 2 weeks and they will all be large gatherings.,"I make my living gigging around the country, a little fearful gigs will be cancelled now...",0
fjebuk0,"I work in a pharmacy. We sold out of masks nearly a month ago and out of hand sanitiser last week. People have thrown a freaker every bloody day over it. 
We got extra hand sanitiser in and it's the stuff no one ever buys because it's like €15 cost price. It still sold. People will pay anything.","The cynic in me decided to take a peak at Adverts/Donedeal earlier to see if Irish folks were buying up masks/hand sanitiser for profiteering from a public health crisis. 
Price gouging confirmed. Dickheads be dickheads I suppose. Fuck all those people...",1
fjb2kw1,This would be in Wicklow!,What county?,0
fj9mu2e,">No IT conference is complete without a heap of unrelated bullshit. 
Considering it costs you absolutely nothing to write down your (presumably cis, given your response) pronouns, what's your issue? Takes ten seconds and you can forget it's there. I don't see why you'd ever care.
Given the inherent networking nature of these events, you may we well stick down pronouns along with your name. Literally no reason not to, and to be annoyed by that is stupid.
Writing down pronouns may seem stupid to you (again, presuming you're cis) but it can make things so much easier for any trans members of the community in attendance. 
It's not for you.","""As an effort to further the inclusion, lanyards were given out to those who bought tickets, on which there was a special section for writing one’s pronouns. This was a remarkable touch that a lot of people very much appreciated.""
No IT conference is complete without a heap of unrelated bullshit.",0
fjcu4vq,The most disappointing trailer since... well... cant remember the last time I was so disappointed,What an absolute load of garbage. I read those books as a kid. They were great. Not even close,0
fja8kn7,"I'm sorry, I don't see anything persistent about OP's requests.","another ""sealion"" troll.
Sealioning (also spelled sea-lioning and sea lioning) is a type of trolling or harassment which consists of pursuing people with persistent requests for evidence or repeated questions, while maintaining a pretense of civility and sincerity.
Sealioning - Wikipedia. https://en.wikipedia.org/wiki/Sealioning",0
fjc0uuw,"If we enter Wuhan lockdown conditions, you won't be leaving your apartment for 2 weeks.
Let's hope it doesn't come to that.",I live just above coles and have never seen so many empty shelves in last 4 years. I don't understand why stockpile ? If govt announces a lockdown then are grocery stores going to close too?,0
fjaxoi6,"Biggest annoyance for me when I used to put frozen food out, the amount of products customers dump in the freezer! Should be charged as theft if caught! Waste of food.",And people that just leave milk/ice cream/random meat on random shelves to go off. They should also be part of the roundup for punishment!,0
fjej2ag,It'll go viral,I'd say it'll be sickening,0
fjd1tvp,"Thanks, IF.","You will need ID and proof of address. If you already have an account, and you can prove that, you should be OK. They are issuing SSCN codes that you can use to identify yourself as an account holder.",0
fjcpqhj,u/catwhamen Mera bhi kata tha usne,"NOTICE
&nbsp;
SHARMA-JI-KI-LADKI MISSING
This is to inform you that Sharma-ji-ki-ladki working  in catfish.org has been reported missing from December 2019 evening around 7 pm. She is 4'7"" tall, medium built. She has a katega scar above the left eyebrow. She was last seen in RDT catfishing innocent boy.  Anyone who sees her or gets any infomation about her is requested to please inform me or sharmaji.",1
fjejqdg,"We've only been saying it since 2016. Remember when 2016 started with a load of celebrities dying? Then Brexit, then Trump. The celebrity deaths culminated with George Michael and Carrie Fisher in December. Seriously go look at all the amazing musicians and actors that died in 2016. Ever since then the world has gone fucking mental.",People say this every year.,0
fj9sxd3,Faith bad,"ITT: Many folks complaining that the title is misleading since there have been no actual tests conducted - because the scientists are irritated that they have to spend time and resources behind such a wild claim - rather than undertaking more important research.
so my new question is - if there is a large scale experiment where the effects are actually monitored & documented - do you reckon people will actually sign up for it.... and willingly put themselves in the mix ""for science"".",1
