id_text,text,parent_text,label
fj5vjya,That's something even the girl I am currently with does. But instead of watching geopolitics she sleeps on my shoulder in which she murmurs god knows what,"Saturday night ka mera 'sneak in the garden and light up a joint' routine badiya baith gaya hai. Kal mast joint fooka gaane sunte sunte and moon ko dekha and uske baad some geopolitics ke videos. Man, I love saturday nights.",1
1572561176420323328,"@ZaleskiLuke @trumpsacrazyman Twice impeached, de-platformed, disgraced, coup inciting madman.",Trump was already president and it was shit. He was impeached twice. He drove us into a disease-ridden hellstate of death and unemployment and debt. Then he pretended he won for 2 months and unleashed the kraken of cons lying relentlessly until he incited an attack on the Capitol,0
1572525710878838784,@SocialistNHS The whole Nation needs to go on strike… except for Bankers and Energy Corporations of course???,"Would you support NHS workers if they had to go out on strike?

It looks like we will be left with little choice soon! 

If you would support us please reply with a ?.

#OurNHS",0
1572483153184407553,@iam_paulash @Omo_orimolusi ?,"@Omo_orimolusi My sister is comma that is your problem, pls add it to make it complete",0
1538247149451878403,@bigkenreid @Aideen_Reporter God bless Aideen RIP ?,Tonight the thought @Aideen_Reporter is no longer with us is just heart breaking. A decent soul who suffered too much. The news has stunned many of us. We all need to take care. God bless her. RIP.,0
1580525611130400768,@forzarevilo Yup I am lol,"I hear a lot of people complaining that in LA it's hard to find good friends when the better question is, are you a good friend?",0
fj5dg1h,Lovely!,"Pronounces Jalapeno as it's spelled, whenever anyone says stop he starts singing, ""rough riders roll"", pronounces bologna as it's spelled, pronounced Italian as eye-talian, constantly calling me "" honor student"" whenever I do anything stupid, ""are you sure? Are you positive? I thought you were__!"" Etc.",0
1572328946125111296,@shainadenny @wildearthpets @dogdropco We 100% should do a fun taste testing with @dogdropco pet parents!,@RyanBethencourt @wildearthpets This is amazing! Would love to get these in the hands of some @dogdropco parents,0
1579725213696417794,@Pdouble0k The man is talking to archery people this week. So perhaps after ten-twenty years of practice? ?,@CatzzzUK Catch me if you can ?,1
1538178719898009602,@MarkACoughlan Up and down in 3 hours but that was going at the pace of the slowest in the group....you'd want to be reasonably fit as it's steep enough in places,@kommc How long did that take mate? Home next month and want to do a few climbs with the kids. Did Diamond Hill 3 years ago easy enough but there older now.,1
fj54bb5,How often do you see any kind of baby bird?,pigeons are surveillance drone placed by the government. I’ve never seen a baby pigeon. They just spawn out of nowhere.,1
fj62jxi,As a Muslim this is exactly what they want us to do- react with violence on a large scale. All it will achieve is with more innocent bloodshed and allowing the RSS-BJP terrorists to come back to power in 2024 with even greater majority by gaining the sympathy of the majority who will see them as saviors. The Sanghis basically use the Israel model of unity through hatred which works because most Indians(including Muslims) are communal in nature irrespective of educational background. The problem is not Hinduism or Islam. No religion encourages violence or hatred. The issue is the politics of this country depend on the exploitation and brainwash of it's naive population who blindly believe the Divider in Chief as long as he makes bullshit promises of safety and prosperity and no matter how many times he fucks them they will gladly bend over and take it. Hitler used the same type of propaganda the Sanghis use and if people don't think it works- have a good look at the state of this country.,"True. Back in 1993 or the IM run from 2004-2007, the bombings felt unfair because neither governments nor society supported babri. Babri was carried out by what was seen as a fringe extremist group, but everybody in society paid the price. I have no problem calling those bombings terrorism.
But if bombings happen now, I'll actually call it armed resistance rather than condemn it as terrorism. Government, judiciary, media, police, bulk of hindu society itself - are arrayed against them. If they are forced into a fight they didn't want in the first place, it's not terrorism but resistance. Bhagat Singh might have thrown bombs, but he was not a terrorist - he was a resistance fighter.",1
1579889021127258113,"@stufflistings Q9) A. 10MP ?

#GalaxyZFlip3 
#FlipAtFlipkart #GalaxyZFlip3 
#GalaxyZFlip3Giveaway 
#stufflistingsarmy 
@stufflistings","Q9. What is the resolution of the #GalaxyZFlip3 front camera?
A. 10MP
B. 5MP
C. 8MP
D. 12MP
#FlipAtFlipkart #GalaxyZFlip3 #GalaxyZFlip3Giveaway #stufflistingsarmy",0
1580535898667503616,@thesledge1969 Good morning to you my sweet friend! Lots of rain here. Have a great Thursday and thank you on my Tribe! Big hugs ??⚾️☕️☕️???⚾️,@SlK0907 Gm my sweet friend happy Thursday to u. Hope u have a amazing day and keep safe and warm. Enjoy your coffee and breakfast . Gd luck to ur tribe tonight. Big hugs ☕️☕️????????,0
1578604139529240576,@JBarney1994 I'm a Collingwood supporter but after Buckley sent half a dozen premiership players out the door nothing else amazes me these days! I like Ollie but if he wants to go to Geelong so he can play with his brother SO BE IT! END OF STORY!! KAPUTSKI!!,Have to laugh at the Collingwood fans on here who have been talking down Ollie Henry ever since he requested a trade now suddenly complaining that a pick in the mid-20s isn’t enough,0
1572461042973966336,@sayhitolyss @itsalyssuhlove Me 2 .. I’m like I’m not interested! You know anyone who wants to buy a PS5 ?,I hate the kind of people that every time you talk to them they’re always trying and sell you something.,1
1579702912577830913,@Frances56033968 @GardeningIdeas1 Hahaha ?,I keep forgetting to put a #Gardening Lol,0
fj63vnt,"And, er, where is the mandatory dog tax?","Have three lots of family members visiting at different times today. Don’t intend to leave the house at all, going to sit on my arse and enjoy hot drinks all day, before going back to three walks to school a day tomorrow. My parents want to take the kids to Liverpool today, so might get a chance for some Sunday Xbox. 
I’m halfway through two weeks off work. I totally forgot about work, until now. Il spend the second half dreading going back to work.",1
1580520535066574848,"@MotherCluckyou Be Careful. Saw a show once where a guy tripped in his shop, hit his head on a table and knocked himself out. He had something in his hand that started on fire. Shop burned down.",Yesterday I was greedy and inpatient and burned my top lip with my hot tea. This morning I tripped on a kitchen rug and busted the inside of my bottom lip when I slammed into the kitchen counter. I will be taking instant oatmeal to work for breakfast and lunch today ???‍♀️,1
fj5dtr7,"The church of scientology is screwy anyway, I wouldnt doubt it.","David Miscavige, the chairman of the Church of Scientology definitely murdered his wife and is getting off scott free for it. Him and his wife got into a pretty heated argument in 2007, and she hasn’t been seen since. Lawyers hired by David claim she is still alive and devotes 100% of her time to work at the church of scientology, which is why she hasn’t been seen since August 2007. In 2013, a former member of the church had filed a missing person report that was closed after a few officers had “spoken and seen Mrs.Miscavige”, even though there’s no evidence whatsoever of this meeting. All missing person’s reports now are turned down since this investigation is forever closed.",1
fj5411q,Thank you I'll definitely try this,"Throughout the day (maybe once an hour or so) ask yourself ""Am I dreaming?"" Then, look around and logically think why you are not dreaming. (""I jump but I am not able to fly. That is my cat which I've had for 4 years. I normally eat soup every day for lunch, etc"") Whatever it is, think through it logically.
Eventually, when you are dreaming, you will be able to recognize that you are dreaming because you have done this line of questioning so much. I used to do this and was able to control my dreams because of this technique.",0
1572500325009072132,@onporter You would hope someone might have done. Risk assessment and all that.,@MarcWilliams22 Did no one at #cpfc plan for the inevitability of this?,0
fj5by0n,"....yes, but here, you're not going to get shot by someone who thinks they have the right to own a military weapon, and if you do get hurt, you can be taken to hospital and treated without having a crippling bill follow you out of the hospital and having to declare medical bankruptcy; you can go to university without being laden with debt as soon as you get out and we have elections that are run by an impartial independent body, not potentially by the incumbent.
Sorry, I'll take here, thanks, over that lunatic asylum.","Big difference is that land is cheaper in Texas and governments dont  interfere with private property rights once zoned. Australia is a locked up country, locked up bureaucracy, nanny state laws and endless regulations that rarely achieves its objectives. From my experience in Texas is that they have a  greater desire to protect the natural beauty and wilderness values than  just about all our governments  while still making Texas the cheapest places to build  a house or own land.  We have lots of potential but we squander our opportunities because of our stupid politicians.",1
1578492728555757568,"@ReturnofR REM what's the Frequency, Kenneth ?",What SONG did YOU listen to TODAY?,0
1538218056840798209,@ArnoutPosthumus Thank you for recorrecting autocorrect,@tiffaquinn Veganizing haggis*,0
1578338475841290240,@lavern_spicer No.,Is Elon Musk buying Twitter or not?,0
fj514lu,There’s dildos in the kids section?,Throw dildos until you can reach the whips,1
1538145169282945024,"@ElaineARoche ?????? Well done , relief","BabyDoc passed all 4th year exams, that’s made my week #grateful ??",0
1537897620546281474,@mario_manresa @UCD_SBBS Great news. Congratulations!,"It's official now!! I am absolutely delighted to announce that I will join @UCD_SBBS as an Assistant Professor under the Ad Astra fellows program, starting September 2022. This is the start of a new and very special chapter, a dream that comes true! (1/3)",0
1579703654491516928,@abhisheknigam19 @rajatsambyal_ Coaching classes,"@rajatsambyal_ Sir, what have u started?",1
1579720394873122817,@AshwiniMS_TNIE Many congratulations ??,"Completed 18 years in Journalism today! 

#WorkAnniversary",0
1579746198201982976,"@arcomedys @Swiggy Have you eaten 

Gujarati language",@Swiggy what does that mean?,1
fj57zba,If this is true he’s way smarter than I would want to give him credit for.,"Donald Trump is purposefully handling the Corona Virus poorly so that it reaches pandemic state and he can declare Martial Law.
Martial law: is the imposition of direct military control of normal civilian functions by a government, especially in response to a temporary emergency such as invasion or major disaster, or in an occupied territory.",0
1579052712502923265,@DeeHalnon Thank you Dee,"@mtully21 How right you are Maureen
Your flowers are just beautiful ?",0
fj5e7dj,What the actual fuck?!?,my mom made me watch i spit on your grave (the first one) when i was 7-9. shit was traumatizing. a 7-9 year old watching a woman got raped even though it was acting.,1
1579060232030158848,@Nell496 @RadioBrendanRTE Yep very much from the heart,@urlofcork @RadioBrendanRTE It was powerful Urlo. Made me cry.,0
1572500293425975298,"@claireroberts01 Happy Birthday , what a wonderful family ❤️❤️❤️","Today is my birthday, I have balloons ???I want to thank my donor and family who 24 years ago decided that they wanted to donate their kidneys and I was one of the lucky recipients. #forevergrateful ❤️",1
1572512814744621056,"@D_Blanchflower @stephbonner7 @trussliz she’s also a dangerous diplomat, not because of any policies, she has no skill at that level, but because of a complete lack of understanding of international diplomacy",Done many interviews &amp; written several columns on @trussliz and her disastrous economic policies so far I have said they are in ‘total disarray’ but seems inadequate as pronouncements get worse daily I have never in my fifty years of doing economics seen anything as bad as this,0
1572500396740079617,@CarolineLucas @frogyuk @Jacob_Rees_Mogg And what can @CommonsSpeaker do? Nothing!,So our slouching Business Sec @Jacob_Rees_Mogg evades Parliament &amp; finally makes critical major announcement re urgent #energycrisis support for businesses via video &amp; press release. Blatant avoidance of scrutiny exposes his false posing as one who respects tradition &amp; Parliament,0
1536234046648369152,@ricettatore1968 ???,@FedericaPito Sexi,0
fj661yj,See! I have a 1 year old and I would be doing exactly this daily if I didn't have my few deep breaths before meeting every baby.,"I burst out laughing when a distant relative told me that her newborn daughter was called Tinkerbell. I thought she was joking, she wasn't. Poor kid.",1
fj51ajs,Haven’t heard that one before,Your mum,1
1572566425390428162,@chrissyteigen @MashRoots_Cincy,"Coming to Cincinnati for a couple days tomorrow! Would love to know what to eat, please!",0
fj65m1n,Why is someone with there hands down there tracksuit annoying you,"It's not just a London thing, it's annoying as hell. You just want to tell them it's not gonna fall off! They don't have to keep guard of it just incase haha",1
1578331872429371392,"@meyrosad How they did it back in the day, bonus points if the wife is half the age of the groom",lets get married so we can get to know each other,1
1538205460444110848,@YvonneBurdett3 @BremainInSpain @alex_kovaleski Dorris death stare..,@BremainInSpain @alex_kovaleski Is she related to Dorries?,0
1578275596517675008,"@Wanderlustin @SarahDemp Right?
I know enough to be dangerous about that franchise but not enough of all of that so I’m just enjoying an incredible show",@SarahDemp i am living in wonderful bliss having shit all knowledge of the timelines ?,0
1578281747342823425,@merry_burke @ACTA_org @JanelleBowden can you help?,@ACTA_org I have filled in the application form from my phone and it isn't clear what I need to do next. Do you have it??,0
fj5e4oc,"So touch their eyes and force them to roll, got it","Soothing, calm voice. Get them to roll their eyes if you can.",1
fj54lo2,Xnxx,redtube,1
1579718981027475456,@Anikha1123 @Kavitha19310128 Hi,@Anikha1123 @Kavitha19310128 Super cute Nani bangaram,0
fj5domd,It's supposed to be not farfetched conspiracy theories,"The conspiracy about the music in pop songs nowadays. They have a kind of ring to them and that's what get children addicted to it. Like I'm the song ""Middle"", and Justin Bieber's ""Sorry"". They both have a high pitched sound in the background that I believe is the thing addicting people to the songs.",1
1578361300576788481,"@kylelabat @LIVGolfInv @PGATOUR Yes imagine if you watched both 
Or watched one but did not mind about the other 
Or watched neither but did not mind either","In the world of #golf

1. LIV enthusiasts claim @LIVGolfInv is second coming of Christ, the best thing since sliced bread -  IT IS NOT

2. @PGATOUR loyalists claim LIV is a clown show &amp; unwatchable - SO NOT TRUE

3. Golf journalism is dead

4. Strangely, neutral is not an option",0
1572447347933851650,@PabaluSilva Thank you ?,@VindyaPeiris2 Absolutely not but cute. ?,0
1580536472582918145,@JoJoFromJerz If you seriously think that's going to result in anything other than more of our tax dollars wasted you're dreaming,F*CK YES! Ron DeSantis is under federal Investigation by the US Department of Treasury over his use of COVID Relief Funds to fly migrants to Martha’s Vinyard.,1
fj5dl60,So did they do it or just let their guard down so it would happen?,"9/11. Sorry US brothers, but your government (like any other) is willing to sacrifice thousands of civilian lives to keep the war economy going.",1
1572169347224797184,"@JohnMcCullough6 May be a bit weird to us today, but symbolic breaking of things is a very old tradition!",@archae_delle Weird behaviour there.,1
fj548vr,Weren’t we apart of that then quit?,Sign the Paris Agreement,1
fj6zb0a,"why not give it back to him, it's his property? It's like being in school and the teacher takes away the stuff","Guy tries to call police on himself. 

Young gent P1 comes to the door. Regular knows we search. Hands over his wallet, boom bag of cocaine . 

B1 “Sorry mate that’s getting destroyed, and you’re not coming in, however you’ve not caused issues before so come back next week and all is forgiven” 
Sounds fair right? 
P1 “ok I’ll go, can I have that back?”
B2 “err no mate”
P1 “ why not?”
B1 “because we’re not drug dealers! Of course you can’t have it back we’re all under cctv and this will be destroyed under camera too”
P1 “ I don’t believe you’ll destroy it!”
(Note: Many people seem to think bouncers either all take or sell gear, it’s not true and even if one of us wanted drugs we’re not gonna trust something that you could have got anywhere and done anything to)
B1 “it’s not my job to convince you of anything mate, been nice, been fair now please listen to your GF and go home”
P1 “ I’m gonna call the police and tell them you’re in possession of drugs”
B2 and B3 laughing I take the lad away from door to chat more discreetly. 
B1” look mate I know your annoyed but you’re saying you’re gonna call the police to tell them we’re in possession of drugs? That we took from you!
P1 swears at me and then proceeds to call the police. He was only on the phone for 60 seconds so I assume 999 binned him off and no police showed up.",1
1578681995495809024,@Castletonian That’s true Joe….,@mtully21 Isn’t it in our darkest hour that we most need the light. ? #Creeslough,1
1579706714559238144,@PunjabGovtIndia ਸਰਕਾਰ ਬਹੁਤ ਵਧੀਆ ਕੰਮ ਕਰ ਰਹੀ ਹੈ| ਹਾਲੇ ਹੋਰ ਵਕਤ ਦੀ ਉਡੀਕ ਕਰਨੀ ਬਣਦੀ ਹੈ|ਸਰਕਾਰ ਆਗਾਮੀ ਸਮੇਂ ਵਿੱਚ ਹੋਰ ਵਿਕਾਸ ਦੀਆ ਨੀਤੀਆ ਲਿਆਏਗੀ|,"Vigilance Bureau arrested Davinder Kumar, Assistant Registrar, Co-operative &amp; Marketing Societies, block Dasuya, District Hoshiarpur red-handed for accepting a bribe of ₹20,000. Accused has been supervising 70 Cooperative Societies in block Dasuya including above said at Tanda.",0
1572503153865822208,@SiobhanBenita What’s this fascination with the eu Never did us any good,"Liz Truss has told the BBC that she's prepared to take difficult or unpopular decisions to help UK economic growth.  

Excellent.  When are we rejoining the EU then?",1
1578188503699296257,"@Josh_B_Rosner @thebooksdesk @PolygonBooks Thanks Josh! (I’ll never forget how kind you were when I lost my job, which was the exact period in which I was writing this one. It meant/ means a lot!) X",@PaulDalgarno @thebooksdesk @PolygonBooks Oh how wonderful!! Congrats!,0
fj6fepf,And are a security nightmare,There are kettles and toasters that hook into your WiFi that can be set to operate at a particular time or be controlled by your phone however you're still going to have to get out of bed to make tea and butter your toast,1
1580055582224289792,@Shambhavi130 Pran Jaaye Par Wajan Na Jaaye,"Weight gain is more difficult than weight loss ,? change my mind if you can.",0
1579716607030751233,@shivaniACH Ho ka,एवढया वर्षे झाले ट्विटर वापरते पण like ला चार वेळा प्रेस केल्यावर स्क्रिनशॉट निघतो हे आज समजले ?‍♀️?‍♀️,0
1572499608760193029,@NorthBSHA Why would you hit such a legend,@Stoney1875 He’s blues apparently but either way it’s the most embarrassing attempt I’ve ever seen,0
1572460251781410817,@SDishanthan I thought the same thing,@VindyaPeiris2 If am correct you haven’t reply his/her message that’s the reason why he/she told you that you are arrogant,0
1578289549544824835,@clothedvillainy Think they just don't have time to digest the slew of online content.,@Graeme_Orr Gotta get those clicks.,0
1538518313407549441,@Wonderful_Ed Bible study.,What was your favorite Saturday morning cartoon?,0
fj54ip2,?,"PLEASE READ THIS MESSAGE IN ITS ENTIRETY BEFORE TAKING ACTION.
Hi there, your post has been removed for one of the following reasons: 


Rule 3: You must phrase the question to require more of an explanation than just ""yes"" or ""no"".


Rule 3: Questions with a single correct answer, that can be researched elsewhere are not allowed on AskReddit.


Rule 1: You must post a clear and direct question in the title.  The question must be a full sentence.  Try including question phrases like ""What is..."", ""What are..."".


If you have any queries or concerns, please feel free to contact the mods. Thank you.
I am a bot, and this action was performed automatically. Please contact the moderators of this subreddit if you have any questions or concerns.",0
1572501180705800195,"@thetimes More than a million on the streets of London sounds a lot. But to put it into context more people were on the streets of London this year for both the Notting Hill Carnival and Gay Pride. They planned for more, we were expecting more, they just didn't come.","More than a million people lined the capital’s streets; four billion are thought to have watched worldwide. Her last farewell was an astonishingly colourful national ritual, Ben Macintyre writes",0
fj56gb2,Yes unfortunately it can be either parent that leaves. Sometimes even both.,Its not always the father.,0
1580555957901283328,@CalltoActivism ??‍♀️,"BREAKING: Officer Fanone demands that Donald Trump be “held accountable” for the actions that led up to January 6.

Who stands with Officer Fanone and agrees with him? ✋",0
1538116771990974464,@TheCouchtripper You are an obsessed freak. Seek help.,@YeSecondPost How do you know he's a dude? Is it because he's got a cock?,0
1572500913813868550,"@Davedaly51Dave @Garybro82547780 With all the favours he’s done for them over the years, it’s only right that they reciprocate","@Garybro82547780 Rumours are the Unite Birmingham hotel is fully booked with Tory’s for conference week.
Even Lens suite.",0
1572330713697091585,"@SQLBits That time, when a huge curtain reveal the whole fun fair at SQL Bits Party Telford","If you could pick your FAVOURITE thing from ANY #SQLBits event, what would you choose?

????☕️?",0
1579995988307374080,@madzadev Javascript.,What are you currently learning? ?‍??‍?,0
1572500537064689665,@asmir1 The kids here need it plus there's loads of talent in small heath park lool,@asmir1 Do one in small heath next,0
1578470666017177600,"@thepaulwilliams I always look at the front row first then locks, then the 7, 9, 10 and 15, before saying a silent prayer ??","When you're looking at team sheets, which section to you look at first?

I don't look at the team sheet in order. 

I always go front row.

Then backrow.

Then locks.

Then centres.

Then the rest.",0
fj63v1t,Looking to correct my mistake.,Care to be more specific? At the moment you're just asking if anybody's seen a mug.,1
fj53zwv,"For me it's quite the opposite, I have to throw in some zero days where I can just relax and regain some energy (both for my mind as well as getting some physical rest).","Avoid zero days, do something that helps you move forward at least once a day. It can be as simple as doing laundry, cooking, cleaning. Whatever, do at least one thing once a day that helps you. 
Exercise 
Read- someone smarter than you figured out what you’re trying to figure it out and odds are they wrote it down.
I got this advice from another reddit post, really helped me.",0
1572500973494439940,"@myeyemyview A lot of English people don’t understand or speak proper English, init!?","I got a letter from the NHS this morning,
It included instructions in 28 different languages, that's right 28.
Here's a way to save the NHS money, only treat people who speak the language of the country they live in,",0
1572514088089165824,"I'm not setting up my own justgiving page, I'm just going to join in the walk, walk in Gail's memory &amp; ask all you amazing people who have been so supportive to me over these last couple of years that if you'd like to make a donation, then please donate to Elspeths page.","This Saturday is the Brain Tumour Research Walk of Hope, it falls exactly 2 years to the day since we lost @ClaretGaily on 24th September 2020, to this terrible disease. I can't believe it will be 2 years. It feels like a life time ago &amp; yesterday at the same time.",0
1579753078961868807,@NGKabra @TimothyDSnyder Common thing when we friends meet ?,"""Sometimes you change the subject, and sometimes the subject changes you."" —@TimothyDSnyder",0
