id_text,text,parent_text,label
fj6j93j,"Liverpool lost and I forgot my homie's bday
Sucks","3 of my ex colleagues from my previous company quit yesterday, 2 I was on very good terms with, including a guy that was among the top performers who couldn't handle the politics any more.
Meanwhile David de Gea (and Jordan Pickford) are collecting their paychecks.
Another mate (my bestie at work and said top performer's roomie) just spilled the beans today on why HR encouraged me to quit during probation period itself so he could save 185000 for the company.
Sucks.",1
fj5e8r4,Well should I insert a picture of penis or something?,Not many. It's not original enough.,1
1580303793542995968,@ImMytheros THIS IS FACTS!,It's so important to post your content to other platforms for growth. You're not going to grow by just streaming constantly and not branching out.,0
1538191416228192256,@sprinkles785 I'm glad I haven't tweeted much today?,It’s one of those days where I have deleted more reply’s than normal … it’s a case of ?…,1
1572476064185651201,@Janet_A_P Definitely,@alexthepage Floella Benjamin,0
fj58flv,I am really fucking happy for you dude,"Lowest point was probably the year after high school. My parents had divorced and my mom moved out first after keeping me on lockdown because she found out I was dating a girl. Then my dad moved out to live with my now step mom. I went from having no freedom at all to having absolute freedom, and I did not handle it well. I did a lot of drugs and drank a lot of alcohol. Most of the time, the only consumables in the house wee ramen and booze. I didn’t even care about taking care of myself because I was drunk or high all the time. 
I think the highest point is now. I bought a house last September, got out of an unhappy marriage, my teenager is absolutely thriving, I’ve got a decent paying job, published two novels, and I got back together with that same girl I dated twenty years ago. Things are going really well now.",1
1538569931993796614,@bearaboi Good for you your a gentleman she was lucky she had you to watch over her,"Did something last night I never did before while out in Dublin: asked a girl if she's okay going home with the man she was with.

As I was walking behind the couple, I noticed how utterly demeaning he was to her in what he was saying to her and a red flag went up in my mind.",1
fj5c0s6,hell yeah,Mint chocolate chip.,1
1579742664349876224,@Dfo_Ds Too ab loge or to kya ?,@Heart_stolen07 Maine nahi liya ♥️de ??,0
1580526380541878272,@jeemoney1117 ? love this.,"@oliviacola My 7 year old son would buddy up with him in a hearbeat. He always asks me if hes ""weird"" because he doesn't like what all the other kids do.  I say hell no, you do you always!!!",0
1578412887483199488,@Libaral_india Perfect…you nailed it….???,"पहिला सेट उद्धव ठाकरे यांनी जिंकला आहे नक्की ! 

शिंदे गट अंगावर येऊन देखील उद्धव यांनी फक्त शिंदे गटाच्या शिंगात शिंग अडकवून त्यांनी सेट केलेल्या अजेंड्या पुरते मर्यादित राहायला नकार दिला?",0
1579736732781924358,"Transportation Facilities

?Trichy International Airport is Additional Bonanza ! 

? Thanjavur Junction is Just 24kms only !!

?TN's 2nd Biggest Rail Hub Trichy Junction is Jus 39km

?Budalur Railway Station in Thanjavur dt is Jus 10km

? Upcoming Thanjavur Airport","#SportsCity #Sengipatti_Thanjavur

?If Our Govt Will Announce Sports City in Sengipatti, Thanjavur District. 

?It Will be a Big Boost 2 Central Region Dt's of TN. 

?Then the Long Neglected Delta Districts get Some Attention. Hope Infra will develop afterwards here in Delta.",0
1579715501436981248,#Hyderabad #SingleOccupancy #doublesharing #womenhostel #menhostels #PGS #payingguest #womenshostel #security #hostel #workingwomenspg #Hyderabad #luxury #hitechcity #madhapur #gachibowli #corporate #Kondapur #mumbai #delhi #noida #bangalore #jaipur #maharashtra #tamilnadu,"On demand Hyderabad's luxury hostels/pg's/hostels helper.. #Hyderabad

My Charges are below... In note.. 

NOTE : my charge is only ₹999 which is non-refundable and need to be paid before starting the process. If you are OK with it then only WhatsApp or call me on 9000539552",0
fj55iql,Or perhaps your gaming skills are good,Ur eyes are pretty cool,1
1572501130260905986,"@RJPcoach @CoachingFamily @coachingbadges @TheS_Resource Started as a block of Duke of Edinburgh  stuff. Volunteering I think.

Now there's a whole range of reasons. I think most of all I find it intellectually stimulating and challenging, interspersed with some great moments, memories and bonds","Some questions for everyone?

Why did you start coaching?

Why do you coach now?

If the answers aren't the same what changed and why?

@CoachingFamily @coachingbadges @TheS_Resource",0
1578307398695280641,@pjroane @laddbbq ??? Me too,@laddbbq I dont believe you just send me a rack and i will let you know.,0
1580539847814811651,@ksdotlewis I would I'm never scared of shit but women are just as crazy as a man these day's ?  real shit ? but I love to try new shit ???✌️,"If your Twitter Crush said “Ima be in your area a couple hours away, can you come and let me take you on a date?” Not a link, a legit date. Would you go? Or no? Are you scared?",1
1580103947670679552,@kritikatwtss Us?,Sometimes I just want to cry for no reason.,0
1572467489535295488,@RedMedusa13 @yoghurteater Sloths? I NEED some of those,"@yoghurteater I got some cool ones in Matalan (cream with black stars), &amp; Peacocks, (sloths) ?",0
fj57y7k,"Speaking from experience, my brother was abusive to me and my sisters. Now, I just don't talk to him as much. I wish you the best.",My sister loved stealing my things and my brother loves beating me up. My parents only ever told me to “just deal with it or fight back”. If i fought back I’d just get more hurt,0
fjdvgrr,"How does the fuck does the minister for housings advisors husband being the Md of a company making millions out of the housing crisis anything to do with politics? 
Do you really want me to have to explain that to you?",How the fuck has that anything to do with politics you nutjob. Not everything a politician does is related to their political life.,0
fja5rcy,Lol yeah. Coincidence and you got lucky xD,"Ek din mene JP ko fake birthday wish kiya tha. Sab karne lage. Phir pta chala ki sach me uska birthday hai. Oops! XD 
(Hope I’m right, jp?) O.o",0
fjcn60e,">Fighting each other?      
We don’t really have a choice in that, its a state sponsored contest with the aid of certain media agencies.  
And our regressive culture is helping all this shit.",Because we as an Indian fighting with each other over religious stuff instead of working towards the growth of the economy.,0
fjaa7yy,"We are a civilised society and mob “justice” is not legitimate form of justice.
Apparently the execution was stayed because the president has not replied to the mercy petition filed by the convicts.","Ridiculous.
Give them to the crowds and see what comes out",0
fjcgu3h,"My little sausage dog eats royal Canin, and once ate an entire dead hare on a walk. The head, feet, hair, bones - everything.
I was sure he was going to die/be sick all over the gaff.
Not a bother on him. The divil.","Ah be very careful. Going from cooked to uncooked meats in the diet for a dog when they dont have the proper microbiome to help digest it.
My Dad is a butcher and we used to give my dog the best of cuts for his meals but now that he's 15, more cooked food and generic dogfood cause his belly ain't what it used to be.",1
fjcm1hn,Sounds too good to be true,"The world is ending 
Change my mind",1
fjawrv9,"or anywhere else including the Maldives https://www.kuredu.com/webcams/, this headline is a scaremongering farce.",Yet strangely the seas are not rising in Sydney Harbour,0
fjb8hhu,Baltimore too. Come on over and be gay with us.,"Philadelphia is where it's at, we're gay af",0
fj9ev98,Exactly.,I want to see a graph comparing this to yearly flu and cold infections and deaths. Because its probably lower on both fronts. Yet people are going ape shit crazy like its the end of the world,0
fja2ujq,"beep. boop. I'm a bot that provides downloadable links for v.redd.it videos!


Download via https://ripsave.com


Downloadable soundless link


Audio only


First link is active for 6 hours. Mention me again if it is down

Info&#32;|&#32;Support&#32;me&#32;❤&#32;|&#32;Github",u/VredditDownloader,1
fjawwu6,Hes asking valid questions tbh.,"Attenborough wants the world to stop helping the starving victims of famines and pandemics and let them die
He will be cracking one out to coronavirus
I couldn't give the tiniest shit how well he narrates nature documentaries
He is fucking evil
Fuck David Attenborough
https://www.theguardian.com/global-development/2013/sep/18/david-attenborough-famine-population
Sending food aid to famine-stricken countries avoids the more fundamental problem of population growth, Sir David Attenborough has said, as he called for more debate about population control.
The renowned broadcaster told the Daily Telegraph the world was ""heading for disaster"", and without action the ""natural world will do something"".
""What are all these famines in Ethiopia? What are they about?"" he said. ""They're about too many people for too little land. That's what it's about. And we are blinding ourselves. We say, get the United Nations to send them bags of flour. That's barmy.""
He admitted the issues had huge sensitivities, but insisted it was important to ""just keep on about it"".
One area of concern, he said, was about the right to have children. ""To start with, it is the individual's great privilege to have children. And who am I to say that you shan't have children? That's one thing,"" he said. ""And the last sensitivity – and the most tricky of all – is the fact, when you talk about world population, the areas we're talking about are Africa and Asia, you know.""",1
fja8wub,Elaborate,"Is it just me or is being raised in a big city (Mumbai in my case) really different from being raised in a small town?
The aspirations and priorities of kids in the 2 aforementioned categories of places are so radically different.",0
fjc2scn,That’s why the real people who control this country deemed they had to go,This is really sad. These guys are effectively neutral and independent and provide primary news to most other media organisations.,1
fja1ayv,I am sure this is it.,"Is this to gain sympathy or what? He is a showman, he aint going nowhere.",0
fjenbqj,It wont hit cork because people don't travel to that shithole.,We need to build a wall around Leinster. It’s all fun and games now but what if it hit Cork? We can’t take that risk.,1
fjcfqjx,He's dancing like a cephalopod...,"Is the unit in the jeans and t-shirt some random dude who walked in off the street, or did he actually attend a wedding in that?",0
fja6wxy,Time to ask your crush out now,The first corona virus death in the US was in the town next to mine.,1
fjacwyq,">We taking extreme precautions (like sanitizers for one) is just a waste of money and time. This habits truly makes you immunologically weaker & compromised.
There is a little logic to this, but NOT when confronted by a pandemic! This is a new strain of virus which we have NOT been exposed to before, and we have NOT built up immunity towards. By not washing your hands and sanitizing when such a virus is going around, you are being very irresponsible. 
Not washing hands, sanitizing, and taking precautions will only further spread the virus, and it is people with weak immune systems like the elderly, babies and the ill who are most likely to die from this disease. So you may survive, but you also may spread it to someone else with low immunity who will die. SO PLEASE WASH YOUR HANDS!","Human immune system learns through trial and error. The thing is western world is too fragile for Indian conditions, conditions highly optimal for growth and proliferation of infectious microorganisms (which includes the germs). Also we do not have a cold cycle (at least in the parts southern to regions where it snows) which can wipe out almost all of the infectious microbes. In Europe and America, the immune system of the people is not worked out as much as an Indian's immune system. Half of the year the immune system of western population is chilling owning to the environmental conditions favouring humans over microorganisms. 
The memory of the way to defend the  body from the microorganisms (henceforth microbes) is short lived (for about 30-50 days). Hence as soon as the cold cycle ends and the conditions turn favourable for the microbes and all the memory of the immune system of how to defend itself from the microbe is gone. All the microbes are aliens to the body even though there might not be a significant change in the microbes characteristics. Hence there prevention is best and hence the sanitizers , extreme safety precautions etc are brought about.
In case of India where the environmental situation is highly favourable to the microbes than the humans. We taking extreme precautions (like sanitizers for one) is just a waste of money and time. This habits truly makes you immunologically weaker & compromised. 
Hence we can say that we are inherently stronger than our western counterparts.
If theres any query regarding this please feel free to ask me any questions. I will answer what i know to my fullest.",1
fjdk01c,Okay.,That boy at bottom left can't be more than 14 years old.,0
fjal1xy,">Rest whole article is just roaming around the point making useless conclusions. And shit like ""she used a Sanskrit word, vhp also uses the Sanskrit word, so she's clearly RSS"" when conveniently omits the dact that many from  MMS to Pranav Da have used a common Sanskrit word.
What are you talking about?? What article are you referring to? There is nothing in any of the articles I've posted about Sanskrit words!","Though you should've already known that Pieter is barely regarded high in journalists circles, lemme go through his stuff again.
The Caravan article is behind paywall, please post full text. This is cited as source many times in his every piece when ever he gives actual links to RSS.
The Quint article is by same author, and instead of providing proof of links, he is again clutching at straws. Not criticizing the RSS doesn't mean she is RSS, by this logic Kejriwal is supporter of RSS backed violence in Delhi.
Rest whole article is just roaming around the point making useless conclusions. And shit like ""she used a Sanskrit word, vhp also uses the Sanskrit word, so she's clearly RSS"" when conveniently omits the dact that many from  MMS to Pranav Da have used a common Sanskrit word.
Also, the author seems very, very angry about her tussle with Hillary for some reason, despite it's clearly Hillary in the wrong for making baseless accusations against some of her fellow dems to favor her friends.
Intercept is, well, Intercept. No source, no facts, just how they like it.
That said, please post the Caravan article which provides source of the RSS backing & funding as Pieter claims.",1
fjcncc3,Yeah have u heard of 'the high man'.,Have you seen the Cliffs of Moher?,0
fjbndcg,"Quite the beneficial insect, too- often sold in garden stores.
&#x200B;
Much better to use a heap of these guys than spraying poisons around.","Looks like a lacewing, nothing to be worried about.
https://australianmuseum.net.au/learn/animals/insects/lacewings-and-antlions-order-neuroptera/",0
fjdrdw9,I think people are more concerned about the 47 billion tourists on o'Connell street and in temple bar. Not the 47 people at the Cashel parade.... which is why I'll be going to the Cashel parade.,"Don't know about other small towns,but here it will be about 10 mins of trucks and tractors. So the people at the beginning will be home and eating spuds by the time it gets to the finish line,  so maybe we can just get it done and over with???",0
fjbe3gh,"It probably would, even the fact you have an autoimmune disease might. But I wouldn’t ever stop taking them, the reward here far outweighs the current risk.
Just keep regular hand hygiene and ask people around you that if they feel they may have been exposed or have any symptoms that they keep their distance from you if possible.","I take immunosuppressants for inflammatory bowel disease, do you know if that makes me more susceptible?",0
fjaij2s,"You can freeze it and it’ll be fine. 
I always have 3/4 loafs of bread frozen, handy if you forget to pick some up or if something happens, like the snow. Unusual but handy a few times a year.","It will all be stale ina week too, but the shops will still be open...",0
fjcl727,Physical money is fully gross.,"Knew someone who worked in a bank, their hands would get black with dirt after handling money",0
fjc5byh,"> We once used coins such as Annas, paise, even half annas! and one could survive a day! 
> The rupee used to be made of silver which would be a day’s salary back then
How old are you?","We once used coins such as Annas, paise, even half annas! and one could survive a day! 
The rupee used to be made of silver which would be a day’s salary back then, then we made rupee from copper nickel alloy, now steel! I guess we’ll either demonetise one rupee altogether or make them from aluminium before the end of this decade!",1
fjb29f5,TBF Codeine shouldn't be commercially available,"Honestly there's this bizarre attitude with pharmacy staff that anyone who knows annything about these drugs must be a drug dealer or something.
They have the same attitude with codeine/rikodeine.
I'd wager they did have it but just wouldn't sell it to you.",0
fjeb060,I keep touching my lips. Constantly. I don't know if I have always done this.,Never realised how much I touch my face til they told me not to. I can't stop doing it!,0
fjcfs1k,"But they're doing it in China so it must work. 
They also slung cats and dogs out of the top floor of apartment buildings, so we should probably start doing that too.",Face masks don't help you from catching it said on tv tonight. It only stops from spreading if you have it so no need to wear one.,1
fjco5tj,starts stocking up on shower heads,Just wash your dot out in the shower.,1
fja3paf,Who and what,Must feel good to be Adama Traoré right now.,0
fjcrc8a,"See, I find sally and erica really awkward and forced. Maybe they will grow into it.","Ben and Liam always seemed awkward. I really like Sally and Erica, I think they’ll only keep getting better.",0
